rating,review
good,Ity was a good company to work for but  my last managerr was not very nice to his workers.  He would yell at them in front of their co workers.  He was not very well liked by people in other departments
good,"Very stressful fast paced environment but rewarding and interesting. Long hours, on call. International teleconferences at different time zones."
good,My supervisor was very supportive and the training I received was great.  The support and encouragement from fellow staff and management was great.  Very fun job!
good,nice place to work. competitive place to work . Good encourage from all. good place to work. Cool Place to work. Place to work. Management is good and coperative.
good,Great company to work. The Bonus and Benefits are nice. There are many great managers there to help you grow in your field. I would highly recommend anyone to join AIG
good,Great company to work for. many perks and bonuses given to full time employees. great work and life balance. Management mentors and sets team members  up for success.
good,Loved working with them for 10 years.  A great place to work.  I would recommend working with them and would love to work with them again in the future.
good,This is a great place to work. My supervisor is very nice and seems to care about you as a person. The work is not overwhelming and there is plenty of time to get your work done.
good,A good big multinational company to work for. The management really cares the development of it employees and tries its best to accommodate the needs of its employees.  The company provides its employees a lot of training classes and programs and really helps its employees to learn and improve themselves.
good,"I am responsible for overseeing my teams as they progress on various tasks"
good,Very trustworthy people great location in the green tree area. Very serious about customer service and they will be honest to you for you to feel safe when investing
good,AIG is a great company to work and explore our skills. Management is very supportive and employee friendly with good professionalism. There are many streams to work with.
good,"Ambiente ottimale per esplicare la propria atiività lavorativaReceptionist (Impiegato passato), Napoli, Campania – 3 aprile 2017La tipica giornata lavorativa si svolgeva accogliendo gli ospiti dell'ostello, fornire loro informazione sui luoghi da visitare, preparare la colazione, ogni volta che svolgevo il turno di notte, chiamare i taxi per portarli, oppure, mandarli a prendere all'aeroporto."
good,"SunAmerica Financial Group shines its light on the life and retirement operations of insurance giant American International Group (AIG). Operating as AIG Life and Retirement, its subsidiaries sell a variety of investment products, including life policies and fixed and variable annuities (American General Life) and group retirement services for education, health care, and not-for-profit organizations (VALIC)"
good,"a caring insurance company, with a flexible work schedule. The management team was always getting you up to date in your training and communicating of the company."
good,"I was hired to dismantle a department of 26 and create a software program that would allow every department to write their own contracts.  Working with resources I was able to develop that system, test, write the manual and train over 300 employees on the new system."
good,"AIG is a great place to work, and offers the appropriate training needed for all levels of employees. Staff was very helpful."
good,I recommended to work with AIG. The management provides a good work environment and freedom to explore on your skillset. It is good experience to work with such good professionals.
good,AIG is a good company to work for anyone who wants gain experience in Insurance industry. Learning opportunities are generously provided.
good,AIG is a great place to work. I have always felt supported and I believe my manager genuinely wishes for me to succeed. Other team members are also very happy.
good,"I enjoyed my stay at AIG especially working with my team mates its like having a family at workplace, however due to its schedule I have to find another work that will suit my personal needs."
good,AIG resource was a difficult but rewarding experience working with children with explicit growing needs.  AIG children provide just as much challenge as any other student.
good,Buen ambiente de trabajo y oportunidades de crecimiento profesional
good,"Employees are more serious and responsible, good team work, work performance is obvious. For interns, there is a big harvest."
good,"Great working place with great staff, every day was a challenge and a reward. Co-workers were always helpful and eager to teach what they had learned."
good,A company that promotes not just work but healthy and lively atmosphere. It provides training to its employees which enhance not just their skills but their personal well being too.
good,"the company is great.  recommend everyone to work with.  good benefit and people.  "
good,"La capacitación del personal es excelente, el ambiente de trabajo excelente, sin embargo alli es una empresa donde vulneran los derechos de los trabajadores "" a trabajo igual salario igual"" Alli no aplica esa filosofia, si no estas de acuerdo vete... Hay que trabajar con la cultura del latinoamericano, Chilenos, Argentinos, Mexicanos etc..."
good,"Preparing New business quotes and renewal assessments in line with AIG Guidelines and capacities.Inter-acting with Risk Engineers regarding surveys to be conducted and Risk management status follow up on new and existing clients.Checking & signing off Placing slips & Policy wording in line with Guidelines.Attending to Broker queries.Placing Reinsurance in accordance with AIG guidelines and capacities.Uploading Pricing tools including Nat cat assessments on Swiss Re flood tool and Google earth.Checking and signing off Premium allocations.Attending to Credit control queries with Finance.Attending to claims queries.Prepare referral documentation to Product Heads in Global countries for additional capacities and approvals.Motivate ,train , lead & mentor Junior UW's on team objectives and overall business goals."
good,"Working closely with Underwriter, rate accounts, process filings, process mvrs.  Consult with Underwriters in order to process Conditional Renewal or Non-Renewal Letters, issue policies. "
good,"- fast pace learning"
good,"I have a tremendous profile growth in the organization. Initially joined as Support Engineer in the Year 2007. In 2012 I was promoted to the role of Project Manager and tasked with to look after project and manage project team. In 2014, got promotion to head the ICT department which is responsible to manage IT related activities for organization."
good,I really enjoyed working with AIG. I learned a lot of the insurance industry. I would recommend anything interested in working there.
good,"The highlight of my journey was traveling to Argentina, Ecuador, and Colombia.  The team's down there were so hospitable."
good,"> Friendly and supportive environemnt"
good,"I absolutely LOVED interning here as a junior in college. I would recommend this company to anyone, young or experienced. They offer great pay and management was amazing"
good,"my day starts with answering emails and resolving issues regarding claims, I learned new things everyday from my colleagues, managed accounts and issue work to my co-workers, the hardest part of the job is there is not enough time in the day, the most enjoyable part of the job was interacting with my peers."
good,"None- Office closed locally. no job available as a W-2 employee."
good,"AIG is a great place to work with many great people. It is self driven and you have to be smart about time management. I learned various things at AIG such as information about insurance, retirement, and also developed sales skills. The hardest part of the job for me was my age and look. Where I was young, I had trouble gaining credibility from certain clients. The best part about the job is the people and the freedom."
good,"Była to firma, która dawała możliwość rozwoju. "
good,Good company to work for.  Friendly atmosphere overall.  Management very cooperative.  Work/Life balance is excellent.  Competitive salary and benefits.
good,"AIG has been such a great company that does offer a lot of career opportunities to those who seek it. I don't think I'd reach this far if AIG didn't provide me the opportunities that I have been looking for. "
good,"•	24 X 7 Production database administration, support and monitoring to ensure a proactive problem recognition and resolution of database issues."
good,enjoyed time at AIG many exceptional people employed systems are old but being upgraded. technology issues are consistant
good,It was the most fund place to work. I loved everything about the job. My co-workers were the best. Since it was the first place I worked in the US it was a very good experience.
good,"My everyday work has been extremely busy which I feel busy is good.  "
good,"The most important part of the job, was the co-workers and management.  Everyone was able to work well together, and the environment was stress free."
good,During my 19 years of employment at ASG. I increased my knowledge of the company to the degree.that I was able to train new employee I was advanced to crew leader in the setter off  area. I separate products and had good communication with my co-workers. The hardest was standing up all day. The most enjoying thing was my co-workers and  good benefit
good,Great place to work with opportunities for growth and career development.  Excellent work life balance and peers who are always looking to work together as a team.
good,Working at AIG was realy a good experience for me and worked in Reinsurance group.Management was great to work with. Thanks.
good,This was third co-op as part of my Northeastern University internship program. I worked in the Catastrophe Modeling department. I booked monthly portfolios and modeled accounts for Underwriters. I enjoyed my time at AIG and developed some great relationships.
good,"People used to be friendly; during project delivery periods, the environment used to be busy and everyone was focused on the project."
good,"Traveled, training staff on computer data program for tracking claims.  Worked with staff transferring all claims data from paper logs to computer program.  I reported to home office in New Jersey while residing in Illinois.  Enjoyable part of job was traveling and meeting new people in different offices.  Hardest part was being away from home."
good,We would accept and open the mail and get it ready for processing.Management was very helpful and let you know where you stood and would work with you.
good,"As a result of major corporate restructuring, my role within AIG has been eliminated. I was hired to develop and establish change management program across AIG Property Casualty, specifically for Federal Reserve Supervision department to enhance transparency, reporting practices and management oversight."
good,"This is a good company to work for.  The benefits are great. Good atmosphere, good people oriented , excellent customer service  Co workers were easily to get along with. Management very helpful and considerate. The difficult part of job was dealing with new cases daily when different concerns had to researched, but not always. Overall good people and excellent  atmosphere."
good,"AIG is a huge organization, but there is one constant - they encourage you make what you can of your position. "
good,My experiance as an AIG Service Analyst was a challenging yet very rewarding experience.
good,very much a fun experience. I enjoyed working with the people as well as the kids.
good,A great company to work for!  Nothing but excellent things to say about AIG
good,Worked well with sales trainers and passed FINRA exams. Attended major local events while demonstrating sales tactics.
good,"•	Preparation of quarterly risk reports Rate Monitoring & Profitability Study the results are analyzed and appropriate commentary is supplied     before presenting to the Senior Management."
good,"I started with AIG in Phoenix Az , company transferred me to open new office in Houston. When workers compensation department shut down in Houston RVP sent me to the Dallas office.  "
good,"get as many appointments you can get, its a numbers game and the work environment is great."
good,Challenging position within the financial community offering opportunities to expand my knowledge base and continue to grow as a leader within my field.
good,"Worked as Admin Asst to the Operations Manager.  Answered phones, set up and coded all bills for payment, typing, duties as assigned."
good,"Everyone is very friendly, kind of like a second family. They know how to incorporate fun in to work so that it is a little more enjoyable. Great benefits. Amazing values and culture."
good,"Diverse work environment, lots of exciting challenges, but in the process of restructuring,"
good,"Learn processes of various departments"
good,I was so fortunate to have the experience in my young 20's working for them on Wall Street.  I didn't realize how invaluable the the work/life lessons would be.
good,This allowed me to deveolp people skills that I still use today.
good,"I wonderful company to work for. My intentions were to stay with them until I retired, but unfortunately we were laid off."
good,Gained knowledge about the Insurance industry and good atmosphere to work
good,"As a long term Commercial Property Underwriter for Chartis (Prev. AIG) I worked on numerous large accounts, dealing predominantly with renewals, liaising between clients, brokers, property management teams & surveyors."
good,Nice people. Love the job. I do a lot of work with electronic files. I maintain them as well as keep hard copies.
good,A great place to work. you are trained very thorough. manager help you with your success. Coworkers respect each other. you are recognized.
good,"I loved working in an office and being part of a team. It was my first office position. I did all of the paper work for 6 claims adjusters and a lot of times I was able to help them with computer issues. I really felt like a part of the ""family"""
good,"I enjoyed this job, because it was one of my first professional jobs out of high school, and even though I wasn't full qualified, my manager still worked with me and trusted me to do the job, and I fullfilled my job and did all that was required of me."
good,"I had the 0700 hrs to 1500 hrs shift. I would have to be dressed and in roll call by 0745 hrs. After informing guards of daily post orders go about assissting the supervisor to the shift. Duties included but was not limited to meal reliefs, any incident requiring security presence, handling mail for executives floors, taking over supervisor role when supervisor was not available. One thing I loved about my job was my co-workers. The most enjoyable part of my day was meeting new and interesting people."
good,Local office is very customer focused and departments work together to solve problems.  Local managers are advocates for their team but corporate decisions have hurt the local dynamic.
good,This is shared services of AIG Inc. USA. The culture here is more of learning and dealing with financial reportings. Bosses are good and one can look forward to join.
good,"Disciplina y control lo cual facilita los resultados."
good,a conversar en persona pero en lineas generales a Cia es buena para trabajar.
good,My job ended with any notice or anything. I gave them 16 years of my life. I grew with this company. I learned a lot working here. I didn't want to leave but I had no choice. Everyone is nice and the office environment is relaxing and enjoyable. We worked together as a team.
good,"Until Corporate re-organization in my division after 2011, company was great to work for.  Had an excellent district manager, but they dumped this person also.  My division, Valic, had a stellar reputation and track record.  All the employees pulled together to keep company going after 2008 and always helped one another.  CEO rating below is for Valic division.  I can't speak to other parts of AIG."
good,Loved this job but hated the way it ended. Great for a 2 to 3 year type of company after what happened in 2008.
good,"was a great place to work. Was able to work on your own, was not watched over all the time"
good,"I am lucky to be involved in such a forward thinking, ambitious company. I have really struggled to find any constructive criticism to write on this review. Yes of course there are small things that sometimes make work days a little harder but they would be the same in any company."
good,"Boa empresa no geral, bons beneficios e flexibilidade"
good,great place to work. great opportunity for advancement. great employee and environment morale. They are very supportive of personal endeavors and professional growth.
good,Definitely has a very good workplace culture and good work life balance. Amazing team and good managers. Most enjoyable part is being able to make decisions and move forward.
good,"Its a great learning working at AIG."
good,Productive and great place to work. Love the people I worked with. You can move up in the company fast if you apply. Great work recognition and acknowledgement.
good,The company is good. I have worked for them for many years and I can say that they have provided me with many great opportunities during my years of employment with this organization.
good,"While I worked for AIG I felt fortunate to be there.  We were treated well and I enjoyed my job.  Unfortunately, in 2014 they decided to transfer our jobs out of state and laid off several employees.  After about 2 years they brought the department back to N.J. and hired new people."
good,"My day would require answering the phone and taking orders. Take care of the customers that would walk in, make pizza slices. I would help out in the back and prep stuff that needed to be done. I was taught how to use a deli slicer. I believe the hardest part about working there was only working with the owner. No one else was there to help out when it got busy, but the things that i enjoyed about working there was learning new things and having fun doing my job"
good,This was a great job while it lasted.  That's the thing about insurance its up and down.  I got laid off after 17 years of employment.  This was a total letdown.
good,Good life and work balance workplace. Fun workplace. And great company. Good to start your career with. A good place to grow. Lots of good people to work with.
good,Aig is a good place to work but there is not a lot of learning done here and they do not have people trying to grow young talent. I have been here for three years and need a change.
good,Taking Calls from customers. I've learned to have patience. Great Management Team. A culture of team work was present all the time. Nothing hard about the job and I really enjoyed it.
good,Typical large company. Work defined by project managers who was located in a different location whose customers were also located in a different location.  I was a contractor working under a 6 month contract as was the go to guy for any issues. Was actually called the afternoon my contract was terminated.
good,Was migrating from XP to Windows 7. Migrating all user data and installing applications individualized for each users needs. Everyone was nicely mannered and professional to work with. Company did lots of meals in departments and celebrations which was nice. My position was only contract. I would enjoy working here.
good,"Was a fun place to work util they started outsourcing work to India, Phillipines and Ireland. Thousands have been laid off all over country as a result."
good,"excellent benefits, work from home option in some departments, very intelligent colleagues.  great collegiality.  interesting claims."
good,Enjoyed working at AIG. Benefits were great. I worked from home 90% of the time.  Excellent co-workers. My typical day would involved the review of over 1800 lines of invoices from various vendors that would be matched to the Litigation Management Guidelines for AIG.
good,I worked there for 22 years.  I had a break in between as my boss opened up his own firm.  We relocated back there after 9/11. Very nice atmosphere and employees worked well together.
good,Its a fast paced company and I learned to work with multiple assignments in short time period.
good,"Great place to work if the country wasn't in a recession.  Great pay incentives for top producers, trips, etc."
good,"Coordinated all PM with various vendors to ensure fire safety system, fire extinguishers and all levels to the building emergency fire panels."
good,"Productive and fun workplace, some coworkers are friends for life"
good,It is very nice company to work there and it will very balance life in this company.
good,I like learning new responsibilities weekly. I have learned so much from my manager. I like working separately or in a team. i like the workplace culture.
good,"Excelente ambiente de trabalho, cultura da empresa, benefícios, lideres, e oportunidades de aprendizado com pessoas altamente preparadas para exercer suas funções na empresa."
good,"> Learned time management a lot"
good,"I enjoy working at AIG. For anybody looking to work at a big company with big benefits, I recommend AIG. It's a good balance between work/life balance."
good,There was a lot of work and a constant reminder that there were people waiting in the wings to replace us. As a result we worked to get the job done. A work from home option was available and often used as the 1.5 hours we saved commuting was used to complete assignments.
good,"Good place to work with an emphasis on teamwork. Good health insurance, dental, PTO, holiday pay, bonus and lots of opportunities for continued learning."
good,Long work hours were often a necessity while working at AIG. It felt like there are not enough hours in a day to complete all your needed and assigned deadlines.
good,Great place for full time employees with many remote positions available. Would not necessarily recommend working here as a contractor due to organization.
good,I only tolerated this job because of the money. It was for me a regular job that was boring and the people there only had that same vibe where they wanted it to end.
good,Life insurance company with a good office environment. Made good friends. Management came from a MLM environment which made the office not the best and more conductive place to work.
good,"visitas a diferentes pueblos. manejo de clientes"
good,"Good place to work.  Good Benefits.  Assortment of projects however, training was lacking if any at all.   Must be highly technical and willing to learn on your own."
good,"My experience with the local branch was positive and I built lasting relationships with other staff. I don;t have anything else to contribute regarding my work for this company, at this time.  Thank You!"
good,"During my two week stay at the AIG i have been assigned with different tasks, therefore everyday at AIG was different. The best experience i have was when i was helping the financial analyst, analyse the company's performance by using excel and looking as the over all performance of the company and writing statements on what should or could be done to improve this."
good,AIG is the place good to work even US shift working 2-11. AIG is located in ecospace BAngalore. this is the FCOE newly established
good,"People were friendly and fun to work with. Management was fun for the most part, but some were intense. Hardest part was cold calling and trying to get in front of prospects. Lot of phone calls! No reimbursement for milage. Some long drives to clients. Unless you are lucky enough to get a client list that is compact and near the office, you won't make much due to the expense."
good,Great Company to work for   My division of claims was disbanded and was laid off.  Great work environment and on the road frequently. Provided company car which is a great benifit
good,One thing I can say is that I learned some valuable tools and work ethnics working for this company. The company as a whole is an ok work environment.
good,"Es una empresa de autoaprendizaje, automotivacion, con autonomia y apoyo en las tomas de decisiones."
good,Good work life balance and motivated co-workers. Management is good and the used technology is great. Get good holidays and its fun working.
good,"If you are dedicated, motivation and responsibility just follows you around."
good,"En realidad una muy buena compañía, aunque a veces las proyecciones laborales se estancan."
good,"An insurer with strategic focus on the local market. The local management possesses overall authority in setting out strategy, business decisions, product approvals etc..."
good,A good place to get experience in claims and the insurance world.
good,"Nice place to work, everyone just did their work because we got our rate of pay by how much work we got done."
good,"A typical day at work would see a sales employee getting out of Office by 10:00 - 10:30 AM if there are no internal meetings. The day is spent meeting people from Banks, Individual Financial Advisors, National Distributors with whom a prior appointment was made. Return to Office by 5:00 PM - 5:30 PM."
good,a good company to work with a nice place to settle and learn everything to work with them is one of the best experience i ever had in term of it related
