rating,review
good,I like working at AIG as a contractor. Good pay and company culture/environment is good. Too many lay offs so everyone is on the edge of their seats. overall good place to work.
good,"• Worked predominantly as a Business Support Analyst for AIG Insurance supporting the UK, Ireland, Nordic regions– Handling Premiums, Claims, Reinsurance data on daily and weekly basis"
good,"Talented people, abundant employee resources and diverse culture. AIG is a good place to be for the beginning of one's career. The company has lots of bureaucracy and politics. I do not recommend it for one's advancement to management level."
good,"This position gave me phone call experience, a more indepth knowledge in Microsoft office, and improved my typing skills."
good,"AIG has a strong board of directors and is well run. Focus is on getting the best-qualified candidate for the open role."
good,I worked 14 years for AIG and enjoyed the challenges of my job.  I liked the interaction with the agents and working with the insureds.
good,"Manage complex casualty and excess construction defect claims for subcontractors involving a variety of trades.  Investigate and evaluate property damage values and negotiate settlements.  Analyze and interpret multiple types of commercial policies.  Prepare coverage letters and issue settlement checks.  Hire investigation experts and manage attorneys in coordinating settlements involving multiple parties.  Participate in site inspections, attend mediations and settlement conferences.  Reviewed legal documents and insured contracts.  Manage excess policy accounts."
good,"Great company that provides a safe environment to work in. Good opportunities to advance, and maintain a balanced life style. Work, family, and social life can be well lived as an AIG employee. Compensation is good as well."
good,The Management gives me a lot of help. I could keep asking questions if I felt confused. Very good company to work. It is a regret because the department I work will be wiped out and moved all jobs to India.
good,"In my time in AIG, I have learned so much both personally and professionally. All the people are highly knowledgeable in everything they do and are capable of working in a very fast paced environment."
good,Loved working at AIG. I learned a lot and changed positions during my ten years there.  The people were nice and the Admins. were all very supportive to each other.
good,"es una buena compañía, goza de excelentes productos,responde a las necesides de los clientes."
good,"I am happy working with AIG. As I am looking out for exposure and growth in my career, I would like to apply in other organizations."
good,"Very corporate and company is going though many transitions since 2008, but okay place to work."
good,"The insurance business is interesting with the mortally tables, life expectances. Was fun work place and never a dull moment."
good,"If you search indeed, payscale, salary, glassdoor, or any other compe sation site you will see that AIG consistently pays less than competitors for the same job title.  With that said, with the benefits package they offer, you'd have a hard time matching what the extras are that are offered.  If you've ever faced a large medical bill, you know that this is worth it."
good,"When I was still a call center agent, I had to multi task. I was asked to take calls and process claims at the same time as I was trained to do both. I was given a kot of opportunities from simply doing my responsibilities to additional tasks such as coaching, training, forecasting volume to handling escalated calls."
good,"This was a great place to work, there was lots of fun experiences and room for advancement. I met and maintained many friends from this company. There was a good deal of work at times, and we tackled it as a team. I learned how to deal with diverse group of clients. Regrettably, the company was caught up in the financial crisis of 2008, and contracted. We lost a lot of our work due to this. That was very hard for the staff and myself. Nevertheless it was a memorable growth and learning experience."
good,"A typical day consist of obtaining statuses on projects, managing others and helping solve day to day system problems.  Co workers are very professional and courteous.  Best part of the day is helping others solve problems and the instant gratification of seeing a project successfully implemented into production.  Hardest part of the job is not having enough time in the day to help others and get project  management tasks completed.  Managing others is a very rewarding challenge."
good,Co-workers made working here great and there was plenty of work to do in the beginning
good,"Fast paced, multi task, quite yet energetic office environment. Always balance between productivity and quality, and be ready for regular unexpected surprise of extras.."
good,"Good environment and very knowledgeable co-workers. I was part of the O&S Finance team, which gave me a board spectrum to explore my skills, on the domestic and international level. I was part of a highly qualified team and added value to the company by setting up Project Cost Reporting and Allocation Modules with a complex expense reporting process, having an Accounting and Finance background and being the linking key between Finance Operations & Systems and Technology team I was able to translate and understand specific financial requirements in order to deliver a better product. It was a pleasure to work with such talented people, both in the Finance and IT department, they were all great co-workers, team players and good mentors. I have learned a lot from our Financial managers, AIO and entire team."
good,Enjoyed working with this company because every was always willing to help others to meet deadlines
good,"No room for advancement as the company is laying off rather than hiring. Good management, decent workplace environment, very corporate. Not overly fun or exciting, just a normal job. Good benefits and pay."
good,"After 2008 and it's momentous changes, my work here took many twists and turns.  Working in a small direct group we were liaisons between NY Federal Reserve and other departments within the company.  I had direct responsibility for reconciling and arranging payments to and draws from Government line of credit.  In addition, our group oversaw derivatives reporting around the world, training groups from California to Japan and maintaining reports for cashflow and risk stemming from debt, foreign exchange and investments, as well."
good,"Answering phones, processing payments etc. It was an enjoyable experience, my co-workers and supervisors were a good lot."
good,"Responsible for reviewing, correcting and balancing of suspense items for entire disbursement unit"
good,AIG was a great place to work with lots of benefits and great knowledgeable people.
good,I have learned a lot and once was open to learn and excel. At that time I took initiative to learn all aspects of the jobs in my departments. My co-workers have all had over 20 years of insurance experience and taught me all I wanted to learn. Most days are full and although lunch is encouraged many days involve working through lunch to leave on time. Working from home is an option now so working extra hours is easier to do and maintain a home life. The hardest part of my job is gaining approval to write accounts and compete.
good,"Employees are respected,"
good,"My experience here at AIG is wonderful, the experience I have gained while working here for 22 years will provide assistance to me when I do leave the company.   The company has been downsizing during the last few years, that is the sole reason I am looking for employment elsewhere."
good,Typical day included interfacing with internal Business Units and coordination of projects with Technical Data Center staff; managing projects; problem resolution; insuring client satisfaction with service commitments.
good,I enjoyed solving problems and seeking answers for customers.
good,During my time there I enjoyed working for them and would have kept working for them if they had not sold my department.
good,"You work very hard and make your boss happy but when it comes to promotion they don't remember what you have done for the department. Instead, they give you silly reasons why they cannot promote you. I have more responsibilities this time than before and yet Management comes up with silly reasons not to promote me. There's too much politics involved when it comes to promotion."
good,clear instructions = quick processing.
good,Learned the processing of obtaining licensing for your vehicle
good,My engagement was temporary however I was able to learn and become knowledgeable with different software programs. This is where I became proficient with Microsoft Excel.
good,"Excellent company. Very good at training claim personnel. Management people were not as well trained which presented a problem. Co workers were great everyone engaged. Hardest part of the job was working with supervisor who was not commfortable with technical information. The most enjoyable was the company environment, benefits and pay."
good,You Learn a lot at AIG. Each person has a well defined job profile without any overlapping.
good,"One of the better call center opportunities. They do have a strict structure, typical of large call centers."
good,"Enjoyed working with all my co-workers, Always empowered to excel, Working conditions were great. Travel distance was very hectic, Compensation and advancement was minimal."
good,Very high volume / demand IT shop with strong goals to deliver against. Great compensation packages with some work flexibility. Lost of smart people but some politics that aren't unusual at other similar / large IT firms.
good,Good company to work for.  There is a work life balance culture that is encouraged.  And pay is competitive to market/industry standard.  Great benefits.
good,"This position offered security,  great benefits and an average salary."
good,I am no longer at aig I am a broker working mostly at transamerica I was a manager for Aig for 6 years  if my credentials aren’t enough I don’t need your company
good,"Good people and enjoyable company to work for. "
good,"Good work culture, good work from home, study policy."
good,Good job but commissions where not good if people didn’t pay you didn’t get paid. But if people paid their insurance it was good..my general manager was really good but they did change management a lot but then the offices closed where we live they had down size
good,AIG provides a great work life balance and the ability to work remotely 4 days a week and my team and manager are excellent.  There is no room for advancement in my department and salary increase is slim to none.
good,"I enjoyed my time working at AIG in the operations department. The building was nice, located in dtla. The parking was close by, free parking and near the freeway. My department colleagues and management were great. Work life balance was good. Good learning experience."
good,Management is encouraging and willing to change to deliver their products and services.  Management provides support to remove organizational challenges.
good,I loved my experience at AIG as a contractor and had a wonderful time there. The hardest part of the job was getting used to the very American centric style of working
good,"Nice environment, but unstable.  Very flexible and work with your schedule.  Vacations and Personal leave options are good. It was a great place to work except for the many lay offs."
good,"Answering phone, scheduling appointments, running client review"
good,"Good experience.  I learned a lot about handling professional liability claims.  I liked attending mediations and negotiatiating settlements. I developed skills including analyzing liablity and damages, and evaluating exposure."
good,It was indeed a great experience and learning with AIG. Working as an outbound campaign executive is tough but persistence and hard work are well compensated. The working culture was great however lapses are less opportunity to grow and excel in a higher or better position.
good,"A very fun please to work if you enjoy what you do."
good,My overall time with AIG was a pleasure. I grew fond of everyone but hate that all the office had to close. Would love to be there still. I worked with an awesome admin team. We had a great manager who wanted the company to grow and there were consent learning every day.
good,Good Work Life Balance. Flexible working hours. Management is changing  frequently. Way behind technology infrastructure compared to peers in market  .
good,"It seemed like there was room for advancement if you could get past the call center and its bad office politics and subpar management. They wanted to interview me for the job I wanted after I left the company, how could HR not know I was no longer employed there?"
good,"Great place - great people and a wonderful culture, leadership is earnest and well meaning … but big isn't always better. this is an industry leader top of the heap go there only if that is where you want to be."
good,good company to work if they had the Agency model. The culture of the company is sound. People helping Main street America. Quality of life.... insurance is a suite of products that change how we look at insurance.
good,Workplace at AIG was productive and fun. It was a pretty quiet environment. I learned to be able to work on my own. I only had 1 counterpart I worked directly with in the IT asset management department. We were the only ones in the entire IT inventory room
good,"Working with AIG was a fruitful experience as they not only focus on helping you grow in your career by providing the necessary trainings but also help you grow as a responsible , sensitive citizen of the world."
good,"Reviewed UW support team"
good,"Working in Aiggs IT dept allowed a work life balance. Pro: working remotely at least 3day week."
good,AIG gives a good platform to professionals who are looking to restart their career after completing college. They have management who promotes an environment that is conducive to young professionals who want to learn and add value to their team. They also give yearly incentive bonuses for performance to employees who maintain and exceed the expectations of their role.
good,Management changes every 18-36 months and with each change a different direction is implemented. The vision set for the impacted areas are never met.  Constantly starting over but never seeing anything through the complete transformation.
good,"Great place to work, there are good team building initiatives as well as cross functional teams that actually make sense.   For the most part I felt as though my work was my own."
good,"AIG è un'azienda che richiede molto."
good,Scope of work started to be focused and eventually scope expands as part of economic development.The regional role was very challenging due to difference in  the provisions of the law.
good,"I was attached to CS and now back end team. I love helping my customer's who call in to resolve their problem.The happiness when the issue has been resolve and they they greet thank you,that situation always make me happy. I have learned how to be more patient, and talk in a good manner.The is hectic sometimes to keep answering the calls, but i do enjoy it, my management did valued me that's why looking for diff job."
good,"Productive, business-casual drss-code workplace with high professional standards of workplace ettiquette, and strict adherance to PCI standards, with private desks."
good,"There's nothing but at all based on my experience.i would say that its the Best place to work and management. However, sometimes Reassurance is difficult when compromise by some manipulative nature."
good,"It is a good company as it is very solid management. However you need to look upon the operation team on how they are treated."
good,"AIG is a great place to work. Great people, professional culture, and a supportive staff. The company direction will be pretty evident to you early on, and whether or not you will want to be there long term will be pretty easy to determine."
good,"Being a life claim examiner where you deal with death on a daily basis can be stressful. However, we had a strong work family environment and supported each other on a regular basis."
good,"AIG was a challenging, yet rewarding place to work. While the work environment was fairly conservative, the people were friendly and approachable. Things do tend to move slower at such a  large company, so pack your patience. You do, however, learn a great deal of business sense, competitive insight, and power moves at AIG."
good,"Workplace allows Project Managers to lead projects to completion if funding and management is available to support project initiatives."
good,"We worked hard and had very supportive relationships with the other employees. "
good,Gained all Insurance knowledge and experience at AIG.  I started working at AIG in 1991 and left the Organization in 2015.  I do not know who the current AIG CEO is.
good,Overall a great place to work. Onboard process needs some improvement.  Work anywhere policy supports a great work -life balance. Senior management open to suggestions for innovation and actually implemented them.
good,AIG is an amazing place to work and has great managers that are willing to help you with any issues you may have. AIG's interview process is slightly more difficult than other companies' but it is worth it to be able to work in such a great place.
good,"Been around since 2012 and AIG has gone through DRAMATIC shifts of layoffs, change in management, stagnant pay, and no merit increases. During layoffs, workload was redistributed, which was needed, but very little acknowledgement from management on the hard work. Overall pleased, and new management has done very well in changing the status quo"
good,The office was very laid back.  We were able to work from home two days a week.  We could also wear jeans. My direct managers were always good managers and looked out for their reports.  I enjoyed my position at AIG.
good,"Managers are flexible regrading work/life balance, requesting time off, etc...Not interrupted by agent calls and emails as much as other companies. Good communication system."
good,able to work remotely and come into the office once a week was really great for worklife balance. management was local in the office and open to discussions
good,My work involved gathering data from different groups and there are too many systems carrying similar data and it took a lot of time to synchronize it and put it to use.
good,"The manager at the office was good, in Hicksville. He was concerned about the workers and listened to their problems. He walked around the office almost every day to ask the attorneys what problems they had with their cases. He therefore had few surprises. The support staff seemed to like him also."
good,"The job was wonderful, until the bail out happened, the company down sized and then my branch got cut, we all were laid off due to non relocation. The worst part is that I just hit my three years."
good,Good technology and team members but very poor management. Lack of training and constant micromanagement creates a very hostile environment for employees.
good,"Nice infrastructure setup which, really helped our mind to work with lot of focus."
good,"* A typical work day was 9-10 hours a day"
good,AIG is a company with diverse culture and diverse technologies. I would recommend AIG to anyone at anytime.Very good benefits. Flexible work arrangements.
good,"AIG has some of the best benefits to offer. They match you up to 6 percent in 401k, start with 24 PTO days, maternity leave for both partners, short-leaves, and health benefits."
good,Every day includes interesting work and routine work.   Interesting work includes understanding business opportunities and how we can apply technology to create real business value.   Focusing on a few things that make a difference has worked well in moving things forward.   The biggest challenge is getting buy-in from all the stake holders which requires creating relationships and explaining business value in non-IT terms.   The most enjoyable part of the job is seeing your hard work pay off and doing something that makes a difference.
good,"AIG is an always changing environment, so I learnt to implement new processes within a though deadline."
good,"A typical day on the call-floor is very laid back. Most managers are willing to help you. There are a team of supervisors that are available during business hours to answer questions that customer service representatives may have, or take supervisor calls should they need to. The most enjoyable part of the job is helping others and building relationships with your coworkers. The hardest part of the job is keeping calm with upset customers that call in, and continuing to help them even though you may be frustrated. Throughout my time here I have gained a lot of experience in dealing with all kinds of people in multiple situations and how to deescalate people very well."
good,"AIG is a good place to work in. Has a nice environment and friendly managers and teammates. Their benefits are good, especially their free health card. NO need to pay additional for dependents."
good,"Great PTO and 401K benefits. Overall good place to work."
good,"AIG gives you many opportunities to expand your skill set, and to gain exposure in several different fields. However, it is a difficult company to advance in."
good,"It happened when one of the IT bosses from Texas visited Manila. We were on an early shift to attend the activity in the afternoon. We need to manage our time properly in our time properly in order to submit our deliverables for that day. After our shift ended, we went to the venue and it so nice to see the Fiesta-theme which shows how the Filipinos celebrate an event like this. The committee wore an Ati-atihan costume, there were food like turon (sweet wrapped bananas), dirty ice cream, fish balls, etc. We played games such as Luksong-Baka and some relay games. At the end of the day, we were able to make our boss very happy."
good,"Pros"
good,"Travail en equipe avec des collegues bien sympa"
good,"Un + pour son environnement son dynamisme et sa culture d'entreprise."
good,overall a great place to work with great benefits. Currently in a transitioning period where uncertainty remains. Salaries are competitive based on role and skillset. Opportunity for advancement continues to be non-existent in some areas.
good,"Learn to be patient w nasty or impatient policyholders."
good,The environment is suitable for a good and productive organization. It feels like a home away from home. The people are accommodating and you will feel at home right away. I was able to share and further enhance my skills as a Customer Care Associate III and they were able to provide me with the proper training that I needed in order to perform my duties well.
good,"Working in AIG Shared Services made me enjoy my career more because of the several opportunities I was able to experience while I was an employee. I was given the chance to acquire certifications and even work closely with upper management. My exposure to this experience made me more interested in project management and organizational development. Also, I love how friendly and accommodating the people I've worked with here were. Lastly, the targeted coaching that my supervisors provided me. This company showed me that family can also be found in one's workplace."
good,"Work culture is great, good salary but they keep changing the structure and eliminating positions which makes the job very challenging by letting go very smart and knowledgeable people. One day it's likely you'll meet the criteria."
good,A typical day at work involves many challenges not only with the work itself but also working with over 100 underwriters who in effect are our customers as well as co workers.
good,"start at 8:00 AM (at latest) and finish around 5 PM...  Staff and Management were great to work with.  As in any Office Operation, there are some people that make it challenging.  But, they were in the minority.  Local and Middle Managers were very reasonable to work with.  It was nice to learn new things as an Environmental Underwriter."
good,"Good Place to work, enjoyed my tenure with this company, Learned a lot in terms of business and Corporate Policies."
good,AIG is a good workplace where you can learn alot from colleagues and in company.  There's always a quarterly team building.  It gives us a chance to know more about our co-workers which is fun and enjoyable.
good,I learned a lot at AIG and the management is generally easy to work with.  The hardest part of the job was the way systems were sometime implemented.  The people were the best part of the job.
good,"Allowed myself to have creative freedom in a relaxed atmosphere, with great management. AIG did the best to accommodate me for the high costs of living in the San Francisco Bay Area. Only downfall was being laid-off during company cutbacks from a job I truly enjoyed."
good,"AIG has good working environment. Employees are easy to deal with. However, since it's a US based company, most of its employees are on graveyard shift."
good,"With more than 2+ years experienced as Analyst in and AIG, my area of expertise is Data Virtualisation/Visualisation and Data Analytics using CIS, SQL Server and PLSQL scripting."
good,"Atypical day at work goes with small feeling of excitment expecting the unexpected and there's no rutine."
good,"Management Transition"
