rating,review
bad,This is not relevant to my resume .Therefore I am  not answering this question. I do not work here any longer .The division went out of business a few months after I started working there
bad,"Hated the place. They had these random stand up things whereby you had to say what you were aiming to do that day, then again another before you left, on what was achieved. You had to rate your mood too - happy, sad etc & say why you felt that way! Such a strange place."
bad,"This was by far the WORST place I ever worked. The management in my department was awful. Just a few months after I left the company cut about two-thirds of the people. I worked at a branch office and the culture there was not white collar at all, they treated people like they were on a manufacturing line. They only cared about production and not the person at all."
bad,"Revolving new management every year led to:"
bad,"I enjoyed working with my co workers and the clients. Team work is very necessary at any office environment. Our office in Hickory were a great family/team, we always supported each other."
bad,"Management and training is horrible. Company moral absolutely no existent. The moment you start you will want to resign. Its not worth the money. At least in Travel Guard Department. There are many divisions in AIG so I cant speak for all departments but as far as travel insurance. Travel Guard is the worst department to work in. No organization, no structure.  EVERYONE THERE IS MISERABLE AND its contagious. Working there will cause you to have strokes or heart attacks its a proven fact."
bad,"Not a lot of positives about this company right now.  Lots of lay offs, no clear communication to the field on the direction of the company.  Executives are getting huge salaries, while the worker bees scrap by.  The work culture is very stressful and pretty toxic right now.  I would not recommend working for this company."
bad,"I had to learn quickly at this new position, since there is no training to they teach you to figure it out yourself quickly and survive.  This job had taught me a lot."
bad,"Will not recommend"
bad,"Employees don't care about their job. The job is just scamming people out of their money. It is an insurance company, what else do you expect out of this kind of thing?"
bad,long hours ; even asked to comein at 8 and leave after 6. no work life balance or flexibility; no progression map or appraisals.  people paid different salaries varied  from 35k to 110k doing literally the same job.
bad,"It's not what you know, how well you know it, how much value you  bring, but its about who brought you in.   Never seen nepotism run so rampant.   This is why this company is such a epic failure.  Middle and upper management are all in the same club. Managers will never admit they are the problems, rather they will shoot down lower level hard workers and keep their job security than to make sure the company runs profitably.   You have been warned, do not work here!"
bad,Very long hours. Very poor systems. Poor direction from management. Poor collaboration among workers. Lots of relatives work throughout the company - political more than skill based decisions. 10 years never got a raise. Management seems very well aware of all the issues but indifferent to making any changes.
bad,The hardest part of the job was management and dealing with co-workers. I learned that co-workers were back-stabbers and wanted to keep all information to themselves for job security.
bad,"AIG is known all over US, South America and Asia, currently the leading Insurance company in the United States and best employer of the year, Surprisingly recognized by more than 50 countries all over the  world. Working with  internationally acclaimed company is both fun and enjoyable but with big responsibility in a sence that we need to be careful, efficient and trustworthy for the protection of our company and maintaning the top position. Over all it's not easy but the company make sure that you will be compensated rightfully, treated fairly and lived a balanced workplace and personal life."
bad,"There were very limited agile concepts followed by the team.  There was no communication to the other departments that an agile team had been created and some of the other department's processes may have to change to accommodate releasing software every 2 weeks.  The atmosphere then became a ""scrummer fall"" type of culture we were a scrum team following waterfall processes and the executive management team refused to change."
bad,"Very poor management carrot and stick approach to managing advisors, poor compensation. Lack of opportunities for advancement. The district manager needs to retire and let someone who really knows how to grow a team take over. Bad job choice."
bad,"The best part was working from home, so many at the office didn't do their job and was pushed off on our team then not to mention we had no room for advancement. This was a deadend job."
bad,"•	Accountable for the divisional profit and loss for all lines of coverage including general liability, auto liability, workers’ compensation, and various professional liability programs."
bad,"Pay could easily have been much better as I discovered that AIG was billing me out to an agency at $100/hour, while the agency paid me only $37.50/hr."
bad,"You have the wrong ""AIG"". this is not the company that I worked for. The company I worked for was a property investment holdings company. This is an error on your part and apparently I cannot proceed with out writing this."
bad,"It is all about working on the phones, taking calls as quickly as you can.  They want you off before the 12 minute mark and if you are not they are messaging you to find out what is going on.  You learn alot, but do not expect to move up and if you are not well liked you go no where. They also do not like to give you time off and micro manage."
bad,extremely poor management.  No teamwork everyone seemed to be cut throat and out for themselves.  Not open to suggestions or any type of streamlining to enhance productivity.
bad,"I got ill during my employment at AIG, so I had to use short term leave of absence.  When I came back after four weeks they had taken my desk and my funds away. I sat alone in a conference room and filed.  Everyday I came in something more was taken from me.  One day the computer, next day the phone, it was becoming clear they wanted me to quit, because of my illness.  After a few weeks, I literally was in an empty room with just a couple files.  They broke me and I resigned."
bad,"Very bad management, stressful.unfair treatment. partiality of some. waste vendors do not recocommend to join this company at all. unless those vendors are removed."
bad,"Senior co-workers who have been there 20 years etc. etc. They just want you to shut up and do what they say, no thought involved.Directors were tasked with projects that they didn't know how to direct. Somebody has to be accountable for this, and it won't be them!"
bad,"Esta empresa hace contratos eternos por ett, sumamente inestable. Lo que conlleva no tener descansos ni días libres por tiempo ilimitado, incluso años. Ascienden al personal por ser añejo o pariente, provocando que no sepan como solucionar o gestionar las labores con continuas ordenes contradictorias. No hay nada peor que darle poder a un incompetente, que ademas se lo lleva al plano personal, haciendo de su trabajo una batalla de acoso y derribo contra el empleado, hasta que con una palabra suya,consiguen echarlo, sin previo aviso, llamando a última hora de la tarde para avisarte de que al día siguiente no vuelvas, e impidiéndote el acceso, ni si quiera para recoger tus cosas. En esta empresa se llega a niveles de exigencia absurdos, impidiendo al empleado incluso ir al aseo cuando es necesario, cuando las coordinadoras se pasean por los pasillos con las manos en los bolsillos gritando a las espaldas que cojamos mas llamadas. Cómo quiere coger la gestión de mas servicios invitan a otras empresas a hacer visitas para que vean como se gestiona el trabajo, las cuales están falseadas e incluso le dan al empleado un guión de ante mano preparado para que no se diga la verdad. Por no hablar del sueldo, que lo ajustan al mínimo interprofesional para no se ilegal por cuarenta horas a la semana."
bad,"management was terrible"
bad,I did not work at AIG. It was the company that bought my business in 2005. They were great to work with in the transfer of ownership. That is all I know about them
bad,"You'll receive little to no training, will be expected to meet expectations that are unattainable due to the lack of training and will be written up for not doing your job correctly.  Forget about going to management for anything because you will be classified as a trouble maker.  Management does nothing to correct employees who won't work and expects those who do work to pull the slack.  "
bad,not a great place to work did not  like the  management they were rude and not helpful with questions no room out of sales department could not move out of sales
bad,No promotions are granted because of educational background.  The job is who you know and friendship is essential.   The turnover rate is very high because the pay is very low.   The management team are  not experience to handle business.
bad,"This organization has changed so much over the years so my comments here will not apply to all, my old department has been laid-off.  I did enjoy the welcome when I first started."
bad,"Worked in a back office support capacity, never felt welcomed, no culture to embrace.  extremely high pressure environment, little to no support from management."
bad,Currently the company is experiencing numerous layoffs so I would not recommend applying since there is no guarantee as to how long your position would be needed.
bad,"I was wrongfully terminated for following the directions of a manager who instructed me to alter dates on a spreadsheet for audit last week. At this time, I do not have any positive feedback for the company due to the situation I was put in which caused me to lose my job of 19 years and the reason was CERTAINLY not my job performance nor production numbers."
bad,My department has anywhere from 3-10 times the amount of claims as other departments.  Upper management refuses to properly staff our office and just work people until they burn out and leave.
bad,"This was the worst job I have ever had. The leaders in this company could not agree on anything and it took them away from work to seek way to counter one another,  I do not recommend this company to anyone."
bad,rude co workers... rude managers... EVERY ONE was just rude even the trainers that train you were rude. glad i do not work there anymore. goodluck to the ones who do get the job earlier
bad,"Senior management is horrible and does no care about their employees.  They have no interest in retaining talent."
bad,"At the time of employment - commission based sales without benefit of renewal commission paid, mismanagement of departments, massive layoffs due to market crash 2008"
bad,"Could be a great company but it fails.  Different departments doing the same work in different fashions,  why not stream line and handle calls, disbursements and other transaction the say way among all department.  AIG does not value it's employees."
bad,"Very political , high turnover, employee gets burned. there's not too much advancement. stay there not long, can't comment on too much. Can this sight not force people to write review ?"
bad,"I was hired along with two other people for one position. I contacted HR a number of times with no response.  Funny thing, they continued to pay me until I left, which was low but I didn't do anything."
bad,"Company no longer in operates in Atlanta, GA or working under this name.  See 21st Century Insurance company - company was ""re-branded""."
bad,"Mangement very poor."
bad,"I would not recommend working for AIG what so ever. This place is going down hill fast.  The management is a joke. I work in the Houston office and the management over L&C, and New Business have no clue what they are doing.  You cannot ask them for help on your calls because they have no idea anything about what the department does. They have no backbone to stand up for us and try to get us the systems we need and the so called ""goals"" set for us to meet out requirements for bonuses are unobtainable.  Our call volume does not allow us on any given day to meet the ""goal"" that is set of 70 calls/day per person.  The Manager refuses escalations, is unavailable more than half the time, leaves early, gets here late, and when she is here she doesn't return calls that have been escalated to her in the first place. We constantly get agents calling us back complaining about how she was supposed to call them back a week ago and never did. They want to micro-manage but are not worried about giving us the proper tools to accomplish what they are micro-managing. The Director is just as clueless as the Manager. And so is the site director.  Forget customer service, it is about the numbers. Everything is becoming outsourced to save a dime, but is in turn ruining the company. The pay is a joke, and there are no raises, so as the cost of living goes up we are stuck making crummy wages."
bad,This company is outsourcing my department and getting rid  of  alot of people some thats beem with the company for over 22 yrs
bad,"Do not waste your time and go there. The company is going through major lay-offs and their audit department has been impacted.  I was one of the many that were laid off.  It is a cut-throat type of environment, managemet likes to blame staff for their lack of managing their teams, and no work and life balance.  They are very quiet about letting people go since they do a surprise type of lay-off. I have worked for this company for a long time and it has changed for the worse. Don't waste your time, you will be disappointed."
bad,"Leuke werk omgeving leuk personeel veel geleerd,"
bad,"all work, no respect. it was simply a job, not a career. Long hours, lots of work (which was sometimes gratifying). no talent development available."
bad,"Making decisions on applications for writing personal insurance for high net worth client. Works closely with brokers and agents to ensure clients have appropriate coverage in place. We work as a team and bounce ideas off of each other all day long. The hardest part of the job is getting people to understand that insurance is a commodity and that there are times where we have to take action on an account or increase rates. "
bad,A typical work day was busy.  Manager was great and encouraged promoting within.  Manager also encouraged and approved education and tuition reimbursement.
bad,"Highly political company.  Heavy red tape inolved in internal processes. Motivations based on he said she said mess instead of actual information.  Very Crony, this company promotes from within.  It promotes based on management likes instead of qualifications.  Some ideas not liked or proceed based on who said them.  No minorities in management."
bad,"My immediate manager was fabulous.  The managers on up the food chain seemed to be all about politics.  I came from another insurance company and was told I would make double, but the pay was no where near what I was told and much less than I was previously making."
bad,They cared about no one. If you were late they docked your pay by an hour.
bad,"I worked in the Facilities Department and had a great work experience that helped me to develop my skills, however was faced with challenges when trying to advance.  Very shady and unethical business practices within the group.  No integrity existed - hence their collapse"
bad,"Manager's are snubs & extremely rude."
bad,My experience with the company has been a challenge for advancement. Little to no diversity. Very little room for growth change or advancement. I was not told that we were able to obtain pay increases for receiving the government bailout. You are penalizes for presenting ideas or if you questions ratings for end of the year reviews. When ask how can we help the company save money I suggested using technology vs travel. work from home. Ideas were shot down.The plus is the company offer a pension but of course not guarantee.
bad,"A typical day at work would be processing annuity checks from 3 different lockbox drops and ensuring all checks that were in good order were processed same day. Processing items in ""Not in good order queues and personal queues. Responding to various emails and voicemails. Researching various work items to bring into good order. Ensuring the lockbox was balanced."
bad,"Wouldn’t recommend .. not good for emotional stability, company does not look out for employees.. most managers are stressed out mentally and emotionally.  Hard to plan for a vacation. Do not apply for a call center position."
bad,"Poor culture, abusive supervisors and childlike behavior from peers and managers   No sense of stability or job security   Gossip and game playing  horrible atmosphere"
bad,Management lacks professionalism. Advises not micro managing but clearly that is the case. It is sad that a department has over 200% in turnover and it is not addressed. Miserable place to spend the majority of your waking hours. The work is not hard but working becomes unbearable when you are constantly attacked by first level managers and no help is available.
bad,"expectation to work extremely long hours (12-14 hours a day) with no breaks and often on weekends. no reasonable way to maintain work/life balance and not much empathy from management regarding ""family life"""
bad,"RUN dont walk away from this company, they have MASSIVE layofffs with little warning. Severance packages are good but that's the ONLY positive with this company"
bad,"Unorganized and unprofessional environment "
bad,"I worked 80 hour weeks for these guys and when bonus time came around, if you're not part of the ""good ol boys"" network back east, you'll get a big goose egg."
bad,"Management absolutely clueless.  Claims were never paid on time, if at all.  Once it was known office would be closing due to downsizing, nothing got done.  Everything stopped."
bad,"Overcrowded. Zero management abilities. No help from others. Everyone to fearful of their own longevity"
bad,Run away from this company. I worked there 10 years and was laid off. We saw it coming 70 of us gone. No raise in years. Nice system installed if you went to bathroom you had to put yourself on break because manager gets a red flag if your computer is idle 5 minutes. Good severance package.
bad,"The Management team over the new business, customer care, licensing & commissions department is the absolute worse! There's high expectations yet nobody (CSRs) has all of the proper tools/training to do the job ""efficiently & effectively,"" as management calls it. Access to the systems that were provided, was not given until the end of training. Callers are constantly escalating & demanding managers to speak to but guess what? The managers & site director Lisa can't assist, they have no clue on how to do the job! Talk about having people with titles just there to collect a check! Keep in mind, these are the same individuals that determine how much of the annual bonus that is offered. There is no opportunity for growth because they find a way to block you from other positions. There's no resources available and the managers never answer questions. It's ridiculous that escalations are passed to the manager & the manager will ask another rep to call the caller back to fix the issue! Beware when getting accepted into one of the positions above."
bad,Worst place I have ever worked......Treated like a little child. Watched constantly for even talking to your peers. If you get up from your chair to talk to someone you are reprimanded. This place is a sweat shop.......It's like a maze of people all around you in little cubicles. Dirty environment. 4 small bathroom stalls for at least 75 to 100 women. Disgusting...Managers are incompetent and are still there because they know someone or related to someone in the company. Daily stress is terrible. Constantly being told you have to bring up your production or you will go on probation. Very stressful. Would not recommend this company to anyone I know and have not done so......
bad,"if you looking for good career advance don't look job in AIG,"
bad,"Berkeley Heights Loss Sensitive group had a very weak management team. Young kids with huge egos ran the place. Competent managers who worked hard,were smart and who treated people with respect got trampled on. My VP took naps every day and stayed awake just long enough to muckup work of staff or hand out pink slips. The Operation is truely shameful."
bad,"Unreasonable case load, ill defined expectations, emotionally and verbally abusive management at the branch level."
bad,This company has no regard for their employees. Discriminatory practices are prevelant through out the company. They are not a diverse culture. The work force is made up of people that are not professional and respectable. It’s the old insurance man mentality. They do not educate or provide budget to get people up to date on industry practices. They fire anyone who is progressive or a woman. Orientation is a joke. They listen to Wall Street as they follow the money and don’t give their insureds proper pricing and service. Underwriters run the company and the rest of the workforce is not respected. It’s disappointing as they have the means to lead and be a better citizen in the industry. Go work for other insurance houses not here. They don’t deserve sophisticated talent.
bad,The only good thing about working for this company was the benefits. Management did a horrible horrible job. A lot of favoritism with management and horrible communication skills between management employee and hr.
bad,"Too much turmoil within company. Hemorrhaging losses, I don’t think they learned any lessons from the 2008 financial  fiasco the economy experienced. A lot of inefficient decision making within the organization"
bad,"i have been there for almost 5 years and it is like a prison. The management is terrible. They don't like to give raises, but they continue to give you more work."
bad,If you want to work in the mill of insurance companies choose AIG. I felt like I had to take a shower when I'd come home from work. I was routinely asked to do things against insurance regulations.
bad,Work life balance in American International Group is good and 90% of the crowd working in Bangalore is of energetic age group which is an added benefit for new learnings and implementation
bad,"As an account engineer doing account reviews, the replacement work software (GRASP) often required four to five times as long to accomplish account reviews. Little consideration was given by management for the increased burden in establishing work loads and due dates created by this software."
bad,"This job was way to stressful, morale was very very low, they did nothing to raise it. No acknowledgement of work well done. Although I had a good manager, not all were"
bad,"How you feel about AIG is going to vary severely from person to person, depending on what operation you work for, where in the world you are located, and who is in charge at the time."
bad,"The management after 2008 began a race to save the company.  Unfortunately, the company decided the best way to save money was through forced attritions.  They never stopped.  No new hires have been allowed, if a consultant could be hired to perform the work.  This meant that institutional knowledge required to maintain business is now in the hands of contractors."
bad,Only focused on the bottom dollar regardless of what needs to be done to get there. Hardest part of the job was constantly looking for ways to reduce headcount or outsource jobs to other countries.
bad,"Overall the team-culture in the office is quite enjoyable but there is a distinct lack of support here and a very high level of turnover of staff."
bad,Coming into a data migration scenario there was rather frustrating because the testing team did not communicate to the iso builders and  the department I worked in was expected to make things work with their proprietary software.
bad,My standards were way above the standards that this company requires their agents to be held to.  I did not feel that I could continue to work for this company and save my dignity and integrity.
bad,"They are currently hiring for a position at the Corporate Sec that will be outsourced within 6 months, but they won't tell you that. '"
bad,Corporate culture is counter productive to accomplishing day to day goals. The flag of critical is waved too on objectives making completion of goals difficult. 
bad,"Nothing personal, just not interested in working in financial institutions."
bad,Too many promises without rewards. It is clearly who you know and just how far you are willing to stretch the truth to get ahead. There have been several series of downsizing in the Farmington office; just outsourced the call center to the Philippines before Christmas this year. Weak leadership and inconsistencies across all aspects of this office make if a very difficult place to work.
bad,Vast differences in flexible working and treatment of employees across the organisation. Managers focus on own career ambitions/goals and people are routinely employed due to who they know rather than experience. It really depends on what part of the organisation you work for.
