rating,review
good,"The manager, I work with is very nice, but does not know how to develop the staff. I was hired in a position where I would be able to get promoted to management level within 6 months-1 yr. As said they promised me the position, but are not standing by their words. I do everyone’s work and there is no sense of appreciation for our VP."
good,"Excellent companies to learn how the big cooperation work. Company operated in 130 countries world wide, had opportunity to be in half of them during my tenure."
good,Soent 6 solid years with AIG. DC had a good work environment and staff was top-notch. Issues with management as high turn-over slowed the progress of the staff at the time. New management meant new objectives and visions. Always proving one's worth with new management.
good,"Great for fresh grads to start their career.his experience can often be gained via temping, which can, in turn, lead to permanent work. Also if performing well will get opportunities to travel abroad."
good,"Great team, i left due to poor management. Colleagues were wonderful. Difficult to advance within the company. Due to manager entire team left within 6 months"
good,Colleagues were helpful and fun to work with.  There was a team environment and everyone worked together to get the job done effectively and efficiently
good,"Overall it was fantastic experience with AIG, management was so supportive and well guided. I got very good exposure to different technologies and got a chance to train other as well."
good,good environment management another story had fun while working here would look @ again if need be fun company had to be proficient in excel and emails
good,It was fun working in AIG with mature work environment and predefined processes. Very skillful management with prime focus on customer services. Worked closely with onshore team on day to day basis to achieve defined goals.
good,"The job often requires working through day to day tasks independently without a lot of oversight so motivation and being pro-active are key.  Work life balance can vary depending on what department you work in."
good,"Constant change is the norm at AIG, must be willing to get used to this fact, otherwise you might be better off looking elsewhere.  Provides great experience in the industry, but not a great choice for long term stability."
good,"-Good place to work "
good,work from home most days. Stressful work environment most days. Lots of dealing with agents and brokers. I learned a lot about insurance and commercial.
good,It was good experience working in AIG. I was part of Financial operations and also got an opportunity to travel to London for Transition. I got an experience to work in Insurance Domain
good,I worked here as a co-op student. Was able to apply what i learned in school to work. Management was good but there were no room to grow or move up or to return.
good,"Teams run in silos.  Experience and success varies significantly based on the assigned silo. The majority of the senior management team is no longer there, so things may be different now."
good,I wouldn't recommend working at AIG. Insurance business is changing. More likely to streamline business units than to expand departments. Simi regular lay offs.
good,"Most of the client employees are very kind, supportive and helpful. Project task is demanding. Many learnings have been gained thru my experience.here."
good,"When I worked for AIG, it was a company in transition.  Each business unit was under review and remediation causing a great deal of disruption to strategic direction."
good,typical adjusting job behind a desk: answering calls and adjusting files. Timeliness and organization is what you need to succeed. A lot of the time there are issues you need to settle quickly
good,"It's a good company.  employee engagement. good atmosphere at the office. salary does not equal the experience, but they offer training for insurance."
good,"The company was a good company to work for at the time.  AIG provides training classes, good benefits with decent hours of work. If I was not laid off during the recession years I would have finished my career working for AIG."
good,In all honesty it wasn't that bed of a place to work. Management needed more training and they need to make the schedule more accessible to people who live out of town. Don't automatically put them on 10 hour shifts in then make them work overtime in not give them lunches.  The pay is not that great it was $10.50 an hour. To do it again I doubt I would work there again.
good,Customer service organization was a godsent! Most co- workers were friendly and professional.  The culture was antiquated but was trying to improve. There was plenty of training available but not for the day to day task. There was a get it youself attitude. Politics was the hardest part of the job. It was enjoyable to network amongst some peers.
good,"Challenging , fast paced environment, rewarding for self-starters.  Company coming from manual process to automation. Be proactive in gaining knowledge."
good,"Really enjoyed working there. AIG is a really strong company and they take care of their employees very well. Even though they had the bailout, they recovered nicely."
good,AIG used to be a great company to work for in the beginning.  When the Vice President's position began to have a high turnover rate.  I believe the focus on what was best for the company & employee's got lost by personal vision.
good,Good work place.  I enjoyed my time there as a project manager.  The office atmosphere was nice with friendly co workers.  Pleasure to work on site at the office
good,"The good things of this company is the work environment and culture. It is a comfortable place to work at but strict 'house rule'."
good,If you are all about proven systems and procedures this is the company for you. Very little autonomy but they are very efficient at getting things done. Success here depends on how willing you are to follow the AIG process.
good,"Relaxed work environment, most people were willing to help advance your skills and gave you opportunities with projects if you showed that you are motivated to learn and will deliver results"
good,"When I worked in the NJ/NY offices for a different group - I would have given the company an excellent rating.  "
good,"AIG is like a family. We had weekends off and publick hilidays too, had free lunches and working tjere was a geat pleasure. Work was done on time and a lot of new things to learn."
good,"it is a place of work, that allow a lot of days off,  the best part of the job is being able to listen to must.  they do provide free bags of fresh popped popcorn.  well hope this is what you wanted to know"
good,"I learned that the harder you worked and were good at your job you would not be promoted, those who didn't perform were moved up the ladder while others were not."
good,The most enjoyable part of the job was working with my team who were very cooperative and respectful. Management in general was easy to communicate with.
good,It is a cool place to work I enjoyed my coworkers but one thing I didn't like is that I you have to wait 3 months for your commission check & I found myself drink less water because in order to qualify for commission you had to be at you desk for a certain percentage of the day therefore I made sure I didn't have to take a bathroom break so I wouldn't become ineligible for my hard earned bonus.
good,Management give employee freedom to come up with innovative solutions. Learn to lead global cross functional team. Opportunities to help business to created innovative solutions.
good,I liked working there very much.  Met a lot of nice people and had fun while doing my job.  Flexible working hours and work life balance.  Enjoyed my job very much.
good,there was nice and mean people but the nice people made it all worth it. working in the shipping department was lots of fun.There was times of complicated work and less hands on training.
good,AIG was a good introductory opportunity into the business but I did not feel like there we’re many learning opportunities or room for growth. Management was dependent on who you were assigned to work with and the work was not split evenly amongst interns.
good,"While working for AIG i learned a ton of information. This field is great. The company on the other hand is something different. Not secure at all. Due to financial issues, they are having a massive amount of layoffs and my department is dwindling down to only a few individuals. Slowly they are transitioning to moving everything overseas."
good,"It is a good company,. just too much change happening. The benefits are good but the hours are very long. It is a good company,. just too much change happening."
good,"I never worked at AIG, but did some consulting for them.  Indeed is insisting I rate AIG in order to upload my resume.  It was fun working with them through the capacity."
good,An environment that facilitated productivity and competitiveness. Also allowed for independent time and project management with healthy benefits and pension.
good,"Good office atmosphere"
good,"Spent 20+ years there. "
good,AIG is a complex organization.  Can be chaotic at times.  It provides plenty of career opportunities.  Sometimes it is fast paced other times small decisions are slowed down by bureaucracy.
good,I enjoyed my time at AIG.  The management was always helpful and knowledgeable.  We had great teams in our departments and it was fun to come to work each day.
good,Ok place to work if you are a ok with contract. Decent work environment and i learned a lot. Learned a new remote tool and got more experience with Active Directory
good,Great job and environment. Would recommend for an aggressive sales men. Very face paced. Very relaxed environment. Managers are very helpful and try their best to accommodate employees needs.
good,Smaller company purchased by larger. Smaller company was dysfunctional but had a lot of dedicated employees. Systems were outdated but have been updated since then.
good,"méthodes très américaines avec plateau ouvert bruyant"
good,"Very Friendly staff but a busy environment, i recommend this job if you are looking to get experience from a multi platform systems."
good,"OK place to work. No salary increase, hard to get promoted. You must move around to make more money. Flexible work hours. Great employees like family. Most work days are extremely busy. The job is not challenging."
good,AIG has provided me with the tools to advance my career. My direct supervisors are second to none and have supported me throughout my 10 years at the company.
good,"The team I was on was great.  We helped each other to make sure that everyone shined.  Pretty sad that 13 out of 15 of us were let go.  Most of us felt bewildered why were let go; if it was because the expenditures were too high, then why keep hiring senior executives."
good,"- Cách quản lý công việc tài liệu một cách khoa học"
good,"The company tries to run with the herd, it tries to get the latest technology and devices to use."
good,"Good management and friendly workplace. People are open to different perspectives and opinions. There is unity in diversity and everyone works in harmony to a common goal. Since its a captive setup, there are very limited growth opportunities.The movement across teams and processes (lateral and vertical) is not free flowing. All in all it is a good company with hard-core exposure to the Insurance sector, as it is one of the global leaders in their industry."
good,"I was an underwriter assistant and content at the time. I was assigned to an underwriter that was willing to train me. But as time grew and underwriters started to get laid off or quit, I was then promoted to be an underwriter. The manager that was under was not a good mentor. After restructuring of the organization, my unit was thrown around and did not know who we reported to."
good,"If it weren't for the level of uncertainty, I would never leave. Working here has been a great experience thus far and the only hope is that will continue in some structured form."
good,"It used to be a great company to work for.  Over the past 6-10 years, the morale of the workforce has been deteriorating due to the constant fear of being laid-off.  The company posts positive financial numbers quarter after quarter yet employees are laid off often."
good,Constant change breeds instability constant feelings of insecurity of job progressions.  Hiring freezes as a result of poor company performance.medioc
good,"*Great work and life balance"
good,Serious ambiguity about company management. Lack of structure. Company has been trying to rightsize for years and can't seem to get it right. Work life balance is good.
good,"My time at AIG was contract work, not full time. my manager and the team I worked for were great. i cannot provide feedback ion the company, the benefits, etc as I was a contractor and did not have experience with any of this"
good,"If you like highly competitive culture, this Shared Service is the place for you.   There are great rewards for high production achievement and great mentoring program.    Check out the website."
good,It was a good place to work until new management took over I do appreciate the experience that I have learned to take with me to another step and experience in my life.
good,"Loved the job , but they walked in to a meeting one day and let all agent go , said they were taking another route. Would have loved to stay with company"
good,"This was the very first company I worked for but I was actually hired through a placement agency so I can't really tell so much about this company. "
good,It has been many years since I worked at this company and the office I worked for shut down. While i worked there management had transitioned and they were struggling.
good,"its an alright company, hard to move up unless you know somebody, very low pay in my opinion. Very relaxed work place environment. Depending on the area you get hired in the hours can be flexible."
good,"During my time at AIG (American International Group), I was able to successfully increase productivity and greatly reduce exposure to potential liabilities with the creation of and implementation of databases and reports; perform end-to-end over sight of alternative investment month end processes and identify, track, and age variances in transactions for review, analysis and subsequent resolution."
good,"I worked in the claims division of AIG. I worked with some of the most experienced supevisors and managers ever.  Like most claim departments, the number of incoming claim can be challenging."
good,"Temporary position, finite, hired by a temp agency.  Company site was closing. Friendly staff and supervisors, many company perks, community oriented."
good,This was my first time working as an Investment Advisor.  I learned much information about financial planning and retirement.  My career was going along great until AIG shut down our office.
good,"Found the employees to be uninterested in assisting us in doing our job."
good,I worked in the Troy office doing insurance applications for other states which our agents were not qualified to do. The customers did not know they were calling in to Michigan.
good,"Had a good experience, learned a lot and moved up the corporate ladder with good mentorship along the way. The company would benefit from a better workplace culture."
good,"The culture of AIG changed as I progressed in my career. Promotion from within was strong, but as I went into a niche market there was little room for growth. Depending on the manager the experience with the company could be great or sour. My last job title I was not compensated at the proper salary grade because I came from another office. Instead of increasing my salary and salary grade, it was left three grades lower. I'd applied for positions with the same job title and the same job description but was told that I could not get the salary grade three levels higher."
good,"Good place to work, learned a great deal on the overall operations of the business. Collaborative environment for the most part. There is a high turnover rate in IT upper management. Hardest part of the job is connecting with the various departments within the organization as the company is very large. It takes awhile to develop these relationship so that you can connect with the right people to get your job done."
good,Company went through several reorganizations while i was there however my colleagues always maintained a good attitude and focused on the projects/tasks in front of them.
good,"I enjoyed my coworkers, the job function in itself, the flexibility to work remotely when necessary, my mentor and assistant manager were both great as educators and as people. The main drawback, and it was a big one, was an incompetent, recluse manager who did not much enjoy being around people, seemed dismissive of female opinions, talked about women's attractiveness in the work place, and really lacked expertise in the field we were in, and was in the office what seemed like three days a week on average."
good,overall good. they are trying a modern workplace culture with open floor plan. everyone is kind and wants to help you. stressful work with good people
good,"Used to be a very good place - now not so much.  IT is much more about compliance and paper, and less about solving problems and moving the business forward."
good,"AIG is a very fast paced environment.  Very entrepreneurial shop, but like any other organization, the process of getting deals done can become very cumbersome.  Difficult to be nimble."
good,never acutally worked for aig was a vendor in their facility. people seemed nice and they always had something going on to help the communicty. ie: packing supplies for hurricane victims in puerto rico
good,A typical day would consist of 
good,"Good benefits and a management team that listens to feedback that can have a positive impact on outdated processes and procedures. However, with AIG being such a large company, change takes quite a long time to get through the proper channels before they can be implemented."
good,"The job was fine, we received training, the hours were flexible and the job was laid back. The compensation was also fair, but given the option I would chose not to work off commission."
good,The Office is on Wall Street. Well actually Pine street. So working New York City was a new adventure. I really enjoyed the people and the work. I then went their R and D in Boston.
good,"Full time employee for a finance company;"
good,"Helping people resolve there financial issues on a daily basis also assisting member's with loan paybacks, assisting with hardship requests and helping with members change stock options."
good,"Reorg always happening."
good,"Productive and fun place to work. Fast paced.  Very busy.  At times stressful.  Cost conscious,   Good people to work with.  Management does its best to ensure the staff engages in social events to balance the hard work with social events"
good,It was a great job for the short time I was there. My coworkers were great. Most of the management was good. I unfortunately didn't have a good manager.
good,"Good Company. Insurance based environment focusing on both Commercial and Consumer insurance products both domestically and internationally."
good,I am feeling good  but its not great . Some people criticized as its bail out company during recession . So i am not feeling good to say some one refer to work .
good,This was an experiment to see if aig could be an agency life insurance company. Howev er it did not work out. They did not have the support system in place.
good,Just seemed to be a run of the mill call center job. They sell it as a Customer Service role. Just answering calls. Helping no one but their bottom line.
good,"Good company to work for with good benefits, but they don’t offer raises  the starting pay is very low . They have montory over time with only 1 day notices. The shift changes every quarter based of your performance"
good,"good work lift balance, friendly people to work with, one day promote, nice working environment, fairly paid, lots of good training staff, holiday days paid."
good,Good place to work.  Enjoyed working in the HR dept.  Management and President is nice.  I haven't worked there in awhile so not sure  how it is to work there now.
good,It depends on which department you would work. AIG in general is a great process oriented company. Their SDLC process is very book like and you can't go wrong anywhere.
good,"Company has been in a state of flux since CEOs retirement in 2015.  Sadly, the CEO that was put in place (Hancock) was asked to retire.  Company is going thru a lot of organizational changes."
good,Job is wonderful.  There is a lot to learn on the job. Workplace culture is great. The hardest part of the job is to learn all of the applications that AIG supports.Meeting new people the teamwork is wonderful.
good,this is a wonderful company to work for. I work there when it was American General.  I work for this company for 21 years.  If I was able I will go back and work for them.
good,"Working at night"
good,"Day to day consists of answering phones with a high call volume. 2 15 minute breaks (paid) and 1 hour lunch (unpaid) per day. As a CSR you are highly micromanaged and must be on the phone every second scheduled. Depending upon the department, your calls will involve various tasks involving assisting insureds, agent, third parties, medical providers, and attorneys. The teams within the departments consist of a great group of individuals. Teammates will often quickly assist and support one another. The most enjoyable part of this job is being able to help others. However, the hardest part of the job is the lack of pay and difficulty in advancing within the company. If you plan to remain a customer service representative your entire career, this might be the position for you."
good,"When I worked in customer service it was a fun atmosphere, but little pay. I moved to sales for more pay & all the fun went out the window. We don't get any appreciation for what we do. There are great benefits, health 401k, even 2 weeks paid vacation of the bat, however there are no pay raises. None! So if you don't change positions or move up you're such with the same pay no matter how good you are at your job, no matter what the economy is like, no raise!"
good,"I worked for AIG in NY office, Wall Street. The company was large with varying personalities. Most of the management is fair. I learned a lot here. Each of my workdays were every different, making it more enjoyable to me."
good,"The organization was wonderful staff. The processes were well chalked out and it was a very  innovative experience to work there."
good,So many changes taking place now and over the last few years. Seems to be heading in the right direction and has a great customer focus. The people that work there are the most enjoyable part of the job.
good,Good support from the management. Good place to work and learn about different communities. Salary is good and one can make lots of incentives and bonus
good,"I have worked for AIG since 2013 and have had a handful of experiences during my time working for this company. A typical day for the department I currently work in is filled with working out of queues, reviewing Divorce and Power of Attorney documents while working with other processors in those same and different queues. Management tends to work fairly well with employees, especially if an emergency arises or the sudden need to take time off occurs. The job can be a bit stressful sometimes but overall, AIG is not a bad place to work."
good,"High paced environment included live trading with many companies and independent traders making trades in the commodities market.  Great place to work, however due to electronic trading, the physical pits have since been closed."
good,Very challenging.  Data center is set in their procedure and not open for change.  Every day was a challenge and recommendations made for improvement were usually no acted upon.
good,"Prime Responsibilities:"
good,Nice place to work for but not having long term projects. rest all is fine and we get our own space to express the views and thoughts while working here . I will rate 3.
good,"Normal hours. High turnover due to nature of business. Pay didn't match work. Solid job for someone looking for good benefits. Culture was fine, just high turnover."
good,This was a temp job in the Head Office. Made photocopies and helped the Office Manager with personnel files making sure that everything was up to date.
good,"Coordinate communications regrding order status with all constituents of the order which can include claims adjusters, nurse case managers, physicians, claimants, and suppliers."
good,"Totally self generated sales. Very little to no support to field agents form local management. They will want you to sell to all of your friends and family in your first 2 months, then leave you on your own to find clients."
good,Company's upper management was not watching the active management of company's assets which led to the collapse of the US economy. I grew to the top 3% of annuity producers in a tri-state area within the first yr. Company went bankrupt after which I decided to get out of the financial services industry.
good,"I gain a lot of new experience"
good,It wasn't until I was put on a team that I really felt like part of the company. I did learn how to use new software and went over my skills in Excel.
