rating,review
good,Great place to work. work environment is really good and competitive. Many different projects. Hardest part of job was to deal with three team at the same time. Most enjoyable part of the job is the day after the tap out. You feel so relaxed and free that you think about many different things.
good,"In the administration role at Broadcom, we work very much alone, but we are all part of a much greater team. Communication is a must, both via phones and e-mails due to scheduling goals, as well as meeting the necessary required action for any given task. The company has sites world-wide and therefore we communicate with people from all around the globe on a daily basis."
good,"It is a great opportunity to work at Broadcom. As a new graduate, you can learn a lot from senior engineer and they have the most up to date chip design technology which is so appealing to any electrical engineer."
good,I got an active work attitude. I am impressed by my hardworking and nice colleagues. I felt great even though I needed to over work sometimes.
good,"I have been working at Broadcom for 3 years and it was a good experience working there. However, they decided to shut down the baseband business unit so that I and thousands of employees lost our jobs in 2014."
good,I enjoy my work at Broadcom and working with assoicates and management.
good,"A great company and a nice place to learn"
good,Team members are v.cooperative. We can learn as much as we can.
good,"Tested Dash System with various management tools and applications (powershell, ipmitool, etc.)"
good,At Broadcom you are provided with the tools to work efficiently.
good,Working with the guys there was fantastic. I enjoyed working at Broadcom very much. The professionalism was beyond my expectations. The technical knowhow is far beyond the norm. I consider myself extremely fortunate to have the honor to work alongside with brilliant engineers. This is one company I shall reflect back as one of the best places that I have worked.
good,"Broadcom is fast paced with a minimalist culture."
good,"During my 4 years working at Broadcom, I found it very enjoyable. We had great staff, management, bosses and coworkers. They provided insurance, and a friendly atmosphere. I would apply here again."
good,"Fast paced environment with incentives. Management as well as colleagues willing to assist at any given time. Very rewarding in terms of ""being part of the team"", being a part of a growing company."
good,"Had the company not been acquired and my job function moved overseas I would have stayed at Broadcom for another 20 years.  Fantastic people, Great departmental management team."
good,"Pros:"
good,"Broadcom and NetLogic provides a true end-to-end network infrastructure platform solution, extending Broadcom’s leadership in integrating the bandwidth, connectivity and cutting-edge processing technologies required to drive the next generation infrastructure build-out. Financial it's good and stable company ."
good,"the work is highly productive and challenging one."
good,"Broadcom is a pleasant place to work in. Typical test engineer's work is to test the new release of the design group, not that difficult but tedious. But the co-workers are really nice, and they'll help you out when you are stuck. Generally, I love this company."
good,"Productive and fun workplace. People are friendly, helpful, and welcoming."
good,I did my co-op at Broadcom for 8 months as a system engineer intern in the QA group and I couldnt be more happier for all the awesome things I learnt there along with the constant mentorship of my seniors. A fully equipped Gym adds to the perks and incentives. I miss working at Broadcom.
good,"Monday~Friday"
good,"Great place to work, wonderful break rooms and nice people. Shift were reasonable amount of time and over night. Great compensation and incentives days with amazing benefits."
good,"CA is a great place to work if you want to be on the cutting edge of IT infrastructure management.  Over the decades it has grown from a company with the fastest sort utility for IBM mainframes to the recognized leader in IT on many fronts.  For me, as an instructor, there is no typical work day.  Sometimes I'm teaching a class thousands of miles from home or I'm teaching to groups of students live over the internet and spanning multiple continents.  Other days I am writing/editing/testing new curriculum or learning to teach new products."
good,"Proven ability in development, implementation and improvement of Wet Etch, Wet Strip, Wet Clean, Flux Reflow, and Thin Film deposition equipment and process solution into wafer semiconductor manufacturing environment with high volume production."
good,If I could experience this type of work environment and culture all over again then I would do it in a second.  Everyone there was so dedicated and loved what they did.  When I first started there I was a receptionist which I loved.  Being the first impression of the company such a great fit for me.  At the end of my time there I assisted the V.P. of Operations.  All duties within my career at Broadcom were truly valued and I learned so much from all my years there.
good,This corporation gave interesting problems to solve on a daily basis. It was a fast paced work place with a great team to work for.  Never had the same problem to solve over and over.
good,"Every day at work might not be easy, but with proper planning and prioritization, it will bear the best results through team work, communication, resilience, determination, ability to adapt to situations and creating a learning portfolio to avoid any repeat of a mistake."
good,Management allows engineering to work through problems and provide robust solutions. Performance is recognized and rewarded with opportunities for career advancement. Good work life balance and great compensation & benefits.
good,"Good team work, good communication. Great bonus every quarter.  Learned a lot from co-workers. We have to work on the weekend when new product released from design engineers. Friendly working environment"
good,"Speak with someone at an industry event to form an opinion.  Since I have vested shares, my bias will be towards the positive despite any reservations."
good,I worked for 10 years at Broadcom and it was one of the most interesting experiences of my career (and life).  I made many good friends there and sometimes wish I were still there.
good,"Relaxed atmosphere.  Professional organisation."
good,"Overall Broadcom is a great place to work.  Friendly people, great benefits and lots of opportunity for advancements.  Great management team that looks out for there people.  Very fast paced but challenging."
good,"good company"
good,"I've been at Broadcom for (14) years and enjoyed it!  Management and the employee's were like family. It was sad when the company was taken over that there were a lot of people affected. Otherwise, I don't have nothing bad to say about the company."
good,I am much thankful to my organisation as they provided an opportunity to start my career but simultaneously I love to work in the more challenging environment. Expecting a different change with the same work every day is a waste hence decided to go ahead and grow the skills in all sector.
good,"Wonderful people, very diverse. Free food!   You will love working here!  Highly recommend this company!  I will work here again if they want to rehire me"
good,"A friendly atmosphere, good learning opportunities, good work-life balance, nice on site opportunities, good higher management, ample of opportunities to learn and knowledge gaining."
good,"•	Support wireless communication system chip and validation on engineer evaluation boards"
good,Worked with many different people with great talents. They provided upward mobility. The company provided me with many opportunities to grow and learn different skill sets.
good,"Broadcom, a product based company and a place to all the engineering who are proactive and very much excited to work in the field of wireless and IC Design.  There wouldn't be any timings to the time when you come to the office and the time when you leave.  It all depends on the target you complete within the specified time.  I learned a lot in wireless engineering, had a great experience working in most critical projects and testing wireless chips."
good,"A brilliant work place"
good,"Dynamic work environment which makes it exciting, challenging projects, exposure to multiple set of skills on the job"
good,I am very delighted to work in broadcom corporation ltd.everyday i have learned a new things with my co workers. I have worked in three apple projects so i have learned much more information on wireless packets.
good,"I worked as Admin,"
good,"Broadcom Corporation, an American fabless semiconductor company, operated in the wireless and broadband communication business. "
good,Night shift offers a fun yet professional atmosphere with diverse opportunities for advancement for those looking to grow with a Fortune 500 company. Great benefits and work-life balance. Management encourages employee feedback and sets reasonable expectations for performance.
good,"The workplace has good culture with lots of diversities."
good,"A typical day at Broadcom is packed with customer, client, and team- meetings.  The work is complex, intellectually challenging and engaging.  "
good,Lean leadership with strong management . Communication skill with vendors and customers .My Boss are very good enough to teach me .Friendly co workers .After one year get promoted is the most enjoyable day for me .
good,"A good company to work for, good compensation, very good benefits. In the end company layoff massive employees in 2014-2014"
good,Work culture is awesome and best engineers to work and learn both technology and extra fun. Technology we deal with is pioneering advancements in data networking and system on chip related technology.
good,"A great company to work."
good,"Conversion of verilog testbench to UVM testbench."
good,"You can focus on your job and ask mentor questions if you meet any problem. You can get free drink. QA team focus on linux/windows and you can write library for automation testing. Over All, it's a very good company for you to stay."
good,"The best company to hit at any point in your career, if you are really passionate about working hard and gaining knowledge. friendly environment which free lunch is a plus"
good,The Broadcom is a good company with better salary and with balance of life and work.The working environment and the equipment is really good.
good,Working at Broadcom was a wonderful experience.  Being surrounded by people who are the best at what they do and have a passion really energized the entire organization.
good,The people are great and the work is very engaging and challenging. The environment is friendly and a great place to meet new people and enjoy work
good,I get the best work atmosphere at Broadcom. My team is enthusiastic and very helpful.
good,"I was a Design for Test Intern at Broadcom, San Jose, CA for 7 months. My team trained me with the basic work functions of a DFT Engineer. I also learnt how to carry out Functional Verification, find and fix bugs in a design. I developed Perl scripts to automate tasks.      Working at Broadcom, I learnt time management, working in a team, public speaking, how to be more productive, and also enhanced my verbal & written communication skills. "
good,"A Fortune 500 company. Great place, great people to work with."
good,Very focused on market development and match engineering resources. Friendly work environment. Good relationship with top-tied clients.
good,"Great company, they treat you with respect and there is alot of percs to working with this company."
good,"-- Overall good development"
good,"-in a typical day, interns will have discuss of their goal with their mentor.  "
good,the managers and the entire team are very supportive. they enciurage learning and finding more issues rather than just do conventional testing!
good,"Broadcom Corporation (NASDAQ: BRCM), a FORTUNE 500 company, is a global leader and innovator in semiconductor solutions for wired and wireless communications. Broadcom® products seamlessly deliver voice, video, data and multimedia connectivity in the home, office and mobile environments. With the industry's broadest portfolio of state-of-the-art system-on-a-chip and embedded software solutions, Broadcom is changing the world by Connecting everything."
good,"Frontend Flow Development"
good,"flexible hours, talented co-workers, good management, lots of training"
good,"Working as an Intern in Broadcom, I have learned a lot from my work and my colleagues."
good,"Managers are very helpful, and guide us to the right result."
good,Finish layout with circuits designers. Everyone in that company is helpful.
good,"During my 6 years of Broadcom experience I've learned many useful things sucj as Applications Engineering, QA lead for the tools team and C# development."
good,I learned to be a team player. I learned to work under stress. I learned to work long hours.The most Enjoyable part about the job to do a great job and have the people happy with my work.
good,"Productive, Engineering desing work, Project goal are met. "
good,Very nice atmosphere. Friendly Team. New latest technology.
good,• Publish daily design win validation reports of each sales region’s performance based on the status of their opportunities.
good,Great place to work with professionals.
good,I am happy with Broadcom. good support from team members and management. no work load . freedom to do work .
good,Great environment
good,"• Leader of the infrastructure projects and technology for the bank branches in the whole country. Coordination, Planning, Execution, termination of teams and technological services of the units of business. Implemented network security where none existed previously through use of Cisco PIX, Knowledge of VoIP communication systems Nortell, firewalls and VPNs between remote offices and central office."
