rating,review
good,"this is the first time i have worked a graveyard shift and this shift at broadcom is very relaxed and easy,  however, if you are thinking about working graveyard at any place i recommend you think really hard about it."
good,Broadcom WLAN team operates like a start up.  Lots of work.  Good technology.
good,"I worked as a Intern for 8 month and really enjoyed my tenure. I was responsible for testing various chip and assisting engineers, but given the opportunity  I started coding and developed application which was appreciated by everyone. I will recommend anyone to work with this company at any point of career."
good,"Would really enjoy working for Broadcom again. Management was fair, always opportunity to advance. The company really cares for and takes care of their employees."
good,"Broadcom culture is to run lean. Don't expect much from Broadcom, they care about numbers and nothing else. It's an okay place to work if you don't expect a fancy office. Not a place I wanted to work for."
good,"If you keep your mouth shut and do the bare minimum you will keep your job. Suck up to management to get ahead ,slow paced job no real job advancement. Lost a lot of perks and don't see them coming back with the clowns in charge at the moment."
good,"If you had problems with co workers whom were best friends with the supervisors you wouldn't get any help from your bosses. They would edit time cards so upper management wouldn't get suspicious. Then in the case of harassment, if they were apart of upper management they would block your opportunities for advancement for reporting inappropriate actions or advances."
good,"When I start my shift, I was given a number of job requests from Engineers.  I would test those job requests according to Engineers' instructions. At the end of the shift, I would notify or update my report on what I have done during my shift to Engineers and my manager.  The job itself was enjoyable, I work with minimal to no supervision and I'm very comfotable in this kind  of work environment."
good,"Depending on your role at Broadcom, your experience will be either be incredible or miserable. Most of that is due to poor management in some departments; Otherwise, it is a great place to work. Good benefits, good work-life balance (for some). The good jobs there are great, but the jobs within a poorly managed department will have you de-motivated, looking for a new job."
good,"Comprehensive training programs"
good,long hour of working. no vision or bad vision of Sr management team at least for mobile platform solution team.
good,"Good place to work if you are single. ""Unlimited vacation"" means you will be lucky to get two weeks off during the year. Management has a habit of canceling leave with little notice."
good,A company which focuses highly on execution and deliverables. Work hard and party harder environment. Excellent engineering and sales team.
good,Broadcom had an excellent vacation program before 2016.  Enjoyed working with other campuses in North America. A very technically oriented company.  Project intensive with high expectations and goals.
good,Always encouraging good teamwork. People work together well and solve problems. People are professional and kind to each other.
good,"As the Sr. Manager, Global Real Estate for Broadcom Corporation I directed all the real estate services throughout North America, Europe, and Asia for one hundred three (103) facilities..."
good,We tend to know a lot of new things from the expertise people over here
good,Work was long and hours were good benefits were good the peers you work with are good people dealing with engineers could be a little hard to deal with due to the language barrier but manageable.
good,"Good compensation and benefits. Not very much socializing at the workplace. People keep to themselves. Overall, great place to work if you just want to come in, do your job and leave."
good,The work environment is challenging with talented staff.  Success is rewarded well.  The design team is internationally distributed.  Management is committed to maintaining leadership position.
good,"The company is primarily focused on non-organic growth, choosing to expand market reach by acquisition and innovation in small niches. This makes for a very nimble and agile company that responds to constant change while maintining customer loyalty."
good,I found Broadcom to be a good place to work.  The company culture was varied as there were several acquired companies working together but overall managed strived to make it better.
good,they also provide company shuttle in the 22nd station and bridgeport locations. the most enjoyable part is that you can do work from home but i think depends on the team.
good,Exceptional place to work with a lot of intelligent to ask help from. Need time to grow within the organization and requires patience. THe work life balance is a little out of whack but the compensation is very good right now.
good,Broadcom is a good company that is located in Silicon Valley with lots of experienced enginneer and managers. They have the state of the art of technology in semiconductor industry.
good,Used to a good place to work. Not anymore. Cut cost for everything. Less R&D. Pay is good compare to other companies. Company main goal is make wall street happy.
good,Working at broadcom was a great experience. Got to connect with amazing and very talented people. Would love to work with broadcom in the future. Good benefits.
good,"The team works closely with each other. The work environment is nice. But the location is a bit far from the Skytrain, and only a few public transit gets there."
good,"Had an amazing time working in the 60GHz 11ad project. "
good,Good company with lot of talented people. I did my coop work and learnt lot of new stuff. Flexible work hours as long as the things get done on time..
good,"I had a great time in my internship at Broadcom, and was able to learn everything from the ground up. The fellow staff were accommodating, and the flexible hours worked very well with my unpredictable class schedule as a full time student."
good,Helps in learning new dimensions in your career. Work culture promotes aggressiveness and productive work culture. They provide good salary and benefits.
good,"Broadcom, the best part is most of divisions work like a startup. Their typical model is to do everything (hardware/SW) that is needed to design a chip in one location."
good,"Nice work place with lot of focus on technology and deliverable s mixed with entertainment and parties. "
good,"Structured management position of administration team. Performance evaluations based on the needs and expectations of VPs and Directors. Administrative trainings and team buildings for immediate team as well as event planning of campus events. Sponsored special campus projects such as battery recycling, CPR training and building emergency plan."
good,"Broadcom is not the place it once was. The stock has the potential to do well, but given all of their current layoffs, the employees don't have any job security."
good,Great place to work/intern. Very nice people. Extremely good place to intern and learn for an student. Good cafeteria !
good,"Great place to work with many opportunities to learn and network with brilliant talents."
good,"Broadcom has a lot of experienced engineers, not many entry-level engineers though. The company is going through merge and lots of people left the company recently."
good,Good people to work with and state of the art wireless technology.  Design and creative people are out of the box thinkers
good,Great company to work for. That is why I have been here for over 8yrs. I will recommend it any day. Enhanced my analytical skills in a team based environment.
good,Broadcom is a fast paced company that requires the very best out of each employee.  In my time with Broadcom I was able to make some life long friends and achieve things that propelled me further in my finance career.
good,Worked with many brilliant engineers who taught me much about the industry. Some managers bogged down by politics and nepotism. Overall a good company to work for.
good,"- Good place for students to intern."
good,Good company with a strong engineering culture and nice benefits.
good,Management has high expectation and expects everyone to go above and beyond their on their efforts.
good,Broadcom is a great place to work and learn from others. The place is diverse with people from different technology background.
good,My manager was active in my learning and growing as a programmer. Most interns are masters students.
good,Manager and coworkers are extremely knowledgeable and friendly.
good,"Job Description:"
good,Nice manager and colleagues. Technology is not that great but is OK.
good,". working with customer issues"
good,"I had pursued my internship in Broadcom as ""IC Simulation / ASIC Verification Intern"". I was responsible for simulating the designs at various abstraction levels and maintaining overnight regressions. I got the opportunity to work closely with design and verification teams for error-debugging and functional verification. During the course of my internship, i learned UVM-SystemVerilog Test Bench development, perl/shell scripting and got exposed to the industry standard simulation tools like IUS, VCS etc."
good,Great people
good,The company runs 24/7 and has offices all around the world. We support nearly 15000 employees.
good,I joined at the time when Avago was acquiring Broadcom. Hence there were lot of layoff and instability. But the team was amazing and management was as helpful as they can
good,"the environment is very friendly , but the communication could be better. the project planning is not made with everyone involved.  very good team building"
good,"A typical day at work consists of responding to unplanned down equipment and working on PM's. I work on assignments that are complex in nature and require judgment, initiative, and technical/specialized knowledge to resolve problems and/or develop recommended solutions. I effectively complete the established procedures in a precise and efficient manner, with strict adherence to the documented process and procedure. I use the importance of understanding of robust data driven solutions and key performance metrics utilizing the existing data modules (SQCS, CMMS, data mining/management skills)"
good,"I worked here as a project consultant through my affiliated business school. Therefore I don't have enough insight to rank or give comments on the culture, management, etc."
good,"Lots of freedoms, but a very feverish pace of work. If your group does well at there job and in the market, you will be reworded well. Very nice campus."
good,You would be working with some of the brilliant minds around the globe.The work is fast paced and maintaining the work/life balance is often difficult.Exposure is great and you would get to learn a lot from your peers and management.
good,"A great place to work until company was sold to Avago."
good,"day to day, i love my job, I was an operator of tools, then moved on to being a tech with in a year, great place to get started in the industry.  However advancing is not so good when it comes to wages.  Quarterly bonuses have been cut as well."
good,"Good to work with talented people. "
good,Broadcom is a great company to work for. The learning and technical exposure one would get is highly valuable. Fun and Open culture.
good,I have a great management and team. I enjoy working here. I share and learn knowledge from each other. I love to stay with this company but unfortunately our product is not price comparative with our competitor the company decided to close our division in Markham Canada.
good,"Nice place to work with huge technology happenings always."
good,"here you will have aggressive startup goals, but with great corporate culture. "
good,"Supportive colleagues"
good,"High quality of engineers keeps everyone on their toes."
good,The salary and benefits packages are very good. The work is challenging and there is always more to do. Schedules are tight and most projects and teams are under-staffed with good engineers. They do make good products.
good,"except they got hammered by qualcomm"
good,"Great company and culture. Tough city to have a family in, but great place to live in as a single person."
good,"Great place to work but once business slows down they will start cutting any temp workers. Company cracks down on attendance more than work ethic. as long as you show up, the company is happy. If you work here I highly suggest that you always show up and don't work so hard that you burn yourself out and need to call in for mental health days, or your days here are numbered."
good,"Good place to work in terms of stability . Main problem of company  - too many aquisitions, sometimes people do not correspond the required qualification, because jumping from one project to other and similar management problems."
good,"Ideal for growth"
good,"Broadcom is a challenging place to work where much is expected from you, but the compensation makes it worth it. One is expected to put in a considerable number of extra hours, but it is recognized when the customer is pleased by the work of an individual. I was able to hone skills in new areas as well as apply my many years of experience to the tasks given. The best part of the job was working with those around me in the office, all top notch professionals."
good,"If you love semiconductors and everything that makes them tick then this is the place for you! The company is filled with thousands of brilliant computing geniuses and advanced mathematicians. For some people, this company is like heaven and for others who don't fit in with that culture it can be the opposite."
good,"Strong product portfolio"
good,"Broadcom is a good company to work, good work culture, work life balance everything is good. I'm working here for past one and a half years and I have a good experience in working here."
good,It was a great place and there are many best brains in the semiconductor industry. Which helps us to leanrs many new technologies and designs.
good,"Good working environment with competitive salary."
good,"Learned a lot about techincal knowledge"
good,Fun place to work. I worked at Broadcom for 1 year as an intern.
good,"Broadcom is a good company for people who like to play with technologies.  However, the top management lacks of visions.  They had committed lots of strategic mistakes that are gradually eroding its technology advantages.  At the engineering team level, you usually get good teamwork without much politics."
good,Moderate to fast-paced environment.   Great co-workers and most management.  Good variety in duties.
good,"Hectic, fun and challenging at all levels. Great benefits."
good,This company has allowed me to implement and expand my set of skills. My manager is hands-off and allows us to complete our work without reporting to him on a daily basis. I favor this type of management because it allows me to dedicate myself entirely to personal assignments rather than accomplishing mundane tasks like writing up a daily report. This review is entirely personal and does not reflect all Broadcom employees; in fact there are several managers that do implement a very hands-on procedure. The most difficult part of this job is communicating. Engineers often disregard my requests and do not find time to respond until it directly affects them - in which case it becomes urgent for all parties. I do enjoy
good,"Broadcom WAS an amazing company to work for. Recently the management change and work slowed down. They are only worried about being competitive, hours were cut and benefits started to dwindle. Any “perk” that Broadcom offered started to disappear. They used to take care of employees now it seems they couldn’t care less."
good,Great company to work with. CEO delivers. People are collaborative due to division bonus opportunities. Bonus payout scheme is well-defined and generous. Business units are lean so there is less bureaucracy. Employees affected by RIF are given months ahead notice so they can look for internal or external career opportunities. Managers are authorized to recommend RIF'ed employees externally.
good,"This job requires the ability to work for 12.25 hours straight, getting anywhere between 10,000 to 30,000 steps per shift depending on the area. The job as an operator involves working with multiple tool-sets that range in difficulty from easy to learn to difficult. Some tool sets take two to three weeks to learn where others take six to nine months. You must multitask at all times in order to keep up with the fast pace."
good,"Everything depends on the project you work on as teams are spread across the globe and may require long work hours."
good,Broadcom was known as LSI when i joined them and was a very enjoyable place to work. They took very good of their employees and generous benefits
good,"I like to be challenged and everyday with full of motivation with positive attitude to be productive.  Very helpful Co-workers"
good,"Always get a freedom to explore your technical capabilities"
good,"Learned a lot from broadcom who to work under pressure. "
good,"Work culture is aggressive and competitive pay package.Works on cutting edge technologies, makes all the employees accountable for the work they do."
good,"Typical day at work - Good learning curve. Good culture. Relaxed and flexible schedules."
good,Innovative company; great place to work. Good people to work with. Very successful company with great achievements and high expectations.
good,Good company to work with. Lots of opportunities for the freshers. They have great working hour flexibility. Most of the management decisions are taken from HQ in US.
good,I was an intern so I can't tell much but since I have known the company I have seen many layoffs including some of my friends. The company is a stable company but work for me in that company was pretty boring and I think this was my case since I was just an intern and helping out a test engineer.
good,"The entire time there, up until the last six months, was great.  The work was challenging, and each day there was something new.  A lot of work was accomplished."
good,"Provide flexibility to work/life balance, great colleague and working environment."
good,"Very good:- "
good,"It is a good workplace. There is good work-life balance and it pays well."
good,"- Test to find issues, and then try to debug them."
good,Good company to work for.  Good benefits and support. There is alot of support work and diversified areas to work with.  The CEO has eliminated a lot of the useless paperwork (like vacation).
good,"This is a serious place to work and sadly its all work and no play here. But it is not that bad, because hard work pays wel here.Overall a pretty decent placxe to work."
good,Provides good compensation and benefit. Overall has maintained a good management team and workplace culture over the years.The hardest part of the job is 12 hour shifts.
good,"This place is volatile in terms of the job security.  There is very stiff competition in the company's market, hence they have to roll out new product as soon as possible. Work culture is good but people don't work on innovative things quite often."
good,I worked with good people.  AWS work schedule was not conducive for family but it afforded 3 and 4 day weekends.  12 hour shifts are tough especially nights.  Management was fair.  Learned a lot over my career.
good,"Broadcom is a company that has a lot of talented engineers and they usually works very hard. The benefit is realistic and fair, the new managements take good care of hard-working engineers."
good,Broadcom is a company that focuses very much on their engineering and technical aspects. As someone who is coming from a business background I found it difficult at times to share my creativity.
good,Productive int the sense that the company finds balance between serving clients and daily well being of its own employees. This helps drive productivity even higher.
good,Leaning towards shareholders benefit only. Reduced investment in R&D. Help the industry by investing in R&D and broadening ecosystem by helping new companies.
good,"The alternative work schedule is a big plus in the work-life balance.  Some compensation policies discourage good workers from trying to move up."
good,"Fast paced, given responsibility, great place to learn many technical areas. Because of acquisitions and M&A activities, sometimes the workload can be heavy, and direction not crystal clear to all."
good,One of the few large companies left in the Orange County area. Great work life balance. Excellent benefits. Loved the team I worked with. Top class engineers.
good,"Nice place to work with decent pay and pretty good work life balance, depends on manager though."
good,"It a very high standardised place to work,"
good,It's been a very good job and most of the supervisors really try to support operators. Very little micro-managing and willing to flex schedules for school. I've been there nine years and there are many who have been there much longer.
good,Overall a good company to work for with highly talented work force.  Change is always happening and can be overwhelming.  The most enjoyable part of the job is the people in your immediate work group.
good,"I have been working at Qualcomm full-time (More than 3 years)"
good,"Ever dynamic and challenging work environment."
good,"Relax working environment. Flexible working hours, multicultural, loved working with co-workers, detailed weekly status report, some travel requirements,"
good,Broadcom is a good semiconductor company.  It has many great engineers and it uses good engineering processes; Broadcom has good benefits and it provides a stimulating work environment.
good,"Learned  lot of thing, such as managing work-life balance."
good,Everything was nice until the buy out. That when this place really tanked. I think I would still be there today if they had not got bought out.
good,Strong high technology exposure with an opportunity to develop systems/solutions in a fast paced environment. Company growth was faster than the operating methods and procedure development. This offered challenges not usually seen in a mature company.
good,"Work hard, play hard.  You get out what you put in.  Great group of hard working people.  Company is being bought so culture will change along with G&A cuts."
good,"Innovative technology and good work/life balance, very nice working environment, friendly coworkers, free soda and coffee;"
good,"A typical day in current position would start with me checking my e-mails and seeing what would need to be done for the day, or if any hosts need troubleshooting in the data center. I would then make sure all the hosts are up in running and periodically check on them throughout the day. We would usually get new equipment to rack, power, and cable in the data center. We would first need to plan out where this equipment would go (ex. what rack/section/location) figure out what cable it would need, and find out what circuits we would hook them up to. Once we find that out and get it done, we follow with the engineer to which the host belongs to. We would make sure everything is good on their end and make sure it's up and running. I've learned a lot since working as a data center technician for Broadcom. I have learned how to installed servers, all different sizes and brands ranging from Dell to HP to Isilon and learned how to cable them as well. Also learned how to troubleshoot Cisco and Brocade switched. Management has always been helpful when it comes to walking me through a process I might not understand, and will go into detail to make sure we are on the same page. I get along with my co-workers very well and we work on many projects individually as well as together. The hardest part of the job may just not understanding how to troubleshoot new equipment that comes in that we may not have ever worked with before. Times like that is when troubleshooting or installments take longer. Most enjoyable part of the job is learning and soaking up as much knowledge as I can."
good,At Broadcom I had a great opportunity work with some of the most talented people in the industry.  It was truly a unique experience to see a company steal a way market share from its competitor in such a short time.
good,"Great work place. Easy to get to."
good,"I've worked for Broadcom I/O Library team for 5 yrs. I joined as a fresh grad."
good,"Easy, relaxed place to work. Allowed the creative freedom to do my job properly."
good,"Was given the chance to work in several different different areas of embedded programming, work with several OS."
good,"The company is good, engineer around are nice and smart. But senior management should take more responsibility."
good,"As an intern there, people are very glad to help me."
good,Everyone was very helpful. Lot's of opportunities for connecting with other engineers. Management was open and committed to employee development.
good,Good private company to work for. Not much career advancement. Solid compensation package.
good,"Good for people who want to learn new things and innovate."
good,Broadcom has the best engineering team. It's a company if you want to lear the state of art technologies. Busy schedule and often have to work at home. Good ten work.
good,"The corporate culture was quite suitable for me and I got along well with all my colleagues. Good work conditions, good compensation.  4.5 stars. ssss"
good,"My time at Broadcom was enjoyable and challenging."
