rating,review
bad,"Terrible Company and will get worse as Broadcom implements their ideas. Poor management, No team atmosphere. No one was willing to share their knowledge for fear of competition and getting laid off."
bad,"Lack of communication and objectives caused decisions to be made and then reworked constantly "
bad,"Cost cutting is the highest priority for the company, at the expense of productivity and time savings for the employees. Free tools are used instead of tools that cost money."
bad,my contract was cancelled due to a bad manager and horrible team lead. Everyone is out for themselves and between that and the scandals i have no intention of ever going back
bad,Was a bad place to work management goes behind company policy and makes their own rules HR is a joke because they know of violations but do absolutely nothing hours are long and no work life balance basically a Chinese sweat shop you work till you die brown noses move up but dedicated employees move nowhere  a very hostile work environment with no chance for advancement in any department unless you are family or blood related the company got bought out now I hear its worse.
bad,"Broadcom is a great place and culture to work for. As a group, we work very well together and with a family atmosphere. Very flexible schedule and no micro management style."
bad,"There is no loyalty at this company.  They operate on a 1980's corporate raider business model.  Wall Street loves it, but it treats employees as expendable items."
bad,This was a daily contracting company that would give you work to do for a few days than nothing for a period of time. Does not look out for the people that work for them.
bad,"I will highly recommend anyone to not join the company as there the work culture is pathetic, flexibility is not up to the mark, no learning environment for freshers amd managers are a lot of mis-managers in every aspect."
bad,"workplace culture is good , Benifits were good , the company was fare on compensation for the short time with the Broadcom management when they took over the existing company (CA Inc.)"
bad,"Poor management. "
bad,the culture and environment alone were stressful let alone the fact that you have to wear a clean suit constantly. and my departure was done in a very unprofessional way. My supervisor was a good supervisor that was put into a bad situation and I don't know that I would come back if they asked me to.
bad,There are numerous problems involving favoritism and extortion of power within the supervisor department and operator department of the facility. If you end up in the wrong area with the wrong people the changes of making it past three months are slim.
bad,"There is only one good thing about Broadcom, your compensation."
bad,"if you are willing to be treated like a child, then this is the place for you."
bad,"You will be terminated at any time"
bad,"Broadcom is a company where if you don't know someone above you, you will never move out  from operations. Basically you have to kiss a lot of butts to get a better job at the company."
bad,"you can never disconnect from work and you can expect to be contacted while off too."
bad,I was there to look at the planning systems and make recommendations.  VP of Ops did not think it was necessary to change so after reporting my findings to the CIO and one of the controllers I packed up moved on.
bad,Current Security and Office Services Management in inept and recent personnel decisions have caused us to look for other career opportunities.
bad,No teamwork or input from others.  Leadership is dictatorship style and managers micro manage.  Lots of fire drills with no flexibility or work life balance.
bad,"As long as you don't work for Ops, it is a nice place to work for. Stay away of any job under Operations."
bad,"Broadcom pursues the most minimally viable solution to anything.  So if can be done manually and they can save a few bucks eliminating a tool, they will.  They discourage process improvement and innovation, the most important thing is milking every last dollar out of everything.  Prepare yourself for unnecessarily difficult work that could be easily automated.   You will spend more time on mundane nonsense, then actually solving problems and improving the business.  Career progression is also discouraged, and training's are not provided. They have a strict no back-fill policy, virtually eliminating upward mobility."
bad,"The engineers I worked with are amazing people. The leadership at the upper levels have seemed to lose their personal connection with its people. Director level and up.  The direct managers were wary of making any decision or offering and opinion that fell outside of what the director desired. His connection and communication was (as expressed by about 90% of the people there) oppressive and bullish.   "
bad,"Almost as bad as working at a call center.  Drama, immature employees and biased advancement selection. Used to be a decent-ish company to work for, but now overrun by incompetent temps and overconfident, ignorant supervisors. The good hard workers get shunned at raise time while the people who do nothing more than run their mouths instead of their tools are promoted."
bad,"Broadcom has too much stress and work, no work-life balance, compensation not very good compared to the amount of work in the WLAN BU. So much work it makes ppl sick and ill."
bad,"Beyond good compensation, interesting technical work in an uncommon chip fabrication environment, and fellow engineers who are mostly friendly, easy to work with, smart, and talented; there are not many other desirable attributes to working for FOPD that I can identify. I concluded after a few years that the work environment/management style was neither encouraging my best individual effort nor fostering my career. This may be a good place to start your career as a recent graduate who needs some experience or to close out your career."
bad,"Broadcom pays a good salary and gives very good stock options."
bad,Job work /life balance is ok. Compensation and Benefits are good for a large company. Job security are ok as well as job culture.
bad,"The culture of the company is still startup-ish with a lot of delivery pressure, but also has the bureaucracy and politics of a big company. Work life balance is a little difficult to achieve but you are surrounded by a lot of smart people."
bad,"When I first started at Broadcom, I was very happy and it was a great place to work.  Intellectual Property (IP) theft is a high concern in the Semiconductor space, however over the years Broadcom continued to take a more aggressive approach to combating IP theft then I was comfortable with."
bad,Good Job Environment and good to leanrn new IT technologies but there is no job security
bad,"High pressure work place where expected to be on call for 24/7. Compensation packages are competitive but $/hour not great."
bad,"Most engineers I encountered at broadcom were competent and enjoyable to work with.  Everyone was very relaxed about flex time, and there was never an issue if you needed to step out of the office for a bit.  Work had the potential to be varied, and depending on your manager, there were occasional opportunities to learn new tools and skills (time permitting)."
bad,Not a goal oriented but a Typical Profit based company with no long term vision.   No job security even for best performers.   It is a name sake US based company moving verticals to offshore just based on zero threshold.    No centralized goals for the company to move on.  It is mostly based on the immediate supervisor dictatorship.   Not a great place to work.
bad,"Very aggressive project schedules. Bare minimum changes are done one previous designs. Due to tight schedules, any kind of redesigning is discouraged. No investments in innovation."
bad,"1. Learning Opportunity is good."
bad,"we work all from home, so this is not the best place to discuss and have a balance with your family."
bad,The most enjoyable part of my job was the daily interaction with people. Co-workers made the environment more pleasant. My job at Broadcom was basically to ensure the office was running as effective and efficient as possible. What made it difficult was the different directions that management was going without any overall outcome.
bad,Sr. Manager and team is under tremendous presser to deliver. Not a fun place to work. Lots of tense meeting and lots of work to do. Team doens't care about people.
bad,"CA Technologies was acquired recently by Broadcom, and the change is constant. Your experience depends on your team and management. It's difficult to know what or who is leading, and although I think the end result will be good, the morale is getting worse by the day."
good,"Work load is heavy most of time. Not much time to learn and not many people willing to teach (I was very lucky, I replaced a full time engineer and was given some time to actually learn rather than test like a robot.) coworkers are fine, but the managers have to be chosen more carefully."
good,they just think money could buy every thing.  It is not right. good thing is that there is not too many meetings. bad thing is you will be depress there
good,There were a lot of benefits for the staff before the acquisition but after that the whole work environment changed and benefits wer removed. Working was under strict surveillence and the freedom was lost.
good,Poor management and work culture. management is very shallow.
good,"Day at work: Very political culture."
good,"At least for me, work rating was not only based on my performance. "
good,Shareholders and stock price are of upmost importance.  focused less attention on employees and work/life balance.  Used Bonus/performance as the only method to drive employees.
good,"As the title mentions, there is more to than just playing ping pong mechanically,reflexively or re actively  for fun. It also provides a non reflexive, non reactive  thinking environment to bounce ideas around just like the sensitive plastic ping pong ball to be productive in a fast paced environment."
good,Place use to be real great to work at until new management made some decisions that’s caused the workflow to be very slow. Several Supervisors suck up to get ahead . Hard work is not recognized only sucking up. Management in general is a mess no communication and rules are made up after events occur. Most perks that we had are gone and not coming back. Promises of moving up in the company are never really considered .
good,"The compensation, benefits, PTO are very good"
good,Supervisor is good at working but very bad at speaking to people in a manner that tears u apart limb to limb and pushes every button that you have.  Doesn't let your opinion stick or let you speak period.
good,"People are fun to work with. Uncertainty is always there about job security. Work life is balanced."
good,I have nothing to say about the company. Challenging company to work.
good,"Nice place to work, however there is some insecurity about the job constantly"
good,"The peers you work with are great. The pay and benefits are good."
good,"In November 2018, Broadcom acquired the company I worked at for 36 years, CA Technologies.  I was terminated and brought on as a 'transition' employee, and my employment ended on June 28, 2019."
good,"The executive management is focused on profitability and serving the investors.  This is great as a shareholder.  As an employee, you will likely get shares as part of your compensation. "
good,When i started it was a revered company to work for but it was purchased and the new management was not the same.  The company outlook is to make money not be exceptional.  This to me was not the culture I was looking to stay in.  My manager was extremely flexible and allowed for working from home and was very encouraging.  Since the day I started we began to transition our infrastructure to a new Colo datacenter and hand off our responsibilities to an outsourced company.
good,LSI started as a fun place to work.  Great projects and co-workers.  Over time the management became less stable and believable.
good,"Work is fun and relaxed at broadcom."
good,Great place to start career and fun place to work for interns.Lots of new cutting edge products and you get to learn a lot and it prepares you.
good,Agressive company with dynamic environment. Offers great challenges and rewards are decent. Need to maintain work life balance here otherwise you will sucked up in the job
good,The company has experienced great growth in my time here. There promises to be many more changes ahead and lots of wonderful opportunities for continued growth.
good,Learned a lot.Gained expertise in 3GPP mobile wireless protocols.
good,"New task request is a new challenge to improve my career skills. Silicon company require real time tools. Timing issue is the first priority concerned. For example, 3.4Mbs high speed I2C interface to silicon, USB interrupt transfer between PC and micro-controller, read/write silicon with interrupt events. Design window base application with real time approach. Expertise real time system design with software tools and consumer products."
good,"Overall Broadcom is a great place to work. Depending on the area and shift you work your supervisors could be great or not so great. The pay is not where it should be, especially living in Colorado. The average pay should go up at least $3-$5 per hour. I will say it was much better to work here when it was Avago.  alot of the cool extras have gone away. Also they drug test now, which wouldn't be a problem except we live in Colorado where Marijuana is legal. Before Broadcom, management didn't care what you did on your days off as long as you didn't use on your workday or on site, which I get but now you can be fired for smoking on your day off."
good,"Not a lot of work to be done, a lot of nothing major to do. Slow paced."
good,FOPD department does not treating good for contractor. Salary or full -time employee is good. The management does not treat contractor good. Seems like unfair for contractor to work there.
good,"Job work / life  balance is comparable to other large corporations."
good,"Hard work is not appreciated, specifically when it comes to the logistics and L1 technician branch. Commitment to your job is not appreciated there. They would rather lay off a proficient employee, and keep someone who is unprofessional solely because he was getting paid a dollar or two less."
good,"While some of my days where busy from start to finish, there were many times where I would be stuck begging for work, but the higher ups would just ignore the requests. I on many occasions was told to do work that would just be thrown out and then have my job threatened because I was not working on important items. The job boasts great vacation and benefits but it is hard to negotiate any time off with these managers"
good,"I learned lots of stuffs here."
good,This is a very fast paced industry that requires quick thinking and the ability to juggle multiple tasks.
good,Lean aggressive environment.  Strong management.  Systems and work processes are not the most advanced but okay.  Co-workers are helpful and supportive.  Hardest part of the job is the aggressive environment.  Most enjoyable of the job is my role in coaching employees and managers.
good,"Good place to learn new skill."
good,Its good to work. Salary is very good and office is also good.There will be good learning curve and will have the fair opportunity to work on different aspects
good,Work life balance is good here. However the technologies and work culture purely depends on the project you work. Few are using latest where are few are using still old technologies.
good,"The business unit I was in was a great place to work. The company at the exec level is driven by  financial  objectives."
good,Typically worked around 47.5 hours a week while processing and pulling orders for customers. Very good working environment with other members of the shipping and finished good teams. Worked would vary from extremely busy requiring 12 hour days to very slow days with little to nothing to do.
good,"I really appreciate that the company allows flexibility in your workday and unlimited PTO. My co-workers are easy to work with, and I feel supported by team leads."
good,"This is a big company with a lot of employees and good benefits."
good,A typical work day at Broadcom is 8-5 and can be fast paced at times.  The environment is very friendly with a nice cafeteria and gym on campus for employees to enjoy but can be very business oriented and seem stuffy.  The offices seem too spaced out with only 2 or less people per office.  I would like more of an interactive environment.  The most enjoyable part of the day is the people in my team and working hard together.  If you have a good team here then you will love your job.
good,"Learnt quite a lot about the formal verification process."
good,"Broadcom has a good compensation system compared to its peers, however, the work/life balance is not great."
good,"Good place to work and learn. "
good,"Typical work day was busy, which was a good thing as it made your days fly bye. I worked in office services but had no real management to push you in a positive direction. That was probably the hardest part, trying to improve by taking classes but had no help. The most enjoyable part was the interaction with the co-workers."
good,Broadcom offers very high quality of work. The people are friendly and one has a lot of freedom to choose what one wants to work on. Salary is compatible with high end semiconductor industry.
good,Poor executive performance; challenging job; nice co-workers; many many meetings.
good,Evrything was good. Except was appointed as contractor and becoming permanent is very tight
good,No opportunity for growth.
good,Please refer to my work experience at CA Technologies. Broadcom was only a Transitional position for three months due to the acquisition of CA Technologies
good,On many occasions I did a lot of overtime and couldn’t spend time with my family. I also felt that with the amount of work asked of us the pay wasn’t equivalent.
good,"The company is financially run to hit quarterly targets.  Very focused on short term results.  The expectation for finance is to meet forecast with minimal variance, and to close the books with no issues.  No benefit to additional proactive, ad-hoc work."
good,"benefit is good, work life balance.every day not busy and follow the group process. company has very good immigration policy. "
good,I enjoy working at Broadcom because of my friendship with my manager. He tried to be the buffer between me and upper management. I would recommend for people to work at Broadcom
good,"Not applicable, Broadcom acquired CA Technologies, terminated a large percentage of its employees, and retained most of the remaining employees for temporary transition."
good,"The server business was a great idea to enter, but they cancelled the project and let all the good people go."
good,Broadcom is nice place to work. You get a chance to work with sharp minds and always on edge of technology. They offer good compensation and benefits.
good,"Typical day at work is busy all day.  Workplace culture is very bad."
good,"The company is always buying and selling other division. every year we had layoffs. Classic broadcom use to be a great company but after Avago acquisition, everything went down"
good,"Great place to be a shareholder, not so good to be an employee!  Was a great place to work before merger.  Now it's all about numbers and share holder return."
good,"Overall temp job was good. Gave me all the experience I needed in order to become full time with Broadcom."
good,The work life balance at this company is very low. There us a lot of strees working extended hours at this company. The job is unsecurity.
good,"Pretty good. I worked as a summer intern and they had an easy going management style, interesting projects, and flexible hours. Would definitely work here again"
good,"Good company to work for. Good work-life balance, but too many consolidations in the last two years has had a negative impact on employees' morale."
good,"A good productive based company having good culture worked on as a intern with a good management having strict dead lines to deliver , As a fresher learnt lot of things"
good,"It  software and hardware"
good,"New Broadcom management brought in some good changes, but also swiped out some good people.  "
good,Good place to work. Great team and team culture. Driven. Several Market leading products and opportunities to work with great customers.
good,"Interns get to work on actual everyday projects that regular employees are working on, hence you get to interact with lot of people. Company has a good number of technically strong teams. But management is not so great . Company can do better."
good,Broadcom has a Quasi-startup culture with a good environment to learn. There are great people to learn from. I worked with a very supportive group.
good,Fun work place with supportive team. People are friendly and co-operative. Poiltics at upper layer at management.The most enjoyable part of the job was working alongside my teammates and learning from them.
good,"Heavy workload during project time"
good,Really like the company. Day to day AP processing. I've learned a lot from this company. Everything was great. Everyone in the company was really nice. We had potluck at the end of every month.
good,"I am currently working as a part-time contractor of 20 hours a week but was originally hired as a full-time that only lasted 2 weeks before there was a department change. There are no current reqs for full time and no opportunities here for me."
good,"The company provides a good work life balance and good work environment for it's employees. Employees usually get a lot of freedom to implement their ideas and thoughts. Not too much workplace politics and engineers are usually busy with projects to work on."
good,Broadcom has lots of talented engineer but higher managers are not so strong to be able to lead the company
good,"Great company to work for with good benefit, flexible hours, competitive technology and multi-culture environment"
good,It's good place to work with pleasure engineers with pretty good manager.
good,It was a good experience for me. As it is my first company I have learnt so many things here.
good,"Very helpful team and manager. Very easy atmosphere to blend it to. Good colleagues, great learning experience."
good,"- Nice environment to work"
good,Challenging  role with hectic work schedules. adsdfs hggfhgf kjkkj
good,"Will recommend working at the company. I have immensely learnt about technical knowledge, co-workers are good to work . Hardest part is being able to cooperate with every one at the same time. Learning curve will be monotonously increasing and a challenging job."
good,"There are always good things about a big company, mostly the benefits and perks, but when it takes (seemingly) 20 people to get something done that you know could be done more efficiently, it's frustrating."
good,"• Working as Software Quality Assurance/Certification Engineer at BROADCOM, a semiconductor based wired and wireless communication company from MAY 2010 to till date"
good,"I only worked for Broadcom for 3 months, following an acquisition. During that time, they were professional and seemed organized. "
good,"My experience was prior to the Avago acquisition, things have likely changed since then. Recommend looking into the CEO's currently take on IT before committing to this company. Entire IT budget was slashed by 50% with multiple layoffs which was major reason I left this company."
good,The work was stable and relatively easy but any recognition for extra effort goes mostly unnoticed and improvements to a process are relatively slow. The 12 hr shift with 3-4 days off a week were really nice though.
good,"A learning environment, but in all companies there will always be a slight disconnect with managers and engineers and supervisors.  It is a competitive environment."
good,I enjoyed working for Broadcom. I was challenged by the level of responsibility and scope of work. Then the acquisition of Avago changed our path. All Operations was moved to Malaysia
good,Benefit is ok. pay above average. but most of coworker is greater than 40 years old. not very aggressive. good for people who wants a stable job. fixed bonus.
good,"Overall, they just got an engineer from other company without training engineers. People there are not open to exchange idea."
good,"Company culture is OK, depends on your manager,"
good,The organization is driven by business not by technology. It is sort of franchise system. Overall corporate performance  might be prospective by merging software companies rather than chip companies. I am wondering if the existing products can sustain the competitiveness in the future.
good,"high learning curve, environment provides a lot of learning to be done, engineering teams are really organized and well structured, there was loss of vision between engineering and management operations."
good,Broadcom Corporation is a big sized company. Enough opportunites to grow and also has a decent compensation plan.
good,"An interesting job with a great knowledge learning experience, amazing work atmosphere. Though work-life balance and fun activiities were less"
good,The upper management make all the decision of who will get the good compensation and rating.  The direct manager has no input for your compensation/rating of your work.
