rating,review
good,Great company going through needed growing pains.  Increased focus on benefits that will aid in employee retention and recruitment.  Overall a great place to work.
good,"Good work environment, collective and open minded culture. Good compensation, work life balance, etc."
good,I learned a lot about IT installment in a pretty fast paced setting. The management I had took time to teach me what I needed to do and I got it all done in accordance. Paid for our food and gave us small breaks.
good,"Professional and structured. One of the top 100 companies to work."
good,I worked here shortly because my best friend asked me to work with her and El Paso Energy.  It was a difficult decision as I really enjoyed working here.
good,"Good Company to work for.  I had a lot of hands on training. The personnel and management was great to work with.  A lot of work, but enjoyed the challenges . The friendships that were made."
good,This is a great place to work. We received all of the perks. It would be work heaven of Oklahoma City if there was not a layoff. However we hope that it would turn around and recall former employees.
good,"I had the responsibility of entering work orders and invoices in the production division."
good,"Jackfish Lodge in Conklin, AB is the finest camp in the region."
good,"Good place to work, excellent benefits. Every other Friday off. flexible schedules. Good career advancement opportunities. Covered parking area in Devon garage."
good,"Devon Energy has an exceptional work environment, starting from my first day there I felt at home.  However due to the drop in oil prices layoffs were imminent."
good,Was proud to say I worked at Devon Energy.  The oil & gas industry is cyclical and the layoff in early 2016 was unfortunate.  But industries experience highs and lows and it's expected and anticipated.
good,"Good place to work,  I only left for an opportunity to move into upper management and do a ERP implementation. I enjoyed all of my time a Devon as well as the management team."
good,Great place to work. Learned SAP for processing invoices and more about the gas side of the oil and gas industry. Very supportive of surrounding communities.
good,"A typical day would include arriving early, making every effort to buy gas from any wells close to the Devon pipelines.  Then arranging to connect these wells to the appropriate Devon pipeline as quickly as possible."
good,"I was an intern at Devon and if I could literally go back and do things differently, I would have worked harder to stay with the company somehow. I learned so many things from great people and it was the most wonderful job I would have ever wanted!"
good,"I had 15 great years. Was laid off among many others. I would love the opportunity to go back. My job required lots of meetings, mentoring, reviewing the staff work, balancing the general ledger , setting up data. Monthly cash close and revenue close . Balancing suspense. Preparing spreadsheets .  Close communication with land and Division Order . Processing cash and revenue ."
good,i loved working at Devon Energy it is a good place to work good healthcare and vacation time off two weeks and the work hours were good i would tell a friend to go work for Devon Energy
good,"It was pleasure working in this environment.I loved it,Competetiveand well balanced,Overall it was my most enjoyable part of my life.Soon im missing my manager adam who is strength of mine ans carries a smile in each and every momene"
good,"Very pleased with Devon Energy overall, super great people, love the work life balance and environment as well as a beautiful facility.  My only complaint was the long drive downtown and once arriving to work it was too much effort to try and run errands at lunch due to the length of time it takes to get to your vehicle etc...Wish lunch hour was 1.5hrs."
good,I really enjoyed my time there. We had plenty of training. Great work environment. We felt appreciated and could see the impact of our work on the organization. One of the best companies I have worked for.
good,"I worked on several systems converting classic asp applications to .NET applications, many controls needed converting and it was an excellent job. I was around the age of 18 and when I left they took all of our developers to the theater to watch a movie and bought all of us lunch. Devon is an amazing company."
good,Devon Energy taught me so much in every aspect of my life. I will forever be grateful for the time I spent with that great company. The culture of the company was so warming. I looked at my team as my own family.
good,I loved working there. The benefits are great. There are a lot of meetings but they for the most part were fun. The people are one big family. We was always doing things for the community. I would highly recommend it as a great work place.
good,"This was the best Oil Company I worked for.  Loved everyone I worked with."
good,I was paid very well for an intern. The atmosphere was very organized and professional. My mentor was a super nice guy who took the time out of his busy schedule to answer my questions and ensure my presentation was well prepared.
good,"Completed day-to-day operations, complex travel planning, training, org. charts, pay roll, expense reports, vacations, supply orders, and routing mail"
good,"Wonderful place to work. "
good,Devon is a great company with excellent management they give you all the resources to do your job to the best you can do a very safety orinated company with a great name for their self
good,"I worked for Devon for two short years, and enjoyed it thoroughly. The pluses range from excellent benefits and pay, to great co-workers, and exquisite atmosphere. I really enjoyed working there, and if ever I needed to go back, I wouldn't hesitate."
good,I enjoyed working for Devon Energy. It was a safe place to be employed. I would encourage anyone to accept a position at this company.
good,Pays well very good  only reason I worked there great group of people that pay really good that's all I have to say  pays very good
good,"Created Informatica Data Quality 9.6 (IDQ) Data Profiles, Physical Data Objects, Logical Data Objects, Data Services, Mappings, Mapplets for the Environment Health and Safety (EHS) group.  Analyzed data issues to determine if ETL or database (Oracle and SQL Server) was the root cause.  Assisted designers in working out logic for requirements.  Assisted other team in Informatica PowerCenter 9.6 at times."
good,"Corp Benefits a plus. Good people to work with. Always room to learn and grow. Adapts to change. Team environment, multiple functions on a daily basis."
good,Devon Energy is a fantastic oil and gas company in Oklahoma. It has wonderful facilities and amazing people. I would definitely work with this company again in my future!
good,"Good company to work for - great benefits and top notch employees."
good,Great work environment with lots of friendly people. Learned a lot throughout the job. Excellent opportunity for advancement.
good,I meshed well with company employees and culture. Devon provided alternate work schedules allowing me to take every other Friday off.
good,Great company to work. Worked here for a year. Amazing team. A typical day at work involved working with multiple teams.
good,"Great place to work, wonderful co-workers, good management, and diverse projects. There are a lot of processes in this company."
good,"I loved my teammates/buddies/2nd family at Devon Energy!!  This is the hardest part of losing my job.  Not only was my job enjoyable and had great bosses and co-workers from operations, trades to all other contractors.  I loved being there and it's tough getting laid off there after nearly 4.5 years."
good,"Excellent work environment, work / life balance."
good,Good place to work with great colleagues around me. Good financial compensation but spent half the year away from home. It was very rewarding to ensure that employees went home to their families the same way they came to work.
good,Devon Energy has a great teamwork attitude. I quit working for them because the work was slow. Hilcorp offered a full time consulting position so I changed.
good,good place to work. Good company culture. Great Pay. Safety first. Would recommend to anyone in the oilfield. I would like to work for them again in the future.
good,"Devon really cares about creating a close-knit, caring community of employees, and it shows it a healthy work environment that yields good results."
good,"Devon provides a great work atmosphere, benefits and advancement potential. Compensation was also great and it has been hard to find something matching it for the work done."
good,"I started out in the Oil and Gas Industry with Devon Energy Production Company in Decatur, Texas in 2005.  I enjoyed the type of work and people in the Devon office.  It was a family type atmosphere which was great.  Devon shut their office down in 2010 and I was fortunate to find Acoma Energy there shortly after."
good,"I have learnt a lot by applying techniques which i learnt in school on real time data. Most of my work was concentrated on text mining and models building. "
good,Marketing-Travel- co-workers and the management team believe in the business
good,Although this was a one month project I enjoyed my time there. I cannot comment on the long term dynamics however.  I was happy to experience the opportunity to use and learn up to date technology at the time.
good,"lots of time at home,people are good to work for.i would enjoy the job it was able to teach me things i did not know and could take with me to the next job."
good,Great work environment with team players and great management leaders.
good,I worked in records department filing and retrieving documents for other departments.
good,"My typical day at Devon consisted of co-worker and vendor/contractor interaction with about 25-30% spent in the field conducting location inspections, NORM and Sound surveys and making sure that our employees were working safely and properly."
good,"Great remuneration. Great benefits. Great overall company to work for. Learning provided, flexible hours if required, good teamwork. Management can be ego driven, and advancement is limited."
good,"• Involved in gathering business requirements, helped in creating Functional Spec document and created Technical Spec/data mapping documents."
good,The culture of Devon is comfortable and friendly. They care a lot about their employees well being.
