rating,review
bad,The company is full of young professionals that are all naive and just happy to have a job. Management is aware of this and works employees accordingly. Th only way to move up is to work work 70 hour weeks consistently for years.
bad,The culture of this company has gone down hill. Horrible management. They do not support nor value there associates. You are just a number. No room for growth.
bad,"Stress of the job was off the charts! And even worse was the corporate culture. Imagine a place where there is tremendous social pressure to act happy, because no one is!"
bad,"Don't work here even if your life depended on it. Senior management down to team leader and assistants are out for one self."
bad,"If you loved attending high school come work for this company and relive your moments. Managers are promiscuous, self medicated, and unqualified to lead. Clients are pushed on to staff without notice or proper training. When you ask for help you’re greeted with figure it out yourself. I believe this is a response from management to mask their shortcomings in the knowledge department. Many people in position of power, gossip and promote the mean girl environment. After a few months, I feel less knowledgeable than I did walking into the company. Please save your time, energy and soul and avoid this place at all costs."
bad,"The lack of professionalism from upper management through to junior staff is astonishing. Employees are not treated with respect, and taken for granted. Some managers/directors or taking two hour lunches,(sometimes longer) while their direct reports are overworked and unable to take a lunch break. The morale is low and it doesn’t appear it will get any better. Senior management is aware of the issues but choosing to do nothing to resolve the matter. Unless you’re part of the inner circle you won’t be treated or compensated fairly. If you want a job that pays you half your market value, work over 60 hours a week, no training, systems that are faulty, no guidance or leadership, take pride being paid in bagels then this job is for you."
bad,Avoid working for DST Health Solutions in the Information Technology Department! C-Level is decent but direct reports such as Senior Director doesn't have enough experience. Experience Architect's opinions are ignored! The technology department is operated very poorly!  Enterprise Architects are forced to alter a solution to fit with Senior Director's vision thus Architects can't build the correct solution.
bad,"This company does not care about the well being of their staff. You're only a number there, no one cares if life hits you there. If the work isn't done, then you are. The working hours are exhausting and last minute. You are not notified of extended hours until less than 30 minutes, don't work here if you have children or a life."
bad,All levels of personnel were committing Fraud under the HIPAA law. Falsely claiming that the claims were being processed and no reporting was completed for proper follow up.
bad,"Worked for Bfds before they were bought out by Dst,and then ss&c ,  Workers are stressed out, over worked,due to layoffs due to reorg of company."
bad,"slave driven enviroment....not accomodating to new hires who come down with illness...let go before even given the opportunity to provide sufficient documentation for illness...under my probationary period so while I understand their needs, do not believe they believed me nor gave me the time to provide."
bad,"As a private contractor , I deliver groceries to waiting customers in a timely manner. Made sure all deliveries were accurate and properly distributed. Reported any discrepancies to Instacart human resources department"
bad,I was let go after 8 years of service because the company that bought DST was no longer interested in the knowledge there and was just scraping it for parts.
bad,Horrible place to work with zero appreciation!  Every day you go into work you’re waiting for the tap on the shoulder and the walk down to HR. It’s no way to treat hard working people. This company is truly about the bottom line.
bad,"There's nowhere to go in this company, if you come in through the call center or entry level. Be prepared for a bunch of people to tell you 25 different ways to do something, but provide you outdated resources or no resources for reference. The proprietary software is garbage. Management is hit-or-miss. There's a lot of fear of change in management, and presenting new ideas is unwelcome."
bad,I loved my job for the first 15 years that I worked there.  Then things changed and management became horrendous.  They looked for things to use to persecute you.
bad,This is where you go to end your career. Everyone here is old and grumpy and they hate change. Do you like to be told to do the same thing as last month without having an understanding of what you're actually doing? Come to SS&C
bad,That entire company is full of politics. Manager's have favorites and if you aren't one then watch out. The managers know nothing about what we do therefore they can't answer your questions. Most of the co-workers are nice. The manager's falsify your numbers to make you look bad.  There are layoffs going on so why would you apply?
bad,"DST is proud that they under pay their associates. They required management to micro-manage their associates and if they didn't, they were reprimanded. Benefits were decent if you were single because the company paid for them but if you had a family, the costs were extremely high. Work-life balance was non-existent. Your job at DST is your life and if you don't like it, they tell you to quit or they fire you."
bad,"For a Healthcare technologies company they are not very fluent in healthcare, keep in mind this is a Technologies firm that has a motto """
bad,"DST's purchase of Boston Financial Data Services, Inc is responsible for my being severed from the company as of 1/31/18 as DST is not retaining any support staff. From what I have seen of the culture so far, DST does not impress me as a place where I would want to continue employment even if offered."
bad,It was just ok. Nothing special would not decide to work there again. They constantly violate your space and expect you to bend over backwards for not much
bad,Worst place to worst especially if you have a family. HR is the worst they only look out for themselves . Investor services has the laziest managers. They treat there employees like nothing  Low pay and you loads of work. The hours are not flexible and you have to bid for vacation time . Software is outdated and training is a waste. The only thing good about working there is the employees. You have to kissed everyone behind  in order to get what you want and half the time that does not work. Don't work here..
bad,Been working here 5 years average is 55 hours / week with a minimum salary increase and way too much democracy.  Upper Management is clueless and attritition is tough to keep track as employees hate the work and empty promises.
bad,I worked for dst from 2003-2006. It was barely decent at first even though they did not pay much. I did so well with the dept I was in I was transferred to the processing dept and from there everything went down hill. They told me how to do the work one way and it always came back to me from qa saying something totally different. Then they had the nerve to blame me for it! I got into an argument with the sups and managers there in that dept. Shortly after that I was let go. Do not work for dst people!
bad,Got me into MVS and good project management skills.  Everything else was negative.
bad,It is not a place to advance at and the management is very controlling.
bad,"When you've been there for 5 years and raises are so low that incoming new hires make MORE than you, you know you work for SS&C. "
bad,It started out as a good company to work for when it was Dst but when SS&C brought it it went down hill the management is terrible you have to teach yourself how to do things this is not a company you can grow with
bad,DST began cutting benefits and laying off associates.  In 2018 DST was bought out by SS&C. A significant number of associates are unhappy and are pursuing other careers this last year after SS&C completed the buyout process.
bad,"Senior management abuses its authority, The Ops department promotes people based on favoritism instead of the quality of work. As a manager, you do not evaluate your direct report. you are told the grade to give him/her."
bad,"Nothing to say....we were acquired...going through major transition.  DST is effectively no longer a company.  While it was once a great company to work for, times have changed--including the mutual fund industry itself.  As a result, we were bought out, many layoffs happened, and those left are still wondering what is really going to happen.  The new company seems to be smart and perhaps we will do very well.  It's too early to conclude that."
bad,I started at DST 14 years ago with the intention of retiring from there - it was a great place to work. Now it's been bought out by SS&C and the morale is in the toilet. There is no respect for American workers and they are actively moving jobs to their offshore sites in India and Thailand. No job security whatsoever.
bad,company is sinking faster every year. even the higher ups are jumping ship after yet another merger. most employees are looking for new jobs or unsure whether they will be laid off in the near future. no real job security. management asks for more and more work to be done as associates leave and spots aren't filled. lowest compensation increase since i've started even with the tax reform giving the company a ridiculous amount of money.
bad,"Management has no transparency,treats associates like resources, not real people. When management talks about productivity they are never talking about theirs. HR is only there to serve the corporation, beware of all HR dealings. Workplace culture is cut throat behind closed doors. Associates who get their way have leverage over management, beware. Good place to get some experience and training and then get out or you will burn out .. eventually. Sound IT best practices and principles, learn then leave."
bad,"Boston Financial Data Services is a dying company. It was swallowed by DST, which was swallowed by SS&C. BFDS used to be a great place to work, but unfortunately, the M&A activity changed that."
bad,"Whatever you do, don't work at this terrible place.  It's mind-numbing and I'm embarrassed to have even worked there.  The worst management I've seen in all of my years."
bad,"Out of all my years of working in a call center, DST was the worst. Management is bad, they are unable or just do not like to communicate. The Management Team is never on the same page. The hours are ok and so is the pay if you are in dying need of a job. I would not make DST a career."
bad,the managers do not train you. HR protects the wrong Associates. they throw you under the bus and don't want you to have your own mind.
bad,"The trainers did a great job in training......they were not the problem.  One of many problems with DST was the management.  The managers didn't communicate with the trainers in what the new employees needed to know.  When a lot of the new people got to their assigned spot and were to do their assignments, they were clueless."
bad,Run from this place!!!!! They are a horrible company that does not care about their employees. They treat you like you are in high school. They expect you to bend over backwards for little pay. Management is the worst.
bad,"Typically worked 9-10 hr. days, with no break. Enjoyed the co-workers. With the amount of work, it was hard to take any time off."
bad,They treat their employees horrible and their morals and ethics do not line up with mine. They were not honest with the items they were putting on their paperwork.
bad,I worked here for 8 years and seen employees come and go.  SS&C Technologiea does not compensate well and do not keep their employees happy.  Management has no vision for the company.
bad,"Senior Management was living and managing in the 1980's. Standards items like work life balance did not matter to them. They wanted to count the chickens every day rather than allow professionals to ""get it done"". Combative environment."
bad,There is a shortage of technical associates. So you have non-tech people updating and deleting information from actual accounts with no background in this type of work.
bad,"You are used by management from day one.  If it makes your supervisor look good they keep you around; otherwise will dump you at the drop of a hat.  Impossibly overloaded; they wring as much out of you while they can."
bad,"Day consisted of 2-4 meetings per day."
bad,"The company always wants to take but don't want to give anything back, not only in monetary terms but also in basic everyday respect to its employees."
bad,"The company was recently purchased by a competitor with a focus on off-shoring and cost reduction. Wide scale layoffs have occurred and are expected to continue for at least the next year-and-a-half. Unless you're prepared to 'do more with less and love it', best look elsewhere."
bad,This part of the company was dismantled years ago. It was a very negative work environment. I was able to move into a different group. the new group was a healthier environment.
bad,"SS&C is not the ideal place to work if you're a seasoned professional, or someone who likes to work in a collaborative environment where ideas can be exchanged and fostered. It is the company you work for when there are no other options laid out on the table. Quite simply,  don't work there unless you're at the end of the road in your career."
bad,"Once upon a time DST was a great place top work, but now they have reductions in work force quarterly. DST was recently purchased as well leading to more speculation about additional layoffs."
bad,DST loves to micromanage but can’t seem to get things together for the benefit of their employees! I was a CSR and also did other various things for the company! They treat their call center reps like children! Management refuses to look at themselves but will point the finger and blame the CSRs.  Change should start at the top! Lead by example!
bad,"Too Fast pasted"
bad,"I read other peoples comments and I would agree with the negative ones."
bad,"At first I thought it was a good place to learn and advance but once you reach a certain level you have no where to go.   "
bad,"Horrible work-life balance. Very bad compensation. The only good thing there are benefits, health, dental and vacation."
bad,The department I worked in was so unorganized and training was poor. I was balancing client's commissions from the day they gave  me my clients. This was not suppose happen until after 6 months of training. Too much expected from little training. Supervisor had no patience with new employees.
bad,very stressful without good training management is not helpful making trades daily for mutual funds
bad,There is little to no training or guidance yet high expectations of no errors. Management is reclusive. The work load results in one to work very long hours yet management say do not want their staff to work late. One works harder and faster they are given more work. Promise made for advancement yet no room for advancement. Supervisors very condescendingly & offer poor training and guidance.
bad,The greed of this company is unbelievable. Hundreds of people were laid off in the Quincy office while a few people at the top made millions. Now they are replacing them with temps making $14 an hour before they ship the rest of the jobs to Kansas City.
bad,"Communication was awful. No autonomy at all. Factory-like working conditions. No opportunity for advancement.I was laid off with hundreds of other people after a merger, while the top management made millions."
bad,"Spent all day in meetings.  On call 24 hours a day 14 days straight,  They still used a pager and flip phone for their on call system.  The whole department needed to be revamped,"
bad,"Very high turnover, management is clueless, many employees are disgruntled due to being stuck, absurd hours, horrible culture.  This review applies to the Cranford office only."
bad,Constantly moving the requirements making it impossible to obtain advancement.High turnover. Very Stressful. Management doesn't know how to motivate. Would not recommend.
bad,"- Leadership focus is on the bottom line to the detriment of delivery"
bad,This has to be by far the worst job I have ever had. If the clients they had only knew how they treat there materials. Management sucks and everyday was a new vision that went nowhere. The leads never do anything and management is fine with that. I could go on and on with what wrong with this place. If you like to get mistreated then work here. But I recommend STAY AWAY.
bad,This job is not one to have if you have a family.  They are attempting to turn a corner as far as the culture of the place is concerned but the vast majority of the employees feel as if the company is only driven by money with no care for the employees that dedicate there time to make the company successful.
bad,"Ongoing crisis management - high incidence of ""band aid"" fixes.  Average work weeks 60-80 hours.  Very little flexibility.  Poor product quality/reliability.  Company ran by managers not leaders (need new leadership to create the high performance culture Argus is striving for).  Not employee friendly - in all the companies that I have worked for/consulted with never experienced a company so void of any type of performance recognition, success acknowledgement, or employee appreciation.  Very high turn-over rates.  Extreme lack of training, support, and resources.  Many talented, knowledgeable and committed individuals unfortunately, they are often not in decision making roles and company culture is one of top-down orientation.  Argus burns out their top talent - reflected in a recent Engagement survey.  Many silos and little teamwork.  Work is complex, takes time to acquire the needed expertise, and is lost when an associate leaves so turn-over is very detrimental to Argus success.  My comments are limited to Argus Health Systems have heard from Associates that other areas in the company are different."
bad,My time at DST was the worst experience I had in a long time. The employees I worked around were very negative and managment enabled them. Management had no clue about the work we did. Hours were inflexible you never knew when you would go home. Employees ostracized those they didn't like. I was depressed working here and it started to affect my emotional state. The overturn rate was high because of all of this. Very unnecessary and stressful and stressful incidents happened.  I would never recommend this place to anyone.
bad,"Assigned to single client and never expected to move beyond the same balance sheet, just the same data and process month in and month out. Management is too busy or indifferent to actually manage the people below them, never is an attempt to improve or consolidate ideas. Office was not originally with SS&C but since being acquired it's pretty obvious that the company just acquires successful midsize US offices and then sends most of the work to India when people stateside start jumping ship. People were friendly to work with but overall no real professional setting, or culture, to keep people coming back."
bad,"Developing a career is nigh on impossible here. Even in the event that you are promoted, there are multiple corporate loopholes that say you cannot get a salary increase. However, this differs from some select people so it is a very nepotistic place."
bad,"Annual layoffs or more since 2010, emphasis on college grads or offshore resources so you get a target on your back pretty quickly.  Cut budget, run lean, pay execs extremely well and have no vision to grow the company.  They used to have a good culture and really good people but thousands were cut since 2010 and many left seeing no opportunity and layoffs coming.  I wouldn't waste my time working there unless you're desperate. (disclosure: laid off after 20 years of good ratings)"
bad,Tax group review. It is very bad management and culture. Very high turn over. This caused by bad management. There is lack of communication between management level. Managers are using do it my way management style. Avoid this company if you can.
bad,"Due to so many acquisitions, many groups compete with each other and there is no team attitude. The company offers no management training and senior managers are encouraged to ""get things done"" regardless of means. This leads to very negative and at times hostel working conditions. If you are unemployed, by all means take a role with SS&C to get paid, but keep looking as SS&C does not encourage advancement nor competitive pay. If you have a job, as the saying goes ""nothing to see here, move along"" and keep looking elsewhere."
bad,The company lacks focus and structure.  They reward complacency with promotions and upper management isn't hands on.  I am amazed that the company is still operating with the lack of focus and structure that exists there.
bad,Management is poor and there is a double standard. The work environment is horrible and nothing is done to make it better. Management is selective in who is corrected and who is not.
bad,"Management is non-existent or worse.  No clear direction as to what needs to be done, and what the priorities are.  They don't care if you stay or go."
bad,"I hated my time there. Very micromanagement, the culture was awful since it seem people like ""narc"" on others to move up. Very bad atmosphere to work under."
bad,"I have not once heard an employee say they enjoy working for DST. The company is stuck in the '90's and the management is even further behind. Although it is quite outdated, they do offer decent training programs."
bad,"Once upon a time, DST was one of the best employers in the KC area.  Over the past 8 years or so, the company has fixated on the earnings per share for the next quarterly report.  Decisions are based on that factor with no regard for long term consequences. They are badly understaffed and looking at further reductions in force."
bad,"In retrospect, i made a bad decision going to SS&C. "
bad,"It used to be a good culture and good place to work."
bad,I was super excited when I got the call that I was hired. But as time went on I came to realize that the call center is the PITS!!! You have managers and team leads that walk past you and won't even speak. The calls are extremely stressful and you never get recognized for all the hard work you do. Its a terrible and very messy place to work and I wouldn't recommend a soul to work there.
bad,You can stay inside and work out of the cold. That is really the best thing about working at this company. They also offer paid vacation time.
bad,"In the beginning they woo employees with growth and success stories.  There are very few people who move up in the company. "
bad,I would not recommend working for this company. Management is poor with absolutely no leadership skills. There is a severe lack of respect for all employees. There is also a blame culture.
bad,"The company has been sold employment there in the future is uncertain"
bad,"Even though I had the most experience and knowledge of anyone there (including my Assistant Director), there was not nearly enough staff to support new Portfolio Accounts. I had a very rough time keeping up with training them while doing my own work, interviewing new staff, writing reviews, reviewing subordinates' work, and many other things. I spent 12 hour-days at my desk and was finally drained after six months so I asked to be relieved of my duties."
bad,Most stressful job I ever had. The manager I had would scream and yell at people for long periods of time over trivial things. He was known for this hateful behavior yet nothing was done about it. Lots of unethical behavior. Lack of respect for those employees that are not in a management position.
bad,"Typical day consisted of developing and supporting Pharmacy and ECT systems. "
bad,A typical day at work here is horrible. If you have other options do not work here. There is no room for advancement. Management is terrible. Managers do not even have a degree and knows nothing about managing people. They talk to you like childen and think you are suppose to be scared of them. Could go on and on. just a warning if you want a piece of mind. STAY AWAY.
bad,"good, friendly, and helpful co-workers"
bad,"Management is distant, training is minimal, technology is terrible, turnover is high. Would not recommend. Did not learn much besides how to use some proprietary softwares"
bad,Most workers that were getting a good salary were laid off this year and replaced with overseas resources.  I expect that will continue with additional blow that severance pay is being removed from company policy.
bad,"a favorable combination of circumstances, time, and place this art school could be a wonderful opportunity for you to finally develop your talent for painting Synonyms of opportunity break, chance, occasion, opening, room, shot Words Related to opportunity play, way. juncture, pass."
bad,My review of the company is not favorable nor would I refer anyone to this company that spends more time looking at younger folks and does not try to maintain experienced personal
bad,"●	Accurately evaluate, verify, and process responses from fund sponsors and administrators to update brokerage records for clients."
