rating,review
good,Enjoyed every opportunity I was given to learn and broaden my knowledge.  Was a very comfortable place to work that stretched you outside your comfort zone.
good,"don't have too many bad things to say about my tenure at DST.  DST provided me with a platform to advance my career, make some decent money, and learn a lot as well, about business, company politics, as well as technically.  85% of my tenure was really good, the final year of my time there was suspect and shaky, due to my own goals and plans as well as due to a complete change in direction in my department as well as the company as a whole.  Which included a full department relocation which created even more stress not only with the job itself, but with the commute.  Cross training became ""required"" and the agenda became crystal clear.  Too much uneasiness to stick around after that. especially when its clear we wont be properly compensated for all of this cross training and extra loads of work."
good,Difficult for me to provide accurate judgement due to forces out of my or their control which impacted my ability to work.  Platform and market positions does seem impressive however and may prove to be a great place for a person of the right fit.
good,"DST was a great place to work. During the time I was there I met many great people and had several great experiences. I grew so much as a person. I learned what it ment to be a team player. I also grew so much perfessionally. I will say towards the end of my career there it because difficult to find work, life balance. The company had developed the philosophy, ""Do more with less."""
good,No loyalty amongst employees. It can be a very cut throat environment where nepotism is displayed. I have found it very difficult to watch many of my co-workers come and go.
good,"Good benefits, good pay, good hours. Ability to work from home, when approved by management.  Flexible with family issues. Travel to Quincy, MA office may happen."
good,"Good company to work for. I would still be trying to stay there if it wasnt for how I have been being made feel by my manager."
good,Good starter job - flexible schedule through school. Good benefits. In my position there wasn't a lot of growth and lack of camaraderie. Not a lot of team building
good,"5 days working, 9am-6pm."
good,"Since the company was mainly focused on the Mutual Fund industry for so long and the Mutual Fund industry has changed a lot, the company is venturing into new businesses."
good,Call center environment and lots of good people. A lot of room for growth within the company. Also everyday you learn something new.
good,"Since I began working here at Boston Financial Data Services, I have been reaching out to people invested in various companies. Some people are invested through an IRA (Roth, Traditional, Simple, and Rollover). Other people you may reach out are invested through the companies 401K plan and 403B. "
good,"Its a great opportunity if you straight out of college, you can have the opportunity to work with great people, but it seems they leave eventually as they move on to bigger and better things."
good,"Overall my experience with this company was good.  Their training program for new associates is excellent. Middle management did need more training, as they were usually so over worked that management classes weren't available to them and their associates suffered for it.  Usually when layoffs took place middle management would take the hit. The company's higher-ups talk about providing their employees with a good work-family life balance but usually due to ""business needs"" this is just talk."
good,Part time position with no benefits.  This job consisted of processing mutual fund and tax-deferred savings account transactions.
good,"Process transactions on mutual fund accounts. Maintains accounts, services shareholders. Places return phone calls and emails in regards to client accounts."
good,"Headquartered in Windsor, CT and with offices throughout North America, Europe, Asia, and Australia, SS&C provides the global financial services industry with a broad range of highly specialized software for information management, analysis, trading, accounting, reporting and compliance."
good,"Responsible for evaluating, verifying, and processing service requests from shareholders, third-party entities, institutions, broker/dealer operations, or client Fund/Stock groups."
good,The advantage of working for the company was learning about the various fund products.
good,"Took calls from account holders in a modern call center environment downtown. There were lots of places to get help when clients asked questions. You could look on the websites, there were phone numbers to call, instant message other coworkers who worked for the same mutual fund, and of course your neighbor!"
good,"No room for growth so decided to go into another field"
good,"A regular day consists of researching and responding to inquiries from the client or support teams as it relates to processing errors, trends or procedures. I serve as support to my team to ensure the complex issues are properly escalated and tasks are on target for completion. I also work closely with the client on audit responses, projects, procedures and workflows."
good,"DST was an invaluable experience because of the teamwork atmosphere. I was fortunate to work with a team that was eager to share knowledge, provide assistance, and all were dedicated professionals."
good,"I work in the part time division in Kansas City, MO. Great spot and great pay for college students. Great flexibility and decent hours."
good,"Good to great benefits, decent compensation, excellent, highly talented workforce. Company is going through a transitional period, so job security has become sketchy. Used to be a great place to transition from a customer service type job to a technical position. Still a wonderful place to work if you're in a stable, profitable business segment of the company."
good,"Not the most exciting company to work for but there is little room for advancement and most of the high-level positions are filled with old-blood, lifers."
good,Very typical call center job for financial institution.
good,In house training facility offers plenty of classes and distance learning
good,"Utilized training in Lifecycle Development Process for jobs converting new clients, installing new products, or installing enhancements."
good,Culture is great when you work for the right people. The departments are different if you would like to expand your skills and/or work for different people.
good,"I worked for DST for 2 months. Training was not adequate for the amount of stress and phone calls we had to take. Trainers on the floor or PALS became frustrated and belittled trainees. Managers were good. Pay good. Benefits great! On days when not enough people showed up to work, or day after holiday we had to for go lunch and stay and work through lunch!! Free lunch, but no personal time to breakaway for 30 minutes."
good,Work life balance is very good. Less hikes and less promotions. most of applications are legacy and legacy technologies. They will recruit for one position/role and will assign for other roles.
good,Completing multiple request management requests for changing business requirements made every day a different experience. My years of service cut short due to corporate acquisition.
good,This was my dream job before the merger and the subsequent mass layoffs. The company worked very hard to create an diverse inclusive work environment that was very client focused and was good about continuous improvement in processes and education. That all fell apart after the May 2018 merger with SS&C. The mass layoffs were seemingly indiscriminate and resulted in a huge brain-drain. A lot of good people with 15-25 years of tenure were shown the door without regard to trying to keep up support for applications and platforms that were mainstays of the company. SS&C is all about financial returns. I kind of feel sorry for the folks that survived the layoffs and have to now deal with going forward without necessarily resources.
good,Last 5 years of this job were stressful.  I enjoyed this job because of the variety of tasks in a given day.  I kept busy and enjoyed my co-workers.  Pay was fair and benefits were excellent.  Towards the end everyday was stressful with impending mass layoffs and then shortly after several openings.  Felt unappreciated and overworked.  The company is now being bought...hoping they have better luck keeping employees happy.
good,I enjoyed working at SS&C because of the great colleagues and the collaborative work environment. They had very complex and cumbersome systems but there was always someone willing to help you with your tasks.
good,"Supervised the entire Mailroom.  Metered outgoing mail, received incoming packages at scheduled times.  Completed reports and audits on a daily basis.  Quick-Paced work environment, but manageable.  Management is very knowledgeable and helpful.  Great people to work with, but tough to learn all aspects within entire company (A lot of moving parts)"
good,"Very little collaboration across the deep upper management"
good,"Good company layoffs don't help reputation. I had an excellent manager and good coworkers.  Some of the layoffs got rid of bad apples.  Now cutting to the bone and threatening customer experienced with ""do more with less"" culture."
good,"This company did have good benefits and even helped me pay for some of my college expenses, and I was only a telephone rep when I started.  The pay is good.  I started out around 13.00 four years ago, and when I left, I was in a higher position and making around 16.00 an hour.  The thing that I liked the least about this job was the people that I worked with.  A lot of people wouldn't show up to work, and the company wouldn't fire them.  We would be very short-handed a majority of the time which added a lot of stress to the job.  The company does try to make it fun though by doing little group activities but the bad outweighed the good in my opinion.  This job was a Monday to Friday schedule and a typical shift was 8 to 5.  For an interview, I would recommend wearing dress clothes, but a suit would be over the top."
good,"The pay is great, but there is no training program for new hires. I was lost for at least a month having to ask for help with everything."
good,"If your manager likes you then you will have a good time. They don't really train new employees and aren't run properly. When you go to help out other groups no one knows what to do. "
good,Work life balance can be good depending on the area.  Advancement into management is limited and can be difficult to get into.
good,"10 weeks of training, was taught about 401 k, ira's, dividends, interest earned, retirement. Lot's of math and problem solving for this position. Eight hours on the phone helping mutual fund customers with their funds."
good,the managers made it difficult for you to succeed in your job and did not like to answer questions.
good,"The company is a fast paced place to work for. I have learned a lot in the 5 years being there and was promoted on June 2012 as an associate processor II. All my co-workers, seniors, and managers are fun to work with. The hardest part of my job is to get everything done day 1 as diligent and precisely as possible. The most enjoyable part is the people that I work with. Always laughing and having a great time."
good,Management and co-workers were very helpful. Opportunities to advance and try new positions. I enjoyed working with people passionate about their work.
good,Good to grow and enhance the technical skills. Hectic and challenging but leaning wise good especially during the first ten B.D.'s of a month. Gives a great exposure product wise. Sighted below par with industry standards in terms of the salary bracket. Average work culture.
good,"You can learn a lot by working at DST but you likely will learn to work with their proprietary software so that knowledge is not very transferable. My coworkers were all friendly and management was nice enough, however raises are hard to come by at DST even if you can strongly defend why you deserve one. I would recommend DST to someone who simply wants to get some office experience but if you want to grow quickly in your career I would suggest you keep looking."
good,"The culture has changed and so many great people laid off since we were bought out. It's sad. "
good,"DST is a great work environment overall. However, the pay and lack of job advancement opportunities are a bit damning. Management is fairly carefree, but it seems one can get stuck with no advancement."
good,Worked with good people and learned a lot. Able to work flexible hours and wear jeans. Was able to take training so that I could advance my career. Good place.
good,"stressful work environment, as company in middle of transition after unit sold from Citibank to SS&C. Hours can be long depending on client, my manager was very good but heard from colleagues upper management was in disarray due to the transition. Environment very com"
good,Nothing to say good or bad. It is okay..there is a lot of work and not enough employees to do it.  Hiring practices need help as do Management practices.
good,"A typical day at work would involve researching and resolving customer or broker/dealer inquiries concerning pass or pending transactions, requests for product information, legal requirements for transfers to different account types, etc."
good,"A typical day at work for me consists of responding to emails, training associates located offshore, researching testing issues for my offshore trainees, providing documentation to support resolution to testing or criteria set up issues, as well as setting up and documenting test scenarios for my own assigned work tickets as well as the work tickets assigned to offshore."
good,"Accurately responding to inbound pharmacy and/or member telephone inquiries about pharmacy processing, pharmacy reconciliation, claims adjudication, health plan benefit information, and general inquiries; reviewing, preparing, and processing paper-based claims, industry-standard claim forms (e.g., universal claim forms), or direct member reimbursements; and researching, resolving, and responding to claims-related or pharmacy reconciliation related issues. Ensure customers receive the best service through accurate and timely responses and use online systems to service customers.  Follow established policies and procedures be accountable for adherence to work schedules, availability standards, and quality expectations."
good,The is a male dominated company and it is hard to advance your career as a female employee.
good,The management is inconsistant with how they develop employees.
good,"Boston Financial Data Services is a nice place to work. Unless you're in an upper management position, the pay is low but the benefits are good. The work is not too demanding. The company would benefit from better forethought and follow through as an organization, but as a result they're always busy which helps with job security."
good,"Like any other job, this is a normal job. I've learned a lot over the years and now i'm just looking for something part time to work from home. i'm a very quick learner and very smart."
good,DST had many opportunities for growth and advancement in the past. The latest financial downturn (recession) has affected it as well. There is little opportunity for growth as the company has been doing layoffs over the past few years.
good,"I learned a lot and appreciated the mentorship and enjoyed meeting and working with a diverse group and large number of people.  Also, the benefits were good."
good,"It is hard to rate DST because i have been with them for less than one year and it was though an acquisition process. "
good,"In order to keep up on service levels DST will suspend lunch breaks. They try to make up for it by buying the employees lunch. Unfortunately, there is no price to be put on time to clear your head and tackle the rest of the day the way you started out. It also interferes with making appointments and taking care of other business matters. DST is a great company I just wish there was a way to keep lunch breaks."
good,Good company to get your feet wet fresh out of college. Management is constantly changing and changes are implemented often and it's hard to keep up with them.
good,"DST is a great company to work for when developing a career.  DST has great advancement opportunities."
good,"BFDS provided a comfortable workplace.  Because of the volatility of the industry, job security was nonexistent."
good,Good company that will provide excellent benefits. Very understanding in balancing work and personal life of employees. The company believes in constant training and development. Some co-workers are not as friendly and not always team oriented.
good,"I'm grateful for all the experience I obtained while working there! I learned some incredible core values. This job was a milestone in my career and I'm grateful to have had the opportunity. The employees (including the managers) we're incredible mentors. Unfortunately, I'd have to say they were micromanaged and under staffed."
good,"The company has an amazing culture, however the compensation is not fair for the position and the merit increase system is a joke. Even when getting high scores on performance reviews the increase is less than $0.25."
good,"Training is very informative but could use more in regards to the systems that you use. Free bus travel and car parking facilities, good rates of pay for what you do. Work is repetitive and you must have a good eye for any anomalies. All in all a great place to work with some great people."
good,"It's a great company to work at in order to learn and improve your skills, but ultimately a difficult place to work at long term.  Pay does not scale up well."
good,"good place to work, very helpful IR department.  "
good,Flexibility and training. Stong company values and opportunity for growth.
good,"Over the years, there were many opportunities to expand my experience and knowledge.  Some were lateral and some were promotions.   These opportunities were not always presented to me, but I initiated the communications.   I found that others were open to hearing about recommendations to improve processes that moved the business forward.  "
good,On the phones answering clients questions and handling there accounts. Open door policy and managers are easy going but very forward. Co-works are easy to get along with. Hardest part of the job is taking calls back to back with out a break. Being able to help people with there accounts and getting them connected with online access.
good,"Dedicated to client service but put little into staff development/appreciation. A competitive culture is encouraged, with many acquired companies maintaining distinct personalities."
good,"10 weeks of training, was taught about 401 k, ira's, dividends, interest earned, retirement. Lot's of math and problem solving for this position."
good,"I've learned a lot about product companies participating in third party websites: mutual funds, alternative investment, annuities, and plans. I took in calls from different parties such as broker dealers and financial advisors who wanted access to view their client account. This required me to do research on whether it was appropriate to give access to clients based  on their financial registration. (FINRA)"
good,Eight hours on the phone helping mutual fund customers with their funds. Management in my division was the worst I have ever seen in over thirty years. Very repetitive work.
good,This was a good company.  This was a great job to start leaning about QA and it's role in development. DST could do a better job about promoting within and helping employees like working at the office.
good,Typically there is no manager available to ask questions and when you do find one they don't know the answer. Everything is so gray nothing is black and white
good,I loved my job.  My direct leadership team was amazing.  They trusted in the ability of their team to do their jobs.  We had a fun team. We worked tons of hours and travel was part of our job.  We all worked well together and felt we had a great work family  The sale of the company to SSC technologies seemed to leave the employees without clear leadership. From The announcement of the sale until the first RIF at the end of June there was a feeling of doom and the SSC leadership did little or nothing to stabilize morale.
good,"My typical work day is reviewing day to day operations within compliance by mitigating risk for our clients as part of our due diligence. I have learned how to be a self starter and a leader within my group by initiating indiviual and group projects and helping my group succeed in completing projects accuratly and efficiently. Due to my experience in leading within my group, I have had little to no help facilitating and managing the workflow fairly within my department. The hardest part of my job is having to do so much and management not being able to handle the workload due to micro management. The most enjoyable part of my job is that I am able to work a full time job and still be able to continue with my education with no issues with management."
good,"A great place to learn a variety of skills but it's a demanding company. The organization is short staffed in most teams. Especially within the Pharmacy solutions business area, it's a transient work place."
good,"So much is being juggled at once, its hard not to get exposure to learn new skill sets. If you're interested in growing and broadening skill set, that can be achieved at this firm. Management isnt always the brightest but they work with you"
good,"A typical day would involve another supervisor and myself creating a schedule for our associates based upon client knowledge. From there FedEx and UPS would deliver the packages from over 100 different mutual funds.This was when the associates would scan in the information that was contained in the package that would then go to a virtual library, AWD."
good,Overall was good work experience but not really offered advancement opportunities even though I went out on my own and did some SQL Server training with the thought that I would advance into that type of position.
good,"Company is no longer in business as the owner has passed away."
good,Argus Health Systems is great company to work for. Some jobs in call center works weekends but I do not. We have unlimited soda and some food days....
good,For the most part we come in and there isn't a lot of work to be done until scanning is finished and how much work you will get depends on what you do or what client you work with. The management is not very attentive and are very relaxed which is good if you are a self starter but for those who arent they get buy with not doing a lot. The co-workers are pretty good for the most part there are a few that are lazy and dont do much just like every job. The hardest part of the job is if you are a hard worker and you are on a team that has a bunch of lazy people on it. Overall it is a pretty great company to work for there is room for improvement in some areas but what company doesn't ?
good,- Great experience in Global Operations
good,"Fun and enjoyable place to work, co-workers were excellent and very helpful. Lots of opportunities for learning new technology. Ability to be open and honest with management."
good,"Busy place to work at. Lots of work to do, lot to learn. Salaries are not up to market, benefits are ok. Not much fun, minimal social activities. Staff is ok and friendly."
good,it's fun place to work with limited opportunities for growth and the halifax office didnt grow much. Benefits are decent and working hours are not too bad.
good,People care about the customer and doing the right thing. Customers trust DST with their most important data and work.  The new owners are also focused on customer experience.
good,"In my 24 years of working with DST, I was given many opportunities within the company to develop my career.  I enjoyed my time with the company and was sad to see it be sold."
good,Great company to work for.  I was there 35 years and enjoyed my job and managers.  Had different things to do each day.  I liked doing the monthly reports.
good,Good Company to work for .  company is been sold to SS&C however the feed back given by most employees was good  growing with the change and the new opportunity the company will offer
good,"it was a very good place to work, with opportunity for advancements but the company was moving alot of the work for my department to Kansas City, Many of my co-workers including myself were laid off."
good,Good people but far too set in their ways to innovate. Senior management in US ignores Canadian division and will not hire desperately needed resources. Management needs to communicate better.
good,I worked at DST Systems a long time ago. From my memory the environment was typical corporate America.  There was always room for personal growth and advancement.
good,I worked in the billing department. Started as a billing specialist and then got promoted to the team lead. After that there was no room for advancement.
good,I enjoyed working here for many years. My pay increased over time. However the overtime made available to me was nearly the same as my actual  annual pay.
good,Client focus and customer service oriented. All departments try to maintain a consistent rapport with client processes. Associates can move within the company to work for other clients and seek higher level non-exempt positions.
