rating,review
good,"DST is a nice place to work. The only issue I have is the system problems that we face every day.  The company offers great benefits, 401k and bonuses."
good,The most enjoyable part of my job is the relationships I've built with our contacts all over the country and being able to help them with their needs.
good,Good company to work for and offers competitive salary and benefit package. Room for upward mobility within the organization.
good,"No limit to geography, product or asset class.  Must be able to manage your time well in order to be productive while pitching Alternative Funds arose the globe"
good,"Good place to work overall. Good support, good team culture. Not so much on management. Deadlines seem to be implemented last minute with not enough time to meet them."
good,"Ethos within the company is a very strong one, productivity is high. Staff are focussed on ensuring client's experiences are very positive."
good,Great job out of college. Lots of room for growth and opportunities. Challenging at times but can be rewarded. Company is always growing
good,"I have been here 15 years and have grown with the company. When I first started, we were small with about 400 employees. Today, there are about 5,000 employees and growing. Working at the company headquarters helps, knowing they won't close this location."
good,"In the most recent years, DST has focused heavily on employee engagement.  They hold periodic meetings to openly discuss work environments, forecasting, relationships, and much more.  Management is provided with the information discussed; updates to work-life have seen improvements because of these discussions."
good,"you basically pick your own hours, easy job, listen to an audiobook, do decent, you'll outperform everyone else."
good,"My job was to manage, coach, and train associates in the Defined Contribution role.  I have learned throughout the years how defined contribution plans for employers work.  For instance, how they are tested every year and how the 5500 tax reporting is done.  My co-workers were all very good people who all worked very hard.  The hardest part of the job was getting all the Plan Sponsors to submit their plan census to us every year in order for us to accurately test the 401k and prepare the 5500 documents.  The most enjoyable part was working with the Plan Sponsors and providing the high level of customer service each one demanded and deserved.  I find it very rewarding when mistakes are found and then are fixed."
good,This is a great company. However the compensation is low with little opportunity to advance.
good,I worked for DST for 7 years. Out of the 5 managers I worked for only 2 were decent. Not a lot of room for advancement unless you know managers in other areas.
good,"Processed transactions for Mutual Fund companies, wrote and updated current procedures, worked overtime when necessary, contacted dealer for additional information required to establish accounts, process transactions, I maintained high quality during my career at Boston Financial.  "
good,"I was brought in from a temp service but the company does not hire on like rolling over, you have to apply which means you can end up making less than you were making through the temp agency, if I take the job I will also have to quit my second job due to completely different hours plus take a $1.50 an hour pay cut."
good,Great hard working group of people. Freedom to work individually.
good,"I learned a lot about the market, but unable to advance due to lack of sales in area."
good,"As a student worker, my work at DST included clerical work such as filing, data entry, making copies, and answering incoming phone calls."
good,At SS&C you will get an opportunity to gain a wide variety of experience. There are opportunities to start inone area and move to others depending on your goals and aspirations.
good,"SS&C Technologies is a good company to work in. It is challenging because, we deal a lot with demanding clients. We must be able to process, interpret and post financial data within a set time frame, because it is time sensitive. There are chances for career advancement as long as you can prove you are capable. Hours are long and there is much overtime. Management is supportive and helpful. You will learn to work as a team with programmers and developers and clients to improve delivery of products. The most important part of the job was learning new skills."
good,"DST was quite the company for years.  Unfortunately, it has been sold off for the most part.  Would not feel secure working there now.  Too afraid they would close out the area soon after going back."
good,Been here for 10+ years. Stable environment in my office. Each office/department is different. PE is a tough area. Same with tax team and CFR. Ops/OTC has seasoned veterans and you can get help when needed. Good work life environment. Team outings. Job security. Pay is competitive. Strong India mirror team. What you put in is what you get out.
good,"DST was a good place to work although the atmosphere changed after the recession of 2008.   There was more of an upbeat atmosphere during the uptick in the client base, but it was tough when people started getting laid off because of the change in the market. The people were never the issue though. Always good to work with."
good,"Overall working culture is great since there is a lot of diversity. The issue is on how to train staff with new tools to use for work. Example, A programmer introduceses with new programing languege. He should be given time to learn and use the product instead of assuming that he can do it in short time"
good,"For me I had a good time there. My bosses were great. As long as we got the work done we they were okay with just about anything."
good,A lot of work with lower than average pay.  Learn a lot of different skills.  Not a lot of room for advancement.  Tough part of the job was constant phone calls while trying to complete other tasks.
good,"DST Systems is a great place to start your career and gain experience in the industry. It might be hard to move up, because almost everyone working there has been doing so for 15+ years."
good,SS&C typically hires kids directly from college and works them hard. The business is very complex and has very strict deadlines. Can get burned out if you allow the company to work you too much.
good,"DST is a great place to work. I have been privilege to participate in major M&A acquisitions and have worked with some very talented people. If you are looking for a place where you can improve your technical skills, DST is the place for you."
good,"This is a good company, benefits are good, and people are good. "
good,"Like the people I worked with and my immediate supervisors.  Got to do some Cobol,  CICS programming and trained in latest versions of DB2 / SQL."
good,"I worked in a developing group for BFDS primarily in invoice validation.  The work was open ended and challenging.  The developing nature of the work allowed for creative problem solving and heavy involvement with the client.  In a typical day, I would review invoices with the client and resolve discrepancies by creating systematic rules to better represent the calculation rules the client expected.  "
good,"Lots of opportunity to advance in most areas, but competition is stiff. Depending on area in which you work, can be quite stressful."
good,-Unit Manager of large processing unit.
good,"Good location with good parking facilities. subsidised canteen. spacious office."
good,"I learned a lot of Python and Git on the job, and the work environment was pretty lackadaisical. Work hours are very flexible. It did get a little boring some days."
good,The company when I worked for them contained good benefits and a flexible work environment. Management was good to employees and overall the company was good to work for.
good,"Executes manual testing according to the established test plans and specifications, interprets results, documents defects and issues, engages in root cause analysis and retest software corrections to ensure problems are resolved.  The people within the QA world are mentors and friends."
good,"Great work life balance. The people is what makes this place nice - smart individuals who always go above and beyond and never think twice about helping others. Benefits are average. Company tries to make it fun for everyone - cater in lunches, culture days, etc."
good,"Management is cooperative in terms of employee needs. It has been a wonderful experience working in this organisation,  overall have grown in my set of skills, knowledge and confidence. I would definitely recommend joining this company to the freshers. Standard industry benefits provided to employees."
good,Overall DST is a great place to work. My issues were the pay didn't compare to similar jobs and the management within my department was not sufficient.
good,DST has been very good to me through the years and helped to gain valuable professional experience. The transition from part to full-time was swift and beneficial for me as an employee and the specific team I joined.
good,The best part of the job is helping the service members. It brings great joy to me to be able to assist members when it comes to moving which can be very stressful.
good,"If you like working for big companies where the there is room to grow and options for advancement, BFDS is for you. If you are frightened by the fact that your employer is monitoring your your triglycerides, BMI and other vital statistics as part of a new 'wellness' program that seems more akin to Big Brother looking over your shoulder on the treadmill, find a smaller employer. Keep your options open. As part of an effort to be come leaner and meaner current reorganization is silo-ing jobs so that a given job title has narrower responsibilities, which makes it difficult to practice new skills so you can be promoted. "
good,"My view about this company is great still even though I was made redundant. It was all about the people and the flexibility in the workplace that made me last for over 17 years in this company."
good,Great company to work for. Paying to have to park downtown is really the only downside.
good,"Boston Financial always provides a clean, safe, working environment with the latest in technology, benefits programs, training, business practices and human resource policies."
good,"A typical day would be to focus on problem tickets regarding the system and if necessary make program changes to accommodate certain system changes.  "
good,Great environment to work at. A lot of work for low pay. Currently downsizing. A lot of promises broken.
good,This job is answering phone calls and helping customers with their account. It can be a very rewarding job when you can help someone in need that is hurting. My coworkers are amazing and I love working with them.
good,"Your constantly busy, but will enjoy the people you work with."
good,"A fast-paced, ever-growing pharmacy benefits management company."
good,Good environment and happy employee. Compensation is very good and client project are very diversified. Good work life balance and 401k match. Job security is good
good,"I was hired to run the Pune Financial Services team, have seen a lot of growth within teams "
good,A typical work day consisted of trouble shooting clients issues. The hardest part of the job was the many issues the came up. The most enjoyable part was problem being fixed.
good,"This company tends to be very flexible and work with your schedule which is great for new students.The pay isn't amazing but is decent for a college student. The work is physically easy as it only requires desk work on a computer; however, depending on what you do, it can range from dull to complex. It has many great characteristics as long as you view it as a stepping stone in your career."
good,"Average call center, average management, strict attendance, reasonable pay. I do feel like the company appreciated hard working individuals but more recently, there is concern with job security with the recent accession from an outside company."
good,"I have worked at DST Systems for over 10 years and have had a wonderful time. I have had great opportunities here. Care for employees as well as clients was of most importance. I have become a SME(Subject Matter Expert) for several pieces of the system. We all have worked as a team."
good,"A typical day included adjustments to shareholder accounts, reconciliations of company bank accounts, and some research from time to time. It was an interesting and fun place to work for."
good,Fast paced company with the opportunity to expand your horizons. unlike any other accounting positions in the area . Great learning experience and some travel is optional.
good,"The main thing I can say about DST is the company made changes, not company wide but to the Enterprise Services Organization, they had several employees that work remotely, the new CIO stopped the practice and made a poor decision to make remote staff move to a DST office or find employment elsewhere. I would have stayed with the company if they allowed remote staff."
good,"Generally DST has a good corporate culture and is working to improve organization and process, but still suffers from big-corporate bureaucracy and red tape, as well as fragmented groups from acquisitions of many smaller companies."
good,DST has a flexible work environment. They offer work from home now as well.  DST is a big company and has allowed me to learn various job functions while here.
good,"Quick paced and very professional environment, lots of work and data to enter. The time went very fast most all days due to the unlimited amount of work to do. Down part was working through lunches and breaks."
good,"Self paced most of the time."
good,SSNC is a fine place to work at. One can aim to build his her career with it. Manage is wonderful. work place culture is very professiosnal. if you love finance kind of roles then its is a good place to work
good,Always enjoy those whom your working with they will be there to help when you need them and help those when they need it. everyone seems to do there share of the work load.
good,"The company is one of the better ones to work for within the Kansas City Metropolitan area. They do have competitive benefits that includes but not limited to 4o1K, Stock, Profit Sharing, and Medical/Dental/Vision."
good,"I worked in the training dept. The people that I worked with made going to work something I wanted to do. "
good,Enjoyed working there and learn a lot.  Liked their DB2 and other classes.  Was a good fallback position for relocating to KC after Y2K work was complete at Dallas employer
good,"Good company.  Good people. I have enjoyed working here, but the initial training is non-existent, which makes getting up to speed on products and the company difficult.  If you can get past that, it is a good place to work."
good,One of the first things I learned was that everyone regardless of your title rolls up their sleeves and work to deliver reports to clients. This ensure that quality reports are provided to clients.
good,I really enjoyed working for this company. I started as a temp and worked my way to an full time employee and was promoted to an team leader position . this company has a lot of room or  growth and advancements.
good,I loved the company and my job.  Never any layoffs or talk of it and the knowledge gained from working with other departments was wonderful.  There was room for advancement often and many fantastic leaders in the company..
good,"In a typical day i would process financial transaction on mutual fund accounts. "
good,"I enjoyed working for this company and I thought the people were great, I was given the opportunity to move up in the company quickly and my input was always valued"
good,"	Managed a staff of 19 direct reports who were responsible for the multi transaction processing of our mutual fund clients."
good,"A typical work is very busy and fast paced. "
good,TMobile was a very fun and well established place to work. They provided me with alot of my customer service skills to excell and still use the tools today even with a new job.
good,"I enjoyed gaining operation experience within the Mutual Fund industry. I was given classes to learn the laws of IRA's, excel, power point, 401k's and Management training "
good,"Much to learn about the product, good working culture."
good,"My time with DST has been good to me.  Job security is high, which is important and advancement is in line for driven individuals....more so for some than others."
good,"Room for growth "
good,It is a repetitive work environment. I learned so much about 401K and future planning for myself. The company had a lot of factors in play so there is a lot of growing oppurtunity.
good,Fast paced environment.  Focused on customer satisfaction and growing the business.  Highly ethical.  People are respectful of one another.  Great opportunities to engage with clients.
good,"The office I worked out of had a good work-life balance. Keep a lookout for opportunities within the company across the different products and services, as well as markets. If there is a fit, you can make the move."
good,"Could be much better great people I worked with on my team and enjoyed the opportunities given to learn about the healthcare products "
good,DST gave me many opportunities to grow myself and career. I was able to enjoy many years moving to different groups within the company to increase my learning.
good,"I grew up at DST, which allowed me to learn a lot and meet a lot of great people.  Definitely was a company that allowed you a lot of opportunities. In  addition, their work from home policy allowed you to have a good work/life balance."
good,Highly technical co-workers - Learned and shared a lot amongst ourselves - Hated to leave but my wife was accepted to graduate school at the University of Minnesota
good,Had a very enjoyable time wit my team memebers. The managment was great. I was able to learn new skills play important role to my department. The typical day was making sure all reports for ready each departments.
good,"Overall, a great place to work, but not forever. Moreover, on a part-time/flex salary, it works well if you're a college student. Moreover, a strong emphasis on teamwork is highly valued."
good,"Typically in a work day, I provide exceptional customer service to customers by answering questions, resolving issues and assisting with financial transactions. I have learned to process routine service requests for purchases, redemption's, transfers, new account set-ups and other maintenance items requested by the customer. I have learned to research complex issues for customers in order to support their requests, making outbound calls to provide customers with updates or to gain additional information. "
good,"In less than six years at this company I was recognized and rewarded with significant pay increases for performance.  If you can deliver results, be accountable, earn trust, work hard and be willing to step up to the plate, there is a lot of growth opportunity.  It is a culture where commitment is expected and noticed."
good,Great experience for contractor. Great team in place. Professionals but over worked employees. Lack of training on processes due to employee overload is detrimental.
good,Same reason as DST Pharmacy Solutions. Same company. Am primarily seeking a position closer to home. Company was recently purchased by another company out of Connecticut and out departments future is uncertain
good,Very well paid and I had one of the best managers to work with. I mostly had the best experience all the time and I felt my ideas are heard and implemented. It's very easy to talk to the leadership team if you are any concerns. Mostly I found the leadership team is very transparent on the happenings.
good,BFDS was once a joint venture between DST and SSB. When SSB sold to DST things changed - not for the better. There is a lack of direction for the Quincy location and a general feeling that things are not headed in the right direction.
good,"With a large company like DST, opportunities for advancement are available. I've been fortunate to have incredible managers and have learned a tremendous amount from them."
good,This company does a great job working with college students. Management understands school comes first and does a great job providing flexible schedules.
good,i love this job. Just ask and you will be helped. nice work environment great bosses. can be fast paced are slow. but their is always something to do and learn.
good,Great atmosphere and place to gain valuable experience in a professional setting. Great tuition reimbursement program for current and aspiring students. Friendly environment.
good,"I learned so much the 11 years I worked for DST. I took phone calls with shareholders dealing with their mutual funds. I quality controlled other associates work. My last  position with DST was a Client Relations Specialist. I worked mainly with certain clients. I had to make sure all monthly, quarterly and yearly statements for the shareholders were correct. I thought I would retire with this company but unfortunately they laid-off over 700 people several years ago and I was one of them. Very sad day."
good,"Enjoyed working at SS&C."
good,I learned some things about a particular aspect of the medical and pharmaceutical environment which elucidated some of the minutiae that accompany successful completion of prescriptions getting filled.
good,"Great people to work with across the Company.  There is a lot of knowledge to gain within the Company that can assist with being promoted, and also the various options for a career path."
good,"DST Systems is full of different departments and is made up of smaller organizations as well. There is a large variety of individuals and personalities at the organization, in any particular segment. There is a great deal of training involved in obtaining a position with the company. A typical day in my position, as a call center representative, was taking a wide variety of calls daily. No one call or caller was like the other. The days were a constant test on understanding and knowledge of products taught and discussed in the trainings. There is a possibility for growth as long as an individual wants to grow with the company and all the positions it has to offer."
good,"In my previous Job DST - we had a team of 6 members so we have to complete the project the before the deadline so far work is not completed before the last day of the project date - and lot of pressure from clients end "
good,"A very good company, interesting work environment. Professional workplace, high profile clients. I enjoyed my work experience."
good,"Excellent training available, good work hours and generally works on special hours and or days needed.  Equipment up to date and software at the highest level. Excellent benefit for travel (bus) and school education."
good,"Pay was lower on the lower end of the scale mainly due to the location of the office. I enjoyed the people I worked with, and there was a lot of potential for growth."
good,I would rec cash and book weekly. Looked at Loan schedules and booked interest payments.
good,"great benefits, great people."
good,"DST is a great company to work for. They start out at a great hourly wage and they also work around your schedule if you work in the part time department. Even if you are in the PT department, they will let you work up to 36 hours a week so you can definitely make great money and still have a social life or go to class. I would recommend DST to anyone and everyone."
good,You will learn a lot about the Mutual Fund Industry and work with a lot of great people.
good,DST is a good place to work. The work is challenging and interesting. You get to work with many different clients in the mutual fund industry.
good,"Busy working environment.Training and guiding my peers with any helpful information,Taking advantage of courses online within the company which will improve my work skills."
good,I learned great customer service skills. How to keep my cool when it comes to agitated customers. Dependable and easy going co-workers.
good,"nice people and work place.fair salary, competitive benefits. growth opportunity is quite rare but good chance to change position inbound. great platform to learn more skills"
good,"Fun Place to work, you dont have to be in stress for soo long. Enjoy day by playing table tennis, There is no hard things at job, Most enjoyable part of the day is when you help others."
good,"The employees at SS&C technology is very friendly and helpful. SS&C have many events through out the whole year like watching base ball, Casino night, Hallowen party  and Christmas party"
good,Fast paced call center environment.  Ability to advance within the company in a variety of roles with various groups of mutual fund companies.  Extensive training provided and additional specialized trainings offered for those that want to advance their career
good,It was a place that it depended on how well you were liked by upper management. Sometimes you had had to work harder than others or some of the same associates  got to train on special projects before anyone else could.
good,The part of the job I enjoyed the most was involvement / leadership of projects.  I also enjoyed problem-solving situations that required advanced skill sets that I was able to implement to resolve these matters.
