rating,review
good,"I would start taking calls, it could be tech support , billing, programing spanish or english. I learn how to deal with customers not to take it personal, to have patience specially with the non english speaking customers.Management always try to help with a difficult customer and provide the best training, The hardest part of the job was when a male customer wold ask for a male agent for technical support w/o knowing that we would get the same training, and this at the same time was the best part because I would help them and solve their issue and they would see that not only males are good with truble shooting."
good,Good benefits.
good,I really like my job at echostar. They gave you a good training and management was good. Promotion and raises we're good. Unfortunately I got sick and was not able to keep my job but really wish I could have.
good,"This job was a good experience and provided me with excellent customer service and computer knowledge, the hardest part of the job was having to deal with people who were to be terminated. But i enjoyed the camaraderie of all the employees."
good,Worked with customers trying to get issues resolved when they called with a concern.  Gave ETA's on technicians going to perform work at a customer's home.
good,Not a bad place to work although not a very friendly atmosphere lot of Engineers. It was an okay place to work I learned a lot kind of repetitive in some job aspects.
good,The company allowed to cross training. Friendly environment. Highly recommended. Enjoyed working for this company.  I was able to grow with this company.
good,"Great place to work, with opportunities to advance and easy to ask for help if you had problems doing work the supervisor or manager or coworkers would help you when you needed it."
good,it was a good job other than the management great benefits and people were great they had times that we got free food so was a great job to work I would go back there
good,"10 Years Satellite technology, Stable company, Good Managers, Working with new technologies, fast paced environment, new challenges, never a dull moment."
good,I enjoyed working for several years at this company. I taught alot skills that could be used outside of the call center workplace. Also has great benefits and pay rate is great!
good,"Mainly programming in C languages, a lot of challenges and technical to learn from."
good,"I love this job working in a office setting but had the ability to socialize with fellow co works everyone was helpful and friendly, insensitive  for work performs was great and discounts for employees was good too. I love dealing with the different customers , hearing the relief once their problems was solved was enjoyable. I also learned great phone etiquettes and how to calm down irate customers"
good,"Fixed schedule can be a bit challenging and so is the mandatory overtime that is sometimes required.  Otherwise great place to work, great coworkers and staff."
good,EchoStar was  a good company to work for. The management Team was always there when you needed them. The staff is very knowledgeable on the work that they did.
good,A wonderful work environment where flexible working hours were allowed to accommodate those coming to work through serious traffic delays. Opportunities were there to lean new things always with friendly co-workers willing to help achieve the goals of the department. The occasional luncheon provided by the management added to joy of working in the company.
good,"Good place to work "
good,"There is so much going on and everyone I met while working here loved there position! It was a great place to have an internship and to understand how a big company functions,."
good,"Was a fun beginner job, taught me the ropes of customer service and working with team members and constant training allowed experience to be built. Also lots of room for promotions and bonus incentives."
good,"With a large multi-national company though, sometimes the right hand doesn't know what the left hand is doing. If you're looking for an office gig with a very manageable environment - this is the place for you!"
good,Had great time with travel and seeing the world. Worked long hours and travled about 95% of the time but it was worth it. They had a popcorn machine in the break room.
good,"Mijn dag begon om 8 uur, meestal was ik er wat eerder. Ik zorgde dan dat de keuken opgeruimd was, en dan had ik tijd om de computer even op te starten."
good,Very flexible workplace with lot of opportunities to learn. Had a start-up-like environment with people bustling with energy and enthusiasm. Everyone were helpful and encouraging. However I felt there was a lack of structure and organization which if corrected would make it a much more awesome place.
good,"Overall dish is a great place to work with a fun and overall comfortable environment. Because it is customer service though, the schedules can be hectic."
good,"good atmosphere, something new everyday. Learned new tasks. Answered phones, resolved tech issues with customers, also helped new customers establish dish in their home ."
good,the company is focused on the organizations interests. creates an atmosphere of competition to increase productivity. great co-workers. feels like there is a division between upper management and the rest of their employees.
good,"Take calls from Dish Network customers regarding customer service, technical support, and loyalty/retention/cancellation issues."
good,"Senior HR staff position responsible for adding value through broad spectrum HR knowledge and high level expertise. Primary responsibilities were to support EchoStar business partners and  HR staff  with recruitment, employee relations, compliance, training, strategies, general compensation and benefits issues."
good,"I've been working in Echostar for almost two years."
good,Arrive to work and clock in at work.  Morning meeting with all the technicians and supervisors.  Get tablet and perform all preparation and loading of all equipment before leaving warehouse.  Contact customers and inform them of estimated time of arrival and expected time of completion.  Arrive at customers location and proceed to troubleshoot or install new equipment ordered on work sheet.  Explain all aspects of the system to the customer and inform them of all features.  Complete work order and proceed to the next job site and repeat until end of day.  Clean up and return all assigned tools to the warehouse and clock out for the day.
good,handled high call volume customer support and tech iusses.
good,great people place always new faces you have you have to have an outgowing personailty
good,it's been a long time since i worked at this company so i don't quite remember much. i do remember i was one of the best bi-langue customer Representative in the zone i was in. i have received plenty of awards and recognition for my performance.
good,1st year I audited orders. The last nine months I pulled orders on a forklift for the first time.  Worked with reasonable people.  Hard part learning to drive forklift.  Enjoyable not making any miss-pulls.
good,"handled bill inquiries, went over each charge on the bill.  I learned t to use several different computers systems that made my job a lot easier.  Management was always around to hell me with any doubt to make sure the customer was always satisfied.  The hardest past of the job would be when u cannot hear the customer right due to noise on the background or when they would be doing other things while on the phone.  The most enjoyable part of the job was the fact that after  each call at random I would get surveyed for my performance and if the customer gave u a 5 which was the highest score I knew then that I was doing my job correctly. "
good,"Difficult to advance beyond entry levels due to tenured employees, management is happy to work with you depeneding on your willingness to be a team player."
good,"Management was caring, provided he correct amount and time for training. They provide great benefits. The culture is guided towards team work."
good,"Typical day at work would be customers calling in to complain about their tech issues or other reps not doing their job. Everymorning was a followup on your previous day, call backs and what to do to improve. Enjoyable part of the workplace was talking to different people and learning things about their culture and surroundings."
good,"Working for Echostar was a great experience with great teammates, great experiences, and amazing upward movement potential. The only problem I ever had, was initially I wasn't good at sales as I gained experience from managers and coworkers, my sales surged. As they did company policy changed and put more focus on the sales aspect of each appointment."
good,"Most of the people at the company are great and joined the company because they want to work for a place that makes a difference. The benefits are okay, and the company supports the idea of work-life balance"
good,went in at 6am and didn't get off til 9pm. But I loved my job. the most worst part was dealing with a few of the techs when they didn't call in with the information I needed.
good,"Each day I start by picking up my events that are assigned to me.  I log into the computer, open programs that I will be using, and enter my events that I will be monitoring.  Prior to each event, I verify that we are receiving the correct provider, that audio and video is good, and that Closed Captioning is present if it is supplied for that event.  5 minutes prior to air, event is once again checked to make sure it is properly going through our equipment.  At time of air, confirm correct content.  Monitor event for audio, video and problems.  When event is done, take off air.  Also, quality control for movies going to air."
good,We answered calls and each department had there own set of calls. I started in conformations and then went to tech. and ended up in a team that took all escalated calls. I was very impressed the training that was involved. it was not just on the job training. we had a full month to learn all the components of the satellite.
good,"Excellent benefits and paid training, plus company morale meetings."
good,"Loved the job, Learned so much about technology such and computer skills. Had tons of friends to work with which made early mornings really fun. the hardest Job was working with disgruntled customers. The most enjoyable part was working with co workers on special projects and working in teams."
good,Wonderful job to work for and well worth the time for advancement.
good,"It was a call center so answering calls and talking toclients was the job. I loved my coworkers and the over all work environment. The pay was not enough toprovide for a family, this is the only reason I left."
good,waken up at 600am getting to work before 7am having a little fun with the co-worker.the hardest part of the job is making sure you don't hurt yourself. a proud moment when you finish the job
good,Generally always busy which made the shift go by quickly. always had classes available to learn new areas. All classes were on own time but since it was over our 40 hours we were paid overtime to complete the classes. We could come in before our shifts to work overtime hours.
good,"very laid back and easy to work at, if you have computer skills you are good. You get a chance to advance if want to . It has great people to work with and things to do as a company"
good,"I logged on the the phone and computer system and took calls. most of the calls I took were tech (troubleshooting over the phone), but I also took billing, pay per view, and commercial calls. I learned how the system works. I learned how  to work with difficult people and found solutions. I liked my supervisors and Co-workers. The hardest part of my job was assisting elderly customers with limited vision over the phone in under 10 minutes. I really enjoyed helping customers, and working as a team with my co-workers. The pay and benefits were great."
good,"EchoStar was tot 2005 een bedrijf met veel activiteiten qua verkoop en doelstellingen."
good,A typical day at work would be coming in and logging on to your computer then having  a five minute with your co-workers and manager then getting on the phones and serving the customers. I learned that the customer is the reason we get a paycheck and you always want to please that customer no matter what. You had some managers that were fair and cared about what you thought or how you felt about different things. My co-workers were a joy to work with we all made it comfortable for each other. The hardest part of the job was when a customer wants to disconnect their service and you try whatever you can to save them but they still disconnect. The most enjoyable part of my job was when I would have different actors that came into the call center to promote their movies and we would get to meet them.
good,This was awesome and knowledgeable work experience while working in this company. I learned lot about data entry and dealing with customers.
good,"Getting to know the different cultures within the department  and loving it."
good,"The work was challenging and rewarding. The compensation was fair. Management, in general, was relatively good. However, as the sister company which has since absorbed Echostar, I have also worked for in the past and would describe differently."
good,"Management often micro-Manage techs, daily staff meetings, field manager over worked often had to management 17 to 20 personnel"
good,Its Very Good and i am enjoying the culture of echostar. I have great experience in that company about my professional life. I learnt such a good thing.
good,"I just wanted to thank EchoStar for a wonderful 10 year ride. It is good working environment, l have been a GREAT group to work with. I have learned lot from my co-workers and my manage. I am appreciative for all of this."
good,It was fun working here always fun energy had great incentives. The sick leave is ridiculous but every business has there pros and cons . I would work here again
good,Customer/Technical Service for Dish Network customers. Managed escalated calls and provided customer satisfaction.
good,This job was good to have in regards to experience with data entry and auditing.  This job allowed me to become more detail oriented.
good,"This government postion is not for everyone, since you don't get to walk around or move about as much as you would like. but over all a great place to work."
good,"Have great benefits and good paying Job, It was a good job to start off. It takes time and dedication. I was a full time student at the time of getting this job, unfortunately I could not maintain a full time job with being a full time college student, So I resigned"
good,"downloaded software, "
good,I enjoyed working for dish as they seemed to appreciate my work ethic.  While the pay could have been better we did get quarterly reviews and raises were given.
good,fun place to work in got discount to have dish installed in home had privlidge of having dish service in my home also received prizes for good calls and certificates
good,great learning experience for me with customer service. Nice place to work for entry level technicians.
good,We will work 12 hours shifts and even weekends but it was always in a very friendly and competitive environment. Management was constantly changing but always willing to help.
good,It was great working with Echostar. I had wonderful experience in learning technicalities.I got to learn large aspect of technology
good,answer in bound calls for dish network help customers with billing questions and any issues they maybe having with their equpment
good,Everyday is different. New customers on the phone you never know what you will get. The best times are during sales. Little time for socializing with co-workers. Hardest part is like any other job.
good,I love my role and have met many fantastic people! Challenging work and a supportive management team - looking forward to what may lay ahead!
good,The largest Satellite provider (known as Dish Network) in the country with great programming and the greatest group of people to work for.
good,It is a fun place to work.  You meet different people and learn to deal with different people on the phone. Training is excellent and help is available on the floor when you run into problems with the customers.
good,"Fantastic place to work. Great benefits that are affordable. Decent amount of time off. My management always encouraged me and supported me. Great work/life balance; flexible when you need it. I only wish I could have taken my job with me after 14 and a half years, I had to relocate."
good,Great work environment with great people to work with. Work hours are great and the schedule is awesome overall it was a great job to work at..
good,"I love this job, the environment is mostly laid back with a very supportive management team.  I have learned a great deal about video compression and networking while here.  all my co workers are great to work with.  the hardest part of the job is multitasking while trying to restore services during outages."
good,Echostart was also a call center environment: this was my first job where I was giving  the chance to work in techincal support. I really enjoy challenging my self and the learning enviorments. I made long lasting friendships here and was a credit to the team atmosphere.
good,"We always start the day with a team meeting to motivate and plan out our goals for the day and the next ranking. One on ones, feedback, training and training new hires."
good,"i arrived at work logged on to my station clocked in and began taking calls. My management staff was always helpful and a joy to work for, and my co-workers were all very high quality people. The hardest part of the job was the commute which would eventually lead to my resignation."
good,"When it wasn't busy employees are offered time off the phone. If something happened and they needed overtime there wasn't a lot of notice. Hardest part of the job is when the customer starts out telling you they are in the right no matter what,it's hard to get across to the customer the facts. I enjoyed being able to assist customers with their equipment while being kind to them."
good,I learned how to inspect satellite receiver. An how to run a test on them to insure the buttons were working correctly. The work load through the week determine the weekend work.
good,What can I say? This company was a great place to work for and the people are very nice. You actually learn how to fix a receiver and sell them programming all at the same time. the management was great and the co-workers were like family. The hardest part of the job were some of the customers and the most enjoyable part of the job was the whole EchoStar family.
good,"Good pay, guaranteed hours, decent benefits and bonus perks. "
good,I was in charge of Maintenance had to take care of all management concerns.....I also rebuilt the whole entrance when they put turnstills in for fingerprint entering into the building.   Which also made it possible to make the security team secure. because I built a wall and added bullet proof glass so the team would work behind it.
good,Excellent work place too bad that center could not continue get the tax breaks extended. Was hoping to retire from there. Enjoyed my time and experience gained and would love to see the building come back to life.
good,It was a fun work environment with lots of scope for learning.
good,"Been a long time since I worked there, but an awesome place to grow for motivated employees who truly care.  Hired as Technicians Assistant, promoted to Technician, Technical Manager and added responsibility as Operations Manager.  "
good,Days there went by fast...learned alot about people and how to inteact with them in a posative way.Co workers were very helpful and easy going.the hardest part of the job was also the most enjoyable whichh was talking and helping people over the phone with there concerns and technical problems.
good,"Am a current employee. Great place to work. People here very helpful, smart, dedicated and passionate about their work!"
good,Management was great. People were understanding. Workplace was a great location.
good,excellent advancement opportunities in field of engineering
good,"Good company to work with, have lot of fun activities during the typical day, good management and encouraging colleauges. People don't leave this company easily."
good,No real room for advancement in this department. Management and co-workers are great. There is a lot of overtime. PTO is a definite plus. I feel this is the best company to work for in Cheyenne.
good,A great place to work! Each department receives a variety of calls in at a fast rate. Extremely educational in regards to technical aspects of audio video equipment. Great bonding with fellow workers through team orientated projects and goals. Strong leadership from the CEO Charlie Edgren on down. Although at times there were slow periods that were filled by make work. I truly enjoyed talking to such a diverse group of customers as we were able to fulfill several international packages.
good,I learned a lot of customer related skills with this company as well as excellent computer skills.
good,"Efficiently managed, planned, and evaluated daily production processes, maintained high quality productivity operations, directly supervised the work efforts of over 15 employees."
good,"interviewing potential candidates for our customer service call center. "
good,"Fun and enjoyable place to work ,and the management was okay. I learned to work in a fast paced assembly and packing line.Some was fun and easy to work.Working 12 hoursthe incentives."
good,"I worked at EchoStar for about six years and it was a great place to work! My achievements were appreciated and I was promoted twice. I made some lifelong friends there, as an added plus!"
good,"Great technology, still use it today. I met a number of very talented people while working at EchoStar. Many of them are still friends. Working there was a pleasure and I would return if the opportunity presented itself."
good,"I enjoyed working for EchoStar. My duties as a HR Generalist included  recruiting, interviewing, hiring and terminating employees. Other duties including new hire orientation, some training. and benefits. I was responsible for preparing and presenting the new benefits package for the coming fiscal year for all of 700 employees in the El Paso facility. I also coordinated with the HR staff on inputting all benefit data into the computer and get it all done by the deadline. I enjoyed working with the employees."
good,I worked here for 5 years and went from entry level pay to high pay. I loved the training and sales contest. people very friendly and ready to help.all in all great place to work
good,"I was able to use my office skills training. And more. They gave me a chance I started in human resources, then moved to administrative assistant. Loved working with all. Must be a team player"
good,"Easiest job I ever had. I heard now that Dish took over everything is different. I was paid well to watch tv for 8 hours, shift work, not a bad gig until you have to watch commercials all day."
good,"I worked as a Satellite Installation and Service Technician for 6.5 years DishNetwork.  "
good,made available promotions & benefits to present customers to compensate for dissatisfaction. customer oriented & empowered employees to make decisions
good,"I worked at EchoStar during a summer internship.  Being from Baltimore, they provided a place for me to stay.  My boss was very helpful and I learned a lot while working there."
good,"First of all, let me clarify something. When I got hired to work for DishNetwork (back in 06), I had to do a urine drug test. I've recently been told that they do not drug test anymore, but cannot verify that. If you go apply to DishNetwork, I would recommend planning on taking a urine drug test."
good,I would rate this company very high because it had a system that allowed you to work in a fast paced environment but at the same time allowed you to get the work done as required.
good,I worked for echostar for almost 11 years and although they were without problems it was a nice place to work. I have a superb supervisor and the manager was one that really went to bat for the workers.
good,"Worked well with others, overall top performer, recipient of numerous sales awards,  Team leader, great communicator, makes excellent presentations, attended all company sales events."
good,echostar has great opportunities to get a pay increase every thirty days. easy to learn has a good system to rely to work and perform your job .  works with school schedules. great benefits . overtime unlimited
good,"Great management"
good,Excellent job atmosphere with great energy. Very good bonuses and incentives for motivation. Hardest part of the job was the pressure to meet certain quotas. Workplace culture was moderately compettitve.
good,"The job at echostar was competitive for other cable companies as well as troubleshooting and dealing with billing. It was to solve the customers issues and or send a technician,"
good,"always  something different, take calls on different subjects, sometimes sales, tech or just answer questions for new customers, we had different activities, raffles and different incentives we would get according to our productivity"
good,"it was a fun and exciting environment, not a day where i felt pressured or something i didn't want to do. hardest part of job rude customers. but overall i really enjoyed how they work with you. i really didnt enjoy the split shift they have given me."
