rating,review
bad,"Performed workforce management duties (scheduled agents in a call center, scheduled time off requests, ran performance reports, performed statistical analysis for business needs).  Co-workers were a pleasure to work with.  Overall the organization was more concerned with the bottom line and not with the people in the organization or the customers purchasing the service."
bad,"Dish Network was a fast paced multitasking enviroment. My taem had great chemistry, cause we were left toour own defences often."
bad,"At dish the management they have is really just a puppet to upper management. If a process doesn't make sense or does not benefit the customer or the company's employees nobody has the idea to challenge the directives that are set in place. Also in a one particular position I held, although we have Paid Time Off given to us, we had to ask permission to put in that PTO even if the day was available to take off, most of the time a lot of us were told no. Employees there are placed on performance improvement plan and even though they pass all metrics in the plan, the company will still fire you since it is an at will company. They do not care about their employee's the attendance policy is horrific, you can only miss 8 days out of 365 or else you are fired. Place is a very stressful place to work. I would recommend against making this a career choice if you don't have to, find a place that respects it's employees. A place that works for it's employee's so it's employees can be solely dedicated to working for it's customers."
bad,Depending on management you can  get the support you need to advance if management does not believe in you you will be unable to advance or transfer out of that department
bad,It was an ok place to work. the management was very young and it felt like I was back in High School again. the pay was ok for what the type of work you did.
bad,"Fast pace work area.  Always on the phone.  Loud working environment, in a call center.  Hard to concentrate when talking to the customer to assist."
bad,"The work environment varies depending on each departments management chain. However, there are constants including lower than average pay, poor benefits package, high turn over in general, and an overwhelming number of executives and directors that resort to yelling and cursing as standard practice in day to day operations. Both technical and business support salaried positions are pushed to work overtime as standard practice. Negativity from the top down yields a work environment thriving on low morale and employees just trying to keep their heads down to get home without daily conflict. There is a lack of positive encouragement at the company as a whole, of course there are those rogue managers that do a great job supporting their employees and providing positive leadership, but they are in the minority."
bad,Just a normal call center job.  40 hrs a week listening to people complain about their services.  Fairly boring environment and a non existent chain of command.
bad,Working at Echostar means giving your life to your job. You typically have a day filled with people yelling at you and you giving credits to the bill to make people happy.
bad,I liked a number of the people that I worked with.  I was able to take on a variety of responsibilities.  Management was not very good at identifying talent and helping people to contribute to the company.
bad,The job was quite easy but the management was relatively senseless. Seems like the place is run by people from a different era of business struggling but failing to keep up.
bad,"A day at echostar is very stressful and ovewhelming. I believe all of the workers are underpaid and deserve better than what they are being treated. The people there are great but the job is so stressful. The most enjoyable part of the job was the people who called in, because I love people and love to talk. The hardest part about the job was making the manager happy in which it seems as if nobody could ever do that."
bad,"Changes inevitable but no proper training. Management is only worried about numbers nothing else."
bad,"A typical day at work was taking care of customers with billing, packages, technical support, and listening to their needs. I learned that my personal beliefs were not looked at respectfully by everyone and it was taken personal. Management for the most part is great, but there are as always a few bad apples. The hardest part of the job was not knowing what I would personally be asked to do each day outside of my job requirements, for example, change some of the personal information regarding my beliefs, being asked to do drug testing during my shift, and seeing that the measure taken for absences with other employees was not the same for everyone."
bad,I started working here directly out of high school. It was good experience and job training. The hours were long and the schedule was not flexible but the pay was nice.
bad,"EchoStar is an easygoing work environment with good people and a chill atmosphere.  However, middle and upper management are terrible, with a few notable exceptions of course.  Benefits are below average and pay is below average.  Accountability is non-existent.  For those on the twilight on their careers, there is no better place to work as you could ride it out until retirement without doing anything at all.  If you still have passion for design and want to work on something competitive in the consumer electronics industry, you'd do best to look elsewhere."
bad,"Talented staff of employees made working at Echostar enjoyable despite the worst benefits of any engineering company where I have worked. The company produces quality products."
bad,Typical call center job.  Lots of turnover.  Cold calling is a lot of the job
bad,Interesting opportunities for experience in operations.
bad,A typical day at work involved learning about the industry and contributing towards management goals. The hardest part of the job was collaborating with colleagues.
bad,This was a good company when i first started working there. this is also where i met my spouse and we were equals and not any type of direct report. once we decided to get married we told our boss and we found out that he also was interested in my spouse and got vendictive and looked for a way to get rid of me. we moved out of town which allowed for us to resign
bad,I enjoyed working with my tteam I did not approve school shedules they would sometimes not work with school shecdules and mandatory overtime
bad,The job itself was not difficult. Customers could get angry when having no signal. Co workers and Management was not professional at all whatsoever.
bad,"The day starts with calls and ends with calls. I learned that if you want to make sure someone keeps their word you must get it in writing. Management treated new employees like they were less than them which made the job less enjoyable. Co-workers were great, i made some close friends through this job. The hardest part of the job would be trying to maintain a low call handling time, it seemed like their expectations were a little high. The most enjoyable part of the job was being able to help customers out."
bad,The company is currently far behind on technology as they hold on to outdated design techniques refusing to adapt to current technology standards.
good,"Management was awful, they were very unorganized. Co-workes was the only good thing about this job. I really disliked mandatory over time they forced you to come in on your day off with no notice and if you didn't show up to work it would be counted as a ""No Show"""
good,"Interesting place to work to say the least."
good,I had to load and unload tr4unks and clarify and check invetory.The job cause for long hours. my schedule was 3pm to 11pm but i would have to work until 4am sometimes to 6am . and if i wanted to leave at my regular time they would deduct points from me.
good,This particular environment was more hostile than anything else.  There were a few good people to work with but overall the company had a hostile work environment basically towards everyone.
good,It was a fast paced place to work. The pay was decent. The management and politics were the bottom of the barrel. They were rated the worst place to work in the nation by Glassdoor for a very good reason.
good,"The training provided was intensive and prepared me well for the job. The job in it self was not a bad job, but management was unprofessional and employee moral was always low. No job security. There were days when 20+ people would be terminated. Had everyone worried all the time."
good,If finding joy in helping others is your strength Echostar would be a good company to work for. Throughout the years of working there I have increased in my level of having patience for others as well as learned how to deal with conflict in a respectful professional manner. The most enjoyable experience I had while working there was meeting alot of wonderful people which assisted me getting me through my days even when they were highly stressful.
good,"Subpar compensation, poor benefits package, unethical sales strategies encourages, increasing irrelevant group of products/services. Mid management concerned with simply keeping their job. Extreme disconnect between uper management/C-Level execuives and associates exclusively interfacing with existing and potential clients."
good,"Typical day starts with a meeting so you can watch your manager read his email - very counter-productive."
good,"Echostar is a decent place to get your feet wet but past that, moral is poor and most within the company are more concerned with the politics than product."
good,"typical day is easy. A lot to learn if you are on right team. Senior management lacks vision. Co-workers are good, nothing more or less, just like at typical"
good,"Team work                                                                                                         Data Entry "
good,"There was one manager during the time I worked for Dishnetwork that was absolutely phenomenal.  The other managers were average, but it seemed like it was more due to just giving up & not wanting to push anymore.  "
good,If you like working in a call center than this is the place for you. I did not like the mandatory schedule changes every few months. Make sure to get to work at least 20 minutes before your scheduled shift to find a computer.
good,The technical elements of employment are extraordinary and fun to learn. The management environment is very tightly controlled with little latitude for bottom up collaborative improvement strategy.
good,I learned a great deal from my coworkers and manager. I experienced situations that helped me grow as a person and I'm grateful for that. The hardest part of the job is getting all the work done on time and starting out when there were no departmental procedures to follow. The most enjoyable part of the job were the people I met. It is a highly competitive environment and people are encouraged to step out of their comfort zone as it is the only way to move up in this world.
good,"Answered incoming calls for customers and field agents needing troubleshooting and installation instructions. I enjoyed meeting new people to work with. Two things made it hard to work here. One was finding a manager that was willing to help you if you had questions, The second was trying to balance work and family."
good,"• Participated for four months in Hurricane Relief Crew efforts in Florida"
good,"At this place you are just a number. It is male oriented place and there is no room for a female supervisor. They will make your life miserable until you quit on your own,."
good,"Dish just like many corporate giant is huge on rules unspoken or otherwise, and trained their employees to do things that can later come back to hunt the company. This style of management lead to many lawsuits that are still being fought today"
good,Employees were treated as bodies in chairs. Very little reward and recognition was given. High turnover rate and poor leadership in most cases. Would not reccomend.
good,Working here was like all deadlines were due last week and your hair is constantly on fire.  There is nothing at all that moves at a regular pace and ever since working here all other employers have asked me to slow down and take more time and give myself more time to complete tasks.  While here they take full advantage of all your skills but never plan to pay you for all of your assigned tasks.  They called it career development and training.
good,"Assist with technical question, troubleshoot and try to fix issues over the phone with the customer. Keep up to date with constant changes and equipment upgrades."
good,"you have to set you own pace, no one is willing to listen to your idea you have to set the standard for work, you are overwork and not enough composation is awarded towards emplooyee's"
good,"Very little chance of promotions.Had 1 promotion in over 16 years.Very little training, had about a month and a half of training in 16 plus years. Management from what I received was by intimidation."
good,"EchoStar is ok if you can survive the first year. Benefits are not the best but have gotten better over the years. Fast paced environment, must hit the ground running."
good,good place to work depending on the department. 24/7 facility with a good bunch of employees. Good company values and a diverse background.
good,Back to Back customer service on bill and technical inquiries. Able to view situation from a customer perspective. Team mates was the most enjoyable part of the job
good,Almost every day was the same. It was a repetitive routine. I learned a lot about cable and receivers. As well as remote controls. It was all for DISH network. Management was disappointing. I attempted to go part time and was denied several times. Even though I was told they would work with my schedule so that I can go to school when I interviewed. The co-workers were great. The best part was when your shift was over.
good,"• High call volume (up to 120 calls per day)."
good,"Benefits were horrible. After the company hit 6 years old, the owner no longer cared about his employees. Year after year benefits got worse."
good,"Walk-in to a fast paced buzzing workplace. No telecommute option. Nice cafeteria and very green campus with tennis courts and baseball fields. Workload distribution is uneven, need to be fixed by management."
good,The compensation is below industry standards. Job advancement is possible depending on the group that you join. Focus on consistent employee training is missing.
good,"Corporate drama.  Lots of ""not working together"" to accomplish mutual beneficial tasks.  Not very pro-active thinking until ""up against a wall.""  A very pretty location."
good,If you like to monitor and respond to issues as they arise while getting to watch/monitor television stations then this is the job for you.
good,"Typical work includes:"
good,"I usually get up around 6 am in the morning to start van inventory count and job listings for the day. Once the works orders are received, we call all customers on the daily route with estimated times of arrival. When at the job site, we perform the necessary needs as far as new connections, troubleshoot, and upgrade services to the customer. It involves a lot of hands on and technical skills to deliver great service and rapport with many different type of consumers. "
good,"Answer incoming calls "
good,A typical day at work consists of maintaining and refurbishing receivers. I learned how to better work as a team to accomplish a set goal set by management.
good,I enjoyed the customer service aspect of the job but not the fact that my schedule kept changing.
good,Interaction with customers and knowledge of the latest technological innovations make the company a leader in telecommunications industry.
good,"Good stable company, slow wage increases and not to much earning potential in the long run."
good,"Dish Network was very concerned with the bottom line. As a result of this, there was no sense of job security. Management and Director positions were frequently being eliminated. In the last two years I was employed there, they had four different directors, each of which had conflicting ideas of how the business should be run. To cut costs, there were often mass layoffs, commonly referred to as Black Thursdays."
good,"Although it was a good enough job, the pay was low and the amount of hours I worked when I was there were to many hours for the amount of money I was making."
good,"Good place to work, compensation is moderate, management as a whole is good. However, some department managers can be very personal rather than professional."
good,"Great opportunity to grow among the organization, however with very limited benefits and pay."
good,"I spent almost 7 years with the company and learned a lot, but I feel that it is time for a career change."
good,I did enjoy helping customers and liked my co-workers. Management was a little bit too uptight.
good,Answered all calls and sold Dish Network programs. Set install dates. Answered all questions or transferred call to appropriate department. required to know how all Equipment worked. Transferred to Tech support
good,"i have been with this company for over 11 years and I feel it is a good company to work. But, personally, I don't find any potetial for grrowth in my area and that is why I am looking outside. Management is okay, but for the past 4 years the policy in treating employees from other coutries is changed. It may not be a company policy, may be it is department related due to change in management level. I feel uncomfortable due to discriminatory policy in my area. But overall it is a good company to work with moderate satisfaction. Despite of this issue in my area I love this company."
good,"In a call center is loud, I was QA after 30 days. I listened to calls and graded then review. I trained and worked with coaches and could take a team so others could do paperwork"
good,"It's customer service over the ph... call after call, none stop for 8hrs. You are trained on the products well and are given enough time to get comfortable to get on the phone after training. It is stressful because it is customer service for TV services. Customer can be very bad and rude and demeaning. It can be fun and can make great friends within your team and area. Needs to pay more for what you do though."
good,It was a job that paid the bills when there was nothing in my field of study. I had a decent time but got home every day mentally tired. the location I worked at has now been closed.
good,"It was a busy job with multiple roles, We were expected to Up-sell collect and perform Tech support. I was on the escalated tech support team and was required to take escalated transfers from other reps."
good,"Since they are again part of Dish, some of the improvements in benefits that were seen at Echostar have diminished.  Dish is a service organization and Echo is an engineering org, but the Dish mentality prevails to some degree."
good,Great place great people you cant become rich nor can you afford life here in CO but still a cool job to get you by. Collect collect collect. Dial Dial Dial.
good,Culture has gotten better in the time that I have been there.  Still has a pervasive culture of we do everything the best and new ways have been slow to adopt.
good,"that i worked for is closed, so i can't actually recommend working here to anyone, although i suppose when it was open it was a pleasant enough job. mm"
good,"Echostar was the first major company I worked for, and with that said it was a great company to get your foot in the door.  However, with so many layers of management and competition advancement is very difficult and is not on par with the cost of living in the area compared to its competitors."
good,It was a good place to work.  It paid well and if you could do the job it was a place you could move up.  Overall it was a good place to work and the people were friendly.
good,"Enjoyed working with all types of people. Fast pace, and sometimes stressful. Updating technologies and good workplace culture. Always something to manage."
good,Changes since our business unit was given to Dish Network has made this a difficult place to work.  They focus more on punishment than support.  We do not need rewards...but all we get is punishment.
good,"The company really good at giving employees goodies. they had raffles for certain upsell, pot luck. they gave shirts for special events like boxing and movies."
good,"Casual but fast-paced, hard working engineering environment with diligent hard working people. Business casual all the way with fun activities during the holidays."
good,My time at EchoStar was a really good opportunity to get some real world exposure in the satellite communication industry; combined with technical writings and drafting policy briefs.
good,I go to work to work and get things done! Productivity is key. I learned patience and how to multi task. The hardest part was not being able to help like i wanted
good,"You do not work with many people so mostly by yourself.  Pay is poor."
good,Dish Network is just like any other call center.  Metrics driven and lack of balance for family life.  Their training was great and they have several positions available.
good,Worked with the Greatest Manager I had. He was very willing to teach and help the engineer to be successful in many ways. The Product was amazing and launched on time!
good,"A typical day at work was being on the phone and troubleshooting problems with satellite internet.  It could be interesting at times, but also boring at times if one kept getting the same problems."
good,The upper management does not have any idea how to run the company. They run the company like a fast food restaurant. No vision at all. I wouldn't recommend my friends to work here.
good,Good company to work for but they expect a lot from their employees. I only left the position due to our local call center closing.  Would have stayed had that not happened.
good,Pay and benefits are ok. Working at a call center tends to bring different people together. learning to work and help each other out. if you apply yourself in a call center there is possibility for you to grow.
good,"Overall the company is run from the top down and had no schedule flexibility. "
good,Provided daily and monthly sales analytics to the home office.   Updated the metrics report daily to assure the employees were being rewarded for hitting their sales and quality assurance marks.  Upon closing of the division when needed I also assisted in manning phone lines for technical support and sales inquiries.
good,Good people. Environment was constantly changing. R&D lab. Challenging job with interesting prototype products. Very smart people. Very good environment.
good,"Over all a good place to work, but management has issues.  Too many chiefs and not enough indians.  But the work that you get to take part in can be great fun and the people that you work with are awesome.  But little to no advancement, at least in Gilbert.  The main push is to manage remotly from other locations."
good,"Reason why I'm looking for a job is because you don't get paid very well here. Secondly, this industry is going nowhere but down due to streaming online services."
good,"EchoStar was a good place to work, great co-workers, some of the management was a little in over their heads, other than that its a fun place to work with good incentives. Company always finding ways for agents to sign up for overtime with encouraging compensations."
good,"The entire enviroment of the company is like a call center, you learn to accept it with time.  It's a good company to start out at, but not a lot of room to grow."
good,Used programs like Photoshop and Illustrator to design movie and TV posters for DISH Network subscribers home guide screens.
good,"A fun environment, can be stressful at times but they have a billiards pool table, pull you off the phone at times for your hard work and give you 10-15 minutes to play activities they may have or just to relax a bit."
good,I went in and took calls from customers and helped them troubleshoot issues or went over their bill. I learned how to connect the receivers to dvd/vcr/tvs. I made alot of new friends and my trainer was excellent. The one thing I didnt like was that they would change your supervisor every few months so it was never the same one. I enjoyed my job learned alot of useful information made a good deal of money unfortunate that we parted ways.
good,"take payments over the phone and help customers with their technical problems."
good,"Supervisors always willing to help on technical issues, very good at training sessions, and customer appreciated our technical troubleshooting for them."
good,"Tested equipment to make sure it worked. Also worked in shipping, receiving and maintenance"
good,"As a marketing rep. it gives you opportunity to meet so many different people, and learn so many different cultures.  The management style for the Rep Dept.is very lax, is a multicultural place with a very friendly work force.  The hardest part of the job is to deal with sales quota and the most enjoyable is to work with people (customers) you can chose."
good,Hours are very managable. Work is challenging and exciting. High level of responsibility. Great workers and team.
good,I worked WAY to much for what my salary was.  my pay would of been double if I got paid overtime
good,nice place to work. family environment. growth opportunities available
