rating,review
bad,"sales sales everyday speech .Dont work here better to work for free at the worst company. Ceo dont care no one cares, Horrible people at the top. Cut staff and Managers for nothing, if you dont sell watch out."
bad,This job is not secure people that had been there for years are getting fired for what ever excuse they come up with and people getting sick of all the stress.
bad,"Not for those scared of heights.  If you like working with tech it’s great and the customers are fun most of the time.  Avoid having a different van, stick with one and keep it well stocked."
bad,"Would include countless meetings, upper management yelling, and the focus on number of hours per day you worked - not what was produced.  There are badge stations that know when you get something from the cafeteria, go to the bathroom.  The workplace culture is not one to promote a fun atmosphere where team members can collaborate.  Travel to client sites resulted in shared rooms."
bad,Daily scolding are numbers met and not met.  They push their employee to excel with threats and scoldings.  the atmosphere is toxic and I could not wait to get out of the building.  I will never work for that organization again
bad,"•	In charge of training new personnel in download department"
bad,Management lacks in every way! They never make smart decisions nor do they ever do testing.  They have no people skills and are constantly dishonest about things.
bad,"CEO, VPs, Regional Management, are talented in the abusive management style.  Adults yelling down the management hierarchy instead of coaching.  They even bragged about being able to yell at your employees in order to motivate them."
bad,"The management and business is very disorganized, the fire people at there leisure. The security is a joke. Would not recommend to no one to work there."
bad,"Incredibly unrealistic expectations of their workers as in number of saved customers daily/weekly, time it took to save that customer; i.e. 2min from start to finish of the call with an 80% save rate. Constant bombardment of calls from angry customers that didn't realize how bad the satellite signal would be, can't get an upgrade, their bill suddenly became more expensive, etc, etc, etc.Constant bombardment meaning the second I hung up the hone another call came in."
bad,It is closed now. Treat you like you are a kid. You go to the bathroom. You have to log-off. For how many minute you use in the B.R. then deduct the time from your lunch hour.
bad,"Terrible place to work.  Poor pay, poor benefits, no advancement and terrible management.  No consideration for workers lives and needs.  I would never go back."
bad,"Just do your homework before considering joining this company or Dish Network. Read all the reviews in depth. Also, research who the worst company to work for in the US by their employees ratings..."
bad,"Worst place to work, no promotions, management lies all the time."
bad,You are made to badge in and badge out when you leave the facilities even in the Corporate Office. It is a toxic environment and not very open minded and they pay 20-30% below market for positions.
bad,Not a good place to work. Your a number not a person and you only get promoted if you friends with the boss. Coworks hate each other and management is a joke.
bad,"I did not like working here.  The short period I worked here, I was moved around departments and the QC team was really strict.  The pay was low and benefits were high."
bad,"Anytime you are subjected to being cursed at, having your childrens lives threatened and then told by your supervisor that you got the customer off the phone to quickly it is a problem. Supervisors and managers expected everyone to try and sell customers extra channels that they did not need simply to get more money even if you had spent well over 30 minutes on the phone with the, being belittled in every way imaginable."
bad,"I highly recommend that anyone considering working here think again. In order to work here, you must move to Cheyenne which isn't everyone's cup of tea. Between the weather and the intense loneliness and boredom and insane jerks, not everyone will find the capital of Wyoming in the southeast corner of the state to be habitable, certainly not desirable. "
bad,"It is difficult to work for Dish/EchoStar.  The management is in constant flux and turmoil.  The pay scales vary regularly as the upper management try to adjust pay to pay less for more effort and achievement.  Values change with meteoric speed.  The sales staff there are some of the best I have worked with.  Sharp, aggressive and most have a good sense of humor. Because of this there is a good deal of turnover as they can find less difficult culture elsewhere."
bad,Strange place to work nobody says hello when you walk by. Management doesn't care about you or making you better. Its rated like 1st or 3rd worst company in all the polls and the company doesn't care. Benifits are expensive. I need to get out
bad,- Provided excellent customer service to all positions
bad,The management at EchoStar in Cheyenne was the pits! Lack of managerial experience which caused a lot of the hostility within the department! They have a revolving door of employees due to the terrible way they ran the department. Co-workers were okay because they had to deal with the same problems & many were unhappy but were unable to leave like I did. Benefits are horrible! What I learned was there was no advancement at all just lateral moves with no pay raise. Many of my co-workers who have been there for many years were stuck in the same position for many with no advancement or raises while others like myself would come in at a higher position & pay which I found unfair.
bad,"It cost more to work here then being unemployed. Benefits change from month to month. Gas reimbursement, forget about it."
bad,This is perhaps the worst company in the country to work for.
bad,Too much overtime it's great if you have no life or family. The customers scream and yell at you all day long. Management only care about their numbers. Low moral.
bad,"mundane , low morale, management is chosen on a first come basis... co-workers are zombies and the hardest part of the job is being there. The most enjoyable part of the job is leaving."
bad,"You're not a technician, you are a salesman. There is never a set time you might get off work. Your schedule changes weekly with no notice in advance. You have sick days but are penalized for taking a sick day or pto."
bad,"As a salaried employee, I felt belittled by having to swipe my ID badge when I came in and left the building -  like a time card!  There was no employee appreciation or team building experiences except shared disgust with the company.  I resigned as soon as I could."
bad,"Run away and don't look back!  In my short time there, 2 directors and one senior executive literally walked out on the CEO!  "
bad,EchoStar was named one of the worst places to work.  Look up EchoStar on Glassdoor.  Look up EchoStar in Newsweek.  Trust what you find there.  Atlanta was bad.  Colorado is the worst.
bad,"Training was heavenly. You sit back and collect great money for doing nothing but soaking in what seems to be the longest Dish network commercial ever. The torture comes when they throw you on the floor with back-to-back calls. Mostly irate people. Not just because of their original reason for calling, but most of them have been waiting for 15min, and some have been hung up on by other agents. You're instructed to handle ALL issues in under 5min. If you're too helpful and go over time-- write up. If you're not helpful-- write up. Release the call to boost your stats-- write up. You ask for a coach to take an escalated call or make a billing adjustment to an account-- you get avoided or laughed at. Breaks and lunches resemble a mud fish mating pool. If you crave drama you will THRIVE here. I only worked there 2 years and I learned A LOT. I feel like after that I can survive anything, but I would still never EVER go back."
bad,"It is a dead end job with absolutely no opportunity to grow or make a career out of it. Definitely one of those jobs that defines a person and their ambitions, there were people there who had been working there for over 20 years and never been promoted, you either work there and realize that you need to change your life or work there and stay stuck there. Compensation started off good but they changed and it ended up being really bad pay!"
bad,"This company prides itself on being the lowest cost tv service and 1 of the biggest ways they do this is by severely overworking and underpaying their employees.  When an employee gets to a point where they've been there too long and are making more money than they would like to pay that position, they will either fire you or make things so miserable you'll want to quit.  For 3+ years I was putting in extra time from home every day of the year that I was not paid for.  I was lied too by 3 different managers each of those 3 yrs that a position was being created for me that would result in more pay for the work I was doing but this never happened.  Eventually they let me go for something they perceived as a problem but had never been brought to my attention at any time as being a problem."
bad,A day at echostar is a stressful event with customers who  hate you and management that seems to hate you even moore.  They expect improvement but do not provide any tools for you to improve with.  Periodically they get rid of several employees.  Ironically enough it is usually the highest paid employees that get fired.
bad,"I arrive at work early in order to log in and get ready for the day. Once it's time to take begin taking calls I open my phone line and proceed to respond to our high call volume from customers, old customers and even new or potential customers. My day consists of answering back to back calls until the end of my work day. I help customers set up accounts with our service, answer any questions they may have about their account or any troubleshooting questions they may have. I always try to satisfy the customer by using my up-selling skills to teach them about different packages they could sign up for or better equipment that they will find useful. Included in my daily routine was responding to retention calls. I enjoyed being able to help customers keep their service by offering them solutions to their problems."
bad,Most management was horrid. I was one of the lucky ones to report to a descent manager but the director was horrible. I would not recommend this place to my worst enemy.
bad,"Dirty created air that produced respiratory infections. QC harasses the workers. Hostile environment that would threaten termination. Cost cutting made satisfying requirements very difficult and time limitations encouraged mistakes that were penalized heavily. Job applications all but ignored by HR unless you were friends or family with someone important. Work was exhausting and bad for health. Best part was my last day when I walked out for the last time. If I could, I would give negative 3 stars. Stay away from this place!"
bad,This was the most difficult place I have ever worked. It was a very toxic environment with management that treated all staff like children. We were micromanaged and my boss played favorites. She would actually take a few of her favorite team members to Rockies games and leave the rest of us behind. Learned a lot about processes related to what I did and that helped in the next role. Pay was low.
bad,"don't work here its hard to satisfy all the different people, because one wants it done this way , then your trained to do it this way, then new equipment comes out and more training, I felt I spent for time training then working some times."
bad,Management will stab you in the back just to have something to do. Upper Management will scream about policy until no one is looking then threaten your job unless you do something they know is wrong. They owe remote techs just from the Fairmont WV office hundreds of thousands of dollars in pay because unless you worked off the clock and drove the truck off the clock you were fired.
bad,They are overly demanding and do not recognize a good worker when they see it. I was fired 1 week before Christmas because I did not fit the companies new direction.
bad,"Had to make outdated, unsupported equipment work by taking parts from the back-up systems to maintain satellite support. Management both in the building and corp. kept giving the financial support to other stations and upgrades to every other department. Was promised an upgrade to systems that NEVER happened and to my knowledge still hasn't happened even after 4 yrs. Co-workers were great."
bad,EchoStar (Dishnetwork) is a company that I am sorry I ever applied to and worked for. My stress level has gone down tremendously. I am now able to sleep thru the night.
bad,DIsh Network treats you as just another number equally replaceable. You are told to appreciate the job you have. The only motivation to do anything is to not get fired as doing well will not be noticed.
bad,"If your into burning up with excessive weight connected to your body while on the roof, go for it.  If your into freezing in the cold Texas winter months while weighted down on a roof go for it.  If your not really into good pay or weekends off, go for it.  Otherwise, this job isn't for you.  Beware, managers will yell and scream about things outside of your control, i.e. customers wanting a different package from what Customer Service has billed the work order for.  You, as the technician are caught in the middle, and should expect to be asked why you didn't meet your metrics, even though you reported the discrepancy.  And don't count on Customer Service to back you up with customer interaction facts.  They cover only their own tails and put the blame squarely on the shoulders of the field tech.  Good luck to all who venture their way for lack of other resources available."
bad,this was by far the worst company I have ever worked for.  The environment was hostile.  Certain employees were allowed to run rampant and actually sabotage projects.
bad,"Echostar at the time was a ""sweat shop"" environment, management was grinding, unfair and stifling. I did not enjpy the position and left as soon as I found a better position."
bad,Great place to work if your management (which I was) but as a rep you were hounded constantly regarding quota. Favoritism was a cancer at my site and I had to butt head with HR daily to protect my agents
bad,"As a rule the people on the floor that I worked with to be good hard working and enjoyable people to be around.  "
bad,Trained for Technical Support... I was forced into sales...
bad,"You must clock in through a turnstyle every morning and then clock out through the turnstyle at the end of the day. Any divergence in your time will qualify you to be fired, no exceptions."
bad,"Just a terrible place to work. You were expected to bend over backwards on most projects and when you did, there was no special acknowledgement. i. e. .....thank you, nice job."
bad,No communication between departments. The departments are separate silos and the management will do everything to keep it that way. Upper management is a good ol’ boy system. They only watch their own back.
bad,The company is pretty standard in terms of HR/Benefits offerings.
bad,"All dish cares about is selling the customer over priced soundbars, surge protectors, remote covers etc. My fsm manager was great however the directors care only of sales. Great environment for working, just constant phone calls and txtn from ppl you work with trying to inquire sales. Hints why dish has non up to date equipment. Its faulty mostly returning to fix issues with the equipment. Dont go to work here unless its a job that isnt a tech job. Stay clear of here."
bad,"typical day at work = fun, demanding, challenging. Management was some what helpful. they are good on implementing new changes but lack in help if needed. Co-workers awesome people to work with."
bad,"Way slow and way set to the way we have done, and worked, before so no need to try anything new.  Someone else is bound to do it, do not rock the boat."
bad,"I liked the company when I started there, it was fun and no one watched over your shoulder. When things started to change, it became hard to work there do to we the employee's would have to raise their hand's to get help from their supervisor, we could not stand. We also had to save customer's from disconnecting their service."
bad,"Honestly the management was horrible, overtime was mandatory which made home life difficult, absolutely no sick days available and even if you had a note from doctor you would still get docked, no advancements but only on pay but not position wise. Not the best place to work but they will make it seem like it at first then once you actually see how it works to get advanced thru the company it becomes completely shady."
bad,"                        The position of Tester, warranted me to test Dish Network satellite receivers to 			ensure they were they were in proper working order.  Part of the training also 			allowed me to complete Spartanburg Community College's Center for 				Accelerated Technical Training (CATT) certification."
bad,This place is not a good place to work! They lie about the job duties you are hired for versus the duties you are trained for and the duties you eventually do once you are on the floor and phones. There is rampant abuse of leadership and people in positions of trust can't be trusted.
bad,At the time I worked there it was a new center so there were a lot of growing pains.
bad,"company does not care about their employees, they work people a lot of hours and pays them little to nothing"
bad,"Was there only for the short period of time as a contractor. "
bad,Echostar is not a well-run company. This is the kind of job you take when you can't find another job or need to get your foot in the door. It reminds me a lot of a prison.
bad,"Working internally the CEO and founder seems to have set the tone for the culture of the company, which is suffocating. The upper management encourages a manage-up style instead of managing the employees creating and disconnect and discouragement among the employees. "
bad,"EchoStar is great for recent college graduates to get their career started.  EchoStar is typical 8-5 job with minimal stress and risk involved.  The management is top heavy so career advancement is unlikely and if a position does open up, they will fill the position with an outside candidate.  The good news with EchoStar is job security, the bad news the lack of pay and benefits.  The culture and moral are very low at EchoStar, but most of the employees are content with there careers and have very little desire to venture out for a risk and reward position."
bad,"If you are a teenager, with no life, and lies and deceitful practice is ok with you. Then its a good job."
bad,"Regular 50-60 hour work weeks, trying to do what was asked until management decides what course of action they want to take. Politics are the rule of the day, and it isnt what you know, it's who. Mid-level management is good, but no cohesiveness at the top and no clear direction. Co-workers are the only thing that made going to work bearable, but even those are leaving as there is struggling between the parent company and those companies they purchased."
bad,"Rampant calls from irate TV customers, sardine can style call center. TV rips off people as bad as anything. Unexperienced people ""leading"" others; tenure as key. Ghetto, unprofessional workers. Snap decisions were being made all the time by management. You could ace your position and be phased out into a whole new area of the company almost overnight. Socially driven atmosphere."
bad,"4 day work week with 10-12 hrs. shifts..mandatory overtime.. work in rain, cold, hot  weather.. drive company van.. provide great customer service skills. Use of power tools, satellite meter, ladders.. go into crawl spaces and attics.. great pay.. undermanagment.."
bad,There are possibilities to learn (for some people) and work is interesting. Most people who work there are great. The company policies make management to treat its employees just a little better than slaves.
bad,"The company wasn't so bad back in the old days when it was still small, but as the company grew and when it split into 2 companies in 2005, Echostar and Dish Network, that's when it really started going down hill. The DISH side was much worse than the Echo side."
bad,Turn and Burn mentality  get the customer to sign up at all cost mico mgt work environment no future in the company bathroom break raise your hand and ask nicely and hurry up
bad,"I started off on the ground level at Echostar and through hard work, a good boss, i was able to advance.  The company atmosphere/culture is lacking to say the least.  They teach a class here that culture is one of the most important items in a company, while also one of the most difficult to change.  Things haven't changed here. The culture is lacking.  Twisting arms to get the day after thanksgiving off is incredible."
bad,"This place can be a good place to work. The long days with the changing in your schedules every 6 months or so. There is a paid time off but if you don't get sick you will have them to use. Management is never happy about the progress that the employees make, They are always on everyone's case about time and call volume.   With this company they want you to forget about life outside of dish and just focus on the company and their values if there is any. This job all comes down to good money  for the area. If you can take the changing of schedules and the way you are treated on the phone. This job could be for you."
bad,"While working at the call center it became abundantly clear that anyone outside of the management teams was a number. Little to no opportunity exists for advancement. I started off on one of the worst shifts in the building and it took me a year to get off that shift. There is no flexibility on work schedules, sick days or time off. Everything is treated as an absolute. I had to go the hospital because of a medical emergency and was nearly fired because i missed 2 days after having missed days previously due to family emergencies. Employees have little to no rights in the company and they actively look for reasons to keep you from getting bonuses and rewards that company touts to its new employees. The metric goals they set are generally unreasonable especially since a majority of these metrics are entirely out of your control. This is not a company you want to work for."
bad,"As customer service call center, very demanding calls, very short breaks"
bad,"They have fair wages."
bad,need to have alot better managers and upper manager that know what they are doing and how to treat there employees fair and not have favoritism of any kind
bad,"they company just liked to use people . they never like to pay you but they ask a great deal out of you day in and out. Management was very poor ,they didnt take care of their employees"
bad,"Do not recommend as the management, culture and environment are undesirable. The health benefits are lacking and the number of vacation days are less than what other companies provide"
bad,"I learned a lot about electronics design while working at Echostar. I helped created some award winning technology. It was my first job after college, and I worked there for about 15 years."
bad,"Executive team is out of touch with current employment practices. Workplace culture is non-existent.There is no business plan, at least not shared with employees."
bad,EchoStar is or can be a terrible place to work. Middle management is held by some under trained people in need of some people training.
bad,"I hated working there, there was structure or good leadership at all. there was no work ethics or room growth or improvement at all in the company"
bad,"The technical difficulties that are being addressed are real. They are ground breaking and it is exciting to be a part of a push for TV innovation."
bad,"I did enjoy the job in the end.  I was one of the top sales agents and they decided to have a $10,000 sell off between the top sales agents in our region.  I was impressed with the amount of effort they put into the contest."
bad,Frustrating management team. Little chance to advance within company.
bad,"Handled Inventories, large collections and different area in Accounting."
bad,It was a great place to work with plenty of friendly people. I learned a lot about the job from the supervisors and fellow employees. The hardest part of the job was not having enough time to finish every task
bad,"Poor management, poor pay, and people promote their friends rather than those qualified. Also had issues with HR, which did not seem to be taken seriously."
bad,I just filled out the review? You had me review some prior employers and come back to this one? Come on indeed this is a little bit ridiculous. DRRRRRRRRRRR
bad,Poor senior leadership and no vision for future growth of EchoStar. The culture is very depressing and no fun is had at work.  You will work hard and get no reward.  Benefits are not good. The most enjoyable part of this company is that it is leading edge techonology.
bad,"Company is not mature to modern industry concepts.  The management style is of the 1980's and fails to keep good employees because of poor management decisions.  "
