rating,review
good,"Its a job for self motivated people willing to put in extra time and work to properly manage their business. Work days can be long, additional admin and comuter work required."
good,"Very disciplined position working out of my home office. I was very dedicated and made positive growth. Enjoyed working with my other team members in the Midwest division. As I did the sales part of the position, I had very close relations with the service team who would complete the install jobs,"
good,"would not suggest to work in the pest elimination side of the company do to the lack of pay unless your okay with learning how to apply great service for your customers and then throwing it out the window in order to better your self and the company you work for, but than you will run your self in to the ground with no help when you need it from your managers and coworkers because you had to cut corners in order to meet the Revenue they want you to meet so you can make a decent living...."
good,"I started at Ecolab as a temp and was hired on as a full time employee.  Without a degree, there is very little room for advancement.  There was no place for me to go within the company without that piece of paper."
good,good. it was nice to have the abiity to create your own work schedule on a monthly basis and be able to build your week around a potentially changing schedule
good,I worked in the law department of a internationally known company.  They had a great corporate culture and I enjoyed my short tenure there.  They even had pet insurance!
good,"It can be challenging in this role finding a way to balance properly servicing your existing customers, where you are responsible for making sure chemical dispensing equipment  is working properly, with the need to always be adding new customers. It can be a lot for some people to juggle."
good,Bonne entreprise pour travailler sérieusement et pour s'améliorer.
good,"I worked in the GCS division of Ecolab.  We dispatched out calls to repairmen for hospitals, prisons, nursing homes, restaurants and  large companies to repair their food equipment.  In the beginning, it was a great work environment but then the company went through a major restructuring and everything changed.  They replaced quite a few of the upper management and I moved out of the job."
good,Safety is a high priority. They hire in front of growth in order to keep workload down for the existing employees as well as maintain great customer service.
good,"Boa empresa, apesar de obter riscos no trabalho, com relação a salário é uma empresa boa."
good,"Great Company, good passionate people who care about the business they work for."
good,"A typical day at Ecolab is fun and interesting. I've learned a lot while working there, the management is not all the way fair but its easy work. Overall I liked the company."
good,"When I started, things were really disorganized and I was able to use my strong computer skills to ensure the monthly statements and analysis were prepared. The hardest part of the position was that there was no procedures documented."
good,"Very. Professional, handlers closing of facility with fair compensatio n, communicetd well with timely notices of steps being taken. going throuAlthough it was difficult going through 3 separate transitions, in the end, everything worked out both financially and benefits wise."
good,"The Campus and Workout rooms plus Cafeteria is my favorite part of the day. Build your own Mac n Cheese is great! Friendly people, competitive pay, room for advancement leaves a lot to be desired though. Its rare to get hired on from a contractor"
good,"I was contracting there. So I wasn't there long enough to make a determination. Beautiful campus, with walking paths, full service cafeteria, and company store to buy products at discounted prices."
good,"A typical day would include operating the cast packaging machine to package cleaning chemicals and products for industrial use for the most part. It was an interesting shift from my career field but provided the right schedule for me to work at nights and go to school during the day time. I was pursing my BBA Accounting Major degree at the time. "
good,"Comfortable workplace, friendly staff, good salary, good location, easy access."
good,Driving a forklift building orders on pallets and getting them ready for shipping. I learned how to use there system and how different it is working in Texas. My coworkers were all very helpful. The hardest part of the job was the very large orders. The most enjoyable part was the overtime.
good,"Great company, good work environment with good people. The opportunity to gain upward mobility though is not present. Compensation was not as rewarding as the time and work demanded. I just want to make more of an impact than Ecolab has available."
good,"All calls are dispatched through an I-pad issued to employees, employees start their day from their home and travel to locations through out the specified area of coverage and in many cases beyond. I didn't learn anything new, company is still making the same mistakes as when I left the first time but it is a great company and I honestly mean that. Very large corporate structure not truly focused on good customer service as much as they portray. Management is ok. The hardest part of the job was juggling time frames and trying to cover your work as well as help younger inexperienced technicians when in trouble as everything was based upon time management and billing. The most enjoyable part of the day was quitting time."
good,"Pontos positivos: "
good,Ecolab is moving toward a organization that needs to provide information to their customers.  In fact that is becoming much more of a differentiator to the customers.  Ecolab used to be (and still is) a sales and marketing organization.  The transition has started but has a long way to go. Technical resources are not valued to the level of business impact they provided.
good,Lots of phone work but I thought the company was very good. My dissatisfaction was not with the company but my work. Being on the phone all day non-stop can be tiresome but they really work to make it the best possible experience.
good,"Remain busy in work all the time."
good,Empresa internacional y con presencia en los 5 continentes
good,"Empresa internacional de origen norte americana, y con presencia en los 5 continentes."
good,"Working at Ecolab gives you a lot of opportunity.  It allows for a lot of free time because you can make your own schedule.  It can be a fun job, where you get to learn everyday."
good,"Ecloab was fine, but I worked (technically) for a subcontractor called Adecco that was pure garbage. Ecolab itself was adequate. Typical work day started at 7am, done around 4:30pm. I was an admin, so that came with the typical lack of recognition or appreciation, but I've found that to be the case at most places of employment. Typical office atmosphere with an old rich white man dictating the rules (most of them cosmetic, but certainly not encouraging individualism, diversity, or personal growth or development). All in all, I have no real complaints other than the fact that that I had no health insurance and no job security."
good,"Always on the go while multi-tasking. 24/7 on call and need to be computer literate."
good,"This is a growing division within Ecolab with lots of upside for professional growth. There are some growing pains, but people with good ethics and initiative and great customer service skills will succeed."
good,Ecolab has sustained through difficult economic times in America and across the world. I have learned a lot and enjoy working here.
good,"The working environment is balanced."
good,"i learned how to work with others and patiently not a bad job, it was great if you are looking forward to working part time. it can be a strenuous job and tough at times"
good,Ecolab is a great company to work for with great benefits. I've been with the company for over two years. I handle all the replenishment for one of the worlds largest retailers.
good,Fast paced and self motavating company. The hours vary from day to day.Driving alot from account to account. I have about 80 accounts i go to a month.
good,"so algumas pessoas que atrapalham um pouco a empresa, nao param para escutar aos subordinados tomam decisões precipitadas, se se preocupar de certa forma com quem esta a baixo delas so importam com sigo mesmos"
good,My typical day as a Territory Sales Representative for Ecolab consisted of visiting my customers to sell them laundry chemicals and service their dispensing equipment.  I had a territory consisting on Georgia/Alabama/South Carolina so I was on the road a lot.
good,Long boring 12 hour shifts filling pails. The management and workers are friendly. Room for advancement.
good,"A Ecolab é uma empresa multinacional, mas a planta do Brasil tem muitos problemas em relação á sua cultura, tendo muita dificuldade com a equipe de TI e RH. Mas, aprendi muito com relação a minha formação."
good,Formation auprès de chaque service pour bien connaître et comprendre chaque domaine de l'entreprise
good,This was a Student Loan company. I worked in the Collections Department.  Great entry level postion for new College Graduates.
good,"I didn't know anything about the business world before starting here.  I have learned a lot here as they are great for taking their time training someone new.  This company has different standards for every group though.  In merging with Ecolab, the company is suppose to be as ""one"", but it is not.  Being a salary employee doesn't necessarily mean you work as a salary employee.  You still have the punch the clock and are punished for being a few minutes late and you better stay to make up the time and not leave early... ever.  The job is busy and you do learn new things just about every day and gain many relationships.  It is enjoyable to help your customers out, but the toughest part is there is constant change and it can be very difficult to remember who does what or how to do something as procedures change a lot.  In my experience here though... unless you are a ""favorite"" you are not getting promoted.  After going to school, taking classes, earning a degree (while working full time) joining clubs and putting myself out there for extra work... I have not gained any respect from any managers in earning a promotion."
good,It's a pretty good company to work for but it was impossible to advance.
good,I have enjoyed my work here and this is shown by my length of employment here
good,"A good job if you don't have a family, or a life. At least in Nevada. The customer is always right, and when you're dealing with high end Casino's they all want you there on one night, Mondays. You can't do them all on Mondays."
good,Large geography and area to cover.  Excellent overall experience and learning opportunity.
good,"This has been a busy job with different directors, managers and departments to work for. Travel, arranging meetings, budgets, and organising departments."
good,Great company. Bad hours. Typical day was 2:00pm to 5:am sunday  through thursday. On call 7 days a week with a 24 hour response.
good,"Enter in orders via phone, fax or mail.  Was the Customer Service Rep for the Water Care Divison of the company.  Handled returns and notice of shipments"
good,"Hay un buen ambiente de trabajo lo que más me gustó es que los analistas en su momento hicimos un buen trabajo en equipo."
good,"Very busy position as it revolved around the ""hospitality"" industry.  People in this world never sleep, or close their doors. "
good,High stress job with lots of benefits and work. Long hours and a lot of driving and face to face meetings with customers. Great place to work!
good,A good opportunity to network with people in the food industry.
good,Covered multiple Mfg. facilities in the US - supporting the HSE and Industrial Hygiene aspect of the food safety business.
good,a fast paced job with opportunity to do many different tasks.
good,"I love what I do, but it is stressful when you no support from management"
good,"Hace un año y dos meses que trabajo en Ecolab S.A."
good,"A good company to work for, although the territories kept getting expanded requiring being on the road for up to a week at a time."
good,Great company to work for and it a great company to learn about selling.
good,Great company to work for. Great people and a competitive work environment. Salary+commission with few limits on how much you can truly earn.
good,Overall a great company. I learned a ton about overall plant operation. The hardest part of my job was learning how to effectively sale in an environment I had never been around.
good,"not much room for advancement, not really much to say about this place it was a temp. job , they seem to not value employees their wouldn't suggest it to anyone looking for a job to retire from"
good,Please pay more attention to each district. My district suffes because if the rph system. Work hard for 12 bucks an hour sometimes. Just pay us a good hourly with revenue so we always make good money. We do have bills and family to take care of. Unfortunately we all dont make a guarenteed high salary like you managers. But we do all the hard work. Other that that i love my job. I love what i do. The benifets are awesome and we ha e a great retire ment plan.
good,"nada a declarar pois fiquei 3 meses, nao senti muita proximidade com os gestores"
good,I really enjoyed working for Ecolab and I think that the next candidates after me will do the same. I've learned alot working for Ecolab and had the opportunity to see how some of our everyday cleaning etc chemicals are produced.
good,"Empresa ótima para se aprender, paga salário em dia as vezes até antes, bons benefícios porém salário muito baixo para técnico."
good,Manager didn't always follow company direction. Corporate culture was good but not enough support in rural areas. like other companies are paying less now than they did 15 years ago.
good,"if one can overlook the poor management team(which is getting better) , stay under the radar you will be fine.if  management treated employees with more respect it would be much better."
good,"Self driven without supervision. Service heavy working with commercial equipment, plumbing, mechanical, and electrical with a focus on sales. Never enough time for everything though between sales calls, installs, emergency maintenance, employee turnover, weekend on call"
good,"Ecolab has fantastic culture and I enjoyed working there."
good,"A lot of flexibility and a lot of travel in rural areas, selling, servicing, and building relationships is the main core items of this job. You must be good with time management and have the ability to sell. Company vehicle."
good,"Ecolab was a very fast, overworked environment and they look at bringing in the younger college kids before having the older veternans that know the business in and handle the extreme work load."
good,My work day is all about the company goal and our target/customer.  I show up ready to be flexible and take on whatever the task or process is at the time.  I work hard and diligently to exceed my company's standards.  My goal is organic vertical growth within the company; I hold high standards for myself. This job is all about team and working together in order to hit our numbers and beyond.
good,"I met some wonderful people who think and have a clear strategy to work as a team and grow the business. Was working with a very positive attitude and good support from Suppliers, Internal Sales team and most important joint team work"
good,"I can appreciate the stability of the large corporate company after leaving and working for smaller companies. The atmosphere was nice, basically just go in and do your job well and all was good."
good,long workday that started off with checking you had all the supplies you needed for day. then you schedule your jobs and go out for work.  time is very important scheduling is something that need to be worked on.
good,As working at eco lab I have learned more than what My knowledge was before. I feel appreciated at eco lab than any other job I have worked at. Please to be there everyday.
good,"Very fast-paced environment. There are a good amount of leads that actually look out for their team. Higher management rarely goes out onto the floor. "
good,"Se caracteriza por ser una empresa que da la facilidad para hacer carrera, acompañado con un sólido respaldo de las jefaturas."
good,"I started my career with ecolab in the SAC department and was involved in multiple projects for the span of 4 years. The work culture is good and the working hours are flexible. However, the career path in our department is yet not defined."
good,good to work with other groups that would team up to get the most out of an account.  Corporate sales was a good benefit.  The management climb was a bit cut throat.
good,"The company has a pretty good job culture and has good potential for growth and advancement. Management is quiet supportive. A typical day at work required performing many SAP processes using computer, filing, creating databases and spreadsheets"
good,Great place to start your career but paid less than the market without a bonus structure for associates. There is not much room for career advancement.
good,No issues to report but I would like to grow to new heights career wise and I was unable to do that with this company at this time. The culture is team based and everyone is helpful to one another.
good,"Good job, paid well, just on call all the time and doing installs.  Hard to get people to cover your shifts when you want to take vacation.  Also the customers calling all the time."
good,Decent place to work at. Pay isn't all that great and there is communication problems within the management. Four day work week man's now time with your family.
good,"Great Company to work for. Also had some of the Best Managers. Territories are still too large and workload is impossible to complete in a 40 hr work week. Expected not to get any overtime, however impossible to meet deadlines. Need to pay better base salary. Don't receive Bonus unless everyone meets quarterly deadlines. Completely unfair in a competitive based environment!"
good,"Ecolab is a great Company to work for. The MEA headquarters is a stimulating and challenging place to work. The Ecolab culture is ever present. In addition, there are always high calibre colleagues to reach out to in support of my and the company goals."
good,it's a great company with good benefits and if you keep applying to other positions there is a good chance of getting a chance to work in different departments
good,"Es una empresa con buen clima laboral susceptible a mejorarse, el salario es regular pero cuenta con buenas prestaciones que lo hacen atractivo. "
good,I've had a lot of fun working here. I work with a great team and have a good manager. The only issue is lack of upward mobility unless I'm willing to move. Therefore I am standing still.
good,"Good management team, truly care for their employees, Currently going through some growing pains with the Swisher purchase. Ecolab is serious about employee retention."
good,"No balance between life and work. On call 24 hours a day 7 days a week. Benefits are great. even the management is not so bad. If you do not have a life, this is the job for you."
good,Good strong company however balancing work and personal life was extremely difficult. Great territory and very fun job
good,Awesome people to work with and overall fun job. Would gladly work there again if given the opportunity. Not much job advancement however.
good,"Typical day is consisted of 8-10 location visits throughout assigned territory, that includes review and service of equipment, product use and new account approved product availability. Review meetings with middle and upper level management to enhance program use, as well as training lower level employees on best practice use of products and equipment. The most enjoyable part of the job is interacting with different people throughout the course of the day and being able to relate to their specific needs in order to achieve the established goal."
good,"The position is challenging, but comes with much potential for personal and financial growth.  It combines service with sales.  It requires adaptability, patience, and motivation."
good,"capacitación de equipos nuevos  el uso manipulación  calibración."
good,"Acquired in April 2013 so culture change was major event and working environment was very good at the plant local level. "
good,"*Trabalho com responsabilidade."
good,La empresa una de las mejores en control de plagas ya que su metodología es basada en un 50% contribución del cliente y 50% por parte del servicio proporcionado de la empresa ya que la metodología empleada es atraves de hacer conciente al cliente del por que existen las plagas.
good,"Na Ecolab tínhamos a liberdade de estabelecer nossa rotina de trabalho."
good,"work with some great people!"
good,"It is a nice place to work. People are nice and friendly, the management is above average, they are a well organized and caring company"
good,"Typical work day consisted of working in the OR with Surgeons and their staffs. I learned how to work in an OR environment and what occurs on a regular basis."
good,Empresa que incentiva o estudo tem vários treinamentos e boa para experiencias profissionais. Benefícios e bonificações salariais boas.
good,"Flexibilidade no horário de trabalho;"
good,"When you went into work, you knew what had to be done. I gained a lot of knowledge about their computer system and how it worked. Didn't really see management to much. My co-workers were great people to work with. Everyone was very friendly and easy to get along with. The hardest part was having so much to learn in such a short period of time while training. The most enjoyable part of my job there was the people and atmosphere."
good,"A typical day at work began at 7am with talking to my night shift co-workers to see what problems arose with the printers that would affect my day. Usually I was able to check e-mail first thing. My first priority was creating work tickets for e-mail requests and looking for responses to any e-mails I had sent the previous day regarding work tickets I was assigned to. Then I would check the day's list of terminated employees against our user database and remove or modify any report distributions assigned to such people. This could be complex, involving research in our database and sending e-mails. After that I would help print reports, forms or other print requests and deliver them. Sometimes I would need to break down large reports by recipients. I might take phone calls from the sales field asking for e-mailed copies of their stocking report or handle e-mails looking for reprints of a report at a remote location. Often I had to do mass changes in the databases as part of a project, such as converting reports from paper to a web portal. In the afternoon, I frequently reprinted damaged invoices or other pages from large print jobs. This involved finding a particular page in one of dozens of output files. The printers were prone to developing problems, so it was not unusual to spend the afternoon trying to fix the issue ourselves or calling Xerox for help or to place a repair request."
good,"The territory manager position is a demanding 24/7/365 job. On a typical day, you will perform service/sales to five existing customers and prospect two more. You also need to perform installs, in-service trainings, and emergency calls when needed. There is a tremendous amount of techinal information to learn. The management overall is good. My co-workers were awesome. Very helpful. Hardest part of the job was working weekends without tech service. Also, it is a pain to get time off. It is up to the terrritory managers to find someone to work for them. Management does not help out. I had two five day vacations in five years. Most enjoyable part is building relationships with customers and prospects. The company car is nice, too."
good,"Work directly with head, regional and district manager to sell chemical products used by consumer. Present the feature benefits and cost analysis for management"
good,"Great people , nice place just the pay was not worth the drive. Was always something changing. My job was easy and did not have many issues. The best part of the job were the people."
good,Ecolab is a large company with many different business units.  All are dedicated to solve customer challenges and to do what is right.   Ecolab is  committed to it's values and does a good job communicating them.  Had a great time working at Ecolab and with my colleagues.  The most challenging part of working there was as with any large conglomerate there are understandingly competing priorities which creates challenges when executing projects.
good,It was a good place to work overall.  I would recommend it for a starter job and see where it takes you.  The company culture is good and being strictly a field employee.
good,Benefits are good. Management can be out of touch but they try! Hours and pay doesn’t always seem to match. They say they like to eliminate pests! And give the best training. I would agree the training is great! However the elimination part seems to Be lacking.
good,"Client Services Tech Lounge at Ecolab provide a stimulating and fun environment.  You are expected to do your work, and treated as such.  Work is self paced, with people available to assist if needed."
