rating,review
good,"Having worked here management, and associates are closely knit community where most are family outside, or have ongoing friendships that last years. The downside to this is when you're in a meeting with a manager stating that you're having a issue with a co-worker and they tell you that this person has been their friend/co-worker for 5 years or more and dismiss you because their friends are the target of concern. This is a good place to work if your friends, or family are already working here there is a bad culture of favoritism where only a select few individuals who are consistently picked for every ""special"" project takes place. When you bring a concern to your supervisors, and their first response is what did you do, or an outright refusal to investigate this is a quick revolving door, and I watched many tenured and short term employees disappear. The safety team would argue against itself over safety issues, and during my time a trainer left the company due to the bullying that was transpiring in the walls. After submitting a report regarding harassment through a hotline that was meant to protect me I was informed later that all investigations were eventually turned over to the company and this caused me to be the target of a very aware, and bitter management."
good,"Great company to work for, even though I gotten two promotions  over the last 9 years, I feel like I am not getting the opportunities or chance to further advance over the last 5 years even with the completion of my MBA this summer."
good,"The company itself is a great company, however, the food safety division, is not. Work life balance is way out of whack. People are leaving in droves."
good,We would receive raw material and put in a reactor controlling it with temperature to make a finish product. Co workers are very helpful with the process.
good,"After going from Microtek to Ecolab it was a hard adjustment. We were used to a company that cared about their employees to a company that focus only on the $$. Constantly worried about if you were going to lose your job when the out of town directors arrived. If you like being bullied, and receiving empty promises, this is the company for you."
good,They pay well but the training and communication suck. They need to listen more to what their employees tell them they would get more production from them.
good,They Classify you as a Salesman but you are actually a Repairman that also does some sales. By Classifying you as a Salesman they don't have to pay you Overtime.
good,The company is fantastic but recent Manager changes made the position dreadful after a while. I regret the changes because I would still be working for the company.
good,"Although I was able to achieve my goals in sales every month, for my 4 year tenure, I was not considered for a promotion."
good,"The culture has changed so much at Ecolab. I use to love going to work daily.  A lot of micromanaging involved, constant roll outs, unpaid weekend coverage that you are required to be a part of once every month, unrealistic sales numbers and expectations and constantly being hassled about them daily. Too much reporting, too much to keep track of when you already have a territory over for 100+ customers to retain and keep happy, only to  be told you must constantly acquire new business! Meanwhile, not reaping the monetary advantages due to such low payouts on the chemical sales. That's what the job of the outside sales specialist should entail, while this role should be focused on customer retention and advocating on a consultative needs-based approach, versus shoving unnecessary products down a customer's throat. "
good,"Ecolab is a strong company."
good,"No work life balance"
good,"Driving to and from location daily.  Once at a location, I would coach and consult management team on best food safety practices throughout and also consulting on daily operations"
good,"Ecolab is a very good company that provides great service to its customers. There is a good framework for their employees with the benefits and compensation they offer at the entry level however the overall culture breeds overwork due to the negative ratio of employees to required workload. If company bonus structure was more defined and better facilitated by upper level management in addition to workload relief for current employees as well as a better promotion strategy, this company would be a desired location of employment for many talented sales reps."
good,"The company has lots of benefits, vehicle, phone, iPad , plenty of resources.  Coworkers are easy to get along with and if under right manager you can work the job not the job work you. But if you get get under a ne manager that's scared of the non common sense dispatcher your screwed. Promotion is based on who they like. They say budgets and CFESA make you but when you do it and stuck where you are, obviously none of that matters.  Starting wage is ok but don't expect a raise. Your an ignored number to them, replaceable. Management is sensitive be careful.  Bonus is you get plenty of rope. Dispatchers think you just wait for them to call for over 12 hours. Most weekends off are good and bonuses not bad, not a lot but it's something.  Not bad if you negotiate at hiring."
good,Great Company but the management in my District was horrible . I never got paid for a lot of work I done because my District Manager would never turn in my commissions. On call rotation was 1 ever 4 weeks and the coverage area was rediculas . Alot of favortism and only certain people in the District got to take vacations . Upper management let it go on and the same managers still work for Ecolab after several complaints. Don't expect to get any kind of praise for your work . Customer demands are through the roof and you won't get any thanks from them. The company doesn't reward you really and every year it gets more demanding . Big Corporate company = Money Money .
good,"The position can take a great deal of your time.  You are on call 24/7 and will have rotating weekend coverage.  Management varies in their way of doing business.  You will be responsible for increasing sales, collections, routine service of equipment, installation and repair of equipment."
good,"I find working for this place was pretty cool, though i can't say names , the person that the reviews usually talk about in HR she is not a bad person ...she just wants the job done professionally and correctly...that's it. for the others some are cool , most are snakes , but hey ! your there to work not make friends ....i did my work i went on about my life outside of work ..point blank ! ."
good,Not impressed. Good sales training but the involved job is less than desirable. If you want a good start in sales and then move on than it's a good starting point.
good,"Excellent company to work for, pays well. "
good,Good place to grow and learn about sales.  Lot of window time.  Long days and not many days off.  Have to have co workers cover for you.  Must be self motivated.
good,"Going though significant change, very bad moral and poor communication from senior leadership .  Work/life balance is not existent and you are expected to more with less"
good,"Always  short on help and having to do your accounts plus 20 to 50 more accounts due to the turnover of licensed employees."
good,"if you have to use the bathroom you better go during your break, they also have managers who dont even know how to do the work themselves. I had to call pl all the time because they suck"
good,"While their training is top knotch, as is their implications."
good,"Lead Generation Team was totally misaligned, management had no clue what to do. Total lack of direction, or support. This led to  a lot of frustration and passive aggression among the team."
good,I think ECO Lab is a good place to work if you have a good route and the don't mind working all the time and being on call 24 hrs. a day with no extra pay. (COMMISSION ONLY)
good,"The products and innovation was great.  The culture was not what they would lead you to believe.  They would talk about work/ life balance, but that was not the case at all."
good,"THis is a company that promotes family unity and one team, but in reality if your are not a favorite or a yes man you will not be given a fair chance."
good,"I worjed a night shift for many years,  had over 160 accounts.  I even had to work the night my wife had our 3rd child. Very stressful job, i lost my mother and am suffering depression and wasnt able to complete everything and I was fired. I feel like they used me up stressed me out so hard and then left me high and dry with 3 kids and a mortgage."
good,"New ""management"" in the CSR department are terrible. There are no consequences to any bad behavior and the good workers are not appreciated. The management lacks serious leadership responsibilities which is completely necessary to have. There is no job security whatsoever. Employees are completely replaceable and under appreciated."
good,"colegas de trabalho bons, aprendi como fazer o atendimento de clientes"
good,"Ero facente parte di un gruppo di engineer unico tra i vari fornitori concorrenti."
good,"If you enjoy good pay and good benifits with little time for your family, then this job is for you. 24/7 on call. No holidays."
good,"Emails, calendar managements, travel, expense reports, document processing, meetings, events, problem solving, projects, video conference calls, annual meetings, greeting visitors, and many other activities."
good,"Ecolab is a well respected company for a reason- quality products that will always have a need in the market. The personnel are great, always got along well individually with both managers and teammates. Benefits are nice and company vehicle was provided with a monthly stipend for fuel. Customers were usually very loyal and nice to work with. Job security is phenomenal once training is complete and you are comfortable with the position a year into it or so. The drawbacks to the Territory Manager (TM) position lie in the number of customers that the TM is responsible for as well as the substance of what the TM is responsible for at each customer location. Often times interviewers and managers will leave out the installation and service aspect of the position which ends up consuming a larger chunk of the work day/week than they are willing to admit."
good,"O dia a dia é muito corrido de muita pressão e trabalho, a equipe interna é muito parceira uns sempre ajudando uns aos outros."
good,Great company. Work life enjoyment depends on the area you work in. Management ideals vary from area to area. You can expect to work long days with many task that weigh down on your ability to meet customer expectations at times.
good,Very little recognition for a job well done. No pay increases except through sales commissions. Does not treat employees appropriately. You are just a number on their personnel roster.
good,Not a lot of training involved. Didn't every really have the right protective equipment or tools. I sometimes had to use my own tools to get the job done. Terrible work/life balance.
good,"Normal day looks like this:"
good,Ecolab is a good co. to work for but I found out there is  no way to grow with this company. they hire outside of the company and does not promote with in the company for advancement.
good,"I enjoyed this job, until we got a new manager. She would tell us one thing in a meeting, but when we were not in a meeting setting she would say something different. Long hours and always on call."
good,"Its ok. You must have good self mgmt skills, you work from home and have very little oversight. Training is terrible and does not prepare you for the field. They promote MGRs based on how well they can sell. Its all about SALES, SALES and SALES!!!!!!"
good,"Pay was average to good.  Very little work life balance.  Constantly changing programs with favor of the month initiatives."
good,It is ok to work at. this company.  If you love to work and not want to see your family.  It is good for a you guy starting out in the business but not a family man.
good,"Route Manger; ensured that clients had service and chemicals for their dishwashers. In charge of installations for new accounts and sales of new accounts. Maintained, repaired, and serviced dishwashers including troubleshooting, reading wiring schematics, and replacing broken components as needed"
good,This company offered many benefits including a pension.  The pay was fair but the balance of work to life was terribly skewed.
good,"Ecolab was my first job in the commercial field. It was a good school as I had no knowledge of business and thanks to the people I met at the company I was able to develop a whole new set of skills, basically thanks to the great managers that led my career and gave me the chance to asume bigger responsibilities."
good,"A tarefa de um Dedicated Account Manager executa em uma linha de produção, vai desde a manutenção mecânica dos sistemas de transportes, realização de análises químicas, controle no gerenciamento de estoque, realização de pedidos de produtos químicos, treinamentos e comunicação com gerência através do cumprimento de relatórios.  "
good,everyday i dealt with customers who could be satisfied or dissatisfied with the store. The hardest part was trying to calm down a upset customer. The most enjoyable part was when customers were satisfied.
good,"Basicamente no setor de projetos da Ecolab temos duas fases de trabalho:"
good,"Send out daily sales numbers to Area Mgr. Provide pricing to sales reps. Create proposals. Follow up with rep on corporate accounts incentives, problems result when rep has not completed the task on the requested due date."
good,agency worker been made redundent worked there 1 year 9 been made redundent from nights closeing nights down
good,"A typical day includes servicing existing customers, making sales calls to attain new business, installing any new customer equipment, handling any emergency calls that may come up, placing customer orders, placing parts and equipment orders for stock and installs. We handle all of these things while focusing on the number one goal of achieving budget every month. I have learned alot about cleaning and sanitation, as well as advancing my chemical knowledge. I have found that our Ecolab group works well together. We have to rely on each other for call coverage, help with installs, and the occasional part. The hardest part of the job in my opinion would be making up sales dollars that were lost due to corporate follies. I especially enjoy helping my customers and teaching them proper procedures to increase their cleaning, sanitation, guest satisfaction, and thus growing their business."
good,Extremely political environment.
good,Self managed and serviced territory with yearly review by area manager.
good,nothing hard about the job just not what i have in mind for where im going to be spending the rest of my working days...management is new so seems like their trying to prove somthing and the people seem to be invovled in everyones personal life
good,I was with this company for just under five years. The culture I encountered was management by intimidation. VP’s had a ‘just do it attitude’ and required total loyalty while providing little support.
good,As a company they seem to be doing things right! They are the leader in commercial chemical sales and expand often. There is just nothing out there in the rural market in advancement for Ecolab.
good,"I worked for Ecolab for 7 years.First 3 years was great. Managers respected you if you did a good job and they had great benefits and work life balance.My last 4 years they made yearly changes resulting in techs working more for less pay, replaced respected DM's with insulting managers who based your performance solely off of paper, standard 1%  yearly pay increases that changed to 1% biannual. Before I left they changed the policies for new hires which included ""No pension.No pay raise of any kind for the first 5 years.If on the 5th year it was an odd numbered year, the 1% raise would be received on year number 6."""
good,"The people you will work with as far as other employees, are generally terrific people. The management the Huntington facility is laughable. They don't care if people have families. They have people in management/supervisor positions that don't know their a** from a hole in the ground simply because they were popular."
good,i enjoyed the freedom the job offers but goals are often unrealistic. Direct managers are very good and coworkers are very good-upper management is out of touch with the field.
good,All in all it isn't a terrible company to work for..but they could work on making it easier especially for female employees that working overnights is not a requirement. Like you can hire people specially for the night work and others for day work. But the management sucks esp here in Ga.
good,"not a good place for black educated woman as a supervisor."
good,"A very good workers in hard-working people to do jobs. In management did not care about the workers. Working hard in the heat"
good,"Wokring conditions are great but the blance of work and life is terrible. Also no benefits working with them really, just discounts to books and magazines. If hired from outside like a temp, dont expect to continue with them any longer, they promote from within to cover your position after they lay you off..."
good,"As I started out, and through training, I was lead to believe my job would be as a route manager. Since training, I've found that on top of that, I would be having to do collections, data mining reports, act iij ng as an inventory specialist, and a spin doctor. And, out of all of those, Spin Doctor is the worst, because I dont like having to lie to my customers when I can't get parts because corporate has decided to shot down the parts supply pipeline because it's the end of the month/quarter/year. I can't count how many times I've had to tell someone ""that part is back ordered"""
good,"Good company and product, great coworkers, needs more communication between departments and countries. International offices should be given more freedom to act according to their market."
good,"cult like culture, many employees not happy with supervisors Irregular hours and hard to get your 40 hours a week. Very little training for this possition, felt like I was left on my own"
good,"Ecolab wants to pay people like 1999 standards, everyone is to be paid around the same with few chances for advancement. As soon as they purchased the company i was working for they lowered everyone's salary."
good,"Lots of benefits and flexibility with this job. Never the same day twice. But you'll find more support in the larger city centers. In rural areas across the country, reps do much more work for the same pay and with much less support. Middle management leaves plenty to be desired. A couple of good sales years appear to be the only qualifications looked at when picking district managers."
good,"on call 24/7 large territories, low salaries, Company Car is a plus but does not pay for fuel. long hours at times. not to friendly with members of the armed services."
good,"Large multinational company that demands growth. Very competitive within the organization as many departments compete with other departments for the same sales dollars."
good,"However, it's a big company and you're just a number.  The pay is mid range for the equivalent in other companies.  The benefits are very good; especially the health benefits."
good,Ecolab was a quick paced environment..lots of cleaning soultions and chemicals. If you are sensitive in any way to chemicals its probably not the place for you
good,Overall a great place to work but at times can be a place where corporate decisions affect work environments negatively. There are many corporate protocols that are needed to be followed and these can have a negative impact on an employee from the standpoint of job security and constraints.
good,"Company is fantastic, growth is there every quarter. CEO is solid and provides great leadership to the company.That being said, mid-level management has a very tactical outlook on things and not strategical. Only thought is making the plant numbers look good even if it costs the company money. As the saying goes, there is the right way to do things, then there is the Ecolab way."
good,"Good place to work if you don't mind being on call and not having a set work schedule. "
good,"You work all the time, basically.  A customer could call at 11pm, you are required to answer and if needed, go there.  This is clouds when you are on vacation."
good,Have been through several buy-outs.  Many new managers that don't always understand the business and seem to just be in seat.  Demanding and not always realistic.
good,"Just a money machine, profits over everthing and everyone. They have all their technicians on a bonus program, the more they sell the more they make. Its just a game of selling customers things they dont need, until they get so sick of it that they stop using Ecolab for their service. Then the sales staff finds new customers. They lose 30% annually."
good,"24/7 schedule- supervisor spend about 14hours at work (lately forced to work additional 6hrs on days off) "
good,"The benefits are outstanding if you can get past the initial deception of what the job truly involves. You must possess a Bachelors degree to be employed and then you spend over 80% of your time NOT being the salesperson you were hired to be but as a technician servicing and installing dispensers. Lasted 2 years and resigning soon as I am tired of crawling around on wet, dirty and greasy floors in some of the nastiest kitchens in the fast food industry"
good,"A Ecolab é uma empresa boa de trabalhar. Sempre treinando e investindo em seus colaboradores. "
good,"I was fast paced. it was an in bound call center in fishers, in. I sat at my desk for 7 hours a day. I was ok to work at. I had to drive 30 min to get there. They worked with Commercial kitchens."
good,"Overworked for the same pay."
good,"not room for much flexibility for a student worker. if you are looking to do the part time student thing I would advise you to look into nights and weekends because they have you all day from 7-4 Monday- Friday. the work was easy, but the management were not ""team friendly"""
good,"a regular day consist of picking parts and counting and organizing them. after i would assemble units for customers. co-workers talk alot and are in everyone business, the hardest part is recognizing smaller parts{look the same but aren't]"
good,"A empresa é excelente em relação ao horário de trabalho. A coordenação da área em que trabalhava sempre dava apoio em todas as ações que iria realizar. A gerencia é um pouco distante, só tinha contato com meu coordenador direto, o que dificultava no aperfeiçoamento do trabalho, a fim de deixar os clientes totalmente satisfeitos. A parte mais agradável é sair do cliente com o mesmo satisfeito pelo trabalho que exercia, apesar da dificuldades."
good,Very diverse company with great management and areas to advance career
good,Cover majority of QSR accounts in Oklahoma. Conducting sales and service in approx 600 accounts.
good,"Es un buen lugar para trabajar, pero se encuentra en reestructuración"
good,"I've really enjoyed my time working with Ecolab's global change management group. It's an interesting company with a bright future, well managed, and great people. Working at Ecolab was an opportunity to get reacquainted with the global business environment and develop expertise in e-learning using uPerform software--which was new to me. I also provided project management for several training deployments and collaborated on a communication plan to support and promote change management. While the work challenged my technical skills, I learned a lot and especially enjoyed working with global stakeholders."
good,"Currently merged with another company and the vision of where they want to go is different than where the company is actually heading. The management is not always communicating with their employees leaving us in the dark on projects and deadlines. Ecolab is a good company, it is just hard at this time to give them a high grade with all the things that are going on."
good,Empresa excelente porem os gestores nao sao pessoas preparadas para os cargos
good,Alright to work for management very unorganised have to constantly chase them to pay your over time. Apart from that is a decent company better than some pest control companies. The no facial hair policy is bit annoying.
good,"Lots of growth equals lost of change... Ecolab is experiencing both, and unequipped to handle both simultaneously. Their past 20 year strategy is biting them in the butt right now... Plants are deteriorated beyond repair in some circumstances...the strategy needs to change towards rebuilding infrastructure, not shareholder returns."
good,"There is no  work but less benefits and less appreciation, there are limited career opportunities and no growth opportunities.The compensation compared the work does not match ."
good,Work remotely if you can. The office has a clinical feel. Freedom is a huge plus. However upward movement is apparently rather limited. Sometimes the upper management appears clueless.
good,The typical day varied depending on the sales.  I learned to manage time to achieve sales goals.  Management was focused on achieving sales goals.  Workplace culture was sales driven.
good,"Pros;I got to go home,Company Van and Fuel Card"
