rating,review
bad,No support or backing for employees in field. Management does not communicate well with employees or customers. Company only cares about profits and not longevity of customer retention. Toxic culture.
bad,No te toman en cuenta para nada y los que encargados de cuentas nunca ven tu trabajo.
bad,"Terrible culture people"
bad,"such a revolving door of upper management that supervisors are corrupt  and crooked, the rules are made as need full of falsifications to suit there needs  at the moment"
bad,It is a bad place to work where the employees make your job hard and they show favoritism towards the workers.the employees that been there a while it’s hard for them to get there raises
bad,"Working for Ecolab takes over your life, they expect you to be available 24/7 even though I had a part time position. Also you will need a spare room to store all of the spare parts that you are expected to repair/replace for a food safety auditing role."
bad,2 kisinin yapmasi gereken işi tek basıma asgari ücretle yaptim
bad,"Ecolab en la ciudad de Los Mochis Sinaloa es deplorable, te contratan con la promesa de un sueldo agradable y después te cae de sorpresa que no es nisiquiera la mitad de lo prometido."
bad,"It was a horrible experience,  and one i am not proud of. The people and backstabbing was unimaginable.  I left because they didnt support field sales at all."
bad,"Terrible place to work."
bad,"Management is unrealistic, drive hundreds of miles a day. Family life doesn’t exist. Do not recommend. Was promised the world but when it comes down to the fire they don’t back it up."
bad,"RUN-- poor management. if your not part of the click, you don't succeed. sneaky managers make promises they never keep. insurance is high. hr does nothing to help"
bad,"First of all it takes about 2-3 months to get hired in. It’s very unorganized. The plant is in Wisconsin but majority of the office workers are in Minnesota so if you have and issue about anything you have to email someone wait 2-3 days to get a response. Also they use intimidating methods to get the rules across not a write up, warning, just force. It’s going into the next month and I haven’t received any funds for the last I had to send emails to people in Wisconsin and in Minnesota when I told my supervisor he said he would get on it but every time I brought it up it was like he had forgotten every time"
bad,"They work you every Friday, 50 hour weeks and endlessly raise the rate, extremely fast paced. No air, and you can’t breath. Everyone is expected to be a trainer and do not receive raises for being trainers. New hires are treated better then employees that have been there for years. Coaches egg on fights and gossip along with assembler workers. Endless drama and clicks. High school  like environment, no  no growth"
bad,Multiple times I’d loose money off my checks because upper management gave away free product so that can have party or just can’t crunch the numbers right.  Just not worth it. I moved on and make way better living with better people
bad,"Wouldn't touch it with a barge pole. You have no life you are always chased when can you go here when can you go there. They want numbers and quality, you can't have both. Look elsewhere best thing I did was leave."
bad,"To many responsibilities, no Support from Management. Keep raising prices  Not for everyone . You will work a lot of hours and do a lot of driving . They also require a GPS driving app"
bad,"You’ll be constantly working, either in the field or at home. It’s never ending, unrealistic budget to make each month. You’ll have extremely needy customers calling you all hours of the day or night."
bad,"Stressful place to work. New Management that has no clue what there doing, shady co-workers that talk bad about other people behind there backs and try to get people they dont get along with fired."
bad,"Everything I was told in my interview was a lie.  They only care about taking business away from competition, not helping existing customers.  They lost Aramark and Compass on a corporate level due to their insane price structure for their products and services so the marching orders became ""take their business"" at very opportunity.  If you can't take business from the competition, they don't want you.  No matter if you are exceeding your budget, hitting sales goals, and taking incredible care of your existing customers, they only care about new business."
bad,"Very poor management, company does not care about their employees. No structure or organization. They will pressure and force you to comply with their business needs"
bad,"The point system is horrible. Don't work here if you have kids, "
bad,The work was all shifts. mainly Monday through Friday. Some weekends. We were always on call. The area was a 100 mile range. We had to help other service technicians when ever they required it. We worked with caustic chemicals.
bad,"As a woman you are treated very poorly. They work you like a dog continually pile the work on.Make tonnes of unfilled promises.All male upper management have it pretty easy. They do not care about employees and have no loyalty, you are a robot not a person. American owned, Canada is constantly scrambling to get updated systems are archaic."
bad,"Awful company to work at, outdated management methods, teamwork skills lacking, overall depressing workplace. No support to technicians, sent off for irrelevant training, waste of time."
bad,Do not get brainwashed by the management. This is a good place to get trained in the corporate sales world. The career part of this company has diminished.
bad,"I had a DM who was a control freak, megalomaniac who was prejudice and an absolute jerk! He lied thru his teeth with everything and always blamed everyone else for his screw-ups!"
bad,"Management is terrible. they constantly Micro-management with out spending time in the departments to try and figure out how things actually work. They preach safety, until it has a production impact."
bad,Ongelooflijk slecht behandeld vanaf het eerste uur. Ze wilden niet dat ik een dame ging vervangen die van dezelfde bureau als ik kwam (mt&v Finance B.V.). De dame zelf zat al 2 jaar daar gedetacheerd en heeft collega's gevraagd om mij ook weg te jagen zoals mijn voorgangers.
bad,"Terrible leadership, worst contract engagement in my 15 year career. No checks and balances for managers/leaders...they can get away with anything; very difficult work environment across all the teams I worked with"
bad,"They have a system of having backup hires ready to go because most Account Managers only last 6 months.   Play games with your ""salary"" and ""commission"".   Assigned a territory, yet you are constantly pulled out to do work in other territories because that account manager quit and it takes 3 months to get the new guy up to speed.  In the mean time you have to service his accounts.   You will be told Account Managers are in ""sales"" in reality you are a service man.  Your job is to repair broken machines, you are dispatched via text messages, there are no real sales involved, yet your total income is affected by company forces beyond your managers control."
bad,"the worst job I've ever had. no time off at all. when you are off, you're not really off. you constantly get emails from managers, your accounts or whoever, and you must respond. the managers expect to you to do your job with no complaints no questions asked, yet we never have the supplies we need to do our jobs. if you ask them for anything, they act like it is a huge inconvenience. terrible terrible job. stay away."
bad,"I was not employed here long enough to render a reliable unbiased opinion. I will therefore bypass this opportunity to render an opinion. "
bad,"Ecolab, wants to rip its employees off and also its clients. They have cut cost to a point that the employee almost pays to work for them. I would never recommend this company for anything."
bad,"not worth it at all ever. They are the most clueless people I have ever been around my entire life. you have to dress like them, act like them and say yes  to everything presented to you."
bad,"Wouldn't go back, new management made you feel like a number rather than an employee. You really know more about your peers than your own family. To stressfull of a place for."
bad,it would of been nice to have a manager that you could lean from not one that has less time with ecolab than you do however the adm is a great manager even though he has less than a year with the company at least he will get dirty with you and learn
bad,"R&D management totally involved with helping their careers at the expense of lab personnel.  Expect objectives to change not only daily but AFTER your performance review has been written and submitted.  Run, don't walk, to somewhere else to work."
bad,management was great to work with. A highly competent team and place to expand your career. I highly recommend this employer. It was a great experience being part of this HR team.
bad,"Ecolab claims to have a culture of safety, but constently has spills and accidents that are all linked to neglect by the current management.  The Safety Department does not take concerns seriously and puts employees at risk."
bad,These people will undercut and use you. They do not take anything into consideration.They will fire you at the drop of a dime and think nothing of it;
bad,"This company is not a company where women excel.  It's a boy's club where not much training is provided.  The work environment is mostly one where even if you work hard, you will not get ahead in your career."
bad,"Would not recommend this job to anyone. Company does not care about employees home life. Only thing they care about is getting the contract volume done for the month, PERIOD!!!"
bad,The Management in this company has no  training and they put people over you that have no Supervisor training. By far the worst company i have ever heard about.
bad,"I'll keep it short. Ecolab is a bad company. There work practises are sketchy, dangerous and unreliable. Because of their severly underpaying salary for technicians they are made up of rebelious bad seeds that were terminated from other jobs and the dangerously, fresh out of school, inexperienced techs that have no business working in commercial kitchens.  There techs overlook safety and quality for time and profit. Their CEO has a car salesman mentality. He believes you are worth his time if Ecolab is profiting at least 6 figures from your business annually. They use the words ""culture and ethical"" an absurd absurd amount of times but ""cult"" would be more accurate and they have no idea what ethical even means.  I know this first hand as I was a part of their cult for over two years until i was terminated for going to restaraunt management about a serious safety concern. It turned out to be another Ecolab tech that caused the issue. That ""senior"" Technician brought more money into the company (this by routinely lying and selling parts and equipment to restaurants that did not need them) so I was terminated. Thats Evilabs ethics."
bad,Management dont handle situations good. People are so judgemental. Its a ok background for a job but its not the best place to work because of management
bad,"Don't waste your time. Management is HORRIBLE. every supervisor thinks they own you so as soon as you mess up once, especially if you're a temp, you're gone! Everybody in the building wants you fired and will snitch on you for anything. it's a he said/she said company, for example if somebody doesn't like you and just randomly say that you said that you didn't like the job or something along the lines to a supervisor then you're gone. All they care about is how much money they make and could care less about their employees. I could write soooo much more. there is a ridiculous amount of drama in the building and everyone trash talks each other behind their backs their including the supervisors. DO NOT WASTE YOUR TIME"
bad,"Horrible place to work. Supervisors and managers were horrible people. Did not want you to learn anything new. Always talking down to you."
bad,"This company pitches a good sales pitch, but they have no concern for team member happiness or well being. Ecosure is a division of Ecolab and they change their rules as they go to ensure they always profit no matter at what expense their team members suffer. They do not allow you to take vacation time and they do not pay out for accumulated time when you leave."
bad,The job that never ends and doesn't pay. Do you enjoy crawling around on your hands and knees in filthy kitchens all nite long? How about spaying poisonous chemicals constantly? On call 24/7? 60hr plus work weeks all for minimum wage? If you answered yes than this is the job for you. Good luck
bad,"Ecolab is a very top heavy company and the management has lost touch with the people in the field, all they are concerned about are numbers."
bad,"do not ever work for them they are not fair or don't care about your family. they try to fire you for no reasons. look somewhere else to work,"
bad,"Your annual salary is not what you get paid.  It is a guesstimate that no one can explain.  Commission only position that they won't tell you either."
bad,you never know when your going to be working until a few hours before its time to go in
bad,"There was no set schedule, would work 12-15 hours daily some less, so no overtime would be paid for the week.  Manager would call me 1 to10 mins before leaving home to come into work, too see if I would work later time, to cover for someone else.  Covered for others all the time.  The contracted mopping crew would mop in the lab daily with people working and place no sign out on ocasion, therefore I fell and was fired a week and a half later, after pulling my shift and the other lab tech shift due to the fact one was out for family reasons. I constantly worked for others when they wanted off and was only given a day or several hours notice.  Also, I had accured vacation time & personal time in which, they now will not pay for accured vacation time or personal time, HR told me there was a policy change which I told him I had never seen or given a copy. From the first day of work which I sign and agreement given 2 weeks paid vacation, this changed immediately. Is this a way to get people hired and in the door and then change all policies at HR desgression.   Also for the first year I worked every weekend, only getting Monday off , but when people were move around with no dicussion, no one else worked every weekend, it was rotated.  It's weird that they paid for unused personal time at the end of 2013 and one could carry over their vaction time up to 80 hours. I saw everyone that got hurt on the job GOT TERMINATED, and I did not even mention worker's compensation, since I thought keeping a job was more important because I was my family's only support and way to have insurance."
bad,"When I first started I was told it would be Mon-Thur 6am to 4pm, I was there for almost 4 months and never had a Friday off and worked every other Saturday. The Full time people make it their mission to get the temps fired and that's exactly what happened to me, I am a very hard worker, was early to work every day and never missed a day and was terminated because a coworker played a song with one swear word in it off of my iPod without my knowledge and one of the old women heard it and told on me for it and I was terminated that day with no previous infractions. I wouldn't recommend this place to my worst enemy!"
bad,"It's hard work for little pay with no life/work balance at all since your personal cell phone is also used as work phone on business card; therefore, you can get calls any time of the day or night and feel obligated to answer even on vacation or holiday.  Lack of support.  Typical day is drive around pounding pavement, lots of cold calls rain or shine.  Than at the end of the day there's data entry and other paperwork to be done so it's overwhelming.   Management is not supportive and there's a lack of communication/support with sales and operations."
bad,"Basically for a company earning billions of dollars a year they paid poorly, management were basically incompetent bullies, I would not recommend working here."
bad,"Ecolab has to be the worst company ever to work for. Management is a joke. It's pathetic when the ""boss"" does not know how to do his own job let alone the jobs of his people he is to be supervising. & how do they expect us to get our job done w/ no product.U have to order the product you incompetent moron. Gee....how many lawsuits will it take before they pull their heads out of their butts. It's all good though....cuz people like me will just continue to bank off of your stupidity. $$$.....thank u!"
bad,"The pest division is high pressure sales, high prices and low quality service. Managers are phony and I have never seen such a toothless, unfit sales organization. The most shady people survive. If you have integrity, morals, compassion, teeth, family, proper BMI and bills, you DO NOT want to work here"
bad,"Bad management an active blame policy when things go wrong, no thanks when its due"
bad,"I worked for this company for exactly one year. I had virtually zero training as a Pest Elimination Specialist and had to learn the job useing chemicals I had no experience with in the past. When I was hired, I was told it was a 40 hour a week job, nights, Sunday through Thursday. You were attached to your job and your accounts by a beeper. When the beeper went off, you were required to respond within 24 hours, but first, responding with a phone call to the customer within one hour. When you have 124 accounts, no training, and poor management there is no way you have any quality family time or time to relax. The icing on the cake is when I had a family emergency and asked for time off without pay to take care of personal business and get affairs in order it was denied. Denied, because my lazy manager didn't want to get off his fat can and from behind his desk to cover for one of his employees. Needless to say, I was fired. I don't recommend anybody works for this company."
bad,"Company management is arrogant and company has gotten so large that it has became complacent in its role. Management is mostly all intimidation and scare tactics and does not care for family being involved. Family not welcome at rewards banquet nor as a ride along guest such as take your child work for a day and you can be fired for taking your spouse whom was unable to drive to the doctor. Most everthing runs backwards here, the hardest workers are recognized the least but leaned on the most and the pay scale is controlled by policy which changes yearly so your salary can go down instead of up and the kick in the crotch is that it will take more hours to earn less money. Territory managers are put on a pedestal and dont have to do much work. They are mostly are dishonest as they profit from it at expense of the route managers whom keep this company alive. Customers and the challenges was the best part of the job."
bad,"Have been here working previously but they have long hours with day and nights every day , long routes and travels with worse management . They can send you anytime any day anywhere . Make false promises . "
bad,"No hay organización , mucho desorden y poco apoyo en los procesos, tienes que poner de tu bolsa para los gastos de viáticos y tardan en reembolsarlos, te cambian la agenda en cualquier momento y los horarios son a altas horas de la noche"
bad,Management was not supportive.  Going through a rough time.  Absenteeism was excused but ultimately ended my job. You are expected to work no matter what is going on in your life at the time.
bad,They hire and/or put managers in place that have no clue what they are doing. Management at the local and regional level only care about their bonus and will regularly remind you how anything you do affects their bonus. A normal week is in excess of 60 hours and management is still asking you to do more. You will have no support and will really be on your own here.
bad,The management wants employees to be micro managed. There is no room to advance unless you’re a part of their click. In the summer you will pass out due to the heat and the chemicals floating in the air. If you report situations that are going on in the plant you are retaliated on and your job is threatened. Don’t let the pay an hour fool you it’s not worth the hassle.
bad,"No hay equilibrio de la vida personal con la vida laboral. "
bad,Bad management & work almost every weekend.   No real chance for advancement unless your right with management.   They will work you to death & then work you some more.
bad,You work 13 weekends out of the year without compensation and only 2 weeks off for a $16/hr job. Fend for yourself as you do not get much if any useful help form the management.
bad,"I've worked for four companies and this one is by far the worst. They own you, will chew you up and spit you out. They pay you just above average but will work you 60 plus hours per week, and get this: the more you work the less that you earn. They have a rediculous pay structure. Do yourself a favor and choose somewhere else."
bad,"If they ony cared about their employees they way they feel about being everywhere... just imagine what they coudl do!"
bad,I worked there for 13 years and was fired for an accident. I was changing a dispenser and splashed acid in my eye under my safety glasses. I didn't miss any time at all.
bad,"bosses ignore you when you need help, when they do help they over apply chemical that violates label law, do jobs they don't have licenses for, work you night and day to the point of nearly wrecking and expect you to keep going or you can get written up, boss will take credit for your work to upper management, co workers with steal commission for jobs"
bad,this job is not worth anyone's time. do not expect a permanent position if you are going to be working in the warehouse.
bad,Same as my Orkin review the big corporate owned companies are all the same
bad,Most disrespectful place I have ever worked. Supervisors are not trained properly. The thinking of these people is that they are above the people that are actually doing the work.
bad,"The majority of people there are family,friends whom married into their friends family and long time friends who they hired so it's kind of a favoritism type environment."
bad,"I gave 110% every day, for them to give me 7.5 hours for the week. They started cutting all of the temporary employee's hours along with full time. They never gave a straight answer as to why there was no work. They handled the whole situation very unprofessionally."
bad,"They promote work like balance but you don't really have one."
bad,"Run for you life do not apply to this place unless you just don't have no other choice! Pay and management are horrible, you will be on your feet all day long constantly walking.  It is very hot during the summer and very cold during the winter, don't do it! You are not rewarded or promoted based on your experience or your knowledge, you only are rewarded or promoted if management like's you period.  Ecolab has a plant in just about every State and city and all of them are not that bad, but the one I worked for was horrible, go there at your own risk!"
bad,"(Winston-Salem Branch)"
bad,Trash company!!!!!! They treat employees like garbage the supervisors play favorites break times are only 10 min not even enough time to walk to the break room
bad,"A empresa tem uma cultura boa, mas peca na gestão de pessoas, alto turn over, rotatividade e por apresentar uma gestão tóxica."
bad,High expectations. Zero benefit! Don't apply to ecolab. They will run you into the ground for their own benefit  and financial gain. Reducing your pay and ensure your own financial failure.
bad,I worked here for about a month. A month was enough for me if you like to be micromanaged and talked to with no respect as if you are a kid then this is the place for you. They talk to you as if you are dumb and not capable of anything. You can't drink water out on the plant. Quick to write you up if your a minute late. If you get a raise its 25 cents. Just an  awful place to work this place is a joke.
bad,"No back up by manger, left to sort out problems on with customers and manger May our may not answer the phone to you. Work load  totally not realistic no Christmas bonus"
bad,I was laid off after 9 weeks of employment due to reduction in workforce. The company was losing money and had to reduce the number of employees.I cannot provide a full review after only 9 weeks of employment.
bad,"The work life balance with ecolab is terrible. The management in AR is great at making promises, but 9 times out of 10 never follow through. I personal was with the company for a little over 3 years and I saw many people come and go because of the struggle that the job throws at you. I would never recommend this company to anyone who lives in AR, but you may find better luck in another state."
bad,Overall time spent working on machines instead of out selling is 95/5%. Not enough money for how many hours you work. Management is not helpful at all. Stay away!
bad,"Very poor management who does not care about employees safety and well being. HR is one sided and all complaints fall on deaf ears. Expected to work long exhausting hours with no appreciation in return. Trainning is lacking but yet you get in trouble if you make a mistake from lack of knowledge."
bad,"No development if you don't play politics. After Ecolab adquired Nalco, our company (Nalco) became a very different work place, and it was not a healthy corporate culture at all."
