rating,review
good,enjoyed qoeforimg with all my associates. enjoy my customers. once a month meetings qnd equipment pickup was sufficient for training and communication.
good,Ecolab gave me an opportunity to demonstrate my leadership skills.  I lead a team of 10 people.  I enjoyed working there.  They closed this division out of this area.
good,"days at work was always different daily based on production"
good,decent company to work for with great benefits...work autonomy...objectives were achievable...nice working culture...needed new opportunity for advancement
good,Good place to work.  Lots of opportunity.  The location was idea.  I enjoyed the work and of the people there.  I would recommend this company to any finance and accounting professional.
good,"The environment is relax and the folks at Ecolab are friendly. I wish I wasn't a contractor I would have like working at Ecolab even more. It was my first IT job, with the exception of the low pay rate (due to being a contractor) I enjoyed working there."
good,Every day was very busy and changing environment.  There were some meetings each day that took place that got off track at times.  Very experienced workforce and knowledgeable maintenance technicians.
good,"empresa que foca na segurança do colaborador, visando sempre o seu bem estar."
good,"it was a great place to work, lots of training. shadowing of senior technicians.They provided a nice work van, with a full inventory plus the company phone and ipad for all work orders"
good,Great Company to work for. Down side is they are growing and upper management is changing every couple of years. I was caught up in a Downsizing of my division and felt that the new management didn't even know what I brought to the company.
good,"Good work life balance. Insurance is not great. 401k match, stock options, pension after 3 years of working for an ecolab company. Paid time off, sick days, paid short term disability."
good,"According to my experience Ecolab is an excellent company, however the balance between work and family time is difficult to handle, calls in the middle of the night, and endless weekends when you are on call, are difficult factors in the day to day, however they are very good company to create a professional career"
good,"Excelente ambiente laboral y equipo de trabajo, Se preocupan por la seguridad de sus empleados."
good,"The best experience I ever had working for a company, great culture and I acquired new skills with this company. I had a manager who did not micromanage and demonstrated great training and patience as I acquired and gained experience."
good,My time with Ecolab was very rewarding. I was exposed to a myriad of challenging and rewarding opportunities. Being able to conduct my business from home with the flexibility to balance work and personal life was quite agreeable. Although due to the demographics advancement became limited.
good,Ecolab were one of the best companies I have worked for .
good,"I truly do enjoy and appreciate this job. I enjoy the flexibility the most - if I want to sleep in, I just check my schedule to ensure I can move audits to later in the day, and then I do. A typical day involves driving to customer locations (restaurants, hospitals, etc.) and conducting customized audits. These audits are not always well-received by managers, etc. Usually, the corporate offices use these audits to ensure all of their locations are maintaining the proper standards. An eye for detail, the ability to work alone, and honesty is required."
good,"Ecolab is a fun and exciting place to work.  The environment is fast paced and allows you to collaborate with other proessionals within the various businesses.  You can help make the world healthier, cleaner and safer."
good,"En lineas generales, todo el plantel comercial, desde los vendedores,  pasando por administración y Gerencia poseen valores fundamentales para el buen funcionamiento de una empresa."
good,Respeto y colaboracion entre sus empleados. Buen ambiente de trabajo. Estabilidad laboral y crecimiento profesional.
good,"You are totally in control of your own route."
good,It helps to have an inside connection to get hired but not necessary. 4 weeks from interviews to start date. Excellent management. Highly recommend for young people. Great opportunities worldwide
good,Nalco was a great company to work for.You must enjoy being on the road and being away from home as there is a fair amount of travel. You can put your experience to work for you. Most times the management lets you do your job with little oversee but they also have some micro managers.
good,"Interacting with customers to resolve issues, explain and train on the uses of products. Freedom to set my own schedule based on customer needs, being able to respond to emergency's within a timely manner. Communication with coworkers about issues of equipment repair challenges and getting them resolved."
good,"a typical day at work is look at work orders the day before and schedule with customers the ETA, next day drive to customer ,trouble shoot and fix equipment in a time matter, complete work order, order parts if needed and drive to next customer, pick up parts if needed, communicate with dispatch and parts department if needed. complete about 2 to 5 work orders at day."
good,"Nice place to work, the only problem I had with Ecolab was that the on call weekends where way to busy, They have since taken care of that problem. Worked with good people and had good management"
good,"Communication employee and manager is good. We always discuss about business every month to prevent any problem future."
good,"Good company to work in with good benefits too. "
good,Una.buena empresa para destacarme laboralmente que satisface plenamente mis pretenciones y espectativas laborales
good,"Always engaged, fun environment, work/life balance, benefits fair.  Management always concerned employees are receiving what they need to succeed.  Great place to work"
good,"great company to work the employers are great and friendly it is a great company  to get to learn and grow in, they also have great benefits,and a company that takes recycle very sersouis."
good,"muitos benefícios, forte cultura organizacional e ambiente agradavel para trabalho."
good,Slow to adopt new technologies. Global company with many opportunities for advancement. Runs lean and many people in roles that do not fit their function. Service focused.
good,It was again away from the family and short term project. I needed a stable job which I found at Caresource and I moved to CareSource. I was a contractor there at EcoLab and I was looking for a full time position.
good,"Didn't plan on working here more than 2 years and ended up making a career with Ecolab. I would recommend to anyone who is not sure what career path to take, to explore openings with this company."
good,"light assembly fast paced work place. very accommodating to most workers needs "
good,"Great opportunity exists in Supply Chain arena as only recently starting to realize the importance.  Due to being heavily concentrating on Sales and Marketing aspects, Supply Chain functions were not seen as an area to focus... However, lately they are paying utmost attention to the establishment of a robust Supply Chain globally."
good,"Wages and benefits were good.  Plenty of overtime opportunities.  The work itself was great.  Easy, clean, and self explanatory.  If you were trained well, you had no problems. There was no stable management, high turnover rate and no job security."
good,"excellent environment job, good job partners , sometimes need to work really hard but its fun, roll outs, mails, orders, and a lot of stuff to do, learn a lot."
good,Good company to work for however work was slow and not enough to compesate for a full pay check. There were plenlty of learning experiences to enhance my skills.
good,Job required a detailed service approach as well as a sales approach in gaining new customers and add on sales with current customers.
good,"Ecolab offered relevant and engaging hands on training, they are also a safety conscious company, placing your safety above anything else. The pay and benefits are very good."
good,"Hard to be on call 5 days a week 24 hours. "
good,"Permite balancear la vida privada con la profesional, crecer como empleado y sentirse parte del negocio."
good,"Trabalhei quase 10 anos, tive diversas promoções na empresa, até chegar a gerente de território, empresa séria e focada nos resultados. Relacionamento com todos da empresa bem tranquilo, tinha contato com muitos lá dentro, amizade e profissionalismo. Infelizmente uma crise no País fez com que algumas pessoas fossem demitidas na época. Aprendi muito, foi quem me deu o start na carreira de vendas e estou atuando até hoje (13 anos depois)."
good,"At work I learned a lot like how to be social with other people. The management is. interesting because I work on 2nd shift and our boss manage everything like what and how to do everyday.  Sometimes we don't have a coworkers but the one I usually is really cool and we help each other. The hardest part of the job is when we are really busy."
good,Pretty pleasant work atmosphere. It is hard to move up but if you come in with experience into a desired role you will definitely not regret it.
good,"Great Company with great people to work with, learned a lot of things while on the job, Great benefits as well. Best part of the job was putting together everything i learned and watching it all come together in the field."
good,Good place to work.  Pay should definitely be higher for some positions and wage increases are minimal to say the least.  Workplace culture is good. Health benefits are not the greatest but not horrible.
good,"This was a small company, but very good of salary compensation and support. This company is very analytical and the has great potential to grow. Very know company with their cultural background and overseas."
good,Just started working with this company very easy to get along with colleagues and able to find the information I need to help succeed.
good,Empresa que estimula e dá o recurso necessário para que o funcionário se qualifique nas atividades laborais.
good,"Visited customers to maintain the dish machines and product sales."
good,The company is good place to work with. The workers are all nice and easy to work with. It requires a lot of my time. The most enjoyable part working in this company is talking to people.
good,Ecolab is a great place to grow and develop your professional career in every facet. management is dedicated to helping you learn and grow within the company
good,"Empresa com um ótimo recurso de trabalho."
good,"Enjoyed working with this company, had wonderful co-workers and customers. Learned alot from this company, enjoyed traveling to different job sites on a daily basis."
good,"A typical work day is coming in every morning, checking emails for new sales orders and processing them.  This was my first oil and gas position.  I learned valuable information to be able to take with me to further my career.  I managed 7 employees in 4 different locations.  I enjoyed my co-workers, but had to keep the manager/employee relationship.  The hardest part of my job was traveling so much.  The most enjoyable part was the people interaction and problem solving."
good,"I have had 2 months of training here in Texas and including North Carolina. I work by myself everyday and make my own schedule.  I travel all over north and west Texas doing food and safety audits, as well as fixing equipment. I love meeting new people and traveling to new places."
good,"idéologie d'entreprise très présente , bonne ambiance de travail"
good,They are a very large company and a lot of room for growth. benefits are great and pay is fine.
good,"Ecolab offers a great employee environment, where it is easy to consult with others on projects. Furher, it offers a diverse projects to work on."
good,"Challenging culture, solid company financially.  Nalco side of the business (recent merger) is safety-oriented, Ecolab side trying to catch up.  Ergonomics is being received cautiously, lot of training and educating of the sales force.  Businesses are spread out across the globe so training is challenging but they are receptive.  Slow but steady progress on changing the mindset about MSDs and strain/sprain injuries, early reporting, and early intervention."
good,"I like working there, there's always something to strive for"
good,Great company with good culture and values. Cares about employees and empowers them with all the tools needed to be successful.
good,Projects that added high value to the company.
good,too bad they cant accomidate the working conditions and get ac when its 105 degrees outside.
good,"Loved the company, but was tired of the job. Very service oriented, and decided to move on."
good,No thanks.  Feel free to call/contact me so I can know who is asking and I can suit my responses so that they will be relevant and helpful.  Thanks. 123ABC
good,"Enjoyed working for Ecolab Equipment Care. Benefits were good and work related issues were handled in a professional manner. Worked as a remote Technician had the ability to troubleshoot, diagnose, order and schedule repairs on customers equipment. Loved the job would still work for them but the EEC division was sold."
good,"J'ai travaillé pendant 2 mois en interim  au sein du service recouvrement de cette société, j'ai été formé par une collègue très avenante et qui a de bonnes qualités pour la formation."
good,"Great place to work! Can get stressful, but great pay and benefits. Nice company trucks and gas cards and phone. Must be able to develop a work life balance."
good,"Ecolab is a decent job to work at. I have been there going on three years now. I recently relocated to the round lake area, and the pay I'm getting at Ecolab is not worth the driving distance."
good,Empresa que toma de manera muy importante la seguridad industrial  y la integridad del personal que labora en ella
good,"Respect to diversity"
good,My worksites were randomly selected and could take me anywhere in the Bay Area. The work I would performed in a week ranged from high tech companies to Denny's. Each kitchen had its own unique demands and ranged from kids' lunch machines in school to more intricate kitchen machines.
good,Trabalhava na logística com com meu próprio caminhão; Responsável por fazer entregas na grande SP e interior;
good,EcoLab is a great company to work for if the scheduling fits your needs. Plenty of work to do.  Multiple ways to advance throughout the company. Company issued work vehicle is a great perk.
good,"Very quiet - most people keep to themselves doing their work."
good,"I enjoyed my endeavor at Ecolab. I had the opportunity to build a World Class Network from the ground up. The people were the best in the industry to work along with. Ecolab is a World Class Global Company and it was great visiting their manufacturing facilities across the globe, and even more enticing was the fact that the technology we from IT introduced was being used and was very profitable for the company!"
good,"Work day includes reviewing orders for Ecolab Insitutional Divison and Food Safety Division, contacting customers and working with territory and district managers to secure payment on past due customer balances.  Learned how to use Mainframe and SAP software, expanded knowledge of Excel through various tracking projects.  Managers open to new ideas and approachable.  Hardest part of job heavy workload at times, but most enjoyable meeting deadlines and able to complete assignments efficiently and accuracy."
good,Entrei na empresa sem experiencia nenhuma. Aprendi muito na area de controle de pragas. Fiz cursos na area pagos pela a empresa.
good,"Sold water treatment products for industrial accounts. I visited 2-3 customers and/or prospects a day each week to grow our business.Each visit was different, from running technical tests on systems with operators and maintenance crews to making sales presentations to executives."
good,Very innovative. Up to date with latest methods and tools. A true leader in the industry. Employee oriented. Will do whatever it takes to retain good employees. Excellent job developing new talents.
good,"The normal type of work environment. Did a reasonable job at taking care of their employees from Pizza to other benefits. I would recommend anybody and anybody to apply for a job there a clean place, decent place."
good,"Empresa de grande porte, com múltiplas oportunidades de negócios"
good,Worked in several different departments during my time there.  Such a large company that had excellent results around the country.  Enjoyed working in each and every department.  Loved the job
good,Typical day at work is sometimes busy and sometimes slow. There is lots of opportunity for extra work if extra effort is made to get there. Its a great learning experience if you have not had previous job experience. Hardest part most days is dealing with some of the people that do not want to cooperate with you. The training experience was great and most enjoyable.
good,"Uma ótima Empresa para se trabalhar,não tenho nada a reclamar."
good,Days can be long but you can depend on fellow employees for support . The have great benefits and bonus structure .Most enjoyable part of the job is being able to help and support your team on achieving goals and targets.
good,"I learned a lot from Ecolab from top to bottom, sales to customer service. They have a deep and extensive training program the covers all bases. I built a lot of long lasting relationships with customers and within Ecolab."
good,"Great money, but the hours can beat you down. i had great managers and even better co-workers. They give you great training on learning the pest business, unfortunately, they don't train you for your rout you will run. Over all it became a choice, this job, or family."
good,Great work environment and teamwork at it's best.  I would recommend this company to anyone looking for a challenging and rewarding career opportunity.
good,"Great work environment.  Good leadership, as well as friendly with a good vision.  Fast-paced and gives you a broad set of skills."
good,The ability to multi-task is essential to their fast paced environment. Your hard work is acknowledged and salary and benefits are well.
good,"Worked as a lab tech for R&D Chemists, did wet chemistry and performance testing.  Presented work to supervisors.  Enjoyable work place and coworkers, enjoyed the work I was doing.  Too much down time without work to do."
good,Busy. Positive friendly environment. Learned about the business basically through my Area Manager and District Managers. Enjoyed field days and learning the all around picture from inside the office to out.
good,"My days vary, some early some late depending on the schedule."
good,Work was always intersting different every day I learnt how to test chemcails. Manger were fine co workers much the same as every where else good ones and bad ones hardest part of the job was when tanks blew up the clean up after them enjoyed being outside .
good,Fun company to grow with. Like running your own company with the help from a large organization.
good,There are a vast amount of opportunities to be part of. It is a fast and dynamic culture with opportunies to work around the world. The culture has changed since my departure and from what I understand has turned into a watch your back.
good,EcoLab was an excellent transition for me to move from Macalester College into a corporate environment.
good,"Great company! Regret leaving!!! Manager was personable and a down to earth person...he worked harder than anyone. Great benefits and company van w/ gas. At times a hectic schedule, but flexible. All in all, a great place to work with great people."
good,* La journee de travail et agreable pleine provocation.
good,A 90+ year old secure company that focuses on traditional products and innovation.
good,"Very strong corporate and local management support. Great benefits, good pay and work schedule. I unfortunately am too aggressive and worked myself into the weeds taking on way too much work and definitely provided a slightly over through service,  causing me to not be as efficient as other service specialists"
good,"Cette entreprise fait tout pour vous intégrer rapidement et correctement grâce à une formation efficace. Beaucoup d'avantage comme la voiture, le pc, iPhone, plusieurs primes...."
good,"Ecolab is a good company to work for. Wages are great, has work-life balance, and offers assistance to the less fortunate, which is always a great thing."
good,"Good benefits, excellent management. They need to work on improving the RPH to benefit employees more.  Please open up more opportunities for top performers with in the pest division. Instead of giving opportunity to college graduate with no past experience please promote your top performance from each division or at least give them an opportunity to get into some kind of management program"
good,Empresa que reconhece o esforço de seus funcionários.
good,"If hired in now you'll start at the 3rd tier part of the contract, meaning that regardless of all the experience you gain you'll never make as much money as the guy next to you that's at the 1st or 2nd tier of the contract. And you'll be required to put out the same amount of production. The nice part of the job is that you work in a controlled environment, a very diverse group of employees (which is nice) and awesome benefits. The work-life is awesome. They have a 2- 2- 3 schedule that works well for those with families. You'll have lots of help with training, everyone is easy to work with. It's like family there.....crazy, right?"
good,"Bon cadre de travail, bons outils de travail."
good,Organización excelente en el desarrollo de los trabajadores y adiestramiento dela equipo
good,"Make your own schedule, however there are callbacks from customers that interfere with your schedule. If your sales minded, you can make a lot of money without hard selling. Fringe benefits are top of the line, 401k up to 6% match/pension plan."
good,I enjoyed my work at Ecolab. Pay was good but the travel was the big negative. Drove almost 3500 miles a month. Had to pay for my own gas over the and above the company payout. Fuel allotment was not enough to cover expenses.
good,"While I was there we had  good team who worked well together "
good,I enjoyed my time and career growth at Ecolab. The typical day allowed for a good work/life balance. Ecolab is company with a strong safety culture and shows care and concern for its associates.
good,"A very good company for anyone based in Minneapolis and looking for a stable job, with opportunity for mobility across the company. Top player in a solid industry."
good,"Good place for graduates and seasoned professionals alike."
good,"Yo programo mi trabajo(servicios  a realizar)"
good,very fun atmosphere with the ability to manage your work and personal life.  upward advancement very possible.  It has been a pleasure to work here
good,"Positive attitude, great atmosphere, everyone's friendly. Feels like a family. Part-time manager is one of the greatest managers I've worked for."
good,Aprendi a trabalhar em equipe e sobre pressão. Tendo contato com funcionários de fora do brasil.
good,"- Good pay "
good,"La jefatura apoya constantemente, es una empresa solida que da oportunidades de crecimiento. "
good,The company is a great company to work for when the team is full and in my district we have to great ADM and DM. Hour are flexible and you basically make your own schedule through route management. Benefits and 401k is the best ive had in any of my jobs.
good,"Willing to hire people with no direct experience.  Provides everything you need to succeed.  lots of work and all the hours you want.  Hours can be difficult, must be available at all hours"
good,"great environment and coworkers provided a family-feel to work"
good,"trabalhei muito, me dediquei a empresa. "
good,"A Ecolab Química LTDA, é uma empresa que cumpre com suas obrigações com seus funcionários. Empresa oferece plano de carreira, remunerações e diversos benefícios a seus funcionários. A empresa tem refeitório no local, fretado, vale transporte, vale refeição, vale combustível diversos benefícios."
good,Empresa mundial donde me dieron la oportunidad de compartir mis conocimientos y experiencia y donde pude estar a la vanguardia de procesos y temas tanto digitales como fiscales.     Tuve bastante trato con el cliente de manera exitosa.   Pude aportar e implementar procesos de cobranza.   Siempre estuve en area de credito y cobranza.
good,Ecolab is a place where you expect to advance.  There are a lot of opportunities and the morale is very high.  The co-workers there are serious about their jobs and are friendly.
good,"The only thing that bothered me was the fact that I felt I was in the wrong department, other than that it was a pleasure to work with the people there and everyone seems very nice."
good,"A typical day involves and eight hour shift, the management team and co-workers are always more than willing to answer any questions or help those in need. Most enjoyable part of the job is the interaction with others while completing work in a timely manner."
