rating,review
bad,Manager don't care about the people that work their treats employees like they don't worth nothing..he rather hire new people than to keep the employees he has happy ..no pay increase if so it's very poor.
bad,On call subject to change bad pay old trucks horrible office staff put in dangerous situations often really the worst job I have ever had in my life no lunchtime in three years
bad,"Horrible management always changing"
bad,This company choose up employees and spits them out everyday I worked there for 11 years I don't know how I managed to stay there that long I would never recommend this company to anyone nor would I ever go back to work they're dangerous and unsafe working conditions management who just does not care.
bad,This Company did not support the office that was new and trying to regain customer's.  They would not work with me when my husband became diagnosed with Cancer and bypass surgery and I was needed to drive him to dr appointment.  The main office is in indy and that's all they cared about. There prices could not met smaller communities to be competitive.
bad,Giving one star is too much. Horrible micro management. Pay is horrible and they lie to you constantly. On call schedule for a week at a time is a joke and they will mess you over with that.
bad,"All politics... could care a less how good you did or how much you changed things for the better! Comes down to personal relationships and who’s butt you willing to kiss! Do not work here, they treat you like dirt. Turnover is crazy and they don’t want to pay good employees what they are worth... and they wonder why they are left with unmotivated workers. Pass on this company,  there are much better opportunities out there. And also the pay is absolutely horrible for the amount of responsibility in the position that you hold !! Farewell Gas should be their new name, because in less than a year, you will want to say Farewell!!!"
bad,Don't waste your time with this company too many bosses don't expect anything from this company just your paycheck no bonuaes all the employees including  your supervisor talk about you behind your back. Dispatcher was a joke safety personal was a joke everyone wants to be the boss go with amerigas if u want to work in the propane industry
bad,"To many bosses, doing nothing and sitting around while workers are busting but to get their daily work load completed. There was a struggle over territory and  climbing the ladder."
bad,This company  is cut throat. Upper management does not support employees who bring to light unethical practices within the organization and strive to cover up those unethical practices.
bad,"I wouldn't advise anyone to apply to work for this company. Very long work hours, on call daily, dealing with rude customers daily. Dealing with very nasty situtions."
bad,Ferrellgas was not the place for me. You work so hard but don't get anything in return. A big corporate company was just not for me at that time. I decided to move on
bad,"I would answer the phone and take orders for propane, receive payments, open new customer records and negotiate the price of propane with the managers. I learned all the above. A large company that competes with other propane companies for new customers. The hardest thing was the job for me was in another county and I had to drive far. I got to meet new people daily."
bad,"I am an Operations Manager. "
bad,This Company has no respect for the employees and does not recognize their performance when a job is well done. Management is very unsociable and does not reflect a good role model for anyone under management to follow.
bad,"stressful place to work, management and dispatch do not work together, every morning drivers do not know what they are going to do for that day, no raise after a year of employment , only good thing from this place were the employees , management and dispatch never answer phone calls they always have meetings. cannot work overtime"
bad,"Worked at the Sand Springs office in Oklahoma. While i learned a lot about the business that i will no doubt take with me, THERE ARE NO LEADERS,  ONLY MANAGERS....AND THEY AREN'T GOOD AT THAT.  If you're our looking for a place where you work for pennies, get no respect....this is the job for you. If not, keep it moving dont waist your time....TRUST ME!"
bad,The company provided a lack in professional Enviorment. No training provided..
bad,"A typical day  you will be working with unsafe equipment,driving a older badly maintained unsafe truck,trying to get dispatch to route you which could take hrs. Management will not help you with any problems you will have.This job was by far the worst place i have ever worked and i would not recommend anyone to work there. This job is extremely dangerous and poorly managed"
bad,"Heard this was a good company to work for, then got a job and found unorganized, bad management and no raises in years."
bad,the work is grueling and seemed never ending. Management is rude and unappreciative its workers.  Working in a mud pit every day caused my car to sustain damage that I'm still paying for.  Being on-call is frustrating & occupies your life.  My next job will be nothing like this.
bad,The drivers are treated like dogs and there was low pay long work hours and always another deadline to be met! Terribly poor management team with horrible business ethics!! They will do anything for the next dollar!
bad,The day I started the material handler and a driver warned me about the job. I didn't listen. The 3 of us dont work there anymore. They cant keep workers because CDL Drivers dont want to be worked like General Laborers!
bad,They are unorganized and don't treat you with respect. They listen to other employees about something before they even ask you. I preferr no one to think of Ferrellgas as a career
bad,"The position I was in, Operations Manager, was actually three jobs rolled into one. They expected you to manage all of them to the utmost perfection which meant you were working 70+ hours a week. Even then, you were behind. Unless you come in having already been in the propane industry for years and know all of the jobs backwards and forwards, you will burn out trying to do it. If you come in with no experience, you must get ALL of your training done before attempting to do any managing. That means Level 1, Level 2 and Level 3 along with proficiency for all 3. Typically that would take approx. 3-4 months if they allowed you to do that. Good luck with that!"
bad,"Management has no clue what they are doing. Under payed, over worked and be ready to get called out in the middle of the night and on weekends just for them to cut your hrs in the week. Dog eat dog world at Ferrell. And if the work gets to be to much don't say anything because kiss your butt good by if you do."
bad,No pay for on call.  !   Not the same day off each week !  Do not come here if u like being happy at work! 32 hr is full time in the handbook. So look out  for that!
bad,"Poor management- they are 2-faced Drivers are great, coworkers know what needs to be done but Communication is extremely poor. No time off from Nov until March (busy season)."
bad,"Management has not a clue what there doing , very under paid long days long hours micromanaged avoid if possible would recommend this job to kno one who holds a cdl."
bad,"Had some good years at this company and unfortunately the local management did their best to run off and fire all their caring and knowledgeable employees to bring in green And unknowable people to work with propane. Very bad combination if you ask my opinion, poor and unethical boss that makes up trumped up lying stories to get people fired. Corporate should have stood tall and supported their long tenured employees, unfortunately they do not and allowed childish bullies to control the reigns. It’s sad because this is all that’s holding this company back. I still cannot believe how bad this all turned out in the last few years and not to mention this company is in financial disparity, just check the stock prices. Stay away from this company unless you are single and have no personal life and enjoy being threatened and demoralized by the director of operations."
bad,Very unfair place to work. Was being sexually harassed on a daily basis and management did absolutely nothing about it BESIDES giving the guy who was doing so a raise and a promotion for the job that i was already in training for
bad,"Little to no training, over worked, under paid, horrible management. Day one I was told I got the job, worked for two days than was told i wasn't needed, a week later I was told to come back in and work. took over a year before I was considered ""Full Time""."
bad,Overworked and under appreciated! I was a part-time Material Handiler and worked 50-60 hours a week easily every week and never had help. I'm talking I would come in at noon and not leave until 4 or 5 the following morning. Prepared to be overworked all week and weekends
bad,"Worst company I ever worked for!! Management treats you like a monkey! You will not be working out of location specified, you will be working out Tiverton delivering blue rhino! Save yourself the aggravation!"
bad,"Stay away from this company.I left a job I loved to work here, wad attracted to the pay.but no pay is worth the abuse you take from customers and management. They set you up for failure with poor training and even worse management. No one knows what they are doing and are unwilling to help. Placing an order for propane should not take 400 steps. My friends when I say RUN I'm not stuttering....RUN!!!!!!!"
bad,Avoid at all costs this company has management issues it also has one of the worst csa 2010 records in the sector( Just look it up)
bad,"Used to be a great place to work until I continued to get new GM after new GM. The current GM in place has created the worst moral that I have ever been a part of or seen anywhere I have worked. Until he is gone the place will not thrive. GM likes to distance himself from learning the business and leans heavily on staff for all of his answers to corporate. Many unethical situations are taking place with GM that will not be aired on a public forum. I would steer very clear of this place unless you are ready to work 7 days a week year round while the rest of the management team does their 9-5 schedule Monday-Friday. Employees are treated unfairly and managed through fear tactics. No open door policy if you talk to management about issues you will be a target for termination. Management brought in a porta john for the drivers while the managment and office staff were the only ones allowed to use the indoor facilities. No raises in years and bonus structure has been widdled away to nothing. No opportunity for advancement as outsiders are the preferred method of hiring. You have been warned, STAY AS FAR AWAY AS POSSIBLE!"
bad,The company has a lot of debt and legal issues that doesn’t look good for the future! They have horrible Managers that don’t do their jobs. Just not a good place to work.
bad,"Finally out of this toxic abusive situation. When he'd belittle me in front of others I would make excuses like ""he's just stressed"". When he would cuss at me I would make excuses like "" he's just playing"", when he'd talk about me behind my back and thrive in the drama of others, I would make excuses like "" he's known them longer then me"". When he'd make me work overtime, not take a lunch, or come in early and not pay me for overtime I would make excuses like "" I'm am doing my job to the fullest"". The emotional and verbal abuse at a place of employment is not acceptable. This man abused his position as a general manager, and got away with it I resigned today."
bad,Reported a long time problem employee who has had confrontations with several employees including myself which created a hostile work environment.  That employee was terminated but so was I. Manager was also pressuring me to quit which I also reported and imagine that lo and behold I was fired!  If you go there it seems great at first but you soon understand the reasons for their high turnover rste turnover rate
bad,"The people who work hard are passed over and the suck ups are promoted."
bad,"Long hours, middle management constantly trying to push sales, (interesting since they are selling their propane for much higher than their competitors), and constant shifting of blame, responsibility, etc."
bad,"Different location might be different. However Inver Grove heights location has out dated and unsafe vehicles for driving.   New GM is a liar and a fake so if you apply here DO NOT believe a word he says. I can only comment on this location, others may be fine, however new GM oversees all of Minnesota I believe so tread lightly. If you don't heed the warnings of this review, in time you'll see, and you'll remember this review!"
bad,"Would be a great job if there was any leadership. Terrible work environement, zero respect for employees. Lots of backstabbing. They are always hiring because of high turnover rate. Older drivers skip stops or short deliveries then newer guys get those stops added to their route.If you are a solid worker who wants to be treated right this is not the place for you. You will be sorry like I am. That's why I am on this site looking for a new job."
bad,"As a former delivery driver, I was on on call all but 4 days a month. Would be called out in the middle of a blizzard at 2am to drive 2 hours to fill a tank so the customer could have a hot shower in the morning. Absolutely no regard for employee safety nor your time away from Ferrellgas. Stay away!"
bad,This not a place where you woould want to make a career due to mgmt uses personnel as scapegoats and you are fairly heard .
bad,Horrible company  long hrs horrible pay.  The competitors  pay better and offer better benefits.  Wouldn't  suggest this job to anyone. Poorly managed  an just a zoo.
bad,communication with boss's and employees is minimal. nobody answers their phones or returns you calls in a timely fashion. you are essentially on your own once you get hired training is very lax. you will not ever get a raise.they don't care about you as an employee and will work you more hours than they tell you and don't care about your family life or home priorities.
bad,"Thank god every day that I quit, worked my butt off for this company for 8 years and it was the most stressful time of my life. Management knows nothing any everyday you’ll wonder how the company is still in business because of how it’s run."
bad,"The manager is unprofessional, arrogant, belligerent, bully. I sprained my shoulder on the job doing cylinder exchange, I worked 15-18 hour days and he did not appreciate anything I did. He would sit in his office all day, every day just monitoring my work on the handheld to see how fast I was working and add more work from other drivers routes. He tries to intimidate you into doing what he wants, stares at you with this uncomfortable look. Thinks he knows everything. If you are a minority, he does not want you to touch any of the automatic trucks which are the newer trucks, you have to drive the older trucks. Monitors you all day through his cameras while you're on the property. Becomes aggravated when you get injured on the job and seek medical attention. There is a reason why they're always hiring in Conley, GA. Racist. The last day I was there, the manager cut an hour from my work day, the day before, claiming I did not work that extra hour so he took an hour away from me, and an half-hour away from the last day I was there, claiming that I was sitting for the last 30 minutes and said he would not pay me for that hour the day before and for the half hour for the current day(last day.) As a Floater, the manager told me I would be working whatever schedule the drivers route im doing for the week. So, if the driver works Monday thru Thursday and off Friday, that's what you will be working that week. And the last week I was there, because he was short on drivers, he tried to cheat me. He tried cutting time wherever he could so that I could work a full 8 hour day, Friday and"
bad,Not a good place to work for. Lifting 55 pound cylinders all day long. About 130 on average you have to move everyday and working outside in the elements. Long hours about 50 hours every week and being on call for a week every month. $20hr pay isn't high enough for that kind of work.
bad,"This place is so embarrassing to work for. I worked the front desk and the managers have no filter, in front of  coworkers and  customers. I was ashamed of our management. No respect for one another what so ever. Their is an open door policy but every one knew your business if you talked to any of the managers in private about any personal issues. I do not recommend this place to anyone. Don't pay enough for putting up with management."
bad,"They cut people for the most idiotic reasons just to make a bottom line. They are ""ok"" if you just want a temporary position to make the bills, but I would not recommend expecting to retire from there. And their equipment is severely antiquated."
bad,"I have worked there for 8 years and seen a revolving door of management. It all started when they decided to get rid of all the ""Duplicate"" management"" Ferrell gas and blue rhino"" . management is on duty 24 /7 so they burn out in about a year . They don't promote from within so the people they hire start from zero and get thrown to the wolfs. As a driver you hard work but pays well. its a young persons job. your body can't take the abuse for too many years as i'm finding out."
bad,no hours and summer long hours in winter and no job securityand all the customers yell at you because of the price
bad,this company is a joke they treat you like junk and then throw you away. The job is great and I loved doing the work just not for ferrellgas. The reason I was let go is because the os didn't like me so he lied to the upper management and I got let go because I used my key loop wrong (which I didn't ) & he would have known that if he would have done his job correct. They also expect you to work 40+ hours per week but don't pay you for it they say they will and then they don't if you tuen it in on your time card they erase it and pay you for 40 basically this company is a joke like I said
bad,"If you like working for a seventh grader then this is the job for you.  CSR Manager is not able to manage anyone with a strong personality.  Therefore she makes up for it on ones that don’t talk back, or put her in her place.  I have a lawsuit pending.  Stay away."
bad,Customer service reprensatives were very fun to work with all ways willing to help they made you feel like part of the family. All the drivers were outstanding.
bad,You r just a number with no name ! Upper management over paid an over rated ! I do not recommend working here ! The drivers / Csr / an techs r the back bone of the company !!
bad,Low pay for delivering around 350 plus propane tanks to convenient stores. By the time your done with day all you want to do is lay down. It was modern day slavery! I'm glad I ain't there anymore!
bad,"Dead end job with no advancement opportunities. Insurance is no good but the 401k is great. No support, work structure culture or backup from human resources or management. Company has cut workers to the bare bone while and rarely updates equipment even when needed. Equipment is often taped together or rigged to get through another work day. On the bright side they work around your hours."
bad,Beware lest ye explode. They will and do send unqualified personnel out on service calls. A quick internet search will reveal their dirty secrets. They'll kill you and say it was your fault. You must be licensed to go out on service calls alone.
bad,Management is incompetent and dishonest but I think that is just a local problem.  The pay is about right but you pay a lot for the benefits. Good coworkers.
bad,Was offered a full time position only to have them renig it away to give to someone else who had 3 dependents. Got offered partime instead for 40 hours a week but no benefits. I’d say discriminative to say the least. Dishonest people from top to bottom. Pure liars to the core.
bad,"Very high turn around, always under staffed,over worked, raises are not given, no appreciation at ALL, no bonuses and next to NOTHING for compensation on gaining sales. Managers are awful."
bad,"Management is the worst I've seen.  They cause havoc daily and put it all on you. Equipment breaks down daily and they expect you to handle it. Trucks with deployed airbags, no brakes,  no a/c and they still expect you to get 24 stops done in 95 degree heat then complain daily that you dont do enough for them for the dismal pay they give you.  Keep away from this place there's a reason they cant keep people."
bad,I wasted 2 years of my life with Ferrellgas they will run you to death and if you go above and beyond of what is expected they will having you do your stops and other driver stops also they can't keep drivers so they are always understaffed they will tell you anything to get you to work for them except in the peak season to run 60 hrs a week and you are on call all the time and I don't care what they tell you you will pull a 12 to 14 HR shift and turn around a few hrs later while sleeping and get a out of gas call and you have to run it and 3 to 4 hrs later you return to bed and sleep a few hrs and get up and run another 12 to 14 HR day and you will get called out  no question about it. As a driver you are responsible for everything like housekeeping all the up keep on the truck and making calls and setting up repairs for the truck you do everything and I mean everything on top of running you butt off during peak times and the pay is very low for what you do not even close to what you do the managers are over worked and spread thin I couldn't have asked for a better managers but their hands was tied and couldn't do much to make my job a little easier they was so short staffed
bad,"Suspended Friday & fired today with no charges or investigation  Stock prices crashed , company trucks are rotting away on wheels .nothing good  to report"
bad,The work ilegal about DOT hours. You never clocks in or out. Just report you hours at the end of the week. That’s way no body can’t tracking the DOT hours.
bad,"New management that doesn't know what they are doing. Gossip about their employees, scream at them in front of the customers. Very unprofessional, especially with employees"
bad,"Management was very bad, they lower your hours so you quit if they didn't like you, All my goals were high and management knew they had no reason to fire but I kept coming in with low hours, I had better call volume then other girls, I was always at top of list and they knew it and it showed on my paper calls which I kept for reference.  I was a very good customer specialists it was the management  that was very bad, after I quit all the other girls quit too or got fired."
bad,Good luck trying to enjoy family time in the summer because its not going to happen.If your single and dont like being home early and working every weekend than apply.
bad,Constant management turnover(4 om's and 3 dm's in 2.5yrs) and most had no clue about running a propane delivery location. Huge overtime all winter long - make plenty of money but no time for anything except work and sleep. Upper management will dump you in a heartbeat even if you work your butt off for them. Now only hiring seasonal and part time drivers with few benefits. Permanent employees all quitting or getting fired for BS reasons. Stay away unless you only care about the short term.
bad,"Poor management, no raises, no hot water in the restrooms , not allowed to used sick time earned, difficult to use any vacation,  they cut hours or make you work OT, inconsistent"
bad,"No current opportunities for advancement. No raises or bonuses in the last three years.  MAybe a good job for someone not working, but not good for long term."
bad,"Stay away! Was there for years and so many people come and go! People having liquid lunches, not following any policy but as long as your buds with a boss , then you get away with anything!"
bad,"Before employment, you are told there is a ton of room for internal advancement. After employment there is NO advancement opportunities, Seniority comes first over who is available for / needs work. Is a bunch of Micro-Management, a lot of favoritism."
bad,"a day filled with in coming and out going calls, many differnt customers you get to work with on a daily basis"
bad,"Being a material handler at Ferrellgas is more of a young man's job. Late 20s - early 30s takes a toll on your body over time. Work is strictly outside all year so expect brutal summers and freezing winters. Management looks at you like a piece of meat with no regard for your physical well-being. You will be given 0 responsibility as if you're a child with no common sense. Getting a raise as a material handler is like trying to teach a raccoon physics - not going to happen. But you're still expected to break your body to get the work done. ""Potential for bonuses"" is a complete joke, at least for anyone who is not management - they get bonuses regularly. The only path of advancement is by getting a CDL and becoming a driver, which if you look at their reviews, is almost just as bad. The company is run by complete idiots who have a complete lack of common Sense. Just compare the stock prices to other companies that supply propane."
bad,Co-workers were lazy and incompetent. Unfair treatment of employees. Poor communications. No recognition for accomplishments. Poor working conditions. Vehicles not maintained properly.
