rating,review
good,"Driver is a tough job, with long hours in the winter, and easier life i the summer, more commercial and no snow to march through, or drive on.  Safety is a must and a top priority."
good,I work here for a little over a year and everything is good here but in the summer time you only get 40 hours a week I like over time so it can get a little bad in the summer with not making enough money
good,Great atmosphere and friendly people to work with. Nice facility that it clean and well maintained. Would recommend this place to work.
good,"Great co workers, Great management team. Great hours. I love going in and loading trucks and being able to talk to the guys as they pull in."
good,"Love the people, love the job, love the customer.  Great place to work for would go back in a minute if it was possible.  This was such a great company we all cried when we were told that they was shutting down the office.   Love gettig up and going to work.  Excellent benefits."
good,The most important thing I learned at Ferrell Gas is dedication. I started from the bottom and worked my way up. I leaned a lot and I'm looking  fowards to learning more!
good,"The most important thing I learned at FerrellGas was dedication. With a great support system and dedication, skies the limit."
good,This was a fun work place. we work and when we had the chance we talk. we work as a team every day. we did lunch all the time.
good,I actually was hired on through Kelly Services and it did not take long at all to become permanent. The hours as well as the pay was pretty good! The job was so peaceful unlike a lot of call centers I've worked before.
good,"Great structure within the company, management could use a dose of humility."
good,A great place to work with safety issues taken seriously. I enjoy working at the company. Great benefits and opportunities for movement within the entire United States if you so desire.
good,Office had a 3 employee group. I performed my pre-trip inspection on the truck. Studied my route on my hand held mobile device. Departed terminal and began my route. The hardes part of the job was the risks of propane has. The most enjoyable part of the job was that I didn't have any pressure of other people looking over me.
good,"I came up from working into a full time position, obtained my State of FL propane licenses worked from the bottom up and learned every job from delivering gas, service work and sale along with writing contracts to Schools and was a District Manager."
good,A normal day would be coming in reviewing my route for the day and reroute the order of the delivery's to keep up with patterns and customer exceptance issues.
good,"They always treated you good. Good benefits, decent pay. Treated veterans very good!!!"
good,Petroleum companies audit accounts in 8 districts of South Texas checking all the accounts payable an receivables. Making sure all products are available for supplying the accounts an hiring an firing of employees.
good,"Good job, needed more money and more pay, had a great manager, enjoyed the people I worked with."
good,I worked for Ferrelgas for 13 years. I started out as a driver and worked my way up to management.
