rating,review
bad,They do not care that you have a home life!   during the winter months 5-8 add on’s a day on your route.  I repeat do not work for this environment!!  Very unhealthy environment and the avg stay rate of any employee is only 2-3 years.  I watched 3 General Managers quit in 6 months
bad,"Every day is very stress full. Orders are not correct ,charge customers to much for there product. Management is very poor and under trained. NO or very small raises. No set lunch time if you get to take a lunch. They do not promote form with in the company . They think you should be available for them 24/7/365 days a year .The guys I work with are great . The hardest part of the job is not knowing any thing they think they are the CIA. The most enjoyable part of the job is you meet a lot of good people"
bad,Overall corporate culture was not positive. No real management or HR person to improve processes. HR was not actively involved in changing or developing an open door policy. Policies were not in place for staff or management. HR dept was nothing more than 3 recruiters and that is just one piece to HR so individual managers were allowed to do whatever they decided - legal or not. I felt helpless to change anything in the dept. Pay was low in all positions and benefits were just average. Long days for all positions..expectations are 7 am to 7 pm minimum
bad,Work with some good people. Management not so great. Not sure what else I can write to get the minimum amount for this thing to let me finish setting this up.
bad,They tell you home every night worked there 7 weeks 6 week straight spent night out 1 week was training management and Dispatch said that's just how it is I hate when they lie to get you in the door
bad,"Very fast paced, always something to do.  Phone traffic was consistent and the customers were very nice.  Management unfair, loyalty means nothing.  Relationships in the office happening."
bad,"Safety is always our number one priority..... until the price tag comes in and then it is next quarters or next spring's or next year's priority.  We overwork and undertrain our employees and wonder why we can never hire/keep qualified and motivated individuals in my region. "
bad,"Should of closed at 4, cause was not busy to stay open till 5, managment was a hot mess, no vacation during winter months, lots of conflict between all stores, because of management.."
bad,"I stepped down for pay to gain the experience with hazmat and tanker. And believe me, I stepped down. They knew what they were getting from me with low pay and the work load."
bad,"Working day is Monday to Thursday 40 hrs per week sometime we work only 3 days or 8hrs on Thursday when production is slow. Paid is not good you start at $12.00 after you get hired on 90 days only you get is 75 cents more, total when you get hired is $12.75 we no anual increase. To start a job is good but for you get future salary is better find another job."
bad,"Hard to get hours in the summer, way too many hours in the winter. You're on call often including weekends and holidays without pay. No raises or bonus is worth mentioning. There is a serious division between white-collar and blue-collar workers. Blue collar workers are looked down upon. Nuff said."
bad,"Management is not professional, stressful working environment, you are expected to complete tasks you were not trained in.  Coworkers badmouthing the management and tasks at hand.  Customers were rude and overall the company was chaotic."
bad,"long hours no communication with upper supervisors."
bad,They say your job title is customer service and all they are worried about is regaining customers they have lost due the high prices. My walk in customers loved me and would ask how my life was and my manager hated that. A person cant help what the customer talks about. Its more like they want you to be a robot only. You are a paper pusher there. I don't think I would recommend this job to anyone!!
bad,Corporate mentality. Every decision is driven by the bottom line and shareholders. No loyalty to employees or customers whatsoever.
bad,"This companies' upper management team will run this place into the ground eventually! They make poor decisions which in return lose customers and in return, lose drivers' pay! The operations manager at this location is the only positive that the company has! But his hands are tied by the upper management which trickles downhill to the drivers! If you want to be told NO overtime and you like a company that's super unorganized and routes customers totally inefficiently then come work here!"
bad,"A typical day I answered 50-125 calls a day. During slower periods we would work on collection calls. We provided a lot of information about pricing, tank sets, sales of tanks, delivery orders, service calls, and anything requested by the client."
bad,No benefits and some workers lacked good work ethic. Large turnover and disorganized management. Company has since closed and has not reopened.
bad,"Typically have to load and unload propane with forklift, no management to report to in Fredericksburg, and only good part of working your back off is you get to work 3 days and have 4 off."
bad,"Very little supervision day-to-day.  Come in, inspect your truck go out and do your route.  Co-workers were great, but corporate puts tons of pressure on management to get the most out of the workers for the least they can.  The result is a cheapskate mentality, getting by with as little as possible and fudging the rest, with empty promises.   The most enjoyable part of the job was being out and about every day by yourself in the truck, making customers happy, and knowing that regardless of what the rest of the company is doing, you are a success."
bad,"expected to stay out until daily route is completed. inconvenient reload locations-mostly depending on route. inflexible requirements about staying on customers driveways- do not take into account narrowness or amount of curves. expected to work in any weather as if it was clear, dry and daytime. No incentive to bring in additional customers."
bad,Company fluctuated way too much with no defined plan to keep business level.  Company policies were sometimes a little too much and would rip off customers.
bad,"Work 20 hours a day trying to keep up, general manager unrealistic. Great people to work with, management poor. No set goals, day to day survival. Waisted 15 years of my life."
bad,Job was easy but pay is not what u would think you can make more driving a trash truck vs driving a propane truck
bad,Not a job for slackers but good pay if you like being called out of bed at night in the winter and never get home early in the winter.In the summer its better.
bad,Not a bad job if you don’t mind not making money most of the year.The only time you will make money is in the winter and don’t except a raise ever and if you do get one it won’t be much.A lot of favoritism as well and you are expected to do a lot.There are worst places to work but this isn’t much better!
bad,"Lift a lot of weight every day. Guys will not fully cover your route if you take a day off, leaving you to pick up the slack."
bad,Bad management.  Moral issues caused by poor management.  Untrained management.  Power/control issues with people placed in management positions.  Pay not up to standard.  They do have good benefits.
bad,Stressful working environment. No opportunities for associate workers to provide advice and support.  Constant phone interaction with irate customers whom felt unfairly treated by Ferrell Gas.  Short time given on phone with customer to satisfy dispute. Frustrating that customers needs were not handled properly.
bad,"Company is all about the bottom line, and will cut you out of the picture very fast.  You may work 40 hrs a week you may not. Routing is a joke and customer service is very poor"
bad,The day at Ferrellgas started out with sorting out all the mail and delivery to all departments. Moving of some furniture and answering questions from other employees regarding facility operations. Processed mail to go out and be picked up.
bad,"good workplace"
good,Decent job. Decent benefits. Terrible pay. Worked for 3 years never have I received a raise. Have to wait years for openings to be allowed to advance forward through company.
good,"They do cool things for their people but it doesn’t pay very well. Their compensation isn’t very good either. However, I have been happy with it for the most part."
good,Ferrellgas and Blue Rhino both in Taneytown M.D. Ryder tractors are dreadful and shouldn't be allowed on the road. Bobtail shouldn't be left out because they are trash as well. Newer trucks will be here in the next year or so. Management sucks at communicating anything. If your cross trained you never actually know what you're doing. Pay is decent if you threaten to leave. They will give you more money so they dont have to look for new employees.
good,I worked for Ferrell Gas 3 yrs they don't give raises or bonuses and management shows alot of favoritism with certain employees..if your looking for a secure job it's good but don't expect anything else. Also 10 months out of the year you only work 40hrs..
good,"I have only seen a manager 3 times in the last year. The last time was one I never met only coming by to tell me I was fired for ""talking bad"" about the company. Wonderful folks to be associated with."
good,When I first started working there it was good I got along with everyone but as time went I started to see why this job has a high turn over rate which I was even told by the Manager. This place will overwork you with no appreciation shown and the people that I worked with while I was there did not like being there and was looking for other employment. I learned how not to treat your workers and if an issue comes up between workers you deal with it in the manner it should be and not just blow it off like it isn't a big deal.
good,Great place to work for a new person out of school or semi retired.  Not for the person middle of the road in his career path. Very poor internal controls on cash.
good,"Poor management, pay is not good. Main job duties pump of railcar, pump propane, and run front counter. Daily bank deposits. The benefits were ok. You can move up to a driver or a service tech. I would not go back to this location because of the service tech is hard to work around and is not professional."
good,The company could be great as a whole but the branch I worked wasn't so great. The manager was unskilled and pressured drivers into unsafe situations. The pay was low for the jobs I performed.
good,There is little room for advancement or compensation. Most of the management is out of state and there is constantly a merging of service centers and major changes in policies.
good,"Amazing benefits, overall the company itself it great. Each region is managed differently, sometimes you get a good manager and sometimes not so good. Definitely not a transparent company."
good,"kind of ok. dead end job. being on call is rough. Management is very hard to deal with. decent people to work with, but the job is hard work for the money they offer."
good,Pay was good. To many consultants and to many changes for the bad.
good,"My immediate supervisors treated me well, the company is a good company to work for if you are willing to work very long days and don't mind leaving the comfort of your bed to chase out of gas calls."
good,"Winter versus summer is an amazing contrast. Summertime means hourly labor cutbacks, flex help layoffs, and major spending cuts. Winter becomes a hectic mess of long days and 6 or 7 day weeks with employees forced to work OT regardless of choice, and holidays missed due to callouts and weather swings. 70 and 80 hour weeks were not uncommon as a manager, with Saturdays and Sundays spent working in the office or from home."
good,I love my job just there is no advancement or incentives. I want to further my career and have job security
good,delivered propane to customers houses
good,delivering propane to customers or doing service work. not tough but not very organized and slow to make needed changes. People there are very nice but not good managers.
good,"Arrived earlier in the morning do an pre-trip"
good,I don't have much to write about Ferrellgas. The entire management was crooked and half of them were terminated due to suspicious company spending.
good,Management had their favorites that they would advance the rest of us would get excuses. They keep you at what they call flex which is considered part time but they wanted you to work 40 hours every week. It was a way they could get around providing insurance.
good,"If you want to get into the business its a place where you are trained very well, I leaned a lot as far as DOT requirements, and went through some intense safety courses with the company that put on in house.  The hardest part of the job is dealing with the management structure that seems too change very often."
good,"Management structure inconclusive, drivers and subordinates are not understanding who to report to and not management guidance."
good,"I worked in corporate offices in Liberty, MO"
good,Simple day consist of pre tripping your truck with cylinder count. Readying for route delivery. Pretty much on your own. Complete route and go home.
good,This was a workplace of relaxed atmosphere.  Everyone got along like family.  The job duties were enjoyable.  A typical day at work was setting up new client accounts and waiting on customers who came in to make payments.  The hardest part of the job was explaining to clients that they were not approved for credit and had to pay for gas upon delivery.  I did not leave voluntarily.  My job was eliminated.
good,"Taking care of customers needs to install propane gas to their homes for heating, cooking and pools. I was always very busy no down time."
good,"This was an excellent opportunity to learn the propane field. The customer base essentially wants to know just two things!. ""When am I getting my propane and at what cost"" That was our top priority to our customer base.  My days started by reviewing the previous day stats for my customer service reps. How many calls taken and how many calls dropped. Call volume was a seasonal concern, during summer months we were focused on getting our client base signed up for discounted propane when the propane prices have not increased.  I learned a lot about negotiation on propane prices, I learned quite a bit from the Director of Operations about thinking ahead to ensure that the employees were constantly seeking new customers whenever the chance presented itself. The most difficult part was learning the many reports and deciphering how those reports impacted my service center comparatively to the other internal service centers. The most enjoyable part was traveling to the different service centers, spending time with the customer service team receiving feedback and getting to know the staff!"
good,"typical day - prospecting new customers/existing customers for new business.  Coordinating with operations on customers waiting to be set."
good,"Job involves using a small tanker truck to deliver Liquid Petroleum Gas (Propane) to customer tanks (normally at home residences).  Locating customers in rural and semi-rural areas can be frustrating at times.  Frequent driving off-road requires special attention. Handling of liquid propane plus additional responsibilities of the installed systems (customer tanks, gas lines, appliances, etc.) isn't for everybody."
good,Salaried employee's work a TON of hours and expected to sustain that pace. 
good,Enjoyed the job for most of the years I was there. The Co-Workers in my department were the best. Although many are no longer with the company.
good,depending on office location must be able to work independently and with a team - Customers of Ferrellgas are friendly and warm - must have confidence in working on the phone with some cold calling must be able to prioritize as depending on the time of year the day to day varies in call and business volume.
good,"Not to much I can say about them, there pay is ok I guess. I doubt that they  give any type of a raise. The people that work there are good people who is just trying to make a living. The company sucks overall."
good,"Various jobs. Driver, maint. Delivery. As mngt. You have various skills, to gain. As employees you will learn by being cross trained, and learn gas safety measures for safety."
good,"No advancement, no raises to match inflation. Work hours are great. On call once a month for 7 days (required) different rates of pay for completing the same job. Managers hold employees back from advancing."
good,Poor upper management leads to high turn over in the field.  The company vison is not followed or in line with what is followed in field operations.  Employees are left with the uncertainty of always having a job or not
good,Average company to work for.  Manager is supportive and territory is reasonable.  The pay scale needs to be evaluated as it is different in every state.
good,This location has been through several management changes in the time since I worked here.  For me to review would be misleading as I have no idea what the current work day is like.
good,I been working there over 2 years. haven't received a raise. I work long hours during the winter. but it really slows down during the summer time. not a bad place to work.
good,went to another job for better benefits and more pay.  The job was ok but needed a better opportunity with a better grade of work and grade of pay so left
good,coworkers were great people. management not so much; didn't seem to care about staff unless they were making the numbers to make them look good.  Lots of policy changes and nickel/diming customers
good,Pressured to meet quotas for sales of propane tanks and rentals.      Pressured to keep calls with a very limited amount of time when at times seems nearly impossible with the information expected to enter into the software when setting up new accounts.
good,I have worked there for over 6 years and find it a very friendly place to work.  Long hours in the winter with the cold weather but willing to work with you.
good,"Good Company to Work For, But To Many Changes going on with management. Hope They manage things better and work harder on bringing in more work for the disposals...."
good,"very enjoyable Co-workers, never a dull moment.  A little more organization would be good but overall a nice place to work."
good,They only care about the bottom line not their employees. It doesn't seem who they hurt or whats best for the company further just whats best for the bottom line.
good,Lots of work busy days. Very long day during the winter. Shorter days during the summer. Still a full time job. Good supervision.
good,"Good training, Growth Opportunity, Demanding work environment"
good,"great atmosphere for an entry level sales position, good opportunity to learn B2B sales"
good,"Work day can be fast paced from 5 a.m. to 6 p.m. and requiring you to keep shifting gears to make sure customers are taken care of in the most efficient and affective way. During the few slower days you adjust to analyze future demand, equipment requirements and enact a plan to maximize utilization."
good,"I think for the type work and the hazardous conditions and safety requirements ... the pay should be higher. Benefits are standard at best. no pay for being on call , and many times you find yourself having to do more work because of lack of planning or scheduling... poor equipment to work with or none at all (no concept of having the tools or parts to get the job done. The people at my place are decent, management is typical (all about the bottom line, breathe and live propane, propane is the best thing that has ever happened to the planet)."
good,"again this is a place that trys to get by with very few staffing members, and then the customers are the one who suffer"
good,"I didn't like when we where short staffed and this happened a lot. We would have to do our shift and someone elses shift and do it all within our 8 hours. if we did not finish we would get yelled and told that we could not do any overtime. "
good,"The route management system has turned the driver into a useful idiot behind the wheel. Customer satisfaction is no longer the goal. Making a good score on your delivery route is. Competent drivers get the longest routes and most complaints about overtime. If you recommend  changes to benefit a customer (more cylinders or a better delivery pattern) and the computer disagrees, then you are wrong. Even if it is what the customer asked for."
good,"Ferrellgas for many years was supportive and pro-employee and customers.  The philosophy was to put the customers first, and the working climate was great.  Typically we would begin with our routes being sent, and we could use our experience and knowledge of our areas to run our route.  This changed this past year.  Bay City management sent routes that were inefficient and back tracking to run and and we were tasked with following them exactly or get scored poorly.  Many of us became ""seasonal employees"" who would be worked only during ""busy"" months, and benefits were dropped to seasonals."
good,"good people to work with in are division.Pretty much on your own,just get your job done and go home."
good,"A very challenging industry with many different variables to over come constantly each day. A great group of dedicated, hard working co workers getting the job done. Constantly changing management structure to try and find 'Better way' which lessens moral and productivity. It is very enjoyable accomplishing each day and satisfying each and every customer, some days being very long accomplishing that mission."
good,Laid off after working at the company for two months without the possibility of a lay off ever being mentioned during the hiring/interviewing process.
good,It was a sometimes stressful job when people didn't pay and techs were sent out to retrieve or lock off tanks.During a severe winter storm in the midwest we were the emergency call center and helped other stations take calls and assist people to get gas.
good,"Overall good company to work for part time. Full time not to bad but older trucks. Needing repairs a lot. Hours were good. Job of filling on other hand, hard to find customers, no one updated palm devise or routes. always calling dispatch can't find address or customers won't answer phones. Tank way behind houses in bushes, gardens, or just almost out of reach of hoses. Not driver friendly location about 50 percent of the time. Customers Out of gas calls high."
good,"3 person office and not enough work for us to stay busy."
good,"If you like being your own boss and dictating just how fast or slow you have to go, then this may be up your alley. Filling up propane tanks early in the cold mornings and delivering them to customers."
good,Was with this company for over 4 years. After being a material handler for some time I was trained for a driver position. The coworkers were long time employees all who enjoyed their job.
good,This is a great company to work for if you are looking for a stable long term career. The work environment is good with great coworkers. Management is very understanding will work with you if you have obligations outside of work. Overall a good place to work if you can handle working in the elements in good and inclement weather. Opportunity to grow and move forward.
good,Typical day would be working by myself working on propane bottles and when customers came I would fill them up.
good,I only worked here for two years temporarily and they knew that going in I was going to leave in 2 years. But during the time they accommodated me in every way because I was also going to school. Management was very friendly and talk to you real person. However I never received a raise and neither did my coworkers ever. If I had planned to stay there I would have made a bigger deal. The starting salary was ok but you can make more elsewhere. Easy job.
good,I wouldn't  recommend this job to anybody because of the dispatcher in this area. Lot of descent drivers to help out but the supervised are mess & won't  listen when there is a problem with dispatch.
good,"Ferrellgas has laid people off multiple times with absolutely no notice.  The former CEO is now back leading the company after a culture of a ""good 'ol boys club"" continued for a very long period.  I am hopeful that this can be turned around."
good,Company up held management  treating employees on a personal level instead of professional. Upheld management with changes employees hours based of personal issues and religious views.
good,Very excellent place to work good pay and benefits coworkers very cooperative and reasonable and a very fun employment and office staff are very professional at what they do
good,"Been working here for 7 months, and can’t complain about much. District manager is awesome, co workers are great. "
good,"Looking for a full-time job in the Human Services field with the same or better pay and benefits.  Currently obtaining my Master's Degree in Human Services Counseling: Addictions & Recovery, I would like to begin working in my field of choice."
good,"Family retained that home down feeling of home town business.  Many of the office workers were of the millennials generation, due to hours kept.  24-7 on call.  Benefits were kept for those that were full/part time employees."
good,"safely hauled propane with tractor trailer to 60-70 locations in 3 states,"
