rating,review
good,Overall experience was wonderful. Very nice company to work for. Learned  a lot from fellow peers and training was impecable. Everyone is out to help one another. hAS GOOD WORK MORAL THROUGHOUT THE COMPANY.
good,The company is a awesome place to work. If I did not need to move I would still work there. They pay you on time and they treat you with respect. The salary is also not that bad as well.
good,"Hasbro is a great company with a fun culture and fantastic people.  In fact, its the people are what make Hasbro so special."
good,"Start at 8am get assigned a place in the production line be efficient in product placement on the assembly line while working on my own and within a team. I learned about good teamwork, working on my own and efficient work schedules and targets. Meeting new people (co-workers and management) and working was the most enjoyable part of the job."
good,"de bons collaborateurs"
good,"Geen dag was het zelfde met alle verschillende werkzaamheden."
good,una empresa la cual me dio la oportunidad de trabajar con ellos en la temporada de navidad en donde me brindaron su apoyo y estaban muy pendiente del trabajador que no nos faltara nada y el ambiente laboral era muy bueno con los demas mercaderistas y con los jefes en donde trabajabamos 8 horas diarias de domingo a domingo sin descanso por la temporada en la que nos encontrabamos aprendi hacer mas activo de lo que soy a relacionarme mas con ls personas y con los clientes me costo un poco ser mas tolerante pero a medida que ivan pasando los dias aprendi hacer tolerante con las personas
good,"typical day •	Verify receipt of all packing slips and materials against delivery and post goods receipts"
good,"Llegaba a diario a acomodar la mercancia,limpiarla,y organizar los precios,y arealizar labor de venta,aprendi a ser mejor en ofrecer el producto y mas rapido,mis jefes , estaban muy contentos por mis logros y por el beneficio para la empresa,mis colegas buenas personas nos apoyavamos en lo requerido para mejorar el trabajo,y lo que mas me gusto del trabajo que era buen ambiente laboral y buena paga,lo dificil que solo fue por un mes porque la temporada termino muy pronto."
good,"I reviewed my paper requirements daily on the computer and made changes that were indicated by the system."
good,A fun environment but I am not a full-time employee; I am an outside vendor.
good,"My typical day at Hasbro Inc. is to oversee a Team in regards to an assigned portfolio;  to accomplish the necessary research and validation of deductions taken by our customers. "
good,"Trabalhei com boas pessoas ao qual aprendi muito e também ensinei fazendo o meu trabalho e colaborando com serviços que não eram de minha obrigação, porem enriquecendo meu conhecimento profissional e fazendo ótimas amizades."
good,Contacted several store per week worked about 15 hours per week
good,es un trabajo que me gusta pues siempre e trabajado en cadena de montaje
good,"Toys promoter at Toysrus, appointed by Hasbro Limited. One of my most challenging job to start opening up myself to talk to customers, promoting my products and helping them find what toys in their dream."
good,"Hasbro is a good company, the days are long and but if you put in the time you can get ahead, there's plenty of good people who are willing to help you grow with in the company."
good,"Absolutely one of my favorite jobs.  Unfortunately, as a contract position it doesn't matter how hard you work or your contribution to the team, they cannot keep you once your contract ends."
good,"Most management members in IT area are smart, nice and hard working. Like all organizations, some managers were not great communicators. Generally a good place to work."
good,"Travail répétitif, travail saisonnier"
good,"Experience tres enrichissante."
good,Typical day included unpacking stock and supplying line. Management were consistently monitoring our duties.  Co-workers were extremely friendly.  The hardest part of the job was constantly having to stand up and most enjoyable part was the great colleagues
good,I supported end users with computer issues via phone and remote access with Bomgar.  I also performed exchange administrative duties such as adding and removing computer access and setting password changes.  I was also in charge of set up and support of remote access.  I enjoyed working with my team.  I especially enjoyed taking part of the Partnership for Profit project team and would have loved to do more of that.  My least favorite part of working for Hasbro was that they did not promote from within.
good,"I had the absolute privilege to work with offices around the world to update their products each day. The teamwork and structure were there. It was a fun place to work. There was never a dull day. "
good,"Dynamic, ever- changing industry with systems and processes that try to catch up. "
good,entreprise qui permet divers emploies à la manutention.
good,Boa. Só o salário que precisa melhorar e organizar melhor as lojas porque como tinha que bater ponto terminavam os o trabalho às 15 horas e tinha que ficar até às 19 sem fazer nada.
good,"Working for a toy company can be very rewarding. Hasbro has a great corporate culture of community engagement, volunteerism and investment in its employees. "
good,"Supervisors used heavy hand and bullied.  Expectations were many times far to high for what employees could reasonably get done.  Although there was a union in place , they would usually side with management for reward and benefits."
good,"I was only at Hasbro for 6 months, but the team was exceptional at teaching me how toys were made and how to navigate through the departments at a new company."
good,"Great Culture, Great Product, Experience will vary greatly depending on team placement.  Management still struggling to embrace current culture"
good,"Trabajar en HASBRO ha sido una gran experiencia, tanto personal como profesional."
good,all and all good place to work lots of good people I worked with
good,i support production machinery and maintain facility.a typical day involves trouble shooting breakdowns and performing scheduled pm's.i regulary work with engineering to meet production needs.i work with the saftey department to implement saftey procedues and keep machinery and building in safe condition.
good,"very low key job, in between duties its a good job for doing homework! Great boss, good client, good co-workers. Can't complain."
good,While here I was able to explore a different realm outside of what I normally would do. I was able to also explore the workplace within which in turn provided me with knowledge and also a great environment to work in.
good,"Great team of people, hard-working but fun culture.  "
good,"During the quiet period a workday is days regular and early finish on a Friday.H&S is a priority on site."
good,Très bonne entente au travail;avantage du poste de journée.
good,"A typical  day at work consist of a heavy work load which was done with precision in a timely fashion."
good,"Leuk bedrijf, prima locatie, gezellige collega's en actuele producten."
good,"Hasbro has made moves over the years to make itself a leader in the toy industry. They continue to secure top franchises and expand. As a retail merchandiser, it was my job to ensure our products and features were all set at each location. I had an excellent manager who encouraged and assisted in ensuring my success. Across several industries and other work experience, I still find some of the best leadership having come from this organization."
good,working at Hasbro was fun and laidback at the same time management always seek to get the most productivity of the employees.
good,una empresa que su producto se vende solo solo es cosa de dar impulso a las ventas pero con la rotación y acomodo del producto para mas incremento en ventas.
good,"I like my work in Hasbro. "
good,"working at hasbro was enjoyable, co-workers were always helpful, management were always friendly and asking how the day is going with the work, there were no hardest part of job whilst working."
good,Azienda che rincorre la veloctiò anticipazione dei trend. Time to market.
good,Good company to work with. Management is very good & supportive.
good,I follow a scheduled route and call on three different accounts that carry my employers product line. I follow company procedures for each account. Which include locating and identifying product line in stock room then working with the accounts to get product placement on the sales floor. I am looking for a part time position to supplement my hours that I currently have with Hasbro.  
good,"Working at Hasbro was a great experience. It is a very professional place with high work ethic standard."
good,"Who doesn't want to play with toys all day?!"
good,"I was hired as a designer.  The design department was, in my opinion, in disarray.  There were several contractors on staff that were considered temps.  Not a way to run an efficient operation. This was some time ago so I don't know if the vision has changed."
good,"Key Responsibility of the role is to promote profitable growth of Hasbro brands in major global and regional retail accounts operating in multiple Asia Pacific countries. In partnership with Hasbro Global Brand Teams and Global Account Leads, to engage Asian regional and country teams to align, formulate and execute strategy to maximize sustainable growth by balancing company’s short and long term interest. Maximize Hasbro’s competitive advantage by dealing with these Global Customers on a unified Asia/Asia Pacific regional approach through qualitative relationships, strategic alignment, advance planning and business development."
good,"A very family orientated work culture. social events organised yearly, such as BBQ's. due to the nature of the business there are low and high periods of workload which can cause issues."
good,"great work environment"
good,"recolectar pedidos e inquietudes de los jefes de piso que visitaba "
good,"“Daily communication with Upper Management” regarding the several Certifications achieved by the company are as follows: ISO 9001, ISO 14001, SGP and three Chain of Custody Certifications. I create documentation according to the Standards set forth by these certifying bodies while maintaining compliance. Scheduling of external and internal audits annually. My co-workers are all 383 employee's, as we all work together, communicate and perform internal audits, relating to the Standards. The hardest part of my job is also the most enjoyable part, which is, maintaining compliance with Standards that are always being updated."
good,Great place to work with strong team environment.  Hasbro has really strengthened it's focus on Brand Execution and developing a full-faceted brand experience.
good,"contrôler des produis alimentaire"
good,i was an intern for the digital Marketing department for 6 months.
good,"Nice environment, produductive but fun workplace"
good,Relaxed yet challenging atmosphere. Team setting with cross-disciplines really helped me learn much more about the business than what my individual role might have allowed.
good,"At any point in my day I am on the phone or emailing with someone overseas. I am the primary contact for our Western European sites so I interact daily with co-workers in France, Germany, UK, Belgium, Italy, etc. I've learned to market globally rather then think US only. Our team has gone through many changes in the last two years, from management changes to work related changes. The digital team was a production team, we added content to websites and launched them. Now we are a digital marketing team, we are moving away from loading content and focusing more on what content should be created."
good,A faced paced and rapidly changing environment as the game board industry strives to meet the challenges of the digital age.
good,La gestione dovrebbe essere più attenta alle esigenze ed alle performance del personale.
good,"My typical day would start out around 8 am at my first store. Log into vendor log, then go to the toy department to find the department manager and discuss what I would do in this store for today. After a walk-thru I would scan empty peg hooks or empty slots on shelves for my product and proceed to the back stockroom to scan out products from the bins. After taking product to the floor and putting it out, I would clean up my mess, show the department manager what I had accomplished, have department manager sign my vendor log and head to my next store."
good,"Acomodo,chequeo de mercancia en bodega ,convencer qlos clientew compren los juguetes o buscar cada juguete que buscaban y no sefueran sin su juguete actualizacion de precion"
good,A typical work day is at the pace that you decide to perform. You can work extra hard and long one day so that others are more of an ease. Good for outgoing personalities.
good,Una empresa que deja huella en tu vida. muy humana y siempre muy humana.
good,"While working at Hasbro, I was challenged to use my design skills in CAD to develop products. This involved prototyping designs to test and debug problems."
good,Internship was very valuable.  As I worked there I gained valuable experience while working with an engaging team.  I was able to complete my Six Sigma Green Belt.
good,travail assez contragnant mais la vie de l'entreprise est chaleureuse.
good,il y a une bonne ambiance de travail l explication de Sécurité ainsi que le travail a fournir son expliquer correctement ainsi on peux évoluer dans un contexte de travail correcte et être productif
good,"Très constructif comme expérience professionnelle, prêt à refaire"
good,"promocionar y vender productos de la compañía, aprendí a "
good,"Great place to work, with good compensation and environment, but heavily relying on contract and temp workers makes it difficult to gain permanent positions in creative services. This ""revolving door"" of temp workers means that a lot of talented people pass through and are lost, and much time is pent getting new temps up to speed and proficient at their jobs only to be replaced again."
good,"Conducting an internship in the german office of Hasbro Toy Company offered me the ability to learn more about the toy industry, and get an inside look at the functions of a multinational corporation, especially within a marketing context. The most difficult part of the job was the language barrier, and trusting in myself to ask for help when taking on new projects. The most enjoyable part of the job was undoubtedly the coworkers I had the pleasure of working with, and the fun, relaxed culture of the company."
good,It would be unfair to rate this company as it has been over 29 years since I worked there. At the time it was a fantastic experience and I truly enjoyed selling the portfolio
good,"The employee discount for all company employees was one of the benefits I like from this company, because it aloud the employees to save money when buying toys from the company."
good,"This is a strong and stable company, that offers lots of opportunities.  Management does a good job making their employees feel valued, and are given great brands to work on."
good,"Segunda-feira dia de demostração de brinquedos "
good,"En constante évolution, le groupe s'efforce de laisser ses meilleurs éléments évoluer positivement et en totale autonomie dans leur emploi. La prise de décision est assurée dans un contexte serein dès que justifiée et argumentée."
good,aprendí muchas cosas como el llevar un control de cajas u producto por separado a llenar documentos y todos los días se aprenden cosas
good,"I did whatever I could to help the Planning Dept, Business Development & Operations. I am quite flexible in taking on any task and was honest in my opinion about it. When I found myself seeking a challenge in the work, I informed my superiors. When I found myself struggling, I dissected the issue to see what I could improve on and tracked the changes."
good,Hasbro Games was fun and exciting.working there made u feel like u part was of family
good,en este trabajo fue muy bueno por que te desempeñas solo y das conocer tus habilidades aun que con los compañeros casi no hay contacto ya que cada quien anda en su ruta pero es una buena empresa donde aprendes hacer responsable y honesto.
good,I had a great experience working there.  They treated me very well throughout my career.
good,"You get to play with toys and talk to customer in the store environment, its really individually driven which is nice for flexibility but can get lonely and it is a dying art so there are less and less opportunities for it."
good,"It's all enjoyable as you work with toys all day, you get to see new and exciting products and test them (play with them). The hours are fantastic 8-4.30, early finsh on fri. My job is very varied so i never do the same thing from one week to the next which is really interesting. I am a very flexible member of staff and have progressed from a temp to perm."
good,"° Pleasant people"
good,"Una compañía comercialmente desafiante, con una cultura organizacional enfocada a las personas como el capital más importante."
good,"Overall a great place to spend the work day. Very relaxed workplace (no strict dress code, etc.). However, there does not seem to be much room for advancement within the company."
good,"A Hasbro tem uma cultura muito forte atrelada ao trabalho em equipe, a busca constante por inovação no método de trabalho do dia-a-dia e ao aprendizado. "
good,"Great company, good benefits, friendly colleagues.  Flexible hours and management people are really approachable. A lot of challenges for people like I that loves being challenged."
good,"journée type, 7h de poste et une pause au bout de 3h30 de travail de 30min"
good,"Entreprise en pleine restructuration."
good,Great place with happy workers. Management is knowledgeable and workers are happy to be there.
good,"Everyday you will have a scheduled store call. Generally this store call will be at one of three major accounts; Walmart, Target and Toy's R Us. Each day you will fill home locations of products, set displays and ensure features are set."
good,"Daban buenas prestaciones de Ley, Nos daban uniforme completo con todos los materiales para trabajar"
good,"If you enjoy fast paced fun...this is the place for you."
good,Una empresa excelente en trato al empleador y buenos en sus productos.
good,"Buen trabajo en equipo, y ambiente tranquilo entre todos"
good,Managers care for their employees very much which is a positive. Because of the fact your on a assembly line all day you develop a skill to be quick and percise.
good,"permite, favorece e apoia os funcionários dando oportunidades de crescimento dentro da empresa visando o bem estra e satisfação de ambas as partes"
good,* independant management skills
good,"fue un buen trabajo, teniamos horarios de descanso y almuerzo y el ambiente era agradable."
good,"Great company to work for with nice people in the company"
good,being able to design for the marvel toy brand in itself was just awesome. there would be times when I would be designing and toy helicopter prototypes would crash land on my desk. but on a serious note they have an amazing team of artist and visionaries that know what the future in toy business really is.
good,"Uma otima empresa para se trabalhar, principalmente para adquirir experiência, aprendi muito, sei que ainda tenho muito o que aprender e tenho muita vontade e disposição para crescer dentro de uma empresa."
good,"the company is great the consumer finance dept is not."
good,"I would assist with projects in both production and post production."
good,Great place to work and grow. Everyone is friendly and the work environment is hardworking and relaxed at the same time. Great career growth and opportunities.
good,This was the best company that I have worked for to date.  Everyone was so very friendly and worked very hard.  I worked for the  Research and Development Manager.  It was such an imaginitive department and I enjoyed working there everyday.  The management on every level were all amazing to work with.  I learned a lot working at this company regarding the new developed toys and different programs that they utilized.  I still use my knowledge from working at this company to date.
good,Working at Hasbro was a lot of fun. I worked on the Star Wars team during the realest of the new movie and it was very exciting! I learned a lot about the toy process.
good,"My experience as a blue sky product designer for Hasbro in Rhode Island was with brands like Star Wars, Transformers & GIJoe. The history and the lifespan of the brands and products created for the brands was a learning experience in and all of itself."
good,"I spent 18 years working for Hasbro Toy in Pawtucket R.I. Finishing my time there as Director of Model Services which was the prototyping division in which we worked closely with engineering, marketing, design and manufacturing to develop new product to hit the shelves annually. Awesome environment, great people, toy fairs in Manhattan,  NY."
good,"Great people and great products. Way too many chiefs and not enough indians. Marketers have too much power over brands and products. Compensation isn't great if you're a full-timer. But if you love toys and games, it's the place to be."
good,"I loved working here, shame it was only temporary work though. Would go back in a heartbeat if it fitted around my children's school hours, the staff were fab too."
good,A fun and inspiring workplace. Enjoyable and hard working team and supportive management. Friendly staff and a strong learning experience for all student co-ops.
good,I had fun working with Hasbro. It's a very tight family oriented place to work for.  They don't hire to many temps.  Very difficult company to get into.
good,"El trabajo se realizaba dentro del supermercado Tottus en chiclayo , tenia que impulsar el producto que era jueguetes paa niños"
good,Entrete pero poco dinero a comparacion de otras empresas simpatica la supervisora nada qe decir
good,Staff members were enjoyable and a joy to work with.  I loved working there!  Very good compensation and benefit packages.
good,I enjoy helping to solve consumer issues regarding Hasbro products. I have learned that good customer service leads to a great customer experience.
good,"Wonderful environment to develop research, analysis and creative and conceptual skills .....continuous new product development too.....licensing, packaging and sports and entertainment all in the same place.....Outstanding Opportunity"
good,"With the many brands at Hasbro, there is growth happening in every way with a need for extremely innovative product design."
good,Enjoyed working at Hasbro.  Position was eliminated during reorganization of company.
good,"I would keep a spreadsheet up and make additions and review any changes or problems. Took phone calls and messages for manager. Assisted the procurement team with unloading supplies. Most enjoyable part of the job was working in a happy environment with lots of toys! No hardest part, except, maybe, the commute."
good,"Saha sorumlusu olarak görev aldığımız iş hayatında devamlı yeni bilgiler,yeni aksiyonlar almamız ssebebiyle özellikle her oyuncak sezonu eğlenceli dahi geçse bir o kadar da yorucu bir iş temposu oluyordu. Hem yönetim hem ekip olarak çok güzel işlere adım attığımızı düşünüyorum"
good,Great company with an impressive portfolio of brands. Everyday was new adventure and you never really knew what you would to expect. There was always something fun going on.
good,Empresa buena con capacitación constante y buenas prestaciones
good,"Sempre fui eficaz no meu trabalho, pois obtive excelente conhecimento de todas as tarefas operacionais necessárias. Aprendi a liderar e trabalhar com o público. Realizei tambám trabalhos de merchandising, sempre promovendo vitrines, para posicionar nossos produtos."
good,"Very good as far as a structure is concerned, very specific about accuracy and working standards, which helps any individual to grow in their specific area.  I have learned a lot in terms of credit control practises and government regulations. Achieved KPI's through out by maintaining DSO and also by SOX testing compliances. Management is highly qualified and always willing to teach and motivate."
good,Hasbro takes into account that you have a life outside of work.
good,"Hasbro uk is a fantastic place to work because of the culture, people and professionalism, Hasbro UK is now a small development site from its former days, however the extent of knowledge and historic skill base means that through its ever decreasing size it relies on a few to know and do alot.. As most senior management are now US based ,the character of this unique site is not fully understood, this can be a little frustrating, but on the whole, its a fun dynamic place to work. Hasbro is enjoyable experience because of the fun atmosphere and the great product portfolio."
good,"Bons profissionais, função tranquila. Conheci alguns coordenadores."
good,muy buen trabajo y buena ambiente  entretenido dinamico muy buen trato
good,Travelled to different stores daily.  Part time hours.  Stocked shelves in stores with toys for the Christmas season.  Hardest part was locating items in stores warehouse.
good,Hasbro has been a wonderful place to work.  They strive to become one of the best place s to work and this is truly a great place to work.  Managers serve as great mentors to foster growth and career development
good,"J'aime bien travailler chez asbro .je vraiment aimé l'ambiance, le superviseur,."
