rating,review
good,"At Hasbro you are part of a team. Senior leadership is accessible. Meetings provide everyone a chance to weigh in in order to make the best decision possible for the company and the brand. Very thorough in analyses, creative direction, and management style."
good,Great place to work! The company has many talented individual and they definitely work very hard and play hard!  I have learned a lot about toy industry.
good,Great opportunity to develop experiences in assembly and warehousing. Enjoyed working there. Location was not currenlty convenient for me otherwise I would have continued working there
good,"J ai bien aime mon experience de travail."
good,I would work for Hasbro until retirement if I could! Typical days ran smooth. Management was amazing. Hardest part of the job was that I couldn't stay on with the company!
good,great job; management was kind and very understanding. they helped employee meet and exceed quotas. Never had a problem with any coworkers. The only reason I left was that of temporary job placement.
good,"Worked as an intern. Everyone is very cool, calm, and friendly."
good,"I love it here at Hasbro! #DreamJob"
good,"fue divertido trabajar, el trato era bueno y puntuales en el pago"
good,I was a great place to work especially for co-op. Would recommend to anyone in a an instant. Great people and have a very design culture. Rhode Island was not nice though
good,This was my very first job out of school and I have to say it was the best education for me going forward.  I learned so much from so many people here.  I was very thankful for my experience at Hasbro Inc.
good,"Entretenido, variable y divertido. Hacer ruta hace que el trabajo no sea monótono y te permite conocer muchas personas nuevas."
good,"Azienda globale piena di innovazioni. Nel settore retail con sedi in tutto il mondo. Grande senso di team work. assumono un buon metodo di team work. Hanno clienti in tutto il mondo."
good,"I believe Hasbro took the time to not only verify applicants' backgrounds, but tended to hire friendly, exemplary people."
good,"Aprendi a surtir mercancia a piso de venta, colocar material pop, limpieza de anaqueles y a cuadrar inventarios."
good,"Es buena opcion laboral, compañerismo, capacitacion"
good,I you like working 10-12 hours a week this is a great job. Merchandising is a great way to meet people and work with different retail companies. Working with toys department managers is very rewarding.
good,"Really good company to work for. Lots of projects going on.  Opportunities for development aplenty.  Working at Hasbro was challenging , stretching and rewarding,."
good,"A typical day at work is maintaining the daily work force of all the banks activities from Canada, South America and Europe. Communicate with management for daily settlement status. What I learned from Hasbro Inc. is that we are a family and we stick together. The hardest part of the job is the end of the month closing but we always maintain a positive attitude. The most enjoyable part of the job is the toys and the fun activities Hasbro Inc. provides."
good,"I enjoyed every minute of my time there we were able to prepare all meals and foods from scratch which I enjoy, we were able to interact with customers which I enjoy as well"
good,Seria mas facil si directamente pudieramos subir el currículum sin necesidad de modificar todas las experiencias!
good,"Working in a fast paced environment packing orders ready for despatch"
good,"buen compañerismo , se aprende mucho en el tema de exhibiciones "
good,"Although the job was Seasonal, it was a great company to work for."
good,lo que mas me gusta de este trabajo es brindar atencion al cliente
good,"con muchos beneficios, tiempo para tomar un cafe, la hora de almuerzo era respetada, excelente equipo de trabajo, amplio conocimiento en el area de trabajo fue la parte mas gratificante"
good,Amazing Place to grow your career. Great leadership and opportunities to grow as a professional. Good benefits and travel opportunities.
good,I was given a lot of trust on building a concept/doing research/making prototypes. Great people to work with - everyone is really creative and helpful.
good,"Hasbro was everything I'd hoped it would be, they were professional but still managed to have fun with what they did. It was an honor to have worked there."
good,"Fue mi segundo lugar de trabajo. Aprendí contabilidad sin estudiar este ramo. Con la ayuda de un compañero que sí era Contador Títulado."
good,"Super équipe, un plaisir d'aller au travail !"
good,"Fast paced warehouse environment. Good team players. Management will progress you. It is hard physical  work having to met deadlines ,but good friendly environment ."
good,Hasbro was a great place to work.  I was able to learn about different aspects of the design process of a toy along with learning about 3D prototyping and model making.
good,"choosing which days to work in the week is up to the merchandiser"
good,It was an amazing experience. I was able to learn from highly experienced managers and executives as well work closely with several teams throughout the company. I was able to take skills and experience from this opportunity that match perfectly into what other employers are looking for in my field.
good,hard labour but good fun the staff were great mainly worked behind the line or nesting department would have stayed if hours were better
good,muy agradable poder ayudar a los clientes a salir de sus dudas.
good,"trabajo por temporadas dia del niño y  navidad, en tiendas del centro de concepcion siempre he tenido grato ambiente laboral"
good,"I started at the bottom and made my way to the top and wish I had never been let go... Just an amazing place to work. Team spit, team growth, individual growth and some of the best people to work side by side with."
good,"	Processed High Volume of Vendor, Intercompany and Importation Invoice’s"
good,"Everyone here is kind, easy to get along, the IT department is unified, we accomplish a lot of work with a small group."
good,Work environment is flexible and relax to work. Its  fun company to work for and everyone is willing to help. Work/ life balance provided motivates to work harder.
good,lo primero de cualquier dia de trabajo es llegar ami tienda asignada saludar alos encargados del area donde vaya arealizar mi acomodo y despues checar mis muebles que mis juguetes esten bien frenteados  que mis anaqueles esten limpios y rellenar los huecos que se tengan saludar amis compañeros siempre y cuando no perdiendo tiempo enmis labores yme gusta mucho mi chamba el material la mercancia que manejo todo.
good,I loved working at Hasbro and thoroughly enjoyed my time at the factory.
good,"el trabajo es muy bueno y ademas haces ejercicio "
good,"Cooked exciting meals for the creative hasbro employees,had a awesome time doing my internship there."
good,Currently working on a consulting project for IT/Finance department.  Working in asset management for a business practicum. (MBA)
good,I loved working at Hasbro and would still be working there had i not moved to FL.
good,"Even though my job with Hasbro was only three months. I had a great time working with them. The people were fun the job was fun. Also everything you did like driving, supplies for the job was all reimburse to you."
good,"Fun and educational place to work.  A place to grow.  Setup machines for making puzzles, and games.  Helping women put together games and troubleshoot machines."
good,"I got to learn about the toy business, go in and out of every major retailer, perfection in inventory management. Build strong relationships with multiple managers of all the stores. Merchandising to it's finest extreme."
good,Hasbro is proof that work can be fun. Everyday was a new challenge. The partnerships and relationships built over my years at Hasbro will last a lifetime.
good,I learned all about the design and development process from concept start to shipping out product to stores. A really great place to work. Co-workers enjoy their jobs and are happy to help led you in the right direction.
good,"I would work with the sales force for Northern America except for east coast, but with two different divisions Hasbro & Playskool. It would keep me very busy, different time zones with the sales force so you would have to prioritize your daily work and manage your correspondence with them."
good,"LLegaba saludaba al encargado del departamento, preguntaba si tenial algun pendiente, hiva hacia la bodega para sacar mercancia enseguida la acomodaba conforme planograma,enseguida se hacia limpieza se ponian precios, y cuando teniamos exedentes de mercancia se hacian exiviciones, aprendia a trabajar en equipo, la parte mas dificil es ganar espacios adicionales ya ke todas las marcas quieren espacios adicionales pero aun asi se lograban conforme el servicio en la tienda, y la comunicacion con el encargado de tienda lo que mas me gusto es ke es un muy buen ambiente de trabajo, porque havia muy buen equipo ya que si tenia mucho trajo entre los mismos cmpañeros podriamos ayudarnos entre si."
good,Loved working the assembly line and boxing things. Also loved my co works and looking at the New games .
good,"a typical day at work start at 8 o;clock go to our productive line with my team have our own table, gun tape and productive labels and safety knives. We would have a pallet of 9x5 boxes of toys we would work that pallet and stick the productive label on the toy. We would build CDU's product to promote toys & also build FSTU's to promote toys. Management was really great they would time and watch us on the line floor. My co-workers was really great got along with everyone and got involved with everything. Hardest part of the job was build and filling the FSTU's, most enjoyable part of the job was being involved with everyone in my work."
good,I was assigned to 3 machines and would set up the required items
good,"el trabajo consiste en ordenar y promocionar los juguetes , saber como se utilizan , las edades recomendadas y el precio lo que ayuda mucho en las ventas; aprendi a usar basicamente las cajas , la gerencia fue muy amable y de buen trato , los colegas muy simpaticos y con toda la disposicion a ayudar; lo mas dificil y agotador fue el orden ya que fue para el dia del niño donde todos estaba en el suelo , y lo que mas me gusto fue el ambiente y la disponibilidad de la gente del lugar"
good,A typical day at work is really good everything is organize. is a easy job. the co worker are nice. i like working there.
good,"In my years at Hasbro, Inc. I've experience nothing but excellent working conditions. The people were very supportive and we all worked as a TEAM. I've dealt with people from all countries all over the world and customer service was at the top of the list. Management would always work with you to advance. My co-workers were like family I always helped in any way I could and would be a good listener. I enjoyed my job tremendously and I loved dealing with people and the different personalities. I've learned so much over the years and I take all that information and experience with me in whatever I do."
good,Hasbro games was an excellent place to jump back into to work force. Provide most of my factory work experience.
good,8 oclock start thats not to early worked in vas and unloading lorries enjoyed working there hoping to go back in in august
good,"I enjoyed growing and learning about Hasbro.I was able to work with the employees there for a year, and as my first corporate job, they made me feel extremely comfortable. As well as feeling comfortable, I was able to learn a lot through my experience and would recommend Hasbro to any individual interested."
