rating,review
good,The company mission is is driven by employee engagement culture with the addition of best talent retention programs designed to improve customer satisfaction and provide the best service possible.
good,The people are what make working for Land O'Lakes a great place to work!  It is OK to be your true self. I have been with the company for many years I love the rural/farmer values.
good,"I LOVE working at Land O'Lakes because we get all the benefits of working for a fortune 200 company but down-to-earth values and a fun, collaborative culture.  My team is like a family- every day coming to work feels like I'm hanging out with friends and we are more productive and efficient because of this.  I enjoy working for a growing, increasingly diverse company with a stable and bright future!"
good,"Land O'Lakes is a fabulous opportunity to invest in your future career.  Excellent growth opportunities with great leadership and team structures.  The best company, I have worked with throughout my career.  The people are just wonderful to work with every day."
good,It is great to be part of a company that is focused on feeding people - a great mission!  The culture is also very inclusive.  I enjoy my co-workers and am proud to work at a place with strong agricultural expertise and a powerful membership.
good,"I love working for Land O'Lakes!  It's a well-known company that is doing meaningful work that has an impact on the world around us.  I receive great support from my manager to help me improve individually, but also to help make process improvements to streamline the way that we work.  The team surrounding me is fantastic as well.  I would highly recommend working at Land O'Lakes!"
good,"One of the best parts of working at Land O'Lakes is being part of our purpose of feeding human progress.  My job is challenging and rewarding.  Every day is not perfect, but I feel very supported by my boss when things get tough.  I am fortunate to work at a company that I love and have been able to grow my career here."
good,Good work culture and safety been the number one priority. Good co- workers that work with a sense of purpose. Diverse work force and the pay is right.
good,If I didnt relocate back east I would have stayed with this company the rest of my working life.  If you like to drive fork lift it's by far the best place to go.
good,"was responsible for upkeep on ammonia compressors also preventative maintenance on boilers, ice banks, whey separators, dryers. Familiar with fristim pumps."
good,Being a Sr. QA Analyst this company has the best work environment I have ever worked. The QA manager was very supportive in taking the ideas and plans for the project and the QA analyst and automation engineers were very manageable and supportive when meeting the deadline of any project.
good,Land O Lakes is a great place to work. It has a new building with alot of amenities that are really great. The people are friendly and the work life balance is great.
good,"Very busy place. Prep your kitchen and start cutting chicken! 1 inch by 1 inch by 1 inch. You're working for scientists you have to get it right."
good,"This is a great company.  I always looked forward to the free fruit that we would receive on Tuesdays. We had a open-book management. Every Thursday was a company huddle, that would consist of the whole company meeting at 10 am to openly talk about the Pro's and Con's of our company. We had a Summer company picnic. The company also would give all employees a chance to go to the Cheese Festival in Shelburne, Vt. And I will miss the  goody box that we would get around Thanksgiving. I thought the company party at Xmas was  the greatest. We would receive a bonus. And in the first of the year we would find out  about the profit share bonus."
good,Land O Lakes is a great company to work for. They truly care about their employees and their costumers/consumers. They encourage each employee to follow their dreams and will help you to reach your goals.
good,"Land O' Lakes is a wonderful company to work for.  Great work environment, offers great benefits. Flexible work arrangements.  Offers classes to better your performance"
good,"after a huge downsize i was given the unbelievable opportunity to take the position of Credit Manager over 5 states which keep me busy but I loved it.  the company supported every aspect of the job and encouraged me to learn more about what our clients (farmers) did. Being from the City and working with Farmers, it was fascinating to learn about field crops, yields, fertilizers and etc. The hardest part of the job was know that a difficult year had past and the farmer hadn't made his estimate of yields and still had to pay the balance for products.  The best part of the job was travelling to meet each one of them and knowing their circumstances."
good,"i loved this place. the cheese department closed down, therefore there was a massive layoff . 153 employees were laid off , i was unfortunately one of them."
good,I enjoyed my employment with Land O' Lakes in Central California. This company compensated their employees well. They offered great benefits and retirement.
good,"Great project, great people and great food. Land O' lake Egypt was great experience and fun filled. Studying the agricultural value chain and sweet potato production system is complex and fulfilling to decipher and map out."
good,"Excellent company with great opportunities. Sales and Sales Management over 12 years with excellent results. I had 10 staff and $10M of sales to manage. Prepared budgets, forecasts and managed P&L with fact based metrics plan."
good,This was a very easy place to work. Got along with everyone. The management was very helpful and understanding if there was a problem.
good,I enjoyed volunteering for the many opportunities the Company offered. They are very generous with giving to the Community. Every one I trained with was very kind.
good,Well oriented personnel and have good management they give us all the benifits we need and a very profetable company so enjoy working with those biggest cows.
good,I haven't gotten a job yet from this site but I'm pretty sure I will get a good permanent job. I have heard from plenty of people that this site is great.
good,"Work is buys and fun. "
good,It was always a good day at work. I learned alot of new and interesting things at this job. I loved all of my mangers they was very nice. My co-workers were very nice. There was nothing hard to my job. I liked everything about my job!
good,Great place to work along with great people. Work flow was always consistant and challenging. Management  are great people to work around. Very informative and always busy. My co-workers are the best people to work with. The hardest part of my job is when i have and issue due to missing paperwork. But as odd as this sound I very much enjoy the challenge of figuring out the issues.
good,was just a great place to work with a lot of great and fun people
good,Great learning environment. The culture was very supportive and collaborative.
