rating,review
good,"This review is for a factory job in a factory that no longer exists.  Land O'Lakes had a bunch of tiny factories all over the place, and had to consolidate due to pressure from market forces"
good,great working with people and animals. well paced job and relaxing. got to learn new things and activities you learned threw out the day.would deff recommend it to anyone.
good,I worked the night shift so there was not much interaction with the company as a whole. Enjoyed the time there and the company treated everyone fair.   The hours were 12 hour shifts 5 days a week
good,"It was too long ago to recall enough details to give a fair rating, but indeed is making this review required so I will rate them 3 stars.  For  most things they were pretty good."
good,Land O'Lakes is a terrific company with great work life balance.  It's company purpose is very motivating and it makes working there bearable given the limited advancement opportunities.
good,"Co-op company owned by farmers. Three divisions, advancement is available in all areas. Connections matter here and each location has a different culture."
good,"stacking skids,learned about butter, management didn't really know ,co workers were nice, 12 hr days 4 20 min. breaks ,going home it was all work no play everyone had their own job and stayed busy meeting new people had no pool table,ping pong table,i was only there month family issues"
good,The company has a strong age bias; younger workers are given more opportunities for training and advancement.  The age demographics of the Land O'Lakes workforce do not match the age demographics of the Twin Cities area.
good,"The location is the largest milk processing plant in the East Coast."
good,"Responsible for maintaining relations, answering phone, taking feed orders, training office coordinator to use computerized Batching System Program to make feed, sorting and delivering mail, and setting-up a breakdown system for scheduling feed output to communicate with production managers.Responsible for maintaining inventory levels – ordering and updating perpetual levels in the computerized batching system, system on Lotus 1-2-3 graphs and spread sheets in both Lotus and Excel."
good,"worked at a branch office, very small location. Can't give much a review on this. I enjoyed it fine. Do not want to write this review."
good,"Working at a cheese factory is not for someone who wants to work at their own pace. You move as fast as the machines move, and if you don't keep up they don't stop for you. Same thing goes for when you are doing sanitation, you have to be on top of your cleaning cycles otherwise you won't have all the machines clean for production and that is frowned upon immensely."
good,fun and productive place to work and the people was fun and easy to be around
good,Rush from meeting to meeting.  Manufacturing facilities micromanaged by corporate leaders.
good,I enjoy working in the manufacturing industry.I am just looking for 8 hour shifts now.I am a fast learner and work well with others as  well as  working on my own.In my spare time I do photography.It is a passion of mine.
good,"I've worked for two other large companies in the Ag and Food Industry in my career, and I enjoy the company culture at Land O'Lakes the best.  I'm allowed to leverage my passions in the work that I do, which is a true blessing.  The company is honest about where they want to go in the future and about the realities we face each day while we try to get there.  It's not always easy, but I feel like I have the support I need to succeed."
good,"The people (co-workers) are really great."
good,"My experience with this company was limited in nature, being employed by a subcontractor with funding from Land O-Lakes.  However, through interactions with their Mindanao Program representative, I was impressed with how said representative coordinated with the different stakeholders involved in the program at the same time acknowledging the expertise of the  subcontractor research team members."
good,"Great Admin job, learned a lot about IT.  "
good,"My co-workers were great to work with. I picked up extensive knowledge in Oralce PL/SQL programming. The management was ok. They had a lot of systems on different platforms and versions, that made it difficult to exchange information between the systems."
good,"Land O'Lakes Inc had a clear mission and values; however, it was not enforced in the portion of the company that I worked in.  I worked for a very small group with many cliques that I just didn't fit into.  Overall, the benefits were great and flexible, but I think my specific group was poorly managed and lacked organizational structure."
good,"Land O'Lakes, Inc. is currently (2019) going through numerous transitions and employees can feel the tension of cultural shifts within the workplace, because things have not settled quite yet. This feeling of uncertainty is difficult for me, because I am not sure where or if I have a place in the company OR if I will like the culture once everything has settled. I appreciate that Land O'Lakes offers a good amount of paid time off, ""summer hour"" half-day Fridays during the summer, and a ""Dress for Your Day"" dress code. This reflects an understanding that employees are whole individuals, not just workers. However, at the same time, I do not feel like I have opportunities for development nor growth - and can sometimes feel like a cog in a much bigger wheel. Working for a cooperative is a major asset though, because that wheel (in which I am a cog) is not only about making money, but also about making a difference for farmers, agriculture, and the world. I feel like working for a Fortune 200 cooperative has all the benefits of a massive corporation, but doesn't come with the guilt of selling out to big money."
good,"Land O'Lakes values their employees and ensures that they have a balanced work/life environment.  They also offer competitive salary, flexibility, and benefits."
good,I am continually learning new things in the course of my work and love that I have the opportunity to take on new challenges and figure things out.  I have amazing co-workers and really enjoy working with them.  The people and the culture are part of what makes Land O'Lakes great!
good,"There is a common theme of longevity within the company, from the first day on it is noticeable that individuals tend to stay with the company. There is a good visibility of Presidents/ Vice Presidents within the divisions, but not with CEO, COO, ect."
good,"Growing up in a small town in rural Wisconsin, Land O'Lakes quickly felt like home to me. The small town community feeling where your co-workers have your back, you can strike up a conversation with anyone, and we all feel like we're working towards a common goal - all reminded me of my small town. After 8 years, I'm still proud to call this company 'home.'"
good,"Processes were not effective and therefore getting projects done was difficult and frustrating. I need to work smarter and not harder. Pay as not very good, but they generously contributed towards my retirement and health care."
good,"Ben put in intervention 3 times for braking hard. Last one was at a gas pump. Few issues with that but other than the privacy issue with camera, great job. Not very many hours of overtime in the winter months but great in spring summer and fall. So far....."
good,No chance to get hired as being a contract worker as they are letting their full time staff go. Sometimes I think I'm safter being a contract worker. The pay is poor.
good,Can't give much since I'm a temp and they don't include temps in any work picnics or anything else since we are not employees.  Pretty laid back as pond long as you get your work done.
good,The people were generous in transferring their knowledge. Management's bottom line approach failed to resolve long-term issues.  Rotation program not offered to all.
good,"Land O Lakes was a good employer, the area was just not for me. I was relocated to another area and enjoyed my time spent there but found through time it was not the right fit for me."
good,"All new management in R&D was terrible.   They do not have any ""game plan"", only try to please their manager - this does not allow for a cohesive strategy ... though other than their personal career, I do not think they care."
good,"An important part of considering working at Land O’Lakes is to realize that it is more than just the Land O’Lakes that you think of with butter."
good,"Working for Land O'Lakes corporate as a contractor, you obviously do not get the full benefits of being a full timer. It can sometimes get as bad as employees treating you differently just because the realized you're a contractor."
good,"Land O'Lakes is a good place to work.  Most of the people are great to work with and I've had solid work experiences thus far.  The culture can be a bit slow paced, especially when it comes to decision making."
good,"Land O'Lakes is a thoroughly interesting company. I never thought I would in the agriculture business, but I'm glad I landed here. They brand themselves as ""farm-to-fork,"" and it's a true assessment of their business.  It's not just butter. This company is food production from beginning to end. It includes seed (WinField United), feed (Purina Animal Nutrition), dairy (butter, spreads), and a global nonprofit. It's a Fortune 500 company that feels like a small company."
good,A decent company that needs to move faster and build a better office to attract top talent. Hours are great and summer fridays are a nice touch. But old world mentality made it a difficult workplace for me.
good,Friendly staff very professional brakes every 2 hours and lunch are on time provide you all the personal protected equipment provide water shade and portable bathrooms on every field
good,"A very well run facility that has passionate employees.  Managers were friendly and off site everyone was like family.  A large facility with different businesses, it was challenging and a great learning experience for me."
good,It was a nice place to work. We were an awesome team. Casual dress code which made it very comfortable. Very stressful at times.
good,"Work started at 8am-5pm, great opportunity to gain laboratory experience for a undergraduate. fun working environment."
good,Corporate headquarter location is a great place to work. Other locations can be different. Opportunity for growth can be dependent on which department you work in.
good,"As a recruiter, I've had the opportunity to work with many excellent hiring managers who care about talent and developing talent. Managers are approachable and dedicated to bringing in top talent and working closely with me as their Talent Acquisition Partner to achieve that goal. Also, I'm challenged with projects that stretch me and keep me thinking about innovation."
good,"Great work environment and culture. Positive atmosphere. Best part is the team members, great group to work with. Has a family feel, company is large, but headquarters is small."
good,"I really like my colleagues, the team atmosphere, and new workspace across HQ that allows me to work close to my group or separately if I need to focus or just need a change of pace."
good,"There is an extreme divide between what the workers want and want management wants workers to do. This is one of the main reasons it is very hard for the company to retain employees. This is even with great pay and benefits. Also, if you are new it is almost a given that you will be working every weekend and holiday."
good,I enjoyed working at Land O' Lakes because it was a fast pace environment and we had to move quickly because we were constantly very busy and I got to meet some very nice people.
good,"My manager and department was great to work with but if you don't have a degree or are an internal candidate its hard to move up.  Recruiting doesn't value existing talent and often looks over qualified candidates.  Benefits good, pay is competitive for similar positions."
good,Working at Land O Lakes I learned that is can be tough to find the resources necessary to complete my job. The organization of the company needs work since there are multiple copies of files and no one knows which is the correct one to use.
good,"The company as a whole is run very well. However, in New York they decided to move the distribution part of the operation to another state due to cost."
good,was able to go from operator to 2nd shift supervisor in less than 3 years
good,"pay and benefits are remarkable!! great job! cannot find a job this good very easily. if you have it, take care of it!!"
good,"Even though the diversity and inclusion seems to be over funded, Land O Lakes is a nice place to work.  The pay and benefits competes with other companies in the area, and they are willing to consider requests for special accommodations."
good,"24 hour operation. "
good,"I worked at Land O'Lakes as a contractor converting all of their computers to windows 7 from XP. "
good,"Good company to work for.  They went through some culture changes after I left, and i understand it is an even better place to work. "
good,"Hard to advance without experience in other fields or companies.  Good people often overlooked if you aren't working at corporate.  Adding new facilities at corporate and continues to be a profitable company, growing each year."
good,"A busy environment with hard working employees. Hardest thing is to know everything. People are great to interacted with and even hanging out outside of work. Strong culture that started off by local Dairy men. I have learned safety skills, employee development, and leader ship skills."
good,Land O Lakes as a whole is a great company to work for. However the office in New York was run with terrible management. Terrific product line.
good,"Lots of room for advancement, flexible working schedule, managers that generally really care. Good leadership.They have a great company culture, offer good compensation and benefits, and have amazing career opportunities available. All around good."
good,I really enjoyed the people that I worked with.  I just could not handle management not dealing with frustrations within the office.
good,"I learned much about FIFO, forecasting, logistics, material replentishment and freight negotiation."
good,I processed invoices within the various programs at Land O Lakes and I got to know the ins and outs of their software.  Management was laid back and i was able to do my work without having to be checked on or interrupted.  The other people in the office were all very helpful and willing to teach me how to do my job.  The hardest part was the repetition but the best part of the job was that i was able to do my job well with out being supervised.
good,"The project work I did was very fulfilling, especially our most recent launch of our all new, secure members website. Learned how to maintain websites, databases & electronic filing systems."
good,high work volume and too few people in my department overall not a bad place if you can get in
good,"I have been with the company for a long time, I have nothing bad to say.  I work remotely which limits my ability to advance within this company.  Hardest part is being remote, and may not get included in communications."
good,"A unique job,gotta wanna work or this isn't the place 4 u.no stress,just do your work n go home,on night shift..pretty good mgmt, very physical job but not hard. Temp,is hot in summer cold on socks but overall not bad"
good,"The people at Land O'Lakes are what make it a great place to work. Everyone seems to have good friends at work that they trust and enjoy working with. The new office is great, along with the perks like the health clinic and gym. There is some uncertainty right now with the direction of the company due to industry changes and a new CEO, so there seems to be some unrest and worry among the company, so we're all hoping Beth and the leadership team can help change inspire innovation and get things turned around."
good,"Land O'Lakes Inc. is a large enterprise and each team or business unit has their own work culture. Those working in international business or international development have much earlier start times due to time zone differences between our various offices around the globe. International trips are, on average, two weeks long so those with families do have to do more to balance their personal schedules and make that happen. Overall, it's a highly engaging place to work with a pay-for-performance culture that ensures those who work hard and bring good ideas to the table are compensated in line with market."
good,"I love working for Land O'Lakes because of the culture that exists being a large food cooperative, rather than a publicly traded company. This brings a culture of camaraderie and cooperation even as an employee. As employees I think we understand that our bosses are our farmers, the ones who make it all possible by feeding the world. Employees appreciate that we also do good work with our local foundation and through our international development efforts overseas, which are helping to bring better opportunities to those farmers."
good,"I started my career out in the manufacturing plants, and progressively took on new assignments and roles, being promoted to our corporate headquarters.  At headquarters we have a really nice fitness center, onsite medical center, onsite child care and a really great cafeteria and company store.  My boss is pretty great about allowing me to work from my home during days of snow or bad weather, so that has really helped with my work life balance.  We have an open work environment which can be fun, but also challenging because you don't have a consistent desk to go to everyday.  The best part of the job is knowing that I'm working for a Farmer Owned Cooperative."
good,"So much going on - lots of energy in dynamic, challenging, industries, all of which have a broad reach - and knowing that you can too in your role is energizing."
good,"Land O'Lakes is a member owned cooperative.  From farmer to fork, Land O'Lakes works with our member owners to help educate the general public about the important role of agriculture in our economy while providing high quality, value added products and services.  The four businesses within Land O'Lakes (Dairy, Purina Animal Nutrition, Winfield United and Sustain) provide us a unique viewpoint and insights into the agricultural industry.  We work together across these businesses and departments to ensure we are making the best decisions for our member owners while providing our employees with growth opportunites."
good,"LOL is a great place to work. I would recommend. I like the environment and the changes that are being made within the company. With a new CEO, things are bound to get better."
good,very laid back atmosphere as long as you stayed on task and got the work done. i enjoyed my work and felt very accomplished leaving every day. Many people retire with the company because of great benefits and culture.
good,"Provided great culture to try new tactics.  Although a conservative company, they strive to adjust to new work environments and provide good benefits to those that work at the campus."
good,Great friedly people willing to train you. Very helpful hard to manage the long hours with kids.
good,"New hires can expect to bounce around shifts, and depending on the department, a fair amount of overtime."
good,A good solid company to work for. Pay and benefits are competitive with the market. Not a lot of opportunity for advancement within the company and some groups have tight circles.
good,"Land O Lakes was a great company to work for with great benefits such as Vision, Health Union Retirement Pension I probably would have retired from there if it wouldve stayed open."
good,"this was a temporary job so there is not a lot of things I can add, the people were a lot of fun to be around and the atmosphere was enjoyable to walk into everyday"
good,While employed here I learned a lot about the farming community around texas. the pay was good and always enjoyed the people i worked with.
good,"Land O'Lakes has a great culture of giving to the community and of high ethics.  The management walks the talk - you can really trust them.  They have really grown in diversity in the past several years and have expanded on their benefits - like free coffee and summer hours.  "
good,"Land O'Lakes views and values employees time at and away from the office with consideration and respect. They facilitate an open and creative environment and encourage employees to collaborate together. Within five years I have been promoted three times. They encourage cross-functional movement and development. Employees of Land O'Lakes are professional, intelligent and respected. I have had opportunity to travel to thirteen of the Feed plant locations nationwide and assist in implementing an advanced call center for the Feed Customer Service org. I have learned a lot and growth immensely in my career."
good,Fast paced feed manufacturing plant several different job titles throughout the facility. There was a good foundation of workers all involved with the daily process.
good,Benefits of working here are medical dental and vision. Life insurance. 401 k. Stocks bonds. Great place to advance. Also lots of locations to relocate to if your wanting to travel.
good,A very good place to work at.  Fast paced and always busy.  The pay was nice and the employees are always easy to work with or ask questions.  I had a nice time there.
good,I love working at Land O'Lakes.  Its meaningful work with a great group of people.  I find that the culture is smart and relaxed at the same time -- a rare find these days.
good,Many development opportunities available! Flexible work environment. Frequent opportunities to network with other departments and business units. Encouraged to learn cross function roles and business.
good,The work is challenging and rewarding and I'm excited to see how this organization impacts the world around us. The people are what make this company great and why I hope to have many more years here.
good,"Land O'Lakes is a great company! I've enjoyed working with each of my supervisors, and learned something from each of them. There are challenges, some of them self-imposed, but there are also great opportunities. The next few years will be critical in determining whether Land O'Lakes can set itself apart from other companies, embrace innovation and fully leverage its engaged employee base, or if it will try to hold on to unnecessary tradition, stifle creativity, and slowly fade. It's exciting to be a part of this moment."
good,"I have been with Land O'Lakes for almost 20 years.  I never thought I would be with an organization this long, but I stay because of the purpose we serve for farmers and the great people I get a chance to work with everyday."
good,"great people, farmer owned co-op culture transcends into company culture.  lots of common sense problem solving, incredible work ethic, and good collaboration between leaders.  Able to mentor from Director and still value those lessons learned which impact my decisions still today."
good,"I loved my teammates and really enjoyed the work with them. I struggled with the species team's at Purina because they are very competitive and do not cooperate for the benefit of the company. Instead, they are very concerned with promoting their own image. This made for a lot of disconnected teams, that didn't have shared benefits/learnings, which resulted in a huge loss of potential."
good,Land O'Lakes has a new open work environment promoting collaborative work between employees and teams.  Discounts on butter and other Land O'Lakes products is a great bonus.
good,Land O'Lakes was a great place to work and still is I'm just looking for day work it works better with my family and activities I am fine Land O Lakes to work with me very well except for the fact that I need the Day hours
good,"Good work environment, good job security. Good benifits and discounts. Overtime and Holiday pay is good. Its a Union plant, so alot more job security overall. HR is really good at helping fix any problems or needs you may have. Really good communication between Supervisors and the Employees."
good,Good place to work. A lot of opportunity for growth.  Home office is in Minneapolis so relocation may be required.  Remote opportunities exist if you're willing to travel
good,"enjoyed 16 years with Land O'Lakes until being down sized out of IT. "
good,When I first started you stayed till the job was done so the shift wouldn't be left with it.When you have one senior man by his self it's lot for one person.Then your to leave it for him and get off their clock or try to write you up.
good,Unloadig trucks and loading trucks keeping up with lot codes and inventory maintaining a clean work space and making sure eveyone had palletts to stack feed on..
good,"Very good people and culture. Land O'Lakes does its best to ensure that we have the best environment for productivity, creativity, collaboration, and flexibility."
good,Different business model with co-op but a great company with excellent benefits. I enjoyed interactions with farmer owners and corporate office.
good,I'm working as a contractor for now. Everyone is very friendly and they are great at training. The work isn't difficult but they say it will get busier which makes it harder.
