rating,review
bad,The worse company I ever worked for no teamwork at all nobody speaks English can not comprehend how people can be leads and not speak English they hired me for forklift operator but put me at pallets pallet sta
bad,The good is the people I work work. The bad is they dont take into count what experience someone has for other job bids. They pick and choose who they want.
bad,The management made it very difficult to work.  The manager targeted me and made it very difficult to have sick children. The manager would change the schedule when I had a day off and not notify me.
bad,"Production management is running the place into the ground. If you're applying for production be prepared to work 55-65 hour weeks and frequent mandatory Saturdays. You will never see your “leaders” working these Saturdays."
bad,"Management was a joke, plant manager was never around. Union took way too much money from my checks for about 4 months and the Union Steward wasn’t any help in getting my money back all he does is complain non stop about EVERYTHING while helping no one. I was also ridiculed constantly by the guy who trained me for a medical condition in eyes that I’ve had since birth. Overall worst work experience I’ve ever had."
bad,"In the beginning LOL didn't make any waves...but as soon as they got full control of this business things really began to change. The main office (Minnesota) began to pass down their herrassment of employees. For the past 15/20 years I've seen things that should not have happend to good people employed here. Employees attitudes started to change. I told my supervisor that when you lose the good hard dedicated ones its not long after that when the doors will close. This was a great place to work. But whoever is in charge in Minnesota has not heart, no soul and does not care about the workers at this facilitie."
bad,"Stay away from this one!! Low pay for what they expect, not enough maintenance people on a shift to do job, very unsafe workplace and safety culture, a lot of drama."
bad,"No advancement opportunities, co-workers and managers lack relevant and/or college education.  Lack real corporate experience. Management micromanages too often and will not relinquish control of the technological platform collectively to the team.  Management also does not take ownership to work the problem if issues develop from lack of proper funding of associated technology.  Implemented 3 strikes rule (and your out) to change management process which indicates a discriminatory practice resides with IT management from top to bottom.  HR refused to address this policy and team surveys do nothing to address the issues within Management.  Overall there is a real problem with leadership."
bad,"Majority of management is more concerned about nothing but the numbers, regardless of the workers and the level of effort they put into it. Many of the jobs here are completely overwhelming due to the fact they combined multiple previous jobs into 1 new job. "
bad,"Rules are not consistent"
bad,"No advancement opportunities, co-workers and managers lack relevant and/or college education. Lack real corporate experience. Management micromanages too often and will not relinquish control of the credit and financial customer services to the team. Management also does not take ownership to work the problem if issues develop from lack of proper funding. Implemented 3 strikes rule (and your out) to change management process which indicates a discriminatory practice resides with Financial management from top to bottom. HR refused to address this policy and team surveys do nothing to address the issues within Management. Overall there is a real problem with leadership. "
bad,I worked there for two weeks and got in a minor forklift accident my supervisor suspended me told me i would be able to come back in two days four days later i was informed that i was being terminated good luck applying better know how to speak spanish because everybody theirs spanish and cant properly train English employees
bad,"I would advise everyone looking for a job in Davis to look for work elsewhere. The work is priority, not the employee. Backstabbing everywhere you turn. They don’t even allow you to be off Sundays. Guys are treated like work horses."
bad,"Senior management very antagonistic towards people not in their clique.  Doing a great job doesn't mean you will be around.  As companies are bought up and merged, doesn't matter how great you are, if they want you out, you are gone.  Reminds me of cliques in high school.  Company asks you to be tolerant, but if you aren't a minority, then better keep your head down and mouth shut.  Very discouraging after having a great career most of my life."
bad,Pay was adequate. Hours were aweful. Work 12-16 hours with 8 off before another 12-16 hour shift. Treated employees with disdain and zero regard for family life. Tension high always between supervisors and employees. Union has been infiltrated by management.
bad,"a typical day at work was an 8 hour shift starting at 4 am"
bad,"Uninvolved management, taskmasters, and aloof personnel.  The turnover is significant and the working conditions are substandard--moldy tiles, odorous, uneven heat distribution.  "
bad,"I worked for this company less than a year in a management position.  It was probably the worst experience of my career.   Little to no training and unclear expectations created friction with the facility manager.  Continual bad mouthing of previous employees, and an atmosphere of favoritism, led to high anxiety and hostility within the station.  Competition and infighting between the alfalfa and corn managers was a source of unrest almost daily.   "
bad,This job is for people who lack the ability to strive for anything other than just a paycheck. Not intellectually stimulating and hours are long. If you like only being told what to do anot got going anywhere in life than Land o Lakes certainly will do.
bad,"Production work milk and butter, management not behind it's employees', co-workers are great, Company always trying to find ways to fire people instead of helping them."
bad,"Work five to seven days a week year round. Give years of life to the place and they will get rid of you with no remorse at all. Always looking to cut people and at the cost of adding more work to employees that are already working at full capacity. Don't ever trust the human resource department at this location because they are against you in every way. Employees fill out surveys yearly with much emphasis on how horrible the place has become but the surveys go unanswered. Very poor management who would rather get rid of you then to help you. Don't expect to get full time hours for several years if newly hired. You will be scheduled all shifts every week with many third, second, and first shift rotations the same week that take there toll on your well being and family life."
bad,"Even though they are union, they do not honor seniority. They place several people on temporary lay off or standby and then they hire off the street, new people, training on jobs the people on temporary layoff are not allowed to train on. The people on standby are ""chosen"" based on their ""position"" in the company for available training or actual work. For example, one guy's brother is a unit manager, therefore, and for that reason, he is almost never on standby, even though he is at the bottom of the seniority pole in the Teamsters local.. The women hired there recently, who have not yet been senior enough to get a bid job are passed over for training and/or work, left to rot on standby and unemployment. This place reeks of discrimination. Even though you are on standby, you are not laid off. The company pays your medical insurance, for example, the same as they do for the people working 40 hours a week on a ""real"" job. You are not compensated for your standby hours which are approximately 3 am. to 7 am. and 11 am. to 1 pm. and 7pm. to 9 pm. This is your combined standby, Monday thru Friday. It's impossible to have another job to try to support yourself and your family."
bad,Employees and management at the Portland OR office have no discretion and tact.
bad,Very poorly organized and managed building. High turn over due to poor management. The benefits were good although not enough vacation in my opinion. Wages are not very competitive.
bad,Poor management. Very cut throat and the management lacks leadership and organizational behavior. Ended my temp services after having death in the family. Lack of compassion. Certain managers tend to pick on employees.
bad,Well were to start. First it was a laid back maintenance  tech/ maintenance manger position.  So I was pretty  excited about it.  The manger failed to  tell me about some of the things I would have to do. I have no problem  going  in confined  space  but with the right equipment. And safety  that was no concern  for the 2 guy cranking me up and down.  Wow nightmare.
bad,"Inconsistent management, terrible amounts of overtime, long days, only good thing about the place is the pay and benefits. No work home balance and they couldn't care less as to how much you work."
bad,"Enjoyed working with customers to resolve issues reported."
bad,"My boss is selfish, prejudice,  liar, micro manager, and very unprofessional towards me. I'm the only colored guy in the team."
bad,"If you can tolerate hypocrisy, hostile work environment, overt racism, then this job is for you! Absolutely no consideration for hard work, personality contest."
bad,There is forced overtime . you do not know how many hours you will work from day to  day. There is no work life balance.Pay is good for the amount of work in the plant.
bad,"Work environment needed improvement, better direction. Management was lacking in understanding what was needed or wanted. Company /department needed improvement on process."
bad,"I was hired through a labor agency for the summer of 15 as a corn pollinator. It was a lot of field work and it was about 7 hour days 7 days a week. The money was good the job was easy but the organization was a joke. The ""crew leaders"" were anything but professional. Sometime we stood around waiting and got paid for it. It is good for a summer job."
bad,"Get all trucks loaded at all costs. Too many spoiled and unproductive workers in front office, production and warehouse. Lack of teamwork, communication, no management support for warehouse. Lazy workers on both shifts. Loading trucks with broken forklifts, working in extreme weather conditions without heating or air conditioning. The most enjoyable part of job was taking vacations, but not coming back to more work!!"
bad,Great job company pays well but keeps terrible people while pushing good workers away. Work to many hours days off change way to much to enjoy life away from work or at work
bad,"Fast-pace and stressful. Not the best job I have ever had, but not the worst job either. The pay is decent, but could be a lot better for the area I work in."
bad,"Management is not loyal to his Supervisors."
bad,"I would never, ever work for this company again! Management is second rate at best, work conditions are horrible, company morale is depressing!"
bad,You cannot work the shift scheduling they use and expect to have any kind of life. You rarely receive a full forty hour week. You will be on call all shifts during the week with no guarantee of 40 hours. If you are not called in during the week you can be expected to be called in Friday night third shift for sure messing up your unemployment and weekend. Human resource department has no respect for employees or what they sacrifice for them working their on call hours. Don't expect to have any kind of family or social life working here. Very poor human resource department.
bad,"Found favoritism, and unethical practices with regards to employees. Everyone cowered to a bully. Even management had his ear. The job itself I enjoyed, and the people (equals) were nice enough. Pay was pretty good. Tried to keep the place clean."
bad,"its hard work and not for just anyone you really need to be on your toes, a lot of management runs through this plant and high turn over on production"
bad,always understaffed always working short and long 12 hour days always short a supervisor or have a new one rotating door for the front office and plant managers as well.  and a point system that doesn't honor doctor excuses absences and will fire you if you do.
bad,great place to work.they have great benifits and its fast pace and long hours. If you like learning and motivated. the people are friendly and will help if you need help
bad,"I worked pollinating corn for 1 summer and made decent money. The job itself was easy but it was mandatory to work everyday. Some days we came in for only a couple of hours..seems like a waste of time when we were told to reserve a full day. It was outdoor work all day long, we're not allowed inside the buildings and had portable bathrooms but no hand wash station. My food spoiled a couple of times from the heat. "
bad,Good place to work if you can get past the point if the management doesnt want employees around from businesses they bought. they will target them and slowly fire them
bad,"In the 8 months that I was there, I spoke to my supervisor ONCE! And that was because the tech. lead that I worked with didn't feel that I spoke to him with respect when I asked him about technical requirements. The managers that are the decision makers are not available. Both teams that I was a part of suffered immensely from this organization not having a clear direction from either the product owners or the managing directors. From what I could tell, there are a lot of people there that can talk the talk, but cannot actually walk the walk, which is unfortunate, as it really is a great company."
bad,Works for some positions and not for others.  Very difficult to get materials to do certain jobs and can be a very noisy and distracting environment.  Also takes much more effort to keep confidential information protected and secure.  A little like being in college with having to carry a backpack everywhere you go with all your work materials and equipment.
bad,"Terrific purpose - feeding human progress"
bad,"Some jobs are more difficult than others. The pay and benefits are very very good. But a great majority of the workers are more concerned about drama than they are about the job that they are supposed to be doing. Also, management could be a lot better than it currently is. Not very understanding of needing a last minute day off when there is a medical emergency."
bad,"Full of baby boomers stuck in their old ways. Poor management, with politics being the only way to advance or move to a different position. Upper management is concerning due to lack of knowledge and people skills."
bad,"i really liked my past position. great opportunities! it's disheartening when the plant manager asks you to buy their product because they are in the deficit. there is so much potential but no serious money is invested in the business. when you have leaking ceiling tiles everywhere, it leaves an impression. way too much drama and back stabbing and management refuses to deal with it. again... the building has potential and the benefits and pay are top notch!! but the schedule, ot, and drama make it not worth it."
bad,I worked as a contractor for Land O Lakes. A position opened up on the team I was helping. I then had to train the new hire how to do my job knowing that I had only 3-4 weeks left on my contract.
bad,Stressful place to work people slack off always having to pick up slack because other employees talk and mess around but nothing happens because people are buddys with bosses
bad,Come in pack chips in boxes at fast pace and stack on pallet very good pay
bad,Our work areas were constantly working in a dusty dirty lung toxic air. We had to work a month straight with the dust collectors getting working on so everything floated through the air. Must have been able to lift 50lbs and there were people there that couldn't and slowed the entire process down and everyone's pay would be on the low.
good,With the new building they went to an open floor plan and that means you don’t have a desk. You take a work station everyday and it is very noisy. If you miss the feel of a college campus this is the place for you.
good,"Expectation is that you work 10 plus hours a day. I learned that one bad facility does not define the company as a whole. The hardest part of the job was management. I went through 2 plant managers, 4 operation managers and constant turn over of fellow supervisors. The best part of the job was the shift schedule and hourly employees."
good,"Typical day at work is stress filled.  Co-workers made most days bearable.  There seems to be a lack of communication in Management. Decent pay for the area that its located in, however not enough to cover the stress of the job."
good,Worked long hours with 8 hours off between shifts at times. management never took the time to learn how things are made. lot of stress caused by management.
good,LOL is too bereaucratic and lacks resources and culture to be effective but is good with employees capacity building and compensation structures. extensive meeting requirements.
good,"Integrity in upper management at Melrose is lacking. If HR or the Managers don't like you, they will get you fired. Most Supervisors don't have any idea what they are doing and those that do start figuring things out are run out of the plant. Morale is low due to there not being any trust between the floor and management. As an example I recently lost a Supervisor who was the best we had seen in years because he was honest about a mistake he made. The company has no integrity left."
good,"Divisional leadership is great. Unfortunately, that is not the case with all mid-level managers. The company espouses a people and performance ethic, but whether there is any ""people"" focus to go along with the ""performance"" piece very much depends on for whom you work. "
good,"Company is going through significant pressure and change which bleeds down to employees of the organization.  Desire to make positive change is challenging, and ultimately there is strong cultural resistance to make bold decisions."
good,there was not very good training involved with the position.  you were just seated at a desk and computer and had to follow hand outs.  the staff was not very available for questions or training.
good,"I worked here for years before Land O Lakes took over, it went downhill steadily. Poor leadership, played employee favoritism, no team atmosphere, unsafe environment."
good,I would not recommend working there if you have allergies.  The place is full of corn dust.  The Administrative Assistant is a major controlling person and talks to you like you are dirt.  While I was working there the other office person quit because she couldn't work with the other Administrative Assistant.  She was so mean to her.
good,"Good company to get your career started.  Unfortunately, there is little to no advancement once you are employed.  If you're looking for a comfortable place to work, with great benefits - this is it.  If you are looking for a company that wants to see its employees grow and take on bigger roles, this is not the company for you."
good,Very young management team. All about production not quality and people's interest. No support no supervision. Very dusty environment old equipment. Good benefits
good,"Ok Company, was trying to figure out who they wanted to be and was top heavy on management. Dominant player in the Animal Feed business. Decision making seem to be slow."
good,"Very Professional place, A lot of trainings is involved but they do not give you the time to practice before a new regulation is applyed. They are going from training to real life application too fast. The work ambiance could be improved. You do not get any feedback on your job. The Company is also very slow to replace a sick employee, witch put the burden on the other employees, sacrificing their safety work conditions"
good,The company has great work life balance.  Most managers are careful to not create undue burdens on staff members.  The new open office space is distracting and causing people to have to work more because of all the distractions that occur.
good,"12+ hour days"
good,"This was a great place to work once upon a time. Things are changing and the changes no longer include employee morale. The changes we were told by management are for the betterment of the company, not the betterment of the employees. Now the employees are jumping ship for the betterment of themselves."
good,All in all a good place to work. Land O'Lakes really cares about their commitment to the community and their purpose (Feeding Human Progress). Good place but not what it used to be!
good,Manufacturing plant that compensates well but has a poor schedule. Some rough working conditions. Low management/supervisory visibility. Few options for advancement.
good,Very fast pace mill. Unit mill with a lot of good and hard workers. Management is young and has room for improvement. The deadline margin is small for any errors. Couple hours of downtime and could be working weekends a lot.
good,It is a easy place to work scheduling is cool the benefits are great and the vacation you get is unreal. Down side is the management their is lacking any real direction and understanding of processes. They also have a high turn over rate in management which sure doesn't help.
good,I've worked as a contract employee at LOL for 6 months. I switched departments 4 months in to help when another contractor was let go. A permanent position became available in the department that I worked for 2 months. I got the interviews and felt really confident about getting it. They denied me the position because I lack experience. They are now bringing on a completely new employee (we assume - since management won't share anything about who they are other than whispered rumors we hear) that will need to be trained from scratch.
good,Production for 12- or more hours often
good,"So many rules to follow like time of punch in, being late, being too early, all towards a point system for the year before they wipe your slate clean again. Hours may fluctuate depending on position and culture segregated.  Takes a toll on your job/work life. Money is good, lot of overtime but not a regular 9-5 job no matter what shift you take or be placed at. I worked for as long as i could before it started taking a toll on my life and relationship with my fiancee which eventually lead to my resignation."
good,Management is out to screw ya cuz the place is union driven place. They expect another employee to train you thats not a trainer doesnt like to train cuz of how management treats tje trainee.. Always ripping you off what your supposed to be traini g on to do things  that can wait
good,"The office has an open environment, no assigned location for an employee.  It does have a gym, daycare provider and bank onsite at the Corporate office"
good,"Land O'Lakes mission is great, there are a lot of people working toward the good of all farmers."
good,"great place to work if your young and don't mind long hours.  we had some great sup. when we inquired a new gen. manager , a lot the good ones got let go"
good,"Understanding that the Ag industry is up and down - there seems to be an unusual amount of downtime here. The I.T. department is too compartmentalized to get anything done efficiently. The entire company as a whole is about a decade behind in technology."
good,"Good place to work.  Good culture.    Ability to learn through different roles.   Management is good, but up to employee to drive career and seek out new roles."
good,"Land O' Lakes is a successful market- and customer-driven cooperative committed to optimizing the value of our members' dairy, crop and livestock production."
good,"If you like heavy labor in a dusty production setting, this is it."
good,"we were constantly on the move with no down time and some days we were forced to stay up to 6 extra hours, made it hard to maintain a regular life"
good,no advancement. contract workers just keep getting replaced.
good,"You'll see your fellow employees more than your family. Pay is good though. Union, has its pros and cons. Could have better management. Always deadlines!"
good,Be prepared to do a lot of walking and climbing. Very hot work. Bring extra clothes. There is a swing shift when you first start. There are rules with it though.
good,"LOL is a little different since it's a cooperative and not a stock company. Their responsibility is to their producer and coop ownership.  That means that your customers are the owners so there is a very intimate relationship, nothing distant about it. The recent struggling agricultural economy has caused a lot of changes."
good,"I love working here and have never been at a better company. My boss and leadership team are exceptionally supportive, flexible and I’m rewarded fairly and often. We truly care about our customers and their success and we are given freedom and encouraged to deliver the best experience possible to them"
good,"I Was fine working there until new management came in and made it a hostile place to work. It pitted day crew against night crew, it pitted operators against Maintenance men"
good,New progressive office that allows flexibility. Good work life balance but managers are not engaging. Would like to have seen more opportunities for professional growth.
