rating,review
good,"Overall, my experience with this organization has been very good."
good,Já foi melhor...hoje em dia perdeu um pouco o foco e as raízes
good,"Inventory, account for people, Quality a very military type position. I liked how locked in a process you were. Most enjoyable part was we were free to make decisions on the fly to meet our customer demands, very little game playing."
good,"a typical day in an assembly line, with 8 work partners, first we need to know witch model we were doind in that shift, then how many, change assembly position every tow hours, best part of the assembly line its the sreening test, after the radio are all done we test the radio and we can hear some music"
good,"• Managed Account Receivables to maintain effective, updated written procedures for Credit/Debit memos, Daily Highlight Reports, returns processed, and net outs."
good,"stayed busy running 2 machines at a time, kept assembly lines stocked, Great benifits, I got along great with co workers and managment."
good,Enjoyed working for this company. The co-workers were laid back and everyone worked hard to get the job done.
good,"A typical day at Visteon consisted of running a line to get parts ready for automobiles. I learned all different kinds of things. Some of those things include welding, running a forklift, using a power hand jack, a pallet jack and a check plate. The hardest part of the job was seeing the place shut it's doors. Enjoyed working with my co-workers and becoming so close."
good,Excellent place to work. Great environment and support from the floor to the upper management offices. I would recommend them again for any employment.
good,"Little or no job prospects or promotion, lucky that they are still in business in the UK. Change senior management regularly and nearly always brought in from external sources."
good,"Due to too much outsource, quality of Visteon product decrease. Thus some OEMs no longer give Viston business. Due to financial difficulty, Viston went to got Chapter 11 protection"
good,"Employees are free, allowed to explore to their caliber. Work Life balance to be improved. India region to improve much on people management and on the processes."
good,"Very Nice company and workplace. Provide free lunch, timely payement, no discrimination in contract and company employees etc."
good,Mi evaluacion sobre la empresa es que es una empresa que le falta crecer en compromiso con sus empleados y orden en todas las areas.
good,"company culture, earnings potential, office happy hours, best product on the market, sales leadership, opportunity for growth"
good,"Trabalho no almoxarife. Atuei no almoxarifado, auxiliando na contagem de peças.  Ótima relação com os colegas de trabalho."
good,"tournée journaliere des bancs de test du secteur qualité "
good,"Suficiente cantidad de Personas para el trabajo"
good,"* Production Planning & Execution"
good,"We would load and unload trailers that were either coming from Mexico or going to Ford plants nationwide. Learned the value of teamwork, as well as respect for my supervisor because he was not afraid to help out when things got behind just because he was a supervisor. The hardest part of the job was sometimes unloading trucks from Mexico because the trailer floors were not always stable. The most enjoyable part of the job was the people I worked with."
good,I am learing New Management concepts & Technologey Learning
good,"ambiente agradavel de trabalho, bom relacionamento entre funcionarios e chefia, grupos de trabalho muito dinamicos."
good,Dentro da empresa exerço papel multifuncional.
good,Gran empresa con una cultura laborar sólida. Gran ambiente muy bien cuidado rodeado de profesionales capaces.
good,"Alta demanda a resultados, alto enfoque en resultados financieros, grandes retos."
good,usine et personnel tres agreable travail parfois difficile mais tres bien explique et laisse du temps aux nouveaux de se familiariser a l entreprise
good,Empresa com boa visibilidade no segmento e com ótima condicção para trabalhar porém dificil para seguir carreira. Não se tem muita chance de crescimento proficional
good,"Fair compensation and benefits.  Great location.  Nice gym and cafeteria on site.  Opportunity for lateral moves within departments"
good,"Rien à réduire cette entreprise beaucoup de chose et il y a beaucoup de solidarité , et plusieur production diverse donc très gratifiante et très intéressante"
good,"Its US based Indian management company, Good work culture, salary & friendly environment.Career growth & exposure depends on project you get chance to work otherwise its bit difficult."
good,"Empresa ótima para trabalhar, infelizmente mal administrada o que causou sua venda e a demissão de muitos funcionários,"
good,"Gostei muito de trabalhar lá, aprendi bastante e foi muito útil para minha vida profissional."
good,Foi a minha primeira experiência profissional pessoas super amáveis humanas
good,"Visteon Automotive Pvt Ltd."
good,"management is very good in supporting and give some encouragement in the field of mechanical designing. My project work is renault duster door trim.Here my role is try to join the input surface and create B-surface, and converted in to 3d."
good,"Targetted oreiented organisation.I like the commitment towards to customer deliverables.Very much hard working team never lose customer confidents either technical nor deliverable challenges.. "
good,"-The Work was fun and I liked it."
good,"ich habe Industriemechaniker gelernt und ich mag arbeiten bei Maschinen und  Teamarbeit"
good,"i have right answers in contest."
good,"Trabalhei por mais de 8 anos nesta empresa, de estagiário à supervisor, com isto tive a oportunidade de absorver conhecimentos em Supply Chain e Gerenciamento de Projetos."
good,Visteon is transforming from a large multi-business corporation to a electronics-focused profit driven company after acquiring JCI's electronics business.
good,buenos compañeros constante apredizaje y buena administracion y flexibilidad horaria
good,"A good company to work with."
good,Challenges the capability at all times and encourage taking responsibilities
good,Découverte du monde la qualité automobile lors de mes six derniers mois d'études.
good,"habia un buen ambiente de trabajo en el almacen.buena cooperacion entre grupo de trabajo.los ultimos años fueron complicados por llegar al almacen problemas que se debian detectar y corregir.producto mal etiquetado o mal embalado de fabrica.aunque se solucionaron muchos de estos problemas.faltaba bastante comunicacion entre logistica y almacen.a veces eran los responsables de logistica los que pedian los transportes sin comunicacion con almacen,no estando preparadas las cargas.o incluso estando fabricandose"
good,"job was a bit robotic, but not bad as ones mind could be free."
good,"Great company to work for , good pay and benefits, vacation. But what i liked the most was training, they offered tons of training for anyone willing to learn , that what i liked the most and got most of mine from"
good,Operando maquinas Injetoras.
good,I think that there is no balance or security working for visteon company.
good,"Very organized, especially with training.  They definitely want there employees to do the best they can.  Very structured and boring.  If you are looking to be in a company that does the same thing over and over this is the place for you."
good,"Es un lugar relajado, buen ambiente, flexible en horarios y permisos."
good,"Good mood, lot of work, freedom."
good,Empresa oferece muitas oportunidades de qualificação
good,Lot of new stuffs to learn and challenging tasks everyday. Thorughly enjoyed working here. Colleagues are friendly and ready to help and guide you through.
good,"Excelente empresa, exige um aperfeiçoamento constante do funcionário para que atenda as exigências dos clientes e se torne cada vez mais capacitado."
good,Good place to work. Not too worried about having life when there is overtime needed. Good benefits. Supervisors just worried about numbers. If you are willing to work and not good off the supervisors will put more and more work on you and not other employees.
good,"al rotar los puestos de trabajo   la jornada laboral se hacia bastante liviana"
good,"Visteon is a good organization where they value ""Employee Freedom"". I would recommend this company for any new joinee who wants to learn and explore things. "
good,Company has some good products. The work culture was awesome. Lots of opportunities to learn new things. But company should define new products and a proper strategy to stay in automotive electronics business.
good,"Visteon é uma empresa onde comecei a minha carreira, foi onde aprendi o que uso hoje em dia e vi a rotina de uma grande empresa. Descobri que tenho uma grande mobilidade de cargos e aprendizado sem igual."
good,"NIce place to work  you could see nice peopel everyday,it doesnt feel like you are not work  everyboday workin with fun at the same they will done their jobs fully"
good,"Um ambiente agradável de se trabalhar, intervalos ( almoço, janta) com direito de diversão como sala de jogos para evitar o stress do trabalho. Oportunidade em aprender em trabalhar e grupo, agilidade, eficiência, conhecer outras aéreas de trabalho e seu funcionamento, oportunidade em aprender operar maquina, programações. Colegas de trabalho que ajudam nas dificuldades como: produção atrasada ou dificuldade em executar a operação."
good,"Empresa que me valorizou enquanto funcionário, me deu a oportunidade de me tornar técnico de manutenção, fiz grandes amizades e grandes aprendizados."
good,"-Junta diaria con personal a cargo."
good,"La planta de Reynosa formaba parte de Johnson Controls quien vendió el grupo de Electrónicos a Visteon, y la planta de Reynosa fue parte de esta trasaccion, por lo que esta se encuentra en pleno cambio/integración a Visteon."
good,"A empresa Visteon, vem passando por uma grande transformação, e a segregação dela, fez com que perdesse um pouco o grande foco que ela tinha ... Organização, Foco em ter um ambiente agradável de trabalho, e ser o melhor no que faz."
good,quality inspector of automotive parts to insure quality product reached customer in a safe and timely manner at a reasonable price
good,"Arrivée  30 minutes avant l'heure pour pouvoir prendre les informations ainsi que l'emplacement de notre presse."
good,"Work environment is good"
good,"évaluer le besoin, réapprovisionner les postes de travail ."
good,"Top technologies exposure,"
good,"excited"
good,"Read & answer emails, solve problems on the production floor, improve existing processes, track projects, attend meetings, etc."
good,"Empresa oportunidade para desenvolvimento,e valorização pessoal"
good,10-12 hour day making steering gears for Ford vehicles. learned how to work in a union setting
good,"Assemblage et préparation, alimentation de l’équipement mécanisé, surveillance de l’assemblage et"
good,"-Eu gostava muito de trabalhar na visteon a final foram mais de 11 anos na mesma empresa, eu aprendi muita coisas com meus colegas de trabalho e lidres, acredito que eles tambem comigo."
good,"tengo mucha experiencia en el sector de la automoción, en diferentes empresas y esta mea demostrado mucha profesionalidad en los procesos de producción y el trato humano hacia sus empleados, teniendo en cuenta las altas exigencias de los clientes."
good,"1- Dia corrido, com metas para atingir produção."
good,"I ran two machines usually, but sometimes fill in with more. The job was to get part reels and keep all running.Filling PC boards with parts."
good,Permite ao trabalhador se relacionar com diversas areas ampliando os conhecimentos dentro da organização.
good,"This is my first company to work with, many things i learned but Too much of process keeps me saturated all the times."
good,Seguimos todas as programações do dia.
good,Manufacturing Estimator
good,"I had the oportunity to work for different areas developing many skills, I could learn how a Company works and how a product is designed since the initial stages untill the end of its life."
good,"Days fully of job, always scheduled and with a performance measured. Busy days, with much pressure and always with overtime work. The most enjoyable part of the job was visiting the customers and know a little bit more other cities from Brazil."
good,Dynamic Work Environment that allowed me to transition my skills from the Defense Industry to the Commercial Industry.  It was a pleasure to have worked with such a talented team on exciting programs.
good,"A empresa procura por melhorias constantes. Investe em aprendizados necessários para que seus colaboradores possam desenvolver suas atividades com excelêcias. A cultura da empresa está voltada para o respeito pelo individuo e agradar as expectativas do cliente final. Quando você gosta do que está fazendo, acredito não ter parte difícil e sim agradável dentro do ambiente de trabalho. Aprendi muito nesta empresa, e também tive a oportunidade de somar meus conhecimentos adquiridos em outras empresas."
good,"Visteon is good place for Job satisfaction, every one get opportunity to work on complete development life cycle. "
good,"Very well structured company.  I liked working there even though management demanded a lot from their supervisors. Yearly departmental goals had to be met along with daily quality, safety, and production standards that were also reviewed by the management team.  Also responsible for discipline, attendance, maintenance and union interaction with hourly employees."
good,"Visteon is currently under transformation path. It has a very good market share in IC. It is striving hard to make a present in Infotainment and ADAS space."
good,"Planeacion y Ejecucion de Produccion ,Controlada."
good,"Improve my kownledge and skills,an challenging environment assignment.....it nice friendly chat..working experience is better ...."
good,"A empresa era de excelência em quase todos os aspectos, só não tinha plano de carreira para os funcionários."
good,"Empresa do polo industrial com 230 funcionários em seu quadro, fabrica-se cluster(mostrador de funções do carro), radio automotivo e outros acessórios de 4 e 2 rodas, tranquila de se trabalhar onde a gerência de modo geral é origem portuguesa, ótima para aprender e ganhar experiência, porém, não oferece para o funcionário crescimento profissional."
good,"al llegar, mirar en el programa los modelos que hay que fabricar, hacer setup de maquinas si hace falta, tomar mediciones antes de empezar las operaciones."
good,"Based on constant certification demands, unexpected situations would demand fast, reliable execution and control of material passing through our area. "
good,"Very productive, learned to run new machines and work on computers on machines when they went down. Management was nice when there was over time I got a chance to work it. Met a lot of nice people (co-workers). Hardest part of job was when plant closed i relocated to Saline. I enjoyed staying busy."
good,"Dia de trabalho agradavel, aprendir a trabalhar em equipe ,contato direto com a direção tanto com lider de produção á engenheiro de produto,colegas de trabalho liberdade correção de erros no produto,adapitação com horário, novos  conhecimentos e cursos oferecidos pela empresa."
good,"-La journée de travail typique dure plus que 10h du travail"
good,"A parte que agrada neste trabalho é a interajuda entre colegas. Apesar de nem sempre ser possível, é satisfatório alcançar os objetivos impostos pela impressa em relação às produções exigidas."
good,Lot of learning and opportunity for the ones who want to learn and grow in the organization. Good work culture and supportive management
good,"good co - workers who provide their support in timely manner and make things easy.,Company gave me many oppertunity to learn things more .Full freedom was giving in our work."
good,es una empresa que nos podemos desarrollar dentro de la empresa
good,"Technical Delivery Manager."
good,"A empresa é muito dinâmica e com enorme potencial de implementação de iniciativas novas e inovadoras."
good,"Feel accomplished every day"
good,"Buena gestión y coordinación de producción."
good,"buen ambiente de trabajo , estabilidad laboral, exelente trato con tus compañeros, apoyo de tus jefes inmediatos. la parte mas dificil fue el calor y lo mejor el trato con tus compañeros."
good,"Here i have the introduction to a industries after the completion of my study. Hence is my first lesson to open my career so i have worked on behalf of product development engineer and learned about the air conditioned system like radiator, condenser evaporate, compressor and a/c pipes etc."
good,"Rotinas muito comum, mais com uma boa chance do funcionário de aprendizado e crescimento"
good,"Foi meu primeiro contato com uma empresa, aprendi muita coisa boa, contato com um ambiente de trabalho com clientes externos, enfim foi onde comecei a caminha no ramo profissional."
good,"Trabalho que te exige muita disciplina e responsábilidade,onde todos são tratados iguais independente do cargo que exerce."
good,"Uma grande oportunidade em aprender mais e por seus conhecimentos em prática, pois na VISTEON só temos a aprender."
good,fast pace facility where eneryone are on the same page. Good management and co-workers.
good,- Nos ultimos 3 anos uma grande transformação na empresa modificou muito o quadro de funcionários.
good,Program Buyer
good,klasické zaměstnání převážně na tři směny s lidským přístupem.
good,"Empresa espetacular para se trabalhar, muitas amizades."
good,"Working at Visteon was a good time of my life.  The people there was like family, very easy to work with and management was easy to work for.  The pay was very good for that time of my life."
good,"limpieza"
good,"A lot of training and good practice."
good,"Visteon provided me the opportunity to develop a whole new skill set with and new application that was not very popular on the scene at the time of my employment.  I was able to learn SAP and how to set up profiles and to administer job roles through out the company.  I interacted with various levels of management, worked closely with the risk management team and the BAP SAP administrators.  I gained a great re pore with my internal and external customers and provided excellent customer service. The most enjoyable part of the job was the culture diversity and how great we all worked together as a team."
good,Excelente empresa con crecimiento profesional con escuela automotriz oportunidad para recién egresados.
good,"Sobre todo destacar el trabajo en equipo,el compañerismo y una muy buena cultura de la seguridad y la calidad del producto."
good,"	Planejador de novos programas para a Ford (1995), responsável comercial das ações com este cliente, participando no lançamento dos produtos relacionados ao primeiro KA e a F250. "
good,At Visteon the employees are very diverse and competitive at times. It is very hard to learn new skills from fellow coworkers because of their competitive nature and management is very lax. If you get tired you can walk around and enjoy the beautiful scenery around the building.
good,Expérience en intérim qui m'a permis de développer mes connaissances en industrie
good,I enjoyed time here and was very productive.  Enjoyed job and learned a lot about the automobile business.  The workplace culture was good though the location was far.
good,"Buen ambiente de trabajo, buenos jefes y buenos lineamientos a seguir"
good,"A typical day was completing for general ledger for all of the machinery and equipment for the 14 plants that I completed the books for."
good,"Very professional people and company. Good systems, very structured, care for employees and society."
good,Good leadership. Company acquired now. Good place to learn and grow. Good place to start career before moving on to OEMs. Good place for top talent to grow.
good,"Aprendizado generalista na área de RH, Gestão Benefícios e Notas Fiscais."
good,"A Typical working day involves checking the finished of manufactured parts for quality, testing components eg radiators, condensers and inter-coolers for operating specification and report writing"
good,Visteon promotes learning and development of ones technical skills.It offers an ideal environment for improving your programming abilities and greatly rewards your performance.
good,"* Mfg& Eng team always avoid time loss"
good,"Typical day at work is nothing"
good,"Uma empresa ótima para trabalhos em equipe, excelente para se obter um grande aprendizado, e muito organizada no sentido de produtividade e treinamento profissional"
good,"Visteon was a very productive work environment to work at, the staff was very nice and truly great to work with. I learned a lot in the field of management and how to work well with others. For the most part majority of my co-workers were great to work with. I believe the hardest part of the job was meeting the highest expectations on our supplier. The enjoyable part of the was meeting the expectations of our supplier."
good,"Good work culture. Technical learning is good, Co workers are friendly."
good,"Visteon corporation is the one of the growing tier 1 automotive industry."
good,"Job was adventurous and fun making.It starts with a meeting and ends with a meeting.Within a span ,we had gossiping ,seriously working for projects and making fun of each other ..I had experienced that how one should take decision in low time.Enjoyed to work with the team ,learning wide band of experience from veteran."
good,"Trabajar en Visteon me ayudo a tener un mejor progreso económico y personal.En la planta, el personal tenía la posibilidad de progresar con cursos que se dictaban o con la solicitud de querer hacerlo.Uno podía tener contacto directo con el personal de la Dirección y poder dialogar de cualquier inquietud o pedido con el Supervisor.El ambiente donde se trabajaba era muy bueno,el trato con los compañeros y el personal de la empresa también lo era.Siempre se mostró un respeto y modales con todo el personal.En el último año de haber trabajado en la multinacional, me tuvieron muy presente para un progreso y me dieron la posibilidad de trabajar como Data Entry (en el cargo de planilla de producción de los distintos sectores, como así también, la posibilidad de tener contacto con otros sectores de la empresa).También cabe destacar que teníamos un comedor ,máquinas de café y sectores donde uno podía descansar en la hora del desayuno y merienda.También nos brindaban un enfermero las 24 hs. Lo que uno esperaba todos los años era la fiesta de fin de año,el festejo del día del metalúrgico , el día de la familia y el día del niño.En cada fiesta se entregaban premios, cena o almuerzo y por supuesto entretenimiento. "
good,"You answer emails, do web submit, do outbound and inbound calls, troubleshot problems and route tickets. You learned to be more productive and add knowledge to some of the technical issues."
good,"Visteon is a global automotive supplier that provides world-class components, engineering expertise and technical solutions to vehicle manufacturers worldwide. An international manufacturing presence is just one part of the services Visteon provides its customers. Visteon has technical capabilities that support just about every phase of the concept, design and build sequence of vehicle component and module manufacturing focused on products that enhance the performance of climate, interiors and electronic systems"
good,"Is important to have present all the factors that can be affecting the production, shipments and parts control. "
good,"In Visteon Safety is given top most priority. "
good,"Typical day at work was routine, Check Schedule for product to be run."
good,"The project we had was to replace business systems from"
good,"Gostei muito em trabalhar nesta empresa, conquistei experiência na área Plástica."
good,"Work starts at 8:00am, intensive deadlines are around everyday, and push me work harder to meet those deadlines. My manager was always helpful. The company atmosphere was great, colleagues were so friendly. The hardest part of the job was to communicate with all types of people from many different departments in order to achieve the project goals on time with quality. The most enjoyable moment of my job was to deliver the project results with high quality and efficiency to the client and the client showed great satisfaction with my work."
good,Sigo en contacto con varios compañeros un buen ambiente de trabajo
good,"les opportunités de développement : bonnes"
good,"o trabalho la foi muito bom uma pena que ela teve que ir embora daqui de Camaçari e por isso fomos demitidos ,trabalahar lá foi otimo os colegas de trabalho foram fantasticos"
good,"Ambiente agradável de se trabalhar"
good,"I have learned project management and how to get along well with my co-workers in that company."
good,"Visteon a good company to learn and also great Work culture"
good,My first job out of college. There was a lot to learn about the industry and how influential the automotive industry is.  A good first job.
good,"Referência para outras plantas produtivas, organizada e excelentes profissionais."
good,Great Place to work.  Aprreciated working with an interesting group of co workers.  Enjoyed the experience.
