rating,review
bad,"Not the worst place to be, but really just execute all the low level jobs that OEM want the suppliers to do.  Very disrespectful relationship between the OEM and Visteon."
bad,Facility closed in 2007 causing a mass lay off. Very vindictive culture between the company and union. Another profitable company destroyed by bad business decisions.
bad,Typical unionized factory that ended up being closed down.  Workers took off way too much and over 500 greivances was consider normal by management standards.  Work place ever to work.
bad,"Sa à fermer "
bad,"Peu valorisant, le travail en usine consiste à s'occuper de plusieurs machines et de faire des taches répétitives."
bad,"Visteon is a sinking ship and is to be avoided.  Just let go all of its I.T. staff before Christmas and replaced it with the lowest Indian bidder.  And, the leadership expects them to be ready to support the business in 30 days!  Insanely unrealistic!  Typical executive leadership is gutting the company and will no doubt bail on their golden parachutes when there's nothing left but broken people's lives."
bad,"Visteon was shut down during the collapse of the US auto industry"
bad,Used to be a great place to work. Lots of great mind working together to make great products. Now since Visteon took over all the great mind are leaving and Management doesn't seem to care.
bad,this company no longer exists. It went bankrupt. I was an intern with this company so I am not familiar with it's role any more.
bad,Company has reduced heads by thousands.  There is no loyalty and it is a old boys network - no women promotions at all.  Many people have left for better jobs and many more to follow.
bad,"Very poor management, no ability to look into the future, and certainly no ownership in organizational growth. Very short term approach to try and maximize individual wealth."
bad,"Very poor management and even worse communication, over all there is a high level of frustration within the company."
bad,only working culture is good in visteon.salary and job security was very bad . need more focus on Employee development in cross functional activities.
bad,"	Recruitment & Selection "
bad,Sub company that built Chrysler components from the cockpit (dash assembly). Maintaining good quality auto components and ensuring all automotive parts function.
bad,"local de trabalho produtivo e de boa camaradagem,conhecimentos do produto em salas de formação com médico de trabalho"
bad,"Management: I can not think of any thing good to say so therefore I select not to rate the company at all.  "
bad,I had 19 years in that pace...thought I was going to retire from there!
bad,"Falta de seriedad , mala organizacion , poca infraestructura , mal ambiente de trabajo , exceso de presion laboral"
bad,aucune  evolution apres 20 ans d anciennete a part les amis des amies
bad,"In the SSC I meat excelent people."
bad,Visteon purchased JCI electronics and made it sound like it would be a great win win for all.  This is not the case and they are closing our Holland campus leaving many looking for work
bad,"hardest part about the job is job security"
bad,"A empresa em si, bastante interessante, o trabalho, o produto, porém a gerência na época era muito desorganizada."
bad,"olha visteon esta muito coisa problemas a vida sempre, nao faz seguro TPM"
bad,Visteon was the left overs of Ford Motor company's components business.  All the loser plants thrown into Visteon logo.  No chance of survival in the US.
bad,Uma empresa boa de trabalhar porem depende muito do momento econômico do pais.
bad,"-	Essais mécaniques, climatiques et électriques pour de l’électronique de bord automobile (pot vibrant, enceintes climatiques, matériel ESD et diélectrimètre)."
bad,"Nice place to work"
bad,"travail intensif, productif, heures décalées, endroit sale, bruyant...."
bad,Empresa com gerência e diretoria conservadora demais e que não ouve o funcionário.
bad,Too many people involved in decision making process. The management was always infighting. Could not agree on operational decisions. Very poor morale in this facility.
bad,Culture is very poor. Executive mgmt. is clueless. Only add new hires from Harman. Working level employees are great and the only thing that keeps people around. All the good people have either found other jobs or been let go at this point.
bad,"Good things about Visteon:"
bad,I really enjoyed the hours that were for the job. I enjoyed the coworkers and what they did.The work flow was fun and the time went by fast. The job ended and moved to a different state
bad,bueno pues aprendi mucho la verdad a usar makinas   conocer gente nueva  aprender  cosas q nunca abia echo  asi q me fue vastante bien
bad,3 shifts rotation as per week.
bad,"Visteon is becoming an overseas outshore contractor company. Most jobs are moving to so called low cost countries, not good culture and morale for the people left in US."
bad,"Company was spun-off from Ford Motor Company, Most exec management at spin-off were guaranteed Ford pensions so performance of Visteon mattered little to them. Management team was unprepared for rigor of running a stand-alone business, and unable to truly compete in the ultra competitive tier 1 world. Part of this was the result of Ford exec management maneuvering for the 6 - 7 months prior to spin-off. The company was almost destined to fail at the $17B size and scope at spin - with too many assets, too many people, and too much overhead. Company no longer manufactures products in the U.S. and primarily imports to U.S. from Mexico."
bad,pas rester assez longtemps l entreprise licenciait c est un équipementier automobile
bad,"a visteon foi uma excelente empresa quando o corpo dela era os representante de 2006, atualmente as pessoas que carregava a visteon, fazendo ela crescer cada vez mais foram saindo e assim a visteon foi morrendo cada dia um pouco."
good,"Local onde se aprende bastante, mas tem muito stress."
good,Most jobs are overseas.  Should just work there if you are willing to move overseas.  
good,A Visteon compressores já não é o que era aquando da minha permanência efectiva como Técnico.Entrou em decadência tanto em termos de qualidade como em quantidade de produção.
good,"the Shorter Alabama location was a joint venture but when Visteon gave control over the the korean half it all went down hill and fast, the employees are being replaced with koreans for no good reason and most of the time the replacment doesnt even know how to do the job"
good,"A empresa tem seus altos e baixos."
good,"Gosto de trabalhar nessa empresa, mas preciso de uma oportunidade de crescimento profissional, pois estou me qualificando para contribuir com o meu melhor para o crescimento da empresa."
good,"Learned how to work with UAW union work force"
good,"PSE en-cours pour lequel je suis impacté."
good,"If we neglect the complete uncertainty and lack of security, it might have turned out to be a very enjoyable and productive work environment. A lot of promises and prospects for the future were given, but in reality, Visteon proved to be an (very!) intermediate owner of the electronics division that originally belonged to Johnson Controls."
good,"Excelente empresa para se trabalhar bom ambiente de trabalho, recursos para execução dos trabalhos eram fornecidos , muito boa a empresa"
good,"Good company to work"
good,"Monday to Friday working a day night shift."
good,Visteon est une société mondiale de plusieurs dizaine de milliers de personnes avec des sites de recherche et production reparties sur tous les continents. Cela m' a amené à  voyager pour installer les moyens de productions automatisés   que nous concevons et développons dans notre bureau d 'étude.
good,Empresa multinacional com um ambiente multicultural.
good,"Working with electronic engineers to improve the circuit connection layout,  EMC engineers to reduce the emission as much as possible, mechanical engineers to make sure no interference between PCB and housing, DFM engineers to ensure PCB can be built at PCB FAB and ASM."
good,"Average work day was 11 pm to 7 am.  Or the work schedule based on where I was assigned."
good,It was usually fast paced and kept me busy.The pay wasn't good at first but within seven years I was at top pay.I would still be there if the were still here.
good,Empresa con mucha herencia cultural de Ford.  Burocrática y lenta.
good,I work in Vestion electronics in apprentice my job is aoi operator and Smt machine operator my job is very good and many pressure in my job my job is PCB seeing in aoi machine and any issue I capture the issue and solve the problem
good,"checking everyday for manpower, and any quilty issues.  Helping others on the job and showing them a safe and easier way."
good,"une bonne entreprise , ou j'ai fait diffèrent postes de travail j'ai énormément appris .Mais malheureusement ,une entreprise en chute donc pas d'embauche et surtout une tension chez les salaries  ."
good,"Buen clima laboral, excelente uso de herramientas de gestion, aprendi nuevas tecnicas productivas en inyeccion de plasticos, la direccion de la empresa estaba un poco dispersa por motivos de la venta de la empresa y la separacion del grupo, los colegas todos excelentes, salvo que estaban algo  siperpuestas o mezcladas las responzabilidades y esto genera falta de comunicacion, lo mas complejo alcanzar objetivos con rapides por falta de algunas herramientas y capacitacion, lo mas importante que rescate en esta gestion fue la gran calidad y capacidad de los recursos humanos."
good,"Focus on the company and your individual experience while employed there"
good,I have worked at Visteon for over 15 years. I am fortunate to work with some very talented people.
good,"Sempre bem corrido, porém muito produtivo, algumas vezes havia suporte necessário para a execução das tarefas pertinentes ao cargo, outras não. A parte mais difícil de se trabalhar lá era o excesso de pessoas a quem se subordinar e a se reportar, algumas pessoas mal sabiam o que estavam fazendo ali, mas estavam, e acabavam atrapalhando o processo, mas isso não era uma constante. Sempre me saí bem no exercício das minhas atividades, fui muito feliz trabalhando nesta empresa, mas por redução de pessoas e por ter sido eliminado o setor onde eu trabalhava, fui desligada da companhia."
good,"Visteon has got some very good projects to work upon and pays quite well. But the planning of some projects are rather pathetic, it gives one heck of a toss to work life balance."
good,"My biggest concern working for Visteon was the number of hours required.  Normally speaking, evenings, weekends, and holidays were required.   Poor work/ life balance."
good,"good people , but lacked clear direction on daily activity.  I Could have used a more thorough ""on-boarding"" training session, which at the present is non-existing."
good,"Client Manager gave guidance and preferred the contractor perform the job, usually without intervention.  Assistant Director was tecnically proficient and micro-managed."
good,"Quando trabalhei na Dafra foi na fase de implantação do negócio. Período  de muito trabalho e tentativas de organizaçao. "
good,Visteon offers a good place to start your career. The company trust in you as engineer and allows you to make mistakes and learn from them.
good,"continuous restructure since 2014"
good,"O dia a dia quando chegava muitos materias era corrido, e aprendir a ser muito mas organizado estocar materias gerar as tags , organizarva e estocava nos lugares certos , tive a experiência de alimentar linha de produção,  era cansativo,  nao era minha função,  mas ajudava os colegas de trabalho, que sempre min ensinavam, a parte mais difícil era quando chegava muitos materias no salao, que nao tinha nem para onde se movimentar, quando tinha que pegar material em tal Th era muito difícil,  e a parte mais legal era quando o salao estava limpo, materias todos estocados tudo nos seus devidos lugar"
good,"o tipico de trabalho bom eu apredi muita coisa adiquiri experiencia na area de produçao,direção bom tinha otimos colegas de trabalho etcc..."
good,a visteon achei uma empresa boa que da oprtunidaes de promocao que tem politica de empresa que segue o padrao enfim o funcionario tem todos os seus direitos e nao deixa atrasar o salario
good,"Large company, decent pay, but no longer an industry leader"
good,se conserva un buen ambiente de trabajo dentro de la empresa
good,"Friendly Work Culture"
good,"Unpredictable business "
good,"rapport entre ouvriers sympathique, travail difficile"
good,"É uma empresa que se classifica como uma boa escola para aprender a trabalhar nas áreas de manutenção, aprendi muito sobre manutenção preventivas e correctiva, bem como o restante que engloba a manutenção industrial"
good,"Almost every day the same repetitive work, it was a brigade during the study in college. Clear objectives, a good means to achieve them."
good,"Empresa que serviu como boa escola profissional pois dava liberdade para definirmos processos novos, porém o ambiente de trabalho era de bastante cobrança e pressão, gerando elevado nível de stress em muitas situações."
good,"One will learn how to be awake 24 x 7."
good,Very interested that to work with a team which i can't find there and no proper work culture which turns into to resign the Organisation.
good,"Ambiente bueno de trabajo, beneficios buenos tambien."
good,"Worked there many years ago and it was a very challenging time for automotive suppliers.  Don't know what type of culture they have now so hard for me to comment.  Overall, decent company."
good,plant is no longer around the management and the union (workers) ran this plant and work south of the border. Visteon (ford) worried about profits while the people were greedy to no end.
good,"Sorted cargo before loading and unloading."
good,"Good company, and they care their employee very well. good atmosphere to work. Free cab facility and foods during the working hours is available here. Also chances to get higher position when you performing well."
good,"Challenging work on fun products."
good,"-Responsible for global sales"
good,"It was very productive got to learn new things."
good,Required to hard work. The work load has high but the work profile of the each employee has cleared & systems are very good.
good,"rien de special a dire: c est correct "
good,"contrôle final des tableaux de bord et montage des airbags et de nombreuses pièces tel les conduits d'air "
good,Co-workers were excellent and fun to work with-both physical therapy office and company infirmary.
good,"bonne ambiance, travail en équipe, travail posté, assemblage,controle,emballage"
good,"Mi evaluación para esta empresa es algo plana ya que esta empresa en todos sus indicadores esta balanceada, como todas tienen problemas en algunos ámbitos pero siempre están muy balanceados."
good,At visteon there are many different areas that you could have exposure to
good,"- internationales Umfeld intern und extern"
good,Bonne entreprise très propre bonne ambiance de travail
good,"O trabalho em si era árduo, no entanto, a relação que construí com os meus colegas de trabalho era muito positiva, o que me permitiu inconscientemente ignorar qualquer exaustão. Aprendi a relacionar-me melhor no que toca em ambiente de trabalho, aprendi a construir uma relação profissional com os meus colegas no qual se reflectiu mais tarde na própria relação pessoal com ditas pessoas já fora do local de trabalho. Aprendi que nem podemos contar sempre com os outros, no entanto, não deixar emoções pessoais comprometerem a minha contribuição enquanto trabalhador. A parte mais difícil do trabalho foi o grande stress físico imposto sobre mim, assim como grandes horas de trabalho ao qual eu chegava a trabalhar durante 16 horas seguidas, ou seja, dois dias de trabalho num só dia. A melhor parte foi aprender sobre construção de automóveis e a construção de boas relações com colegas de trabalho"
good,"Strong management and able to work on the chapter 11 situation too."
good,"Elaborar procedimentos de fabricação de produtos eletrônicos em linha de alta produção, cerca de 600 rádios/hora"
good,"Depois de antes já ter trabalhado na indústria,foi uma empresa onde pude aprender muitas coisas,entender a necessidade do processo produtivo tentar organizar uma boa equipe,saber articular com as pessoas manter um relacionamento entre os funcionários uma vez que precisamos um do outro,as dificuldades encontradas não foram diferentes das anteriores mas sabendo manter o respeito um com os outros é possível realizar as funções e cumprir o que a empresa espera que façamos como colaboradores."
good,"A união dos colaboradores, a sensação de fazer parte da equipe e a sinergia, fizeram parte do ótimo ambiente de trabalho que vivi quando fiz parte da Visteon."
good,"- Good for Beginners "
good,Coworkers at Visteon were great.  Very hardworking and most people work well together.  There have been several leadership changes over the past few years and the teams are still adapting to the new culture.
good,"buen compañerismo, la puntualidad de los descansos muy importante y los llevaban muy bien,un buen sueldo"
good,learned a lot while working at Centrum.  The times have changed since employment there.  Provided me with skills needed to help me succeed in todays enviroment
good,"When I stated at Visteon it was just spun-off from Ford so the company was still trying to figure out who they were.  The Visteon of today is much different, more leaner and now are leaders in the automotive electronics, thus I don't know anything about them 10 years later.  Sorry."
good,Ambiance agréable qui donne envie de donner le meilleurs de soi.
good,"Empresa com ambiente instavel."
good,"Company provides freedom to experiment ideas and no restrictions. Company has young and energetic work force. As this company has global presence, lot of things can be learnt on systems, process, benchmark etc."
good,"Uma boa empresa para se trabalhar, infelizmente por perdas de contratos começou a perder mercado."
good,"Visteon design and manufacture automotive cockpit electronics and recently focusing on connected car concept."
good,"I Assembled Major Parts In Assembly Line and deals with the"
good,"The Work Environment is good."
good,I joined Ford as a FCG - Ford College Graduate program. This allowed me to work within corporate and plant facilities for over 3 years. The most enjoyable part of working with Ford was opportunities for different jobs within a large company.
good,"Uma Empresa muito bem estruturada,organizada com pessoas educadas,colegas de trabalha bem participativos e comunicativos aprendi muito sobre postura profissional e ètica sobre todos os procedimentos realizados."
good,Buena empresa aunque falta que se actualicen mas sus procesos de promociones laborales.
good,"Global automotive supplier of cockpit electronics systems.  Competitive on sales volumes, but not yet a leader in technologies.  Rapid changes in management. Culture of continuous downsizing and incorporation of low cost countries."
good,"Wrok- Life Balance is very good in Visteon and Work culture and people are very good."
good,"Entreprise qui n'existe plus en France, dommage !!!"
good,"Très belle entreprise, "
good,"New product development"
good,"An excellent place to work prior to the manufacturing move down to Reynosa Mexico. The manner in which it was moved definitely cost this business the opportunity to exist. Between ERP platform failures and loss of supply chain reliability, it never had an opportunity to survive."
good,"It was great working for Visteon. Some drawbacks, but overall, it was a good experience. People were great. No supervision micromanagement was a plus."
good,en general se trabajaba como los compañeros muy solidarios  y se aprendia cada dia un poco mas del trabajo
good,I learn Lots of thing from this companey. how to handel manpower. Production. & critical areas.
good,responsabilidade com as entregas ter seriedade repeito parceria a segurança em geral os desafios bem sucedido
good,O tempo que passei na empresa foi um aprendizado muito grande que tive agora só tem a melhorar ainda mais meus conhecimentos.
good,"Eu trabalhei durante alguns anos na Visteon por um empresa de trabalho temporário, empresa essa que ja nao existe."
good,"1.Good team work,"
good,"Bonne intégration et formation au sein de l'entreprise."
good,Empresa que utiliza o que mais de inovador existe e com equipas muito bem estruturadas e com fortes conhecimentos
good,"*  We collect stock report and we planed for customer requirement of the day and arrange what we want to do and reported time by time work."
good,"Respect de consignes de sécurité de l'ensemble du personnel affecté aux presses a injecter sous ma responsabilte, organisation des productions et des changement d'outils, gestion des stocks et des outils de production ..."
good,Gerencia engessada que apenas ajuda quem faz parte da panela e dos esquemas.
good,"Nunca sabias donde te pondrían ya que hacía funciones de logística y producción."
good,"Really nice work environment with really nice colleagues"
good,"Gostei muito de trabalhar na Visteon, porem a mesma tem sua diretoria um grupo de Portugueses que, infelizmente nao dao vaor ao trabalho e desempenho de seus funcionarios."
good,"More initiative driven from Top Management."
good,"final de mês, sempre tinha aquele almoço especial. adquirir conhecimentos e superei desafios. bons para o desenvolvimento da empresa. Capazes de desenvolver seus trabalhos com qualidade, suprir a necessidade do cliente com qualidade e quantidade. era a equipe empenhada ao trabalho."
good,"Precisa melhora a administração da empresa, aprendi a da suporte nas máquinas smd, e também as outras áreas."
good,when i start my job and when i am a fresher
good,Best learning place.but work life balance is very less. Best place who will start the carrier in automotive field.location also good center of the city.
good,Bonne entreprise dans l'ensemble mais y'a toujours des empoché qui en font moin que les intérim par ce que il on trop d'expérience il dise
good,I was only here for 2 weeks so cannot give a huge amount insight into the work culture pay structure or anything else. But what i can say is that is that all the staff i worked with where very helpful and wiling to share their knowledge.
good,Good company to work.  Environment is stressful due to the nature of the industry but a lot to learn and good team work.  Company use to have good solid procedures and a very good training to their employees.
good,Empresa com grande desenvolvimento tecnologico....
good,They moved to Mexico. I don't understand why Indeed won't let me skip this. They moved the factory to Mexico. I liked working there alright and did so for 23 years.
good,Esta empresa foi umas das melhores do pais para se trabalhar com inumeras oportunidades profissional e de capacitação. Os benefícios eram exelentes.
good,Les compétences des personnes travaillant dans cette entreprise sont nombreuses et fortes.
good,Had good educational benefits. Not really good at implementing new technology. Not well managed. I enjoyed acquiring new skills.
good,Des qu'on commencés une journée il y avais déjà des soucis presse qui ne fonctionnai pas et pas de maintenance réaliser en temps et en heur
good,"Buen ambiente de trabajo pero con poco crecimiento, debido a que generalmente estan buscando gente con experiencia en lugar de elegir jovenes con potencial y ganas de trabajar"
good,"Email Kontrolle, Meetings, Lieferanten Anfrage, technische Workshops und Verhandlungen, Sourcing board"
good,"great learning, started with project & Plant setup, functional input for new system, development of SOPs, handled line production, introduced KIZAN, KANBAN etc.,handled big team and given lot of awards for achievements."
good,"okay , i liked getting my infotainment experience from there. it gave me better learning experience. also i learned allot. good time there"
good,"good place to work - all teams very young and new in the company at the time "
good,"travail en 3/8 , agréable mais difficile , le prix a payer pour gagner 2000euros . j'ais apprécier travailler chez eux mais il n'embauche pas , ce ne sont que des contrats interim ."
good,"I liked it because I could just come in put my headphones on and get my job done.  There was an extensive amount of politics of course because it was union, but a lot of good people that made the day go by fast."
good,"Been a good team player in all hard and soft deadlines."
good,Buena buen ambiente de trabajo y con los compañeros tambien
good,"Quality assurance was my job and, for the most part the job was very enjoyable."
good,"Missions Supply Chain:"
good,"o	Faturamento anual R$ 400 milhões"
good,"Mi período en dicha empresa lo califico como muy favorable, debido a que era una sociedad constituida, seria. Las reglas estuvieron propuestas desde el primer día a través del manual operativo y las normas de convivencia."
good,Visteon was a great company to work for.  The people are nice and there is a great work/life balance.
good,"tré bon environemen pour évolué"
good,"Visteon was another company that spun off from Ford Motor.  I was new to the automotive industry.  My prior position was a Pension Accountant for a local city. I had many challenges coming up to speed on products and manufacturing processes. "
good,was a good company to work for was temp so was layed off looking for a long term position
